speech_id,topic_id,word_count,speech_text,file_name,speaker_id,session_title,year,day,month
7952,topic-id,346,"Mr.Speaker, every year, I have the pleasure of nominating outstanding young men and women from the 27th Congressional District of Texas to the United States military service academies.  Recently, I held a lunch for this year's ten appointees and their families, who have received an appointment to one of the five service academies. I enjoyed visiting with these young folks and their families and would like to recognize each of them for their commitment to protect our great  They are:  Jose Aguirre, from Corpus Christi, Texas, a 2017 graduate of Foy Moody High School, who will attend the United States Naval Academy;  Aaron Jeffrey Frahm, from Corpus Christi, Texas, a 2017 graduate from Marine Military Academy, who will attend the United States Merchant Marine Academy;  Specialist David Zane Ledbetter, United States Army, from Victoria, Texas, a graduate of Victoria West High School, who will attend the U.Military Academy, West Point;  Kaila Celiene Lusson, from Corpus Christi, Texas, a 2017 graduate of Aviano High School, Aviano Air Base, Italy, who will attend the Air Force Academy;  Caleb Michael McCann, from Sinton, Texas, a 2016 graduate of Flour Bluff High School, who will attend the Air Force Academy;  John McNiff, from Corpus Christi, Texas, a 2017 graduate of Incarnate Word Academy, who will attend the U.Coast Guard Academy;  Kalista Courtney Schauer, from Corpus Christi, Texas, a 2017 graduate of Richard King High School, who will attend the U.Military Academy, West Point;  Clayton Daley Thompson, from Corpus Christi, Texas, a 2016 graduate of Flour Bluff High School, who will attend the United States Naval Academy;  Cassandra Hamer, from Corpus Christi, Texas, a 2017 graduate of Richard King High School, who will attend the U.Coast Guard Academy; and  Josh Smith, from Victoria, Texas, a 2017 graduate of Victoria West High School, who will attend the United States Air Force  Each of them brings great pride to all of us in the 27th District of I wish them the best of luck in their academies, and I look forward to hearing great things about their service to our                         Recognizing Drew Scott  ",CREC-2017-07-17-pt1-PgH5889.txt,2067,GAINING RESPONSIBILITY ON WATER ACT OF 2017,2017.0,17.0,May
7953,topic-id,214,"Mr.Speaker, I was walking along the Cannon tunnel and was looking at all of the art from the Congressional Art As Members know, each year, thousands of high school students from every congressional district submit their artwork to their Member of Congress for the annual Congressional Art Helping inspire these young people to become active in the things they are passionate about, like art, is one of my favorite parts of my job.  Today, I would like to recognize Drew Scott, the winner of this year's Congressional Art Competition for the 27th District of She is a junior at Rockport-Fulton High School, and she won this year's contest with an original colored pencil drawing ``Complimentary Calico.'' It is a drawing of one of her friend's cats.  Earlier this year, I visited Rockport-Fulton High School to announce Drew as the winner, and I recently had the pleasure of hosting Drew and her family when they traveled to Washington for the unveiling of her artwork in the Cannon tunnel.  I thank everyone who submitted their artwork for this year's competition. It was an extremely hard decision for the judges. And congratulations to I look forward to seeing next year's entrants. I would like to encourage all high school students to participate in this wonderful opportunity.                          ____________________",CREC-2017-07-17-pt1-PgH5889.txt,2067,GAINING RESPONSIBILITY ON WATER ACT OF 2017,2017.0,17.0,July
7944,topic-id,15,"Mr.Speaker,    The online version has been corrected to read: HONORING UNITED WAY OF BUCKS COUNTY ",CREC-2017-07-24-pt1-PgH6149-5.txt,99999999999999,GAINING RESPONSIBILITY ON WATER ACT OF 2017,2017.0,24.0,July
7942,topic-id,199,"Mr.Speaker, for over a half century, the Lenape Valley Foundation has provided assistance, compassion, and hope to thousands of children, adults, and families within my district. They offer services related to mental health, substance abuse, intellectual disability, and early intervention.  I was pleased to meet with community leaders and volunteers during the groundbreaking ceremony at The Lodge at Lenape Valley Foundation, a new construction on the campus of Lower Bucks  The new facility will provide more outpatient mental health services, including individual group and family therapy, an improved crisis call center, an improved crisis walk-in center, peer support, and Bucks County's only Crisis Residential  I am thankful for the leadership of the Lenape Valley executive team: Alan Hartl, Walter Wolaniuk, Sharon Curran, Philip Braun, JoAnne Davis, Mary Dubyk, Mary Jane Fletcher, Traci Gorman, Angela Jacobsen, Marjorie Morgan, and Mary Ann Venezia, as well as board president, Robert Rogala; vice president, Lisa Bodine; secretary, Helene Cevasco Mathern; treasurer, Mark Strasburg; and all the board of directors.  I am proud to work with an organization which recognizes that everyone can grow and progress toward personal fulfillment, and we are proud to stand by their side.                  Honoring United Way of Bucks County  ",CREC-2017-07-24-pt1-PgH6149-5.txt,1797,GAINING RESPONSIBILITY ON WATER ACT OF 2017,2017.0,24.0,June
7943,topic-id,71,"Mr.Speaker, the United Way of Bucks County is dedicated to improving the lives through the caring power of communities. We all have a stake in making our communities healthy and prosperous. The United Way of Bucks County is committed to working together, advancing the common good, and creating a better life for all. =========================== NOTE ===========================     July 24, 2017, on page H6149, the following appeared: HONORING UNITED WAY OF BUCKS COUNTY ",CREC-2017-07-24-pt1-PgH6149-5.txt,1797,GAINING RESPONSIBILITY ON WATER ACT OF 2017,2017.0,24.0,April
7945,topic-id,145,"Mr.Speaker, ========================= END NOTE =========================   The United Way works in close collaboration with diverse partners in Bucks From schools, government agencies, community corporations, neighborhood associations, the faith community, and volunteers, the United Way brings together passion, resources, and expertise to get things done in Bucks  Although there are about 1,300 United Way chapters nationally, each chapter shapes its own identity, holding firm[[Page H6150]]that everyone deserves a good life through quality education, stable employment, supportive income, and good health.  I am very proud to work with Bucks County's team at the United Way: Marissa Christie, Faith Parkinson, Patricia Winslow Gallagher, Matt Uhler, Danielle Bush, Tim Philpot, Candi Guerrero, Katie Matarazzo, Dan Warvolis, and Pat  Mr.Speaker, these problem-solvers are making an impact on improving lives and making Bucks County a more prosperous community, and for that, they are deserving of all of our thanks and support.                          ____________________",CREC-2017-07-24-pt1-PgH6149-5.txt,1797,EXECUTIVE SESSION,2017.0,24.0,June
8021,topic-id,375,"Mr.Chairman, we have a serious case of legislative amnesia here. Apparently, the sponsors of this bill and those who are speaking in support of it have totally forgotten what we did last year. The WIIN Act last year addressed every single problem that has been presented here this afternoon: new reservoirs, four were authorized in the WIIN Act, which became law less than a year ago--7 months, to be exact; all of the issues of the outflows of water to the delta were addressed so that additional export of water from the delta could occur.  I am wondering: What are we doing here with this piece of legislation, aside from totally eviscerating the protections for the largest estuary on the West Coast, of the Western Hemisphere? The environmental protections are eviscerated.  What are we doing with this legislation besides--oh, you wanted to talk about private water rights? Those private water rights are set in place by the laws of the State of California, which are overridden by this piece of legislation.  Yes, that is true. This legislation removes the water rights that the State of California has given to individuals as well as irrigation districts, but they are stripped away.  What is this all about?  Last year, a 2-year effort was completed and the WIIN Act was passed by this Congress, signed into law. It is in existence. Reservoirs can be built. Water conservation will take place. All of the things that we need to do are in place today.  So why are we fighting this fight? Because we don't know how to stop fighting? Because we don't know how to actually implement a law that we passed last year?  And, by the way, where is the funding for all you want to do here? There is no money in this. You want to do these things. You want water; you want reservoirs--put up the money. Don't just sit here and regurgitate what we have done for the last 5 years and totally ignore the progress that was made with the WIIN legislation.  We ought not do this. I am opposed to this, and, hopefully, we will find some sensible action.  Mr.Mr.Chairman, I am pleased to yield 2 minutes to the gentleman from Colorado (Mr.Tipton).  ",CREC-2017-07-12-pt1-PgH5503.txt,1973,COUNTERING IRAN'S DESTABILIZING ACTIVITIES ACT OF 2017,2017.0,12.0,June
8105,topic-id,26,"Mr.President, I ask unanimous consent that the order for the quorum call be rescinded.  The PRESIDING Without objection, it is so ordered.                     Amendment 250, as Modified  ",CREC-2017-06-15-pt1-PgS3505-6.txt,99999999999999,COUNTERING IRAN'S DESTABILIZING ACTIVITIES ACT OF 2017,2017.0,15.0,July
8106,topic-id,1346,"Mr.President, I am very pleased that the Senator from[[Page S3508]]Alabama is presiding over this very important debate because one of the most important issues to both of our States, Colorado and Alabama, is the economy and the economic well-being of our great country. The amendment that I will be discussing today goes to the very heart of our opportunities in space, our opportunities in innovation, our opportunities to ensure that we have the most reliable information as it relates to weather and to weather events.  It is a great partnership that we have had with the Senator from Alabama, who has been absolutely critical and instrumental in ensuring a persistent, reliable space presence. I thank the Senator from Alabama, Mr.Strange, for his incredible leadership when it comes to making sure that we are able to reach space, that we are able to continue our space mission. Whether it is in the defense of this country or in understanding where the next tornado may strike, I thank the Senator from Alabama for the leadership that has been provided to ensure that constant presence and persistence.  Of course, I rise to speak in support of the bipartisan Gardner-Nelson-Warner et al. amendment, amendment 250. Yet, truly, to the Senate--to my colleagues here--I rise in support of America's role and leadership in space.  I rise on behalf of the hardworking men and women across this Nation who make our country's aerospace industry second to none, because, over the past 70 years, the United States has led the way in space exploration. From the Apollo missions to the space shuttle to the Orion program, we are the leaders in exploring the great frontier of space. That is who this country is. That is who we are--explorers, pioneers. We were the first to the Moon, and I hope we are the first to Mars, but we cannot give up that pioneering innovation that has led this country to greatness.  I will share with colleagues of the Senate a CNBC story from March that China is building a manned spacecraft that is capable of sending astronauts to the Moon as well as to near-Earth orbit flight.  Can you imagine the day when the stars and stripes on the lunar surface stands not alone but stands next to the stars of a flag of another nation--perhaps China's, perhaps somebody else's?  When it comes to our access to space, this debate is absolutely critical because without the passage of amendment 250, we lose a tremendous portion of our access to space. We lose it for commercial applications, and we lose it for civil applications.  In the past few months, this China activity has shown the importance of U.leadership. That is why this bipartisan amendment comes with a very simple point. It ensures that NASA and our commercial space industry will continue to be the country's leader in aerospace.  The ranking member of the Senate Intelligence Committee, Senator Mark Warner, of Virginia, is coleading my amendment. The Senator has done a phenomenal job in leadership on the Intelligence Committee in leading this amendment.  I see that my colleague from Florida, Senator Nelson, has joined this debate. He has done a phenomenal job in leading this effort. As the ranking member of the Senate Commerce, Science, and Transportation Committee, with jurisdiction over NASA, Senator Bill Nelson is the leading cosponsor of this effort.  They understand how important it is to address this issue for NASA and other space missions.  I stand here in support of the greater goals of the underlying bill that we will be amending today. I believe sanctions against our adversaries are warranted and justified and, indeed, should move forward. This amendment is not designed to undermine the intent of the bill, but it seeks to ensure that space exploration may continue as it is currently planned.  Without this bipartisan amendment, multiple missions on the books today--that are already planned today--will be delayed or even canceled and will be subjecting the U.taxpayers to significant cost increases. Without this amendment, missions like the commercial resupply program, which delivers critical supplies to the International Space Station, will be jeopardized by the language of the bill as it is written. American astronauts at the International Space Station, as we speak, are dependent on those supplies, but we are cutting off the American lifeline without the adoption of this amendment. Future missions, like the commercial crew program--a partnership between NASA and private industry to bring astronauts to the International Space Station on a U.S.-manufactured spacecraft--will be put at risk without the adoption of this amendment.  Without this bipartisan amendment, we will continue to rely on Russian spacecraft to take U.astronauts to the International Space Let me just make that more clear. Without the adoption of this amendment, NASA and our astronauts will be dependent on Russia for access to space for even longer. Rejection of this bipartisan amendment results in further Russian dependence.  I do not believe this was the intent of the language when the bill was first written. The Gardner-Nelson-Warner-Shelby et al. amendment creates the certainty that NASA needs and supports to ensure currently planned NASA and commercial launch missions can continue without interruption.  NASA contacted my office yesterday and said of amendment 250: ``We believe this provides us the flexibility to maintain our commitments to our national space program.''  It is not just the commercial crew and cargo missions that are going to be impacted. Several other missions will be subjected to delays--missions like the Joint Polar Satellite This constellation of satellites will give us the ability to constantly monitor the globe for significant weather events, such as floods, tornadoes, and hurricanes. As I stand here today, the three Senators on the floor who are listening to this important debate--with more on C-SPAN--have been impacted dramatically by floods, tornadoes, and hurricanes.  In 2013, we had dramatic flooding in Colorado that damaged thousands and thousands of homes and cost lives. I know the Presiding Officer has faced the same challenge when it has come to tornadoes and incredibly tragic weather events. The Senator from Florida has faced hurricanes, floods, and tornadoes. That is the importance of this amendment--to understand our weather systems and predictions.  I am proud to say that JPSS is being developed in my home State of The JPSS and other essential programs in which we have already invested hundreds of millions of dollars, if not billions of dollars already, are now put at risk of significant delays or cost increases to the taxpayer without the adoption of this amendment.  I am also on the floor to talk about a longer term mission that I truly believe in and hope to see our Nation achieve, one that goes to the very heart of our pioneering spirit of who we are as a people. It is our future manned mission to  As I have spoken on the floor before, as I child I wanted to be an astronaut. I was inspired as I watched NASA astronauts explore that next frontier. I believe that the next destination for human beings to explore is, indeed, Mars, but without this bipartisan amendment, the Mars 2020 rover, which will continue to prepare us for that future manned mission, will be put in doubt. It will be a significant setback and will make the future goal of getting to Mars seem that much further away.  This amendment, amendment 250, allows these missions to move forward with certainty and as scheduled. It is a bipartisan effort to affirm America's leadership in space.  Let's be clear. Last summer we had a debate on this very same issue--that by 2022 we were going to have an ``America first'' opportunity. That is the spirit of this amendment--to make sure that we have access to these vital and critical space missions, access to space, and to continue to grow economic opportunities for the American people. That is what this debate is all about.  I yield the floor to my colleague Senator Nelson and then, of course, will continue with debate.  The PRESIDING The Senator from  ",CREC-2017-06-15-pt1-PgS3505-6.txt,99999999999999,COUNTERING IRAN'S DESTABILIZING ACTIVITIES ACT OF 2017,2017.0,15.0,July
8110,topic-id,404,"Mr.President, I thank my colleague from Arizona as well for allowing this vote to move forward, but in his statements, he said NASA needs to do the same. He repeated it several times.  I would just say that this amendment could actually be titled ``NASA Needs to Do the Same'' because what we had agreed to last year, when it comes to defense, is a way forward on the Atlas V rocket, the RD-180. We agreed to that. I believe it was a unanimous consent agreement. If there was an objection at that time, then it should have been expressed when we made this agreement.  Our colleagues across the aisle, for a unanimous consent, it takes all of us 100 people to agree to a unanimous consent agreement. That agreement was made on the National Defense Authorization NASA needs to do the same.  Our colleague, the ranking member of the Intelligence Committee, Mark Warner, made the point of parity between civil, commercial, and defense. That is what this amendment does.  There are a lot of issues that we come to the floor and we talk about this issue not being rocket science: It is not that difficult. It is not rocket science. Well, we actually have an issue that is rocket science. The mission set before American astronauts is jeopardized if this amendment doesn't pass. The taxpayers of this country face billions of dollars in costs if this amendment doesn't pass. Reliance on Russian technology to get to the space station or resupplying American astronauts will increase if this amendment doesn't pass.  If we want to talk about protecting the people of this country, let's talk about the victims of floods in Colorado, let's talk about people who have died in tornadoes because we didn't have the most accurate ability to forecast where they were coming from, when they were going to strike, and who would be hit. This amendment will allow these weather satellites to go into space to protect the men and women of this country from natural disasters. Again, it brings parity to an agreement that was decided upon through unanimous consent last year.  I support the underlying legislation, and I support this amendment and urge my colleagues to support it as well. I thank the chairman of the Foreign Relations Committee and the ranking member of the Foreign Relations Committee for their leadership on this committee.  I yield the floor.  ",CREC-2017-06-15-pt1-PgS3505-6.txt,99999999999999,COUNTERING IRAN'S DESTABILIZING ACTIVITIES ACT OF 2017,2017.0,15.0,July
8019,topic-id,323,"Mr.Chairman, I rise today in strong support of H.23, legislation sponsored by my good friend and Western Caucus member, David  For years, Western communities have suffered as a result of frivolous lawsuits, inefficient policies, and burdensome regulations that have prevented adoption of commonsense water solutions. These factors, coupled with a lack of rainfall, exacerbated a manmade drought that lasted for 5 years.  Rather than capturing precious water supplies, failed government policies that refused to put Americans first allowed billions of gallons to be funneled into the San Francisco Bay and Pacific These deliberate diversions killed thousands of jobs, harmed our country's food supply, and led to local unemployment levels as high as 40 percent.  Today we have an opportunity to right these wrongs by passing the GROW Act, legislation that is supported by approximately 100 different cities, agriculture groups, water associations, irrigation districts, local chambers of commerce, and businesses throughout the country.  Most of the major provisions in this bill have been passed by this body numerous times. In fact, we have been working to enact similar legislation for nearly 5 years.  For example, title V includes Western Caucus member Tom McClintock's Water Supply Permitting Coordination Act, an excellent bill that will streamline the permitting process for important water storage projects.  Title VI includes Western Caucus member Dan Newhouse's Bureau of Reclamation Water Project Streamlining Act, much-needed legislation that will result in increased storage of surface water.  Title VII includes Western Caucus Vice Chairman Tipton's Water Rights Protection Act, an essential bill that protects private water rights from Federal takings.  I strongly support these titles and the underlying bill. It is far past time that we put our communities, families, and America first.  H.23 addresses previous policy failures and adopts worthwhile water policies that will benefit future generations.  Mr.Chairman, I thank the gentleman from California for sponsoring this much-needed legislation, and I urge my colleagues to vote in support of this commonsense bill.  ",CREC-2017-07-12-pt1-PgH5503.txt,1992,ISSUES OF THE DAY,2017.0,12.0,July
