speech_id,topic_id,word_count,speech_text,file_name,speaker_id,session_title,year,day,month
7983,topic-id,165,"Madam Speaker, veterans shouldn't have to come home in a body bag to be recognized as  Last weekend, I went, along with some of my colleagues, to Tijuana, Mexico, where we visited veterans who have served this country, who have picked up a weapon to go and fight in war to protect our freedoms. They survived, came home, and some of them were deported.  Do you know that if you go and you fight overseas and you are not a citizen and you die, you get automatic citizenship?  One of those people we saw this weekend is my constituent, Hector Barajas, from This is a photo of him. He was proudly still wearing his uniform. He was deported to Mexico after serving 5\1/2\ years in the U.Army, receiving two commendations.  I am proud to cosponsor H.1405, which would allow noncitizen veterans who have been deported to come home and come back to the United I hope that he gets to come back, too.[[Page H4805]]                            ____________________",CREC-2017-06-08-pt1-PgH4804-5.txt,99999999999999,COUNTERING IRAN'S DESTABILIZING ACTIVITIES ACT OF 2017--MOTION TO,2017.0,8.0,April
8094,topic-id,80,"Mr.President, I understand that there are two bills at the desk due for a second reading en bloc.  The PRESIDING The clerk will read the bills by title for the second time en bloc.  The senior assistant legislative clerk read as follows:       A bill (861) to provide for the compensation of Federal      employees affected by lapses in appropriations.       A bill (H.1301) making appropriations for the Department      of Defense for the fiscal year ending September 30, 2017, and      for other purposes.  ",CREC-2017-04-07-pt1-PgS2462-4.txt,1881,THE PEOPLE'S NIGHT,2017.0,7.0,June
8095,topic-id,37,"In order to place the bills on the calendar under the provisions of rule XIV, I object to further proceedings en bloc.  The PRESIDING Objection having been heard, the bills will be placed on the calendar.                          ____________________",CREC-2017-04-07-pt1-PgS2462-4.txt,1881,EXECUTIVE SESSION,2017.0,7.0,May
8118,topic-id,166,"I ask for the yeas and nays.  The PRESIDING Is there a sufficient second?  There appears to be a sufficient second.  The clerk will call the roll.  The assistant bill clerk called the roll.  The result was announced--yeas 94, nays 6, as follows:                      [Rollcall Vote 145 Leg.]                                YEAS--94     Alexander     Baldwin     Barrasso     Bennet     Blunt     Booker     Boozman     Brown     Burr     Cantwell     Capito     Cardin     Carper     Casey     Cassidy     Cochran     Collins     Coons     Corker     Cornyn     Cortez Masto     Cotton     Crapo     Cruz     Daines     Donnelly     Duckworth     Durbin     Enzi     Feinstein     Fischer     Flake     Franken     Gardner     Gillibrand     Grassley     Harris     Hassan     Hatch     Heinrich     Heitkamp     Heller     Hirono     Hoeven     Inhofe     Isakson     Johnson     Kaine     Kennedy     King     Klobuchar     Lankford     Leahy     Lee     Manchin     Markey     McCaskill     McConnell     Menendez     Merkley     Moran     Murkowski     Murphy     Murray     Nelson     Paul     Perdue     Peters     Portman     Reed     Risch     Roberts     Rounds     Rubio     Sanders     Schatz     Schumer     Scott     Shaheen     Shelby     Stabenow     Strange     Tester     Thune     Tillis     Toomey     Udall     Van Hollen     Warner     Warren     Whitehouse     Wicker     Wyden     Young                                NAYS--6     Blumenthal     Ernst     Graham     McCain     Sasse     Sullivan  The amendment (250), as modified, was agreed to.  The PRESIDING The Senator from                           Amendment 240  ",CREC-2017-06-15-pt1-PgS3505-6.txt,1881,THE PEOPLE'S NIGHT,2017.0,15.0,June
8162,topic-id,43,"Mr.President, I ask unanimous consent that with respect to the Rao nomination, the motion to reconsider be considered made and laid upon the table and the President be immediately notified of the Senate's action.  The PRESIDING Without objection, it is so ordered.                          ____________________",CREC-2017-07-10-pt1-PgS3876-4.txt,1881,THE PEOPLE'S NIGHT,2017.0,10.0,July
8213,topic-id,73,"Mr.President, I ask unanimous consent that notwithstanding the upcoming adjournment of the Senate, the President of the Senate, the President pro tempore, and the majority and minority leaders be authorized to make appointments to commissions, committees, boards, conferences, or interparliamentary conferences authorized by law, by concurrent action of the two Houses, or by order of the Senate, and that they be printed in the  The PRESIDING Without objection, it is so ordered.                          ____________________",CREC-2017-04-07-pt1-PgS2462-5.txt,1881,THE PEOPLE'S NIGHT,2017.0,7.0,July
8024,topic-id,384,"Mr.Chairman, here we go again. Today, we are debating a bill that many of my California colleagues and I have opposed time and time again on this House floor.  This bill allows Washington, D.C., politicians to pick winners and losers when it comes to California's water. Now, that is not right. This is a partisan bill that is opposed by both California Senators as well as our  Now, California water is complicated. It is a lot more complicated than healthcare. But it should be up to Californians to kind of decide how to use our water, what we ought to do with that water.  Water is incredibly critical to our This isn't about picking winners and losers. When we think about water, we have certainly got to have storage, we certainly know we are going to have conveyance, but we have got to do this in a California way.  Unfortunately, H.23 is going to pit northern California against southern California while overriding California's own State laws. The bill is also going to gut environmental protections and threaten the critical Bay-Delta ecosystem.  I fish on the Sacramento River, and salmon fishing is incredibly important to the State of California as well as the States to the north of us. This bill is not going to be a good bill. It is going to devastate the fishing industry.  We also have to think about drinking water for northern  Folsom Dam is in my district and Folsom Lake is in my district. It provides not only flood protection, but Folsom Lake provides surface drinking water for a lot of my constituents. We tried to put a simple amendment in here that would actually protect the quality of that drinking water. Unfortunately, H.23 would mandate pumping levels that could negatively impact the Folsom Reservoir water supply. That is going to place many of my constituents at risk.  This isn't a good bill. Let's kill this bill. Let's step back. Let Californians decide the best way to handle California water. That is what we ought to do.  Again, this bill is dramatic overreach. It is the Federal Government stepping into something that the State should actually decide. I hope my colleagues will join me in opposing this bill.  Mr.Mr.Chairman, I yield 2 minutes to the gentleman from California (Mr.Rohrabacher).  ",CREC-2017-07-12-pt1-PgH5503.txt,2102,THE PEOPLE'S NIGHT,2017.0,12.0,June
8177,topic-id,326,"Mr.Speaker, I thank the gentleman from North Carolina (Mr.Walker), my colleague and friend, the chair of the RSC, for hosting this Special Order tonight to highlight[[Page H4905]]some of the recent victories that this Republican-controlled Congress has secured to ensure that every American enjoys freedom and opportunity for which our Nation was founded.  I rise today to thank my colleagues in the House and the Senate for passing my resolution of disapproval, H.43, which used the authority of the Congressional Review Act to overturn the Obama administration's eleventh hour rule forcing States like mine, Tennessee, to fund abortion providers.  Mr.Speaker, I also rise to thank Vice President Mike Pence, who cast that tie-breaking vote in the Tennesseans appreciate his courageous leadership.  Now, abortion is not healthcare, and vulnerable women seeking true comprehensive care deserve better than abortion-centric facilities like Planned  For over 45 years, States like Tennessee had the authority to direct their family planning funds to the healthcare providers that best suited their needs. Yes, they had that decision to decide what is best for their unique communities. Sadly, in a parting gift to the abortion industry, President Obama stole this freedom and flexibility and forced his own political agenda on States across the country like my very own State of  While I am unapologetically pro-life, this bill is simply about states' rights.  Mr.Speaker, when President Trump signed this bill, he put the American people, not the bureaucrats here in Washington, back in the driver's seat of empowering States like Tennessee to steer their title X dollars away from abortion-centric facilities like Planned Parenthood and to give the right back to the State to make that decision about which facilities provide the most comprehensive care for women in their  It was an honor to work with Senator Ernst and the pro-life community to help this life-affirming legislation reach the President's desk.  Mr.Speaker, I want to once again thank President Trump for his leadership on this matter.  ",CREC-2017-06-13-pt1-PgH4901-4.txt,2063,THE PEOPLE'S NIGHT,2017.0,13.0,June
8119,topic-id,32,"Mr.President, I ask unanimous consent for 2 minutes, evenly split between Senator Corker and me, to speak on the NATO amendment.  The PRESIDING Is there objection?  Without objection, it is so ordered.  ",CREC-2017-06-15-pt1-PgS3505-6.txt,2106,THE PEOPLE'S NIGHT,2017.0,15.0,June
8120,topic-id,123,"Mr.President, I would add that my fellow Ohioan, Senator Portman, is a cosponsor of this. Special thanks go to Senator Graham--this is the Graham-Brown NATO amendment--also to Senators McCain, Rubio, Casey, and Jack Reed and Sheldon Whitehouse from Rhode  This is especially important to the Ukrainian community in my A number of them have been in town the last couple of days. They know how critical support for our allies is and how important it is that this amendment sends a clear message that the United States will uphold our half-century commitment to NATO, combined with a strong signal to Russia to clean up its act. That is the importance of this amendment. I ask support from my colleagues.  I yield to Senator  ",CREC-2017-06-15-pt1-PgS3505-6.txt,2106,THE PEOPLE'S NIGHT,2017.0,15.0,June
8140,topic-id,42,"Mr.Speaker, I move that the House do now adjourn.  The motion was agreed to; accordingly (at 12 o'clock and 37 minutes a.m.), under its previous order, the House adjourned until today, Thursday, July 13, 2017, at 10 a.m. for morning-hour debate.                          ____________________",CREC-2017-07-12-pt1-PgH5757-2.txt,2197,THE PEOPLE'S NIGHT,2017.0,12.0,June
8017,topic-id,193,"Mr.Chairman, I thank the gentleman for yielding.  Last winter, two miracles occurred 3,000 miles apart. Here in Washington, our Nation's Capital, Republicans and Democrats came together and passed a significant water bill that was signed into law. Back in California, we saw massive amounts of rainfall that came down in our drought-stricken State, quickly filling our depleted reservoirs.  But I think we can actually take another big step forward by passing H.23, the GROW This bill before us provides even more long-term water solutions for California by expediting the consideration of feasibility studies for water storage projects that have languished for periods of time that are longer than it took to actually build the Hoover The GROW Act also includes provisions that are critical to the Bay-Delta operations and help improve water reliability.  Last year, Mr.Chairman, you heard a lot of doomsday predictions from certain groups that said the language we passed would push threatened species towards extinction. That did not happen. Today you hear a lot of the same talk. But solutions to H.23 are common sense and will bring reliability to the water supply of  Mr.Chairman, I encourage a ``yes'' vote.  ",CREC-2017-07-12-pt1-PgH5503.txt,165,GAINING RESPONSIBILITY ON WATER ACT OF 2017,2017.0,12.0,June
8069,topic-id,21,"Mr.Speaker, I have a motion to recommit at the desk.  The SPEAKER pro tempore. Is the gentleman opposed to the bill?  ",CREC-2017-07-12-pt1-PgH5503.txt,99999999999999,1215,2017.0,12.0,June
8070,topic-id,111,"I am opposed in its current form.  The SPEAKER pro tempore. The Clerk will report the motion to recommit.  The Clerk read as follows:       Mr.Carbajal moves to recommit the bill H.23 to the      Committee on Natural Resources with instructions to report      the same back to the House forthwith with the following      amendment:       Add at the end of title IV, the following:     406. WILDFIRE       Nothing in this Act shall impair the ability of the      National Interagency Fire Center to ensure that there is an      adequate supply of water to fight wildfires, utilizing water      from reservoirs or other surface waters.  The SPEAKER pro tempore. The gentleman from California is recognized for 5 minutes.  ",CREC-2017-07-12-pt1-PgH5503.txt,99999999999999,GAINING RESPONSIBILITY ON WATER ACT OF 2017,2017.0,12.0,June
8071,topic-id,822,"Mr.Speaker, this is the final amendment to the bill, which will not kill the bill or send it back to the committee. If adopted, the bill will immediately proceed to final passage as amended.  My request today is simple: to provide our firefighters with the water they need to effectively fight wildfires. As we speak, two large wildfires are burning in my district on the central coast of So far, over 40,000 acres of land have burned between the Alamo fire and the Whittier fire.  With more than a dozen homes and structures of central coast residents destroyed, we cannot overstate the important and effective work of hundreds of local, State, and Federal firefighters to contain these blazes and prevent more damages.  I spoke with incident commanders and toured both burn sites in Santa Barbara County, witnessing firsthand the incredible damage wreaked by these fires to our region.  I was grateful for the opportunity to address our firefighters and first responders and to thank these brave men and women for willing to risk their own safety to protect infrastructure and save lives.  In one harrowing instance, a firefighter cleared a path, driving a bulldozer through flaming brush to rescue dozens of Boy Scouts trapped at a campground at Lake  Today, we have a duty as appropriators to provide these men and women, working tirelessly in difficult conditions, with the resources they need to effectively combat these frequent and devastating wildfires across our country, and especially in my home  Ignoring our wildfire response when dealing with water allocation is irresponsible and will put American lives in danger.  In addition to adopting this simple amendment to ensure our firefighters' access to water, I urge my colleagues to work to end the disruptive practice of fire borrowing.                              {time}  1900  We cannot continue to rob funds designated for wildfire prevention to pay for fighting fires and simultaneously expect agencies to carry out effective land management practices to reduce the impact of catastrophic wildfires in the future.  Our Federal land management agencies are overwhelmed by the dramatic increase in fires on public lands in recent years, and we cannot in good conscience continue to ignore their urgent need for both prevention and firefighting funding.  I am deeply concerned that this underlying bill today does nothing to address the issues of limited water resources for our agencies charged with fighting wildfires.  I call upon my colleagues to adopt this common-sense amendment and show our firefighters that Congress not only appreciates their efforts, but acts to support them as well.  Mr.Speaker, I yield back the balance of my time.[[Page H5532]]    Mr.Mr.Speaker, I claim the time in opposition to the motion to recommit.  The SPEAKER pro tempore. The gentleman from California is recognized for 5 minutes.  Mr.Mr.Speaker, my friends' concerns are well placed; his amendment is completely misplaced.  The fact is that, for 45 years, our environmental laws have made the management of our forests virtually impossible. After 45 years of experience with these laws, imposed with the explicit promise they would improve our forest environment, I think we are entitled to ask: How is our forest environment doing? And the answer is damning; our forests are dying.  Timber harvests of surplus timber have fallen 80 percent in those years. The result is severe overcrowding in our forests. An acre normally supports between 20 to 100 trees, depending upon the topography; but because of these laws, average density in the Sierra has now ballooned to 266 trees per acre.  In this crowded condition, these trees fight for their lives against other trees trying to occupy the same ground. And in this crowded and stressed condition, they fall victim to disease, pestilence, drought, and, ultimately, catastrophic wildfire.  The answer is not this amendment that seeks to derail this needed water storage; it is to restore scientific management to our forests to restore them to a healthy condition.  When I visited the command center of the Rim Fire several years ago that threatened Yosemite Valley, I asked the firefighters: What answer can I take, in your name, back to Congress? And the answer was: Treatment matters. We need proper forest management.  The good news for my friend from Santa Barbara is he will soon have the opportunity to vote on just such a bill, the Resilient Federal Forest Act, by Mr.Westerman of It treats this problem comprehensively. It passed the House Natural Resources We hope to bring it soon to the floor of the It will address the problems that plague our forests by restoring proper scientific management to our public lands.  Mr.Speaker, I yield back the balance of my time.  The SPEAKER pro tempore. Without objection, the previous question is ordered on the motion to recommit.  There was no objection.  The SPEAKER pro tempore. The question is on the motion to recommit.  The question was taken; and the Speaker pro tempore announced that the noes appeared to have it.                             Recorded Vote  ",CREC-2017-07-12-pt1-PgH5503.txt,99999999999999,GAINING RESPONSIBILITY ON WATER ACT OF 2017,2017.0,12.0,June
8072,topic-id,681,"Mr.Speaker, I demand a recorded vote.  A recorded vote was ordered.  The SPEAKER pro tempore. Pursuant to clause 9 of rule XX, the Chair will reduce to 5 minutes the minimum time for any electronic vote on the question of passage.  This will be a 5-minute vote.  The vote was taken by electronic device, and there were--ayes 189, noes 230, not voting 14, as follows:                             [Roll 351]                               AYES--189     Adams     Aguilar     Barragan     Bass     Beatty     Bera     Beyer     Bishop (GA)     Blum     Blumenauer     Blunt Rochester     Bonamici     Boyle, Brendan     Brady (PA)     Brown (MD)     Brownley (CA)     Bustos     Butterfield     Capuano     Carbajal     Cardenas     Carson (IN)     Cartwright     Castor (FL)     Castro (TX)     Chu, Judy     Cicilline     Clark (MA)     Clarke (NY)     Clay     Clyburn     Cohen     Connolly     Conyers     Cooper     Correa     Costa     Crist     Crowley     Cuellar     Davis (CA)     Davis, Danny     DeFazio     DeGette     Delaney     DeLauro     DelBene     Demings     DeSaulnier     Deutch     Dingell     Doggett     Doyle, Michael     Ellison     Engel     Eshoo     Espaillat     Esty (CT)     Evans     Foster     Frankel (FL)     Fudge     Gabbard     Gallego     Garamendi     Gomez     Gonzalez (TX)     Gottheimer     Green, Al     Green, Gene     Grijalva     Gutierrez     Hanabusa     Hastings     Heck     Higgins (NY)     Himes     Hoyer     Huffman     Jackson Lee     Jayapal     Jeffries     Johnson (GA)     Johnson,     Jones     Kaptur     Keating     Kelly (IL)     Kennedy     Kihuen     Kildee     Kilmer     Kind     Krishnamoorthi     Kuster (NH)     Langevin     Larsen (WA)     Larson (CT)     Lawrence     Lawson (FL)     Lee     Levin     Lewis (GA)     Lipinski     Loebsack     Lofgren     Lowenthal     Lowey     Lujan Grisham,     Lujan, Ben Ray     Lynch     Maloney, Carolyn     Maloney, Sean     Matsui     McCollum     McEachin     McGovern     McNerney     Meeks     Meng     Moore     Moulton     Murphy (FL)     Neal     Nolan     Norcross     O'Halleran     O'Rourke     Pallone     Panetta     Pascrell     Payne     Pelosi     Perlmutter     Peters     Peterson     Pingree     Pocan     Polis     Price (NC)     Quigley     Raskin     Rice (NY)     Richmond     Rosen     Roybal-Allard     Ruiz     Ruppersberger     Rush     Ryan (OH)     Sanchez     Sarbanes     Schakowsky     Schiff     Schneider     Schrader     Scott (VA)     Scott, David     Serrano     Sewell (AL)     Shea-Porter     Sherman     Sinema     Sires     Slaughter     Smith (WA)     Soto     Speier     Suozzi     Swalwell (CA)     Takano     Thompson (CA)     Thompson (MS)     Titus     Tonko     Torres     Tsongas     Vargas     Veasey     Vela     Velazquez     Visclosky     Walz     Wasserman Schultz     Waters, Maxine     Watson Coleman     Welch     Wilson (FL)     Yarmuth                               NOES--230     Abraham     Aderholt     Allen     Amash     Amodei     Arrington     Babin     Bacon     Banks (IN)     Barletta     Barton     Bergman     Biggs     Bilirakis     Bishop (MI)     Bishop (UT)     Black     Blackburn     Bost     Brady (TX)     Brat     Bridenstine     Brooks (AL)     Brooks (IN)     Buchanan     Buck     Bucshon     Budd     Burgess     Byrne     Calvert     Carter (GA)     Carter (TX)     Chabot     Coffman     Cole     Collins (GA)     Collins (NY)     Comer     Comstock     Conaway     Cook     Costello (PA)     Cramer     Crawford     Culberson     Curbelo (FL)     Davidson     Denham     Dent     DeSantis     DesJarlais     Diaz-Balart     Donovan     Duffy     Duncan (SC)     Duncan (TN)     Dunn     Emmer     Estes (KS)     Farenthold     Faso     Ferguson     Fitzpatrick     Fleischmann     Flores     Fortenberry     Foxx     Franks (AZ)     Frelinghuysen     Gaetz     Gallagher     Garrett     Gianforte     Gibbs     Gohmert     Goodlatte     Gosar     Gowdy     Granger     Graves (GA)     Graves (LA)     Graves (MO)     Griffith     Grothman     Handel     Harper     Harris     Hartzler     Hensarling     Herrera Beutler     Hice, Jody     Higgins (LA)     Hill     Holding     Hollingsworth     Huizenga     Hultgren     Hunter     Hurd     Issa     Jenkins (KS)     Jenkins (WV)     Johnson (LA)     Johnson (OH)     Jordan     Joyce (OH)     Katko     Kelly (MS)     Kelly (PA)     King (IA)     King (NY)     Kinzinger     Knight     Kustoff (TN)     Labrador     LaHood     LaMalfa     Lamborn     Lance     Latta     Lewis (MN)     LoBiondo     Long     Loudermilk     Love     Lucas     Luetkemeyer     MacArthur     Marchant     Marino     Marshall     Massie     Mast     McCarthy     McCaul     McClintock     McHenry     McKinley     McMorris Rodgers     McSally     Meadows     Meehan     Messer     Mitchell     Moolenaar     Mooney (WV)     Mullin     Murphy (PA)     Newhouse     Noem     Norman     Nunes     Olson     Palazzo     Palmer     Paulsen     Pearce     Perry     Pittenger     Poe (TX)     Poliquin     Posey     Ratcliffe     Reed     Reichert     Renacci     Rice (SC)     Roby     Roe (TN)     Rogers (AL)     Rogers (KY)     Rohrabacher     Rokita     Rooney, Francis     Rooney, Thomas     Ros-Lehtinen     Roskam     Ross     Rothfus     Rouzer     Royce (CA)     Russell     Rutherford     Sanford     Schweikert     Scott, Austin     Sensenbrenner     Sessions     Shimkus     Shuster     Simpson     Smith (MO)     Smith (NE)     Smith (NJ)     Smith (TX)     Smucker     Stefanik     Stewart     Stivers     Taylor     Tenney     Thompson (PA)     Thornberry     Tiberi     Tipton     Trott     Turner     Upton     Valadao     Wagner     Walberg     Walden     Walker     Walorski     Walters, Mimi     Weber (TX)     Webster (FL)     Wenstrup     Westerman     Williams     Wilson (SC)     Wittman     Womack     Woodall     Yoder     Yoho     Young (AK)     Young (IA)     Zeldin                             NOT VOTING--14     Barr     Cheney     Cleaver     Courtney     Cummings     Davis, Rodney     Guthrie     Hudson     Johnson, Sam     Khanna     Lieu, Ted     Nadler     Napolitano     Scalis                Announcement by the Speaker Pro Tempore  The SPEAKER pro tempore (during the vote). There are 2 minutes remaining.                              {time}  1909  So the motion to recommit was rejected.  The result of the vote was announced as above recorded.  The SPEAKER pro tempore. The question is on the passage of the bill.  The question was taken; and the Speaker pro tempore announced that the ayes appeared to have it.                             Recorded Vote  ",CREC-2017-07-12-pt1-PgH5503.txt,99999999999999,REMEMBERING DON DUNWELL,2017.0,12.0,June
