speech_id,topic_id,word_count,speech_text,file_name,speaker_id,session_title,year,day,month
8125,topic-id,1261,"Mr.President, four years ago, a narrow majority of the Supreme Court struck down the heart of the Voting Rights Act in Shelby County v. That 5 to 4 decision crippled the Federal government's ability to protect minority, elderly, and disadvantaged voters across the country. The impact of this disastrous ruling has been even worse than imagined.  Before the ink even dried on the Court's opinion, Republican officials in several States rushed to enact laws making it harder for minorities to vote. Prior to Shelby County, the Federal government had the ability to prevent racial discriminatory voting changes from taking effect before those changes occur. Proposed laws and new voting procedures would first have been reviewed by the Federal courts or the Department of Justice to ensure that voting rights would not be harmed if the changes went into effect. But without the full protections of the Voting Rights Act after Shelby County, discriminatory laws quickly passed Republican legislatures in several  Chief Justice Roberts's majority opinion in Shelby County noted several[[Page S3734]]times that the protections of the Voting Rights Act are no longer appropriate because our ``Country has changed.'' It is true that our Nation has changed--we have made progress. But there is no question that the scourge of racial discrimination still exists. There are still those within our society intent on suppressing the right to vote and keeping minorities from exercising their constitutional right to participate in our democracy. Since the Shelby County ruling--and now emboldened by the Trump Administration--these forces are more concerning than they have been in decades.  Unfortunately, what has transpired in the aftermath of the Shelby County decision makes the need for the full protections of the Voting Rights Act unmistakably clear. Voter suppression efforts have found renewed life in numerous jurisdictions across the country. Thankfully, in some cases the courts have been able to provide a backstop. Based on strong evidence that hundreds of thousands of minority voters have been disproportionately prevented or discouraged from voting by Republican-enacted voting restrictions, Federal courts have blocked or rolled back many of these laws. Importantly, Federal courts have repeatedly found that these States enacted laws with the intention to discriminate.  Just last month, the Supreme Court left in place the Fourth Circuit Court of Appeals ruling that blocked North Carolina's harsh voting restrictions, including a strict photo identification law. The Fourth Circuit concluded that the Republican legislature had passed the law with the intent to racially discriminate against African Americans, and found that ``the new provisions target African Americans with almost surgical precision.''  In April of this year, Federal district court ruled for a second time that Texas's photo ID law was enacted with the intent to racially discriminate and had a racially discriminatory effect on Hispanic and Black voters. This ruling came after the Fifth Circuit Court of Appeals reaffirmed that the Texas law should be struck down because of its discriminatory effect on minority voters. But just weeks ago, the Republican-led Texas legislature and Governor enacted a new law in an attempt to escape the court's rulings.  Federal courts in Kansas and North Dakota have also acted as a bulwark against attempts by Republican officials to disenfranchise minority voters. In Kansas; courts have issued rulings rejecting repeated attempts by Kansas Secretary of State Kris Kobach from making voter registration more difficult. In North Dakota, a Federal district court held that the State's strict photo ID law disproportionately burdened Native Americans and blocked its implementation in the 2016 election.  These decisions are only the tip of the iceberg of what has transpired since Shelby While our courts are acting to guard against attempts to block minorities from accessing the ballot box, each of these cases requires years of litigation, money, and resources. And these are just the voting changes Republicans are enacting at the State level. Many of the efforts at the local level have gone unnoticed but have equally devastating effects on the voting rights of minorities.  The original Voting Rights Act would have prevented many of these discriminatory laws. But the Supreme Court's decision has taken this country back to an era before the Civil Rights movement--a bad time in our history where some states openly discriminated against minority voters. We are constantly reminded how costly the fight for voting and civil rights has been in this country. Just yesterday, we marked the 53rd anniversary of three civil rights activists who were killed in Mississippi for registering minorities to vote. James Chaney, Michael Schwerner, and Andrew Goodman gave their lives in 1964 when they were murdered while fighting in Mississippi for racial equality and free access to the ballot box. Their example, and the example of generations of civil rights activists who gave their sweat, blood, and sometimes their lives must inspire us and drive us to do more. It is now imperative for us to do everything in our power to correct the Shelby County decision and reinstate the full protections of the Voting Rights Act for the next generation.  The legislation I am introducing today would restore and update the Voting Rights The Voting Rights Advancement Act of 2017 not only modernizes the Voting Rights Act in response to Shelby County, it also modernizes the law to provide tools to combat current forms of voter discrimination. This bill responds to calls from community leaders and grassroots activists working in communities whose voting rights have been threatened or suppressed. It responds to voting rights experts and civil rights leader who have called for strong legislation to counter the voter intimidation and patently discriminatory efforts that were unleashed after the Shelby County ruling.  I am proud to introduce this bill with forty-six original cosponsors, nearly every single member of the Democratic caucus. I am also proud to be joined by Senator Durbin, who worked with me to reauthorize the Voting Rights Act in 2006. In addition, the House of Representatives is today introducing a companion bill led by Congresswoman Terri Sewell, Congresswoman Judy Chu, Congresswoman Michelle Lujan Grisham, my friend Congressman John Lewis, and over 175 members of the House Democratic caucus.  We are all joining together to introduce this bill today because we will not let systematic and persistent efforts to suppress Americans' right to vote go unchecked. We will not stand idly by while this country reverts to a bygone era where it was acceptable to disenfranchise our own citizens because they were Black, Hispanic, or disadvantaged. These unconstitutional and discriminatory efforts deserve a strong response.  Protecting Americans' constitutional right to vote is not a partisan exercise. The original enactment and every reauthorization of the Voting Rights Act has always been bipartisan. When we last reauthorized the Voting Rights Act in 2006, I worked closely with the Republican chairmen of the Senate and House Judiciary Committees--former Senator Arlen Specter and Representative Jim And past reauthorizations of the Voting Rights Act have been signed into law by Republican presidents.  But now, the Republican majority--in both the House and the Senate--refuses to protect the right to vote, restore the Voting Rights Act, or address other critical civil rights issues. Since the Shelby County decision, Republicans at every level of our government have acted to make it harder to vote. This has become the legacy of today's Republican They should think seriously about reversing course, rather than trying to reverse the gains we have made in history. One significant step would be to join with us to pass the Voting Rights Advancement Act to restore the historic and critically-needed protections of this landmark civil rights law.                          ____________________",CREC-2017-06-22-pt1-PgS3733.txt,1383,GAINING RESPONSIBILITY ON WATER ACT OF 2017,2017.0,22.0,July
8014,topic-id,506,"Mr.Chairman, I thank my colleague for yielding.  Mr.Chairman, I rise in strong opposition to H.23. Yet, again, it seems that instead of addressing the issues underlying California's water supply, some of my colleagues are more interested in fanning the flames of century-old water disputes.  The city of Sacramento, which I represent, sits at the confluence of two major rivers, the Sacramento and the Because there is no such thing as an average water year in California, living under the threat of drought and flood has become a way of life for Sacramento residents.  We are working with the Army Corps to invest billions of dollars in flood protection, and we are collaborating with the Bureau of Reclamation to build a groundwater bank and a water recycling facility to increase access to drinking water.  Congress should explore real solutions to drought challenges, as the Sacramento region is doing.  In the short term, we must be efficient about fixing leaks and waste while also continuing conservation efforts.  In the long-term, we should be taking advantage of new technologies to monitor our water use and making investments in wastewater cycling in above- and below-ground water storage.  Last Congress, I introduced a commonsense bill that removed barriers to wastewater cycling projects, making it possible for them to move forward more quickly and efficiently with Federal support. It ultimately became law. Yet instead of debating these types of solutions, we are wasting time on a bill that does not solve our underlying water supply problem.                              {time}  1700  I grew up on a farm in the Central My father, my uncles, and my grandfather were farmers. We raised peaches, plums, nectarines, and grapes. I recall living and understanding what water means to us, so I do understand the value and sensitivities about water.  Now, in the Sacramento region, where I now represent, we have tried to take a balanced approach, working to protect the environment while providing water for our farms and our cities.  It is misleading to claim that H.23 will solve our drought problems. This legislation only prioritizes certain regions or industries instead of taking the comprehensive approach we need.  And by giving the Federal Government power to dictate the best uses of the State's water, H.23 sets a disastrous precedent for other States across the country that should raise alarm on both sides of the aisle.  The bill we are discussing today undermines a State's autonomy. Ultimately, I am concerned that this bill will weaken environmental protections for the Sacramento-San Joaquin delta, and harm our State's ability to manage its own water.  That is why I join my district and the State of California in strongly opposing this bill. We cannot afford to[[Page H5507]]give up California's right to control its own water future. We must focus on an all-of-the-above strategy that puts us on the path to a sustainable water supply while protecting our environment.  Mr.Chairman, I strongly urge my colleagues to reject this legislation.  Mr.Mr.Chairman, I am pleased to yield 2 minutes to the gentleman from California (Mr.Royce).  ",CREC-2017-07-12-pt1-PgH5503.txt,1814,ADDITIONAL STATEMENTS,2017.0,12.0,July
8054,topic-id,171,"Mr.Chair, I rise in support of Mr.DeSaulnier's amendment to H.23.  Recycling projects provide sustainable water sources that help make our communities drought-resilient. In Sacramento, we are working to build a project that would use claimed wastewater to irrigate up to 18,000 acres of farmland and habitat.  These are the types of projects that help prepare California for the next drought, and they result in more water for our farms and cities. We should be working on sustainable solutions like these.  Last Congress, I introduced a bill to improve the Bureau of Reclamation's Title XVI Water Reclamation and Reuse Funding Program by removing the requirement that each recycling project receive an explicit congressional authorization. The bill was included in the WIIN Act passed into law last year, thereby expanding the pool of eligible projects.  Mr.DeSaulnier's amendment continues to move us forward by emphasizing the importance of recycling in our approach to managing water use. I urge my colleagues to support it.  Mr.Mr.Chair, I yield 1 minute to the gentleman from California (Mr.Costa).  ",CREC-2017-07-12-pt1-PgH5503.txt,1814,GAINING RESPONSIBILITY ON WATER ACT OF 2017,2017.0,12.0,June
7976,topic-id,177,"Mr.Speaker, today another farm convoy left Michigan and headed south to help those suffering in America's heartland, where wildfires have burned more than 1 million acres in four  This convoy, and those like it in days gone by and the days to come, is the work of the amazing farming community in my district and across the State of  They have donated trucks, trailers, and time to drive supplies to the affected areas. They have donated food and fencing to help farmers recover and rebuild. They have donated care packages with candy and cards to care for the hurting souls.  Many volunteers are staying and helping in the devastated communities. In fact, tomorrow, two young men from Ogemaw County, Brady and Keaton, are scheduled to travel with 4-H kids from Michigan's Thumb area to volunteer their skills and help build fencing in  The overwhelmingly and generous efforts of the Michigan farming community, in response to this tragedy, represent the best of I pray for God's blessing on all those involved as they help with this crisis.                          ____________________",CREC-2017-04-06-pt1-PgH2769-3.txt,2248,COUNTERING IRAN'S DESTABILIZING ACTIVITIES ACT OF 2017,2017.0,6.0,July
8078,topic-id,495,"Mr.President, today I wish to recognize Alaska's one and only professional sports team and an organization that has become part of the fabric that makes up the Alaskan society, the Alaska  The team started as a small semi-professional hockey team in the late eighties known as the Anchorage Aces, but quickly gained the support and popularity of the community and rose through the ranks to become a professional hockey organization in 1995. In 2003, after becoming the Alaska Aces, the team joined the East Coast Hockey League and almost immediately became one of the league's powerhouses, winning three ECHL Kelly Cups in 2006, 2011, and most recently 2014.  The Aces have produced some of the biggest Alaskan professional athletes such as Scotty Gomez, who went on to win two Stanley Cups and became an NHL All-Star on multiple occasions, and Eagle River's Brian Swanson, whose hockey career took him to the National Hockey League, Europe, and finally back home to the Aces before he retired in 2012.  As good as the team has become, it is their dedication to the community that made them a staple with multiple generations of Whether it was their ``Skate with the Aces'' events in which families could skate with the players and get to know them after home games or the ever-popular military appreciation games, this organization has made a lasting impact on the lives of many hockey players and fans alike.  The Aces are full of fond memories and traditions such as the cowbell crew, which is the name given to its enthusiastic fan section. Then there is Bobby Hill, also known as ``The Horseman,'' who is not only the Alaska Aces superfan in charge of keeping the energy alive at every home game by going up and down the length of the ice riding a hockey stick, but is also a Special Olympics Gold medalist.  The Alaska Aces will be dearly missed in what is certainly an unfortunate end for such a storied franchise. Economic times have taken a hit on many sectors of the Alaskan economy, and we have seen the impact with our sporting events, but Alaskans are resilient and our sports teams and athletes are no different. Hockey has a rich history in Alaska and is culturally ingrained in the fabric of our Alaska has over 45 hockey associations, reflecting the passion and involvement shared by Alaskans of all ages. It is this passion and dedication to the sport that will surely keep the spirit and memory of our Alaska Aces alive.  I want to commend the leadership of the team's owners, the dedication of its fans and players, and the community for making the Alaska Aces one of the league's best franchises and perennial contenders for the ECHL Kelly Cup every season. The Aces play their very last game on April 8, 2017; however, the memories that countless Alaskans have with our hockey team will not fade, but will last a lifetime.                          ____________________",CREC-2017-04-27-pt1-PgS2613-2.txt,1694,COUNTERING IRAN'S DESTABILIZING ACTIVITIES ACT OF 2017,2017.0,27.0,June
8074,topic-id,59,"Mr.Speaker, I was absent during rollcall votes 350, 351, and 352 due to my spouse's health situation in Had I been present, I would have voted ``yea'' on the DeSaulnier I would have also voted ``yea'' on the Motion to I would have also voted ``nay'' on final passage of H.23--Gaining Responsibility on Water Act of 2017.                          PERSONAL EXPLANATION  ",CREC-2017-07-12-pt1-PgH5503.txt,1602,WELCOMING RABBI HERSHEL LUTCH,2017.0,12.0,June
8107,topic-id,1053,"Mr.President, I thank Senator  Indeed, this is an example of the Senate working together. There is, simply, a problem in the bill that was passed.[[Page S3509]]It is a technical problem, but it goes to the heart of our military-civilian space program. It goes to the heart of the cooperation that we have had with Russia that goes back to the Soviet Union days when, in fact, in 1975, in the middle of the Cold War, a crew from America rendezvoused and docked with the crew from the Soviet Ever since that crew, which was led by Tom Stafford, of the United States, and General Alexey Leonov, of the Soviet Union, we have had cooperation in space, and that program continues today on the International Space  Before I get into talking about the details of the amendment, as Senator Gardner has discussed so well already, I hope that the Senate will treat it as technical in nature because it corrects what was not intended. Unless corrected, it will be disastrous not only for NASA but for all of the burgeoning commercial space industry, which we are bringing back to What has happened over the last four decades, in the meantime, is that a lot of that commercial space industry has flown the coop to other launchers from other nations. But it is coming back to America.prayers for the Victims of the Congressional Baseball Practice Shooting  Mr.President, before I get into the substance, I just want to speak with regard to the terrible tragedy that occurred yesterday and of my feelings about this violence that has occurred. I don't know whether it has occurred because of the excessive rhetoric and the sharpness and the fact that politics has become a blood sport, but we are so divided.  This is what I want to say. We are Americans first, regardless of party. In times of threat, we come together. We are all on the same team.  This Senator has prayed, as I know others have, for the complete recovery of all of those who were wounded yesterday, two of whom were apparently grievously wounded. We pray for their full recovery. It was a heinous attack. Let's come together in bipartisanship.                     Amendment 250, as Modified  Mr.President, right here is an example of coming together. Recognizing there is a technical problem, we are coming together to fix that problem. Let's do this in the spirit of what Americans do. We are Americans first.  I am obviously here, as I demonstrated in my vote yesterday, for the Iran sanctions bill, as well as the Russia sanctions amendment, which we adopted yesterday. Both were bipartisan efforts. I wish to thank our colleagues, especially the members of the Banking and Foreign Relations  This Senator is a cosponsor of the sanctions bill which addresses Iran's support for terrorism, ballistic missile activity, and human rights violations--these destabilizing activities--and this bill strengthens the hand of the United States in countering These are destabilizing activities separate and apart from the Iran nuclear agreement, and to date, the United States has the evidence that they have complied with the Iran nuclear agreement.  At the same time, we are facing an aggressive Vladimir The Russia bill which we debated yesterday and which will come to final passage shortly strengthens our hand against Putin's The U.intelligence community has already made clear that Putin attempted to interfere in our election. Let me tell my colleagues, that didn't stop with the past election. It is continuing. And we better be ready for it next year in the 2018 elections because Putin and the GRU have done all the groundwork. But that is nothing new because he had done it in elections before in Europe, and he has been doing it in elections right now, as we saw in It boomeranged on him, thank goodness. We will see an attempt on the upcoming German elections.  The intelligence community has made it very clear--the ranking member of the Intelligence Committee is here--that Putin and the GRU are likely to do this again. That is why I say beware. They have laid the groundwork for next year's elections to try to interfere. Putin's influence campaign struck at the very core of our democracy and simply must not be permitted to do it again.  Now is not the time to cozy up to Russia; rather, the United States must redouble our cyber defenses and our cyber offenses to deter him, to make him feel enough pain so that he won't do it again. The sanctions we will adopt today are tough. We need this, but we need more.  Shortly, we are going to vote on the amendment Senator Gardner has explained. Interestingly, in all of this angst and conflict with Russia, we get along with Russia in the civilian and commercial space program. We have had peaceful cooperation in outer space ever since what I told my colleagues about; that is, since 1975, in the middle of the Cold War, the rendezvous and docking and living together in space for 9 days, a Soviet crew and an American crew. That has been the central theme of our space program since that time. The shining example of that now is the cooperation in the International Space Station, the football field-sized--it is 120 yards long; think one goalpost to another. People don't have any idea of how big it is on orbit. It circles the Earth every 90 minutes.  We have been working in space together with many nations but especially our partner the Russians for over 16 years. So the peaceful cooperation in space has been good for business. It has been good for jobs in And we are working to grow our share of an over $300 billion global space economy.  That is what this amendment is about. It is about fixing the question on the purchase of those RD-180 engines, the Russian engine that is used in the Atlas V, that is used not only for defense launches but for commercial launches and will be one of the two rockets launching American astronauts within a year and a half to and from the International Space  So this amendment is for the benefit of our economy, as well as the betterment of our civilization.  Mr.President, I yield the floor.  The PRESIDING The Senator from  ",CREC-2017-06-15-pt1-PgS3505-6.txt,859,GAINING RESPONSIBILITY ON WATER ACT OF 2017,2017.0,15.0,June
8153,topic-id,27,I yield the floor.  I suggest the absence of a quorum.  The PRESIDING The clerk will call the roll.  The bill clerk proceeded to call the roll.  ,CREC-2017-07-10-pt1-PgS3876-4.txt,859,RECOGNIZING APPOINTEES TO MILITARY SERVICE ACADEMIES,2017.0,10.0,June
