speech_id,topic_id,word_count,speech_text,file_name,speaker_id,session_title,year,day,month
14265,topic-id,1089,"Mr.President, I rise this evening to help deliver a message from American families to my colleagues on the other side of the aisle. The American people have sent a clear message to The message is that they do not want us to go forward with this partisan--and mean--healthcare repeal bill. But, incredibly, we are today about to embark on a vote to do the exact opposite.  What is happening in Washington this week is that we are completely ignoring the message that Wisconsinites and the hard-working American families across this country have sent for us to hear. Haven't you been listening?  To my colleagues on the other side of the aisle, have you been listening to the calls pouring in from families in your States? Have you been listening to the voices of parents and their children, the schoolteachers and doctors, and the working people who are daily struggling to get ahead? These messages have been sent to They have been sent loudly and for too many months--in fact, for too many months for you to possibly not have heard them. The American people don't want to pay more for less care. They don't want the age tax or the higher premiums this plan is offering. People with preexisting conditions don't want to be thrown into a high-risk pool or priced out of the coverage they have today. They don't want bare-bones insurance that doesn't cover the essential services and lifesaving care they may need. They don't want their loved ones who depend on Medicare for nursing home care or their disabled children who rely on Medicaid funding at school to have their care put at risk through caps and cuts. The American people don't want a plan that will make things worse.  It is hard for me to believe that Washington hasn't heard this message because I have been listening.  I have been listening to people like Jean is from Baraboo, She told me that she is scared because her Crohn's disease would cost her a fortune if her preexisting conditions were not covered. She told me that she needs the healthcare she has today because ``my husband ruptured a disk in his back that prevented him from getting a job that promised us coverage. So now he works multiple jobs.''  I have been listening to Mary from Kenosha, I met with Mary recently, and she told me about her son Kyle, at a young age, was diagnosed on the autism spectrum and was never expected to learn to even speak. When Kyle was 7, medical professionals spoke with Mary and said that Kyle might have to be removed from his home and left to be cared for in an institution. But Mary had hope, and thanks to Medicaid, Kyle was able to receive some very specialized medical therapy for his autism, and he was able to remain at home. He was able to receive an education. He was able to get his driver's license, and now Kyle is attending college.  Mary is terrified, nonetheless, that this bill's drastic cuts to Medicaid would rob Kyle of the care he needs to achieve the independence that he has worked so hard for during his entire life. Mary told me about her concern for so many other families with similar situations.  I have been listening to Greg is from Stoddard, He has no idea how he and other older Wisconsinites will be able to afford higher costs for healthcare. Greg's sons, both of whom have diabetes, are already struggling with skyrocketing insulin prices.  I have been listening to the Schaumberg family in Seymour, Their daughter Zoe was born with a congenital heart defect. She had to have open heart surgery at 5 days of age. Now, Zoe is guaranteed coverage without being denied or charged more, but Zoe's parents are scared that this repeal plan will make things worse. When Zoe's mom, Chelsey Schaumberg, was told about how this plan would weaken the guaranteed protections and care that people have today, she said[[Page S4155]]this in her letter to me: ``To me, it's like they're taking the American Dream from her . . . kids in Wisconsin with preexisting conditions . . . are counting on you to protect that right.''  This isn't right. This isn't fair. It is not who we are.  If my colleagues who have been drafting this plan behind closed doors have not been listening to the messages of fear and anxiety from the American people, maybe they will listen to why this proposal is very personal to me.  When I was 9 years old, I got sick. I got really sick. I was in the hospital for 3 months. Following getting out of the hospital, I required significant followup care for nearly a year before I regained my full strength and fully recovered.  But when it came to health insurance, it was like I had a scarlet letter. My grandparents, who raised me, couldn't find a policy that would cover me, not from any insurer and not at any price. They had to pay for my care out of pocket, and I can tell you they made some major sacrifices to do so, all because I was a child who had been branded with those terrifying words ``preexisting condition.''  So what are we doing here? It is time to stop the partisan nonsense. The people of Wisconsin did not send me to Washington to take away people's healthcare. They sent me to fight for people like Zoe, Kyle, and What I hear from people in Wisconsin is that they want us working together to protect the care people have and to make it more affordable.  We should be working together to lower costs like skyrocketing prescription drug prices. We should be working together to strengthen the insurance market and give people more options. But we should not be working on partisan repeal legislation that will make things worse, that will leave millions uninsured, that will make healthcare more expensive, and that will price families out of the care they have today.  It is time we listened to the messages that are being sent to It is time we worked together across the partisan aisle to do our jobs--the jobs the American people sent us here to do on their behalf.  I hope the congressional majority will join me and my colleagues to work together to strengthen healthcare and to move our country forward.  I thank the body.  I yield the floor.  The PRESIDING The Senator from  ",CREC-2017-07-24-pt1-PgS4139-4.txt,1558,MOTION TO DISCHARGE--S.J. RES. 42,2017.0,24.0,June
13997,topic-id,161,"Mr.Speaker, the new version of the Senate Republican healthcare bill should be tossed in the trash. No amendment will fix the massive damage it will cause to California and the entire country.  Women, seniors, and low-income families across the country are being threatened. TrumpCare threatens to shut down hospitals in my district, which would leave many of my constituents without access to critical healthcare services.  People like Doreen from Los Angeles County, will be forced to fight for their lives. Doreen was in remission from ovarian cancer in 2010, when she successfully signed up to receive coverage through the Affordable Care Act, even though she had a preexisting condition. Now she is scared for her life as TrumpCare threatens to take away the healthcare she needs to stay cancer free.  I stand up for ``fighters,'' ``luchadoras'' like Doreen--a woman, senior, and cancer survivor--who will be left helpless by  Again, the Senate Republican healthcare bill should be tossed in the trash.                          ____________________",CREC-2017-07-14-pt1-PgH5870-5.txt,99999999999999,NATIONAL DEFENSE AUTHORIZATION ACT FOR FISCAL YEAR 2018--MOTION TO,2017.0,14.0,June
14138,topic-id,174,"Madam Speaker, I rise today to recognize National Maritime  Since America's founding, our men and women who serve as mariners have dedicated themselves to protecting our economy and our interests at home and abroad. Whether it be through ensuring the delivery of goods, supporting us during times of peace, or standing up during times of war, the maritime industry has held strong.  The Port of Los Angeles, which I am proud to represent, has made countless contributions not only to California but to every other congressional district.  As a member of the Committee on Homeland Security, I work to ensure the safety and security of the Port of Los Angeles so that it can continue to serve as America's port. Along with the Port of Long Beach, the ports employ twice as many men and women as the Hollywood entertainment industry.  Today, I am proud to honor those men and women who serve and have served as U.merchant mariners. I ask that we continue to support the maritime industry today, and every day.                          ____________________",CREC-2017-05-22-pt1-PgH4417-2.txt,99999999999999,INDEPENDENT COMMISSION FOR RUSSIA INVESTIGATION,2017.0,22.0,July
14150,topic-id,160,"Mr.Speaker, I rise today to mark the first 100 days of President Donald Trump's administration.  In his first 100 days, President Trump has enacted more pieces of legislation than any other President since Truman, facilitated the earliest Supreme Court confirmation since 1881, eliminated many onerous regulations to restore economic optimism and opportunity, protected the sanctity of life, and driven illegal border crossings to a 17-year low. His accomplishments are truly remarkable.  I have appreciated President Trump's willingness to listen and work with Congress on major pieces of legislation. His effort to work with Congress is a breath of fresh air.  President Trump made several promises to the American people, and I am encouraged by his efforts to fulfill them. Mr.Speaker, the American people are watching--they are watching both the President and those of us in They will not accept broken promises or half-hearted measures. They want results. I look forward to working alongside President Trump to keep our promises.                          ____________________",CREC-2017-04-27-pt1-PgH2926-2.txt,99999999999999,1300,2017.0,27.0,July
14256,topic-id,1279,"Mr.President, I thank the Senator from Pennsylvania for being here. We have been out here many a night, talking about the importance of I so appreciate his leadership in the Senate on this very important issue. He has been a champion of the Children's Health Insurance Program and has been a voice amongst all Senators in making sure that people have access to healthcare. I so appreciate being out here with him tonight.  I don't really appreciate being here right at this moment. I am really flabbergasted. Why are we here at this moment? Why are we here? I am pretty sure that President Trump, when he was candidate Trump, put in a tweet that he would not cut Yet that is the proposal we are talking about.  No matter what the proposal is--repeal, the House bill, the proposal scored by CBO or some Senate alternative on junk insurance--they all are a cut to Medicaid, so I am not sure how we are here. I am not sure how we are here when the Vice President at the time campaigned, I am sure, against the Affordable Care Act and then became Governor of Indiana and implemented Medicaid expansion in his own After saying that he was against the Affordable Care Act, he implemented Medicaid expansion. I am sure people in his home State said: If you want to take care of people, if you want to raise our standard of living, if you want to keep down the costs of healthcare delivery and private insurance, put people on coverage so that they aren't driving up the cost of uncompensated care.  So how are we here? How are we here when our House colleagues came up with a proposal that basically cuts 23 million people off of healthcare--including 15 million people on Medicaid--after working with the President, who said that he didn't want to cut Medicaid, and the Vice President, who basically campaigned against it and then went ahead and expanded it?  I can't believe how many times I have been on the Senate floor, and I haven't seen one of my colleagues come down here and talk about solutions that they are proposing. I just hear them come and talk about the repeal of the Affordable Care Act and kicking millions of people off of the healthcare they currently have.  Tonight, I can imagine there are many people across the United States of America who are like me, thinking, how could this be happening? How could we be sitting here tonight, not knowing what the Senate is going to vote on, not knowing whether they are going to repeal their health insurance, not knowing where their Senators stand or even if the Senator knows what proposal they are voting on? Yet I can tell you this: More than 70 percent of the American people think the ideas that have now been put forth by the House and the Senate Republicans and the President do not work. They are not the way to increase access to healthcare and drive down the cost of private insurance in the insurance market.  You don't have to take my word for it. I am looking at a statement by Ohio's Republican Governor, John I worked with John Kasich in the House of He was a budget hawk. He wanted to figure out how to make things work. So I trust that, as Governor, he is a fiscal steward about how to get things done when he says: ``Until Congress can step back from political gamesmanship and come together with a workable, bipartisan plan, it is a mistake for the Senate to proceed with a vote on Tuesday and force a one-sided deal that the American people are clearly against.''  So why are we here? Why are we here when a President promised that he wasn't going to cut Medicaid, a Vice President said that he was against the bill but then went and did Medicaid expansion? The people in the United States responded very clearly that they are not interested in cutting millions of people off of health insurance because they know that, even if it doesn't affect their family, it doesn't make common sense for keeping down the costs of healthcare.  So I ask my colleagues to stop and think about the people in the United States of America who are clearly scared to death about what is going to happen tomorrow. They are scared that someone in their family or that they, the provider for their family, are not going to be able to provide insurance.  If you are so brave, come down here and volunteer, as an amendment, to cut all of us--cut the Senate off of our access to health insurance until we come up with some idea that you think is so terrific. I doubt you will come and propose that. You wouldn't want your family cut off of healthcare.  I meet people like Emily Talbot, who came to visit me from Seattle Children's Hospital, who at age 6 was diagnosed with a condition that affected her brain tissues and spinal canal. She was from Idaho, and she was referred to Seattle Children's because it is the pediatric referral center for our region. Thanks to Medicaid, she saw 11 different pediatric subspecialists and had 13 brain surgeries and 7 back surgeries. Her mom told me that without Medicaid and without the prohibition on lifetime caps, she wouldn't have access to healthcare today.  Is that what my Republican colleagues want to say tomorrow, that ``we don't really know for sure how we are going to do this, we don't really know what works, but even though we said we weren't going to cut Medicaid, we are going to cut people off of health insurance who currently have coverage?''  I think the reason why people like these Governors from Republican States have been willing to speak out against this proposal and raise their concerns is because they have to be a steward of Medicaid, and they have to be fiscally responsible. So they know there are better ways.  When I talk to the regional hospitals in my State, they tell me that covering more people under Medicaid has created downward pressure on price in the individual market. It has helped us.  So our solution cannot be decimating the Medicaid market. Our solution has to look at those in the individual market who don't have as much clout as a big employer or somebody who can buy in bulk and drive down their price. There are ways to address that issue.  I look forward to working with my colleagues on those solutions, but that is not what is being recommended tomorrow. Those solutions haven't been put forth, nor are they part of any of these proposals. So I ask my colleagues to not proceed.  The President promised he was not going to cut Medicaid, and now it is like you want somebody to jump off the cliff tomorrow, and you are saying: Oh, by the way, I will throw you a parachute on the way down. It doesn't work.  As my colleagues have said here tonight, it is time to give certainty to this population that we have a proposal that will help continue to give them access to care. I would say to my colleagues that taking a vote on politics when it is the lives and the healthcare access that so many millions of Americans seek--don't play politics with healthcare. Let's get a solution that works and works on both sides of the aisle.  I thank the Presiding Officer, and I yield the floor.  The PRESIDING The Senator from Rhode  ",CREC-2017-07-24-pt1-PgS4139-4.txt,172,1300,2017.0,24.0,May
