speech_id,topic_id,word_count,speech_text,file_name,speaker_id,session_title,year,day,month
14259,topic-id,2271,"Mr.President, I thank my colleague from Massachusetts for her good words and her advocacy.  I rise to join her and my colleagues on the floor in sharing the concerns I continue to hear every single day in my State, whether it is just simply walking the parades, as I did in Stillwater, MN, where people would come up off the sides, or, on the Fourth of July, when a family with a child with Down syndrome just came off the side of the parade and grabbed me and said we need healthcare for our son, that we cannot cut him off, that we cannot make these drastic, draconian reductions to Medicaid--because he is the face for  Right now, as far as I know, we have many versions of this healthcare bill. I think I heard this version referred to as option I was thinking that is not really correct because we have had options A and Those were the two House healthcare bills. We had options C and D, which were the two Senate healthcare bills. Then we went to option E, which was back to the idea of repealing without having a replacement. Now, as far as I know, after doing A, B, C, D, and E, we are at plan My mom was a teacher her entire life, and I learned from her that you cannot get much lower than F, right? I think it is time to set a new course, and that is to work together for a better grade for the American people and for a better healthcare plan, which means working across the aisle to make changes to the Affordable Care  The Minnesotans whom I have heard from do not like A, B, C, D, E, or On Friday, in fact, I received a letter that was signed by 121 different Minnesota healthcare organizations, and it talked about these past proposals.  They wrote this:       Minor changes or amendments will not change the ultimate      impact of these bills and their deep and devastating impact      on Minnesota and its citizens.  What were these groups?  They were pretty mainstream groups, those being the AARP Minnesota, our children's hospitals, the Autism Society of Minnesota, our nursing homes, the Minnesota Hospital Association, the Minnesota Nurses Association, Mental Health Minnesota, our Catholic Health Association, our addiction treatment professionals, and many more.  As different as these groups may be in their missions and in the work they do and who belongs to them and where they live, what they have in common is that they are dedicated to taking care of the health and well-being of They are scared about what would happen if any of these proposals--A, B, C, D, E, or F--were to pass.  They have seen that the nonpartisan Congressional Budget Office estimates that with a number of these bills, it would mean that over 20 million people, if not all of them, would lose their health insurance, that Medicaid would get cut by more than $700 billion, and that out-of-pocket costs would skyrocket. Deductibles for a benchmark plan could reach $13,000 by 2026. They have seen that the Congressional Budget Office has found that a repeal bill without a replacement would be even worse, as 32 million people would lose their coverage, and premiums would double.  I understand why these Minnesota healthcare organizations are scared about these bills, but the people who are even more scared are the citizens of my State who depend on the Affordable Care Act for their healthcare.  As I said, we all knew, on the day it passed, that the Affordable Care Act was a beginning and not an end. You cannot pass a major piece of legislation like that without making changes over time. Unfortunately, with the exception of a few minor things, we have been, basically, blocked from making changes because we are always having thrown at us this idea of simply repealing everything and causing chaos. After the sentiment of the American people has been made quite clear--and you do not have to look at a poll to know that; all you have to do is walk down the Main Street during any parade in our State--now is the time for us to work across the aisle and make some positive changes.  What are those changes? For one, we know we must bring some certainty to the exchanges and stabilize the market.[[Page S4148]]  I see the Senator from New Hampshire here who is the former Governor of New She knows, along with her colleague Senator Shaheen, we need to have more certainty in the marketplace. That is why we support the bill that would do that. We should vote on that bill.  I also support Senators Kaine and Carper's legislation--the Individual Health Insurance Marketplace Improvement Act--to reestablish a Federal reinsurance program. This bill would lower premiums by providing support for high-cost patients.  Now, the Republican legislature in my State--both houses are Republican--joined with the Democratic Governor in our State and passed a similar State-based reinsurance program.  I know Alaska, which, by all accounts, is a red State, has passed a reinsurance program that recently got approval from this administration. Just last week, as Senator Hassan knows, New Hampshire announced its plans to pursue one as well.  So we can and we should come together to pursue this as one change we can make positively for the  Another is, it is long past time to do something about the rising cost of prescription drugs. I have a bill--and I see my colleague from Minnesota here as well, Senator We have worked on this issue together on both bills, which is similar to this issue of harnessing the negotiating power of 41 million seniors who are on Medicare in order to bring drug prices down. Right now, Medicare is literally banned from negotiating on behalf of 41 million seniors. The last time I checked, the senior citizens in my State had a lot of power, and 41 million people, especially seniors, is a lot of negotiating power. Let's harness that because it will not just help to bring drug prices down in the Medicare Program, but it will help down the line for all citizens.  There is the bringing in of more competition. One way you do that is by dangling the prospect of competition from other countries. You can do it with a trigger that is based on the number of competitors you have in a certain market. You can do it based on an increase in price or you can just do it.  I and Senator McCain, who is certainly in our thoughts and prayers this week, have long had a bill to allow Americans to bring in safe, less expensive drugs from That is very similar to that of the U.market. As I have often noted when I talk about this bill, we can see Canada from our porch in We can see those lower prices right across the border.  When we have developed so many lifesaving drugs, when we have done the research, when we have put government money--taxpayer money--into the research, why in this country do we have the most expensive drugs in the world?  I can tell you why. It is that we have not done anything about it here because, for too long, the pharmaceutical companies have been able to have their way when it comes to legislation. This is the end of that. Finally, the American people are starting to see this as not just campaign rhetoric but as a real problem when 4 out of the top 10 best selling drugs have gone up over 100 percent in just the last 10 years.  Here are some more ideas.  Senator Lee and I have a bill--bipartisan, across the aisle--that would again allow the temporary importation of safe drugs that have been on the market in another country for at least 10 years when there is not healthy competition for that drug in this country.  I and Senator Grassley, a Republican from Iowa, have a bill to stop something called pay for delay, which is when big pharmaceutical companies actually pay off generic companies to keep less expensive products off the market. That is an outrage. I would challenge any Senator to vote against that. I do not think one will. That is why we need a vote, and that is a perfect example of a bipartisan bill that could be included in a package of measures that could be improvements on the Affordable Care  How about this one? It is the CREATES Act, which is another bipartisan bill with me, Senator Grassley, Senator Leahy, Senator Feinstein, Senator Lee, and many others that would put a stop to tactics in which pharmaceutical companies refuse to provide samples that the generic companies need to develop new drugs. According to the Congressional Budget Office, this legislation would save taxpayers $3.5 billion, and the one I just mentioned on pay for delay would save taxpayers $2.9 billion.  Why would we say to the taxpayers of this country that we will not do that, that we will not even allow it to come up for a vote?  These are votes the Senate should and must take. Bringing up a bill that devastates the Medicaid Program or that repeals big parts of the Affordable Care Act, without having a replacement, does the opposite. It does nothing. These bills--A, B, C, D, E, or F--do nothing in terms of bringing down pharmaceutical prices.  What is this really about? It is about the identical twins whom I met yesterday from Cambridge, MN, which is a small town--a town similar, I am sure, to the towns the Presiding Officer would find in his State or to the towns in New Hampshire or to the towns Senator Whitehouse would see in Rhode  This is about identical twins. One of the twins is a pitcher, and one of the twins is a catcher on their softball team. One of the twins found out, just in the last year, that she has juvenile diabetes. It is a very dangerous, dangerous thing to have at that young age. The other twin is perfectly healthy. Of course, the family had to go immediately to the doctor. They bought insulin, and the insulin had gone up three times what it should have in just the last few years. It is very difficult for them to afford now. They got the strips. They had to do all of this, and the price kept escalating. To add to everything else, now this mom is worried that one of her daughters, not two, will have a preexisting condition and be kicked off of the insurance.  Think about that. They are identical twins. It could be either one. You do not know which one. Is it the catcher? Is it the pitcher? It is a lottery. If you do not have healthcare like the Affordable Care Act in place, it is like a lottery. You do not know which one of them is going to be kicked off the insurance, not have insurance, and get very sick and possibly die. That is what we are talking about here.  That is not what this country is about. It could happen to anyone--to anyone in this Chamber, to anyone up in the Gallery, to anyone at home. You do not know when it is going to happen to you or your sister or your brother or your neighbor or your dad or your mom or your grandma or your grandpa. That is why we have affordable healthcare insurance.  This debate is also about our seniors and our rural communities. As Senator Franken knows, we have heard time and time again from our rural hospitals--from Aurora to Gilbert, to I was up there recently, and that is what I heard about--the rural hospitals and how difficult it is going to be for them if any of these bills pass.  I know it is something our Republican colleagues, all of whom are from rural States--Senators Collins, Capito, and Murkowski--have expressed real concerns about with regard to the impact of some of the proposed Medicaid cuts and what they would do in their  Both the Senator from New Hampshire who is here with me today, Senator Hassan, and certainly Senator Whitehouse have been leaders in this area. That is why we passed the Cures That is why we put a bunch of funding from the Cures Act into opioid addiction treatment. That is why we passed the Comprehensive Addiction and Recovery Act on a bipartisan basis--one of the few bills that made it through last year.  You cannot just run TV ads on it, and you cannot just put it on campaign brochures and then go out 6 months later and cut Medicaid, which provides the treatment for 32 percent of opioid medication-assisted treatments we have in our You cannot do that. You cannot give beautiful speeches and go to press conferences and then make those kinds of cuts. I know my colleagues on both sides of the aisle understand this.  This is a time when we can chart a different path forward, when we can end up where we should have begun but still standing, and that is by working together to find some positive changes to the Affordable Care Act for the[[Page S4149]]American people. Again, I said it on the day it passed--it is a beginning and not an end. Let's seize this moment, open the door, and work together for the American people.  Thank you, Mr. I yield the floor.  The PRESIDING The Senator from  ",CREC-2017-07-24-pt1-PgS4139-4.txt,1826,NATIONAL MARITIME DAY,2017.0,24.0,July
14114,topic-id,564,"Mr.Speaker, I rise today in support of the backbone of the American economy: small business.  Whether I meet with an owner of a family restaurant that has been on the same street corner for 50 years or a programmer for a startup tech company trying to land its first big break, I am always inspired by the amount of dedication and ingenuity that goes into running a small business. These men and women work hard, and their passion can always be seen in the products and services that they produce.  The district I serve is home to so many thriving small businesses, and each one has a great story behind it. Such is the case with M.Neill, Incorporated, a family-owned heating company located in Bernardsville, New This is M.Neill's 100th anniversary.  Business has not always been easy for M.The company has been overcoming obstacles since David Neill started it in 1917. It has had to navigate through the Great Depression, the OPEC oil crisis, and the 2008 financial crisis. It has had to make the move from coal to more efficient fuels. But through four generations, M.Neill has always been able to adapt and expand its business.  M.Neill continues to be a household name in heating in the Bernardsville area. It caters to other local small businesses and families all around Somerset and Morris Counties, and it is known for its 24/7 service and family-oriented approach. Some of its customers even date back to when the company first began, testament to the value of the honest service that M.Neill provides.  Today I congratulate current owner David Neill on the centennial of the company. The entrepreneurial spirit and innovation the Neill family has exhibited over the past 100 years is truly exemplary and serves as an example to all of us.  The stories we hear about successful small businesses are not the only evidence we have that they are pivotal to our economy. The statistics also prove that point.  We have over 29 million small businesses in the United States, and nearly two-thirds of the jobs created in this country come from those businesses. It is undeniable that a thriving small business sector is critical to bolstering employment in this country.  The same is true in New Jersey, which is home to 843,000 small businesses, accounting for over 99 percent of the total businesses in the These same small businesses employ 1.8 million people in New Jersey, more than half of our total workforce.  With so many people relying on work from our small business community, it only makes sense that Congress does everything possible to support them. That is why we must use this week, National Small Business Week, to continue to talk about the ways we can help rid small businesses of harmful regulations and equip them with the tools they need to grow and to prosper.  Last year we made great strides in the House by passing legislation such as the American Manufacturing Competitiveness Act and the Strengthening Career and Technical Education for the 21st Century Act, but we need to do more. Mr.Speaker, I urge my colleagues on both sides of the aisle to come together to support pro-small business legislation. Families like the Neills work hard their entire lives to serve their communities. It is imperative that those of us in Congress work to serve them as well.[[Page H3073]]                            ____________________",CREC-2017-05-03-pt1-PgH3072.txt,1936,NATIONAL DEFENSE AUTHORIZATION ACT FOR FISCAL YEAR 2018--MOTION TO,2017.0,3.0,July
14003,topic-id,1148,"Mr.President, I thank the distinguished senior Senator from Illinois for his comments. Certainly we hear those same things in town meetings in                          Russia Investigation  Mr.President, on another matter, this afternoon, Attorney General Sessions will return to the Senate for the first time since his confirmation hearing. It has been more than 3 months since the press revealed that the Attorney General gave false testimony in response to questions from both myself and from Senator Franken about his contact with Russian officials; yet the Attorney General has made no effort to come back before the Judiciary Committee to explain these actions--actions that some could construe as perjury.[[Page S3421]]  There are now countless new and troubling questions swirling around the Attorney In fact, he was scheduled to appear before the Appropriations Committee this morning--a committee that would have to vote on his request for a budget--but, for the second time in as many months, he abruptly canceled. Neither I nor Senator Franken sit on the Intelligence Committee, so we are not going to have the opportunity to follow up with the Attorney General in person. I am not going to be able to ask him why he hid his contacts with the Russian Ambassador, including a reported third meeting at the Mayflower Hotel, nor will I be able to ask about the timing of his recusal or his involvement with the Russia investigation both before his recusal and after. I will not be able to ask whether the President ever suggested he intervene in the Russia investigation in any way. And especially I will not be able to ask how the Attorney General can justify violating his recusal from the Russia investigation by working to fire its lead investigator.  The American people deserve answers to each of these questions--not only answers, they deserve truthful answers. That is why I shared my questions for Attorney General Sessions on these topics. But I also shared them with members of the Intelligence  So, at least, on the plus side, Attorney General Sessions will finally face some serious questions, but I am still concerned he is not going to be the most forthcoming witness. We saw last week that Trump administration officials have invented a brand new claim of privilege to insulate themselves from congressional oversight--and to protect themselves from giving answers that would be embarrassing or damaging to the  I asked the Congressional Research Service to provide me with a list of valid reasons to refuse to answer a question from a There is executive privilege, of course, but it has to be invoked by the President, and it is not absolute. Of course, there are also constitutional privileges, such as the Fifth Amendment right to not incriminate oneself. Even in my days as prosecutor, I strongly protected the rights of people, no matter what crime they were charged with, to take the Fifth Amendment if they wanted to, but there is no ``I would rather not answer'' privilege. That is not in the Fifth That is not an executive privilege. Unless it necessarily involves disclosing classified information, the answer ``I would rather discuss this behind closed doors'' is not a valid response either. That is really not a valid response. That is just trying to get out of answering questions.  The Attorney General's spokesperson said yesterday that Attorney General Sessions ``believes it is important for the American people to hear the truth directly from him and [he] looks forward to answering the committee's questions.'' Yet it was also reported yesterday he plans to invoke executive privilege in response to some inquiries. If true, the Attorney General is speaking out of both sides of his mouth.  I hope the Attorney General is not going to allow President Trump to follow the precedent of Richard Nixon and go down the path of invoking executive privilege to stop an inquiry into illegal or unethical conduct. These questions need to be answered. The American people deserve the truth. They deserve an Attorney General who is held accountable for his leadership of the Justice Department, not one who is embroiled in controversy and hides from the congressional committee of oversight jurisdiction of his  We must not lose sight of the fact that our democracy was attacked. It was attacked by a country that has no respect for us. If we do not take this seriously, we will be attacked again. We must know exactly how that happened so we can protect our democratic institutions and protect our country. This goes way beyond the Republican or the Democratic parties. That includes knowing whether members of the Trump campaign enabled Russian interference.  Russia is not a friend. Just as they have tried to interfere with elections in some of the NATO countries in other parts of the world, we know they have tried to interfere with ours. The American people also deserve to know whether the President or his administration have attempted to interfere in the Russia investigation, knowing it was improper. Any such attempt would amount to obstruction of justice.  Attorney General Sessions needs to answer critical questions today. He needs to answer for his leadership of the Justice Department in both the Senate Appropriations and the Judiciary He can keep ducking the questions, but sooner or later, the Attorney General must answer for his actions.  We deserve to know whether he is acting in the public interest--which is what an Attorney General should do--or in Donald Trump's personal interest. If he cannot decide between those interests, if he cannot distinguish between the public's interests and Donald Trump's interests, well, he is not fit to serve as Attorney  I pointed out, when Deputy Rosenstein came before the Appropriations Committee this morning, all the things the administration were cutting out of the budget--money for victims of crime, money to go after the opioid epidemic in this country, large cuts in the I could go on and on. However, there is one place they did put in money for more lawyers. They put in money for lawyers to work taking private property of people in Texas and Arizona and elsewhere to build this wall of the President's. So we will take out money for victims of crime or for fighting the opioid epidemic, but we will sure learn how to get money to hire private lawyers to go after people's private property along the Rio Grande to build a wall which will not really accomplish anything, other than to fulfill part of a campaign promise--a campaign promise to build a $40 billion wall. The other part, of course, was to have Mexico pay for it. The check is in the mail--very, very, very slow mail.  I see--speaking of Attorneys General and people from Texas--my friend, the former attorney general of Texas, the distinguished senior Senator from Texas on the floor so I yield the floor.  The PRESIDING The Republican whip.  ",CREC-2017-06-13-pt1-PgS3416-3.txt,1383,SMALL BUSINESS INVESTMENT OPPORTUNITY ACT OF 2017,2017.0,13.0,July
14095,topic-id,174,"Mr.Speaker, I rise today in support of H.2333, the Small Business Investment Opportunity Act of 2017.  Constantly, we hear that access to capital is a major hurdle for small businesses. Despite an improving economy, small business lending has plateaued since the Great  The Small Business Investment Opportunity Act aims to improve access to capital by increasing the amount a small business investment company can provide to small businesses.  In Kansas, communities from Hutchinson to Shawnee, Newton to Parsons, have benefited from small business investment company programs, with more than $307 million in investments to over 110 small businesses across the  Small businesses are the Nation's job creators, and providing this sort of access to capital will spur job creation and growth.  Mr.Speaker, I recently finished my 39th townhall, and I dare say that at every townhall somebody asked me: Why can't Congress do anything in a bipartisan fashion?  Mr.Speaker, this is an example of both parties working together for bipartisan solutions to grow this economy.  Mr.Speaker, I encourage my colleagues to support this measure.  ",CREC-2017-07-24-pt1-PgH6178.txt,99999999999999,SMALL BUSINESS INVESTMENT OPPORTUNITY ACT OF 2017,2017.0,24.0,July
