speech_id,topic_id,word_count,speech_text,file_name,speaker_id,session_title,year,day,month
12750,topic-id,224,"Mr.Speaker, I rise today to express support for my legislation, H.2292, which would extend the construction period for the hydroelectric project at New York City's Cannonsville Dam in Delaware County, New  Once completed, the Cannonsville hydroelectric project will generate over 42,000 megawatt hours of electricity each year, enough to avoid the emission of 24,000 tons of greenhouse gases. But, unfortunately, the project is in jeopardy due to this time lag.  Current Federal Energy Regulation Commission regulations allow a licensee 2 years to begin construction of a hydroelectric project once the license has been issued. The FERC may extend the deadline for an additional 2 years, but this may only be done once.  If construction has not begun on the project by the expiration of the second extension, the Commission will terminate the license, risking all of the hard work and planning that had been put into the project development.  I introduced this legislation to further extend the deadline for construction at the Cannonsville site, because the second FERC-granted extension will expire shortly, and construction has not yet begun.  By allowing for additional time for commencement of construction, we can help protect downstream communities and ensure the safe development of a clean and renewable energy project on this New York City-owned facility.  Mr.Speaker, I would like to thank Mr.Upton, the chairman of the subcommittee, and ",CREC-2017-06-12-pt1-PgH4829.txt,99999999999999,STRENGTHENING CHILDREN'S SAFETY ACT OF 2017,2017.0,12.0,July
12954,topic-id,1216,"Mr.President, I am pleased to be an original cosponsor of the Stop the Importation and Trafficking of Synthetic Analogues Act with my colleague Senator Chuck This legislation addresses the significant challenges associated with prosecuting those who manufacture and traffic deadly synthetic drugs, including synthetic opioids, like clandestinely produced fentanyl, and synthetic cannabinoids and cathinones.  Synthetic drugs pose an increasing threat to our They hit our communities in cycles and cause devastation. For example, in Corpus Christi, TX, there were 31 EMS calls in 1 day related to synthetic drugs. In Syracuse, NY, 18 individuals were taken to the emergency room in a 24-hour period after taking synthetic marijuana, and in Cincinnati, OH, a shocking 174 overdoses occurred over 6 days. These overdoses were largely attributed to heroin laced with carfentanil, a synthetic opioid that is 100,000 times stronger than morphine.  In 2012, Congress outlawed many synthetic drugs, but manufacturers did not stop producing them. Instead, they began producing controlled substance analogues which mimic the effects of controlled substances, such as opioids, marijuana, PCP, and  The new drug, even though it has an effect on the body that is similar to a controlled substance, may no longer be illegal under Federal law because it is not listed in one of the five schedules of the Controlled Substances Consequently, these drugs are shipped to our country and marketed as legal alternatives to illegal drugs.  This makes enforcement efforts difficult.  Synthetic opioids, like fentanyl, are deadly. Since 2015, 130 deaths have been linked to the drug in the Bay area of Nationally, the Centers for Disease Control and Prevention reports that more than 15,000 deaths in 2015 involved synthetic opioids other than methadone, which includes fentanyl. That is equivalent to 42 deaths per day.  Like other synthetic drugs, illicit fentanyl and its analogues are clandestinely produced, and primarily enter the United States in one of three ways:  (1) Chinese chemists produce and ship it to the United States via international mail;  (2) Mexican drug traffickers produce it with precursor chemicals from China and smuggle it across the Southwest Border; or  (3) Chinese chemists produce and ship it to Canada, where it is smuggled across the northern border.  The point is, regardless of the type, synthetic drugs pose a deadly and quickly evolving public health threat.  It is clear that the current system for scheduling controlled substances and prosecuting controlled substance analogues is not able to keep up with the speed with which new synthetic drugs are produced or to prevent the deaths they cause.  That is why the Stop the Importation and Trafficking of Synthetic Drugs Act to provide the Department of Justice with new tools, using a multifaceted approach.  First, the bill immediately controls 13 fentanyl analogues that law enforcement has come into contact with. These substances have already caused 162 overdose deaths in the United  Second, while the existing Federal Analogue Enforcement Act allows prosecutors to charge those who manufacture, distribute, or dispense controlled substance analogues, the law contains definition of a controlled substance analogue that is vague and often misinterpreted. As a result, court cases using this law result in a drawn out and expensive battle of the experts.  Moreover, because because controlled substance analogues are not listed as federally controlled substances, even if a prosecutor in one case successfully proves that a substance is a controlled substance analogue, this ruling is not applied across the board. A different person charged with manufacturing the exact same substance in another case is not automatically guilty of a crime. Instead, the prosecutor in the new case has to reprove that the substance in question is an analogue all over again.  Therefore, to ensure that prosecutors do not have to reprove that a substance is an analogue each and every time it appears, the bill establishes a new schedule  The legislation authorizes the Attorney General to add new synthetic drugs, including fentanyl and other analogues, to this new schedule, and make them illegal through an expedited, temporary scheduling process.  It also authorizes the Attorney General to permanently schedule these substances, either in schedule A or in another schedule, like schedule This provides the Attorney General with the maximum flexibility needed to better combat these dangerous drugs.  Those found guilty of manufacturing, distributing, or dispensing schedule A substances would be subject to existing schedule III penalties, or a maximum of 10 years imprisonment for a first offense.  The Department of Justice has told my staff that this approach will allow them to act quickly when new and dangerous substances threaten our communities.  Recognizing that the vast majority of synthetic drugs originate from outside of the United States, the legislation imposes criminal penalties for the illegal import and export of substances designated as schedule It also authorizes penalties for those who manufacture or distribute these substances while intending, knowing, or having reasonable cause to believe they will ultimately be imported into the United  Third, the bill maintains the ability of prosecutors to charge defendants using the Federal Analogue Enforcement Act, but clarifies the definition of a controlled substance analogue within the  Specifically, the language clarifies that the chemical structure of the substance must be similar to that of schedule I or II controlled substance to be considered a controlled substance analogue. On top of this, the substance must also have a stimulant, depressant or hallucinogenic effect on the body that is similar to a schedule I or II controlled substance or the person manufacturing, distributing or dispensing[[Page S3365]]the drug must represent or intend for the drug to have an effect that is similar to a schedule I or II controlled substance.  If prosecutors successfully prove a substance is a controlled substance analogue under the new definition, those who traffic the drug could face higher penalties than those assigned to schedule A, because the penalty would be associated with the drug it mimics.  Finally, those trafficking these substances do not market them as synthetic drugs. Instead, they mislabel the products, which are often sold at gas stations and convenience stores. To prevent this from happening, the bill requires all schedule A substances to be properly labeled and establishes civil penalties for failure to do so.  This provision will allow civil enforcement action to be taken to remove mislabeled products from the shelves of gas stations and convenience stores.  I want to close by sharing the story of one of my constituents, a young man named Connor Unfortunately, a synthetic drug known as Spice claimed his life. Connor took one hit of the drug, which, according to the Drug Enforcement Administration, is a mixture of herbs and spices that is typically sprayed with a synthetic compound chemically similar to THC, the psychoactive ingredient in marijuana. His brain swelled, causing him to go into a coma, and he never woke up.  Sadly, Connor's story has become all too common. And this is unacceptable. That is why I am pleased to be an original cosponsor of the Stop the Importation and Trafficking of Synthetic Analogues Law enforcement must have the ability to swiftly bring those who manufacture, distribute, and dispense these deadly drugs to justice.  I look forward to working with and obtaining feedback from my colleagues and other stakeholders on this bill, which provides new and necessary authorities to combat synthetic drugs.                                 ______                                       By ",CREC-2017-06-08-pt1-PgS3364.txt,1332,BANKRUPTCY JUDGESHIP ACT OF 2017,2017.0,8.0,July
12714,topic-id,512,"Mr.Speaker, I move to suspend the rules and agree to the concurrent resolution (35) authorizing the use of the Capitol Grounds for the National Peace Officers Memorial Service and the National Honor Guard and Pipe Band  The Clerk read the title of the concurrent resolution.  The text of the concurrent resolution is as follows:                             Con 35       Resolved by the House of Representatives (the Senate      concurring),     SECTION 1. USE OF THE CAPITOL GROUNDS FOR NATIONAL PEACE                    OFFICERS MEMORIAL       (a) In General.--The Grand Lodge of the Fraternal Order of      Police and its auxiliary shall be permitted to sponsor a      public event, the 36th Annual National Peace Officers      Memorial Service (in this resolution referred to as the      ``Memorial Service''), on the Capitol Grounds, in order to      honor the law enforcement officers who died in the line of      duty during 2016.       (b) Date of Memorial Service.--The Memorial Service shall      be held on May 15, 2017, or on such other date as the Speaker      of the House of Representatives and the Committee on Rules      and Administration of the Senate jointly designate, with      preparation for the event to begin on May 11, 2017, and take-     down completed on May 16, 2017.     2. USE OF THE CAPITOL GROUNDS FOR NATIONAL HONOR GUARD                    AND PIPE BAND       (a) In General.--The Grand Lodge of the Fraternal Order of      Police and its auxiliary shall be permitted to sponsor a      public event, the National Honor Guard and Pipe Band      Exhibition (in this resolution referred to as the      ``Exhibition''), on the Capitol Grounds, in order to allow      law enforcement representatives to exhibit their ability to      demonstrate Honor Guard programs and provide for a bagpipe      exhibition.       (b) Date of Exhibition.--The exhibition shall be held on      May 14, 2017, or on such other date as the Speaker of the      House of Representatives and the Committee on Rules and      Administration of the Senate jointly designate.     3. TERMS AND       (a) In General.--Under conditions to be prescribed by the      Architect of the Capitol and the Capitol Police Board, the      event shall be--       (1) free of admission charge and open to the public; and       (2) arranged not to interfere with the needs of       (b) Expenses and Liabilities.--The sponsors of the Memorial      Service and Exhibition shall assume full responsibility for      all expenses and liabilities incident to all activities      associated with the events.     4. EVENT       Subject to the approval of the Architect of the Capitol,      the sponsors referred to in section 3(b) are authorized to      erect upon the Capitol Grounds such stage, sound      amplification devices, and other related structures and      equipment, as may be required for the Memorial Service and          5. ENFORCEMENT OF       The Capitol Police Board shall provide for enforcement of      the restrictions contained in section 5104(c) of title 40,      United States Code, concerning sales, advertisements,      displays, and solicitations on the Capitol Grounds, as well      as other restrictions applicable to the Capitol Grounds, in      connection with the events.  The SPEAKER pro tempore. Pursuant to the rule, the gentleman from Georgia (Mr.Ferguson) and the gentleman from Georgia (Mr.Johnson) each will control 20 minutes.  The Chair recognizes the gentleman from Georgia (Mr.Ferguson).                             General Leave  ",CREC-2017-04-25-pt1-PgH2820-6.txt,99999999999999,BANKRUPTCY JUDGESHIP ACT OF 2017,2017.0,25.0,July
12715,topic-id,46,"Mr.Speaker, I ask unanimous consent that all Members may have 5 legislative days in which to revise and extend their remarks and include extraneous material on 35.  The SPEAKER pro tempore. Is there objection to the request of the gentleman from Georgia?  There was no objection.  ",CREC-2017-04-25-pt1-PgH2820-6.txt,99999999999999,BANKRUPTCY JUDGESHIP ACT OF 2017,2017.0,25.0,July
12716,topic-id,217,"Mr.Speaker, I yield myself such time as I may consume.  Mr.Speaker, 35 authorizes the use of the Capitol Grounds for the annual National Police Officers' Memorial Service and the National Honor Guard and Pipe Band These events are held each year as part of Police Week to honor the men and women who sacrificed their lives in the line of duty. This use of the Capitol Grounds is a worthy recognition of the honorable sacrifice of our Nation's brave first responders and their families.  This year, 234 fallen officers will be honored, which is 100 more than last year. Ten of these officers are from my home State of Georgia, and 70 died from 9/11-related cancer. This year, we will also remember five officers of the Dallas Police Department for their courage in the line of fire while responding to the shootings in Dallas at last July's protest.[[Page H2821]]  This is a clear reminder of the sacrifices that our men and women in law enforcement make every day as they put their lives on the line to maintain safe communities for us and our loved ones. We must do all we can to support these brave men and women and their families.  Mr.Speaker, I urge support of this resolution, and I reserve the balance of my time.  ",CREC-2017-04-25-pt1-PgH2820-6.txt,99999999999999,IMMIGRATION,2017.0,25.0,July
12717,topic-id,70,"Mr.Speaker, I yield back the balance of my time.  The SPEAKER pro tempore. The question is on the motion offered by the gentleman from Georgia (Mr.Ferguson) that the House suspend the rules and agree to the concurrent resolution, 35.  The question was taken; and (two-thirds being in the affirmative) the rules were suspended and the concurrent resolution was agreed to.  A motion to reconsider was laid on the table.                          ____________________",CREC-2017-04-25-pt1-PgH2820-6.txt,99999999999999,IMMIGRATION,2017.0,25.0,July
12884,topic-id,190,"Mr.Chairman, perfluorinated compounds, namely PFOA and PFOS, have been found in public and private drinking water wells in communities surrounding over 600 military installations nationwide, including several in my own district, impacting 70,000  While the military does not dispute its responsibility for the water contamination, the response thus far has been unacceptable. For all of our constituents, they all have the right to safe, clean drinking water, and they deserve to know if PFOS or PFOA have compromised their long-term health.  The bipartisan amendment I have introduced instructs the Secretary of Defense to consult with the Agency for Toxic Substances and Disease Registry to carry out a study on any health effects experienced by those exposed to PFOS and PFOA at military installations or former military installations.  While this study alone will not fix the serious concerns about water contamination, it will provide us with critical information about the health impact these unregulated chemicals may have, and aid the Federal Government in conjunction with State and local agencies to reverse the contamination and protect the health and welfare of our residents.  Mr.Chairman, I urge my colleagues to support this amendment.  ",CREC-2017-07-14-pt1-PgH5836-2.txt,1797,EXECUTIVE CALENDAR--Continued,2017.0,14.0,July
12988,topic-id,196,"Mr.President, I ask unanimous consent that the order for the quorum call be rescinded.  The PRESIDING Without objection, it is so ordered.                             Cloture Motion  Pursuant to rule XXII, the Chair lays before the Senate the pending cloture motion, which the clerk will state.  The senior assistant legislative clerk read as follows:                             Cloture Motion       We, the undersigned Senators, in accordance with the      provisions of rule XXII of the Standing Rules of the Senate,      do hereby move to bring to a close debate on the nomination      of John Sullivan, of Maryland, to be Deputy Secretary of              Mitch McConnell, Cory Gardner, Tom Cotton, Roy Blunt,            Jeff Flake, John Cornyn, John Barrasso, Ron Johnson,            James Risch, Joni Ernst, John Thune, Mike Rounds,            Orrin Hatch, Bob Corker, David Perdue, John Hoeven,            James  The PRESIDING OFFICER (Mr.Flake). By unanimous consent, the mandatory quorum call has been waived.  The question is, Is it the sense of the Senate that debate on the nomination of John Sullivan, of Maryland, to be Deputy Secretary of State, shall be brought to a close?  The yeas and nays are mandatory under the rule.  The clerk will call the roll.  The senior assistant legislative clerk called the roll.  ",CREC-2017-05-23-pt1-PgS3076-6.txt,1633,AUTHORIZING USE OF CAPITOL GROUNDS FOR NATIONAL PEACE OFFICERS MEMORIAL,2017.0,23.0,July
13082,topic-id,223,"Mr.Speaker, I rise today to voice support for the dedicated public servants who make this country great.  President Trump campaigned on a promise to drain the swamp, and instead he nominated unqualified Wall Street executives and career politicians for Cabinet and senior-level positions, leaving the next level of appointments almost entirely unfilled, all while threatening to cut the experienced Federal workforce who make our government work well every day.  As the only Ph.physicist in Congress, I know that many of these Federal workers and their support staff are scientists who work every day to advance innovation and improve our standard of living. The Department of Energy, for example, relies on scientists with technical expertise to run our national labs. The success of their work depends on long-term sustained funding and a continuity of competent leadership to make their new ideas a reality.  But our President's skinny budget would destroy scientific funding and force us to give up our place as a leader in innovation, and many of his appointments are insulting jokes. So last weekend I joined the March for Science because it is clear that this administration does not value science and scientific enterprise.  I call on my colleagues here today to support scientists and Federal workers. And if a swamp needs to be drained, the place to start is Mar-a-                         ____________________",CREC-2017-04-27-pt1-PgH2907-3.txt,1888,AUTHORIZING USE OF CAPITOL GROUNDS FOR NATIONAL PEACE OFFICERS MEMORIAL,2017.0,27.0,July
12720,topic-id,47,"Mr.Speaker, I ask unanimous consent that all Members have 5 legislative days to revise and extend their remarks and include extraneous material on the subject of my Special  The SPEAKER pro tempore. Is there objection to the request of the gentlewoman from Hawaii?  There was no objection.  ",CREC-2017-06-07-pt1-PgH4690-5.txt,2122,STATEMENTS ON INTRODUCED BILLS AND JOINT RESOLUTIONS,2017.0,7.0,July
12721,topic-id,53,"Mr.Speaker, our current immigration policies are hurting families, tearing them apart, and deporting people who are part of the very fabric of our communities.  I have a few people in particular I plan to talk about and whose stories I will be sharing, but first I yield to the gentleman from Texas (",CREC-2017-06-07-pt1-PgH4690-5.txt,2122,"ORDERS FOR WEDNESDAY, JULY 26, 2017",2017.0,7.0,July
