speech_id,topic_id,word_count,speech_text,file_name,speaker_id,session_title,year,day,month
4861,topic-id,591,"Mr.President, today I wish to honor Barbara Vachon, who retired this March after 16 years of service to the For as long as I have been in the Senate, with just a 2-month exception, Barb has served as my executive assistant and my right hand.  Barb's service to the Senate began in 2001, when her friend Trecia called and offered her a temporary position in Senator Jim Jeffords' office. In New Hampshire at the time, Barb decided she would take a chance and try out life in Washington, Barb thought she was coming down to Washington for a 2-month assignment, answering phones and staffing the front office until the office could hire someone right out of college, but Barb quickly became an invaluable member of Senator Jeffords' team. Eventually, she became the Senator's executive assistant, working alongside him every day until his retirement from the Senate in 2007.  Barb's first year in the Senate included Senator Jeffords switching parties, 9/11, and the anthrax and ricin scares. Any one of these events might have given a different person a reason to leave the Senate, but Barb stayed and worked as hard as ever. When Senator Jeffords retired in 2007, Barb helped Senator Bernie Sanders' office learn the ways of the Senate for 2 months, after which she joined my office.  From day 1, Barb was always the person who made the trains run on time in my office. Barb had the challenging and sometimes impossible task of keeping my day on schedule, while at the same time juggling phone calls, personal notes, briefing memos, and any number of inquiries that came across her desk. There were even a few times where she managed to track down particularly old and rare library books at my request. No matter the task at hand, Barb approached her work with good humor and a can-do attitude that impressed everyone.  Barb's contributions in my Senate office are immeasurable, but I thought it was worth trying to quantify some of the ways in which she has served the people of Pennsylvania and our During her decade of service to Pennsylvania, Barb welcomed more than 200 ambassadors, dignitaries, and administration officials to my office, drafted more than 500 letters, and greeted over 1,000 Pennsylvanians at my ``Keystone Coffees.'' She acted as a mentor and support system for all my staff members, and befriended everyone she worked with in the Everyone, from the Capitol Police officers she passed on her 3-block commute, to the photographers in the Senate Photo Studio who patiently waited while Barb shepherded our constituents for photos, knows how valued Barb was to our team and to me personally.  Having been in the Senate long before I was, Barb understood how to balance the everyday needs in the office with the overall goals we set for ourselves when we first began our service here. Barb provided everyone in my office, myself included, with the important perspective that is often lost here in the Senate: it is easy to get bogged down in details or small problems, but the work we do here is important, lasting, and honorable. Barb never lost sight of how fortunate we are to work in this institution, and I know our team is grateful to have always had that reminder.  It is hard to imagine my office without Barb, but I know she will enjoy her retirement, whether she is home in New Hampshire or traveling the world. I wish her and her children, Heather and Michael, well in this new chapter.                          ____________________",CREC-2017-03-23-pt1-PgS1968.txt,1828,1945,2017.0,23.0,February
4821,topic-id,528,"Mr.Speaker, I thank my friend, Congressman Veasey, from the great State of  Mr.Speaker, I rise today as part of the observation of Black History Month to continue my series of remarks recognizing HBCUs, Historically Black Colleges and I ask my colleagues to join me in celebrating Benedict College in Columbia, South  Founded in 1870, just 5 years after the end of the Civil War, by the American Baptist Home Mission Society, Benedict was originally named Benedict Institute, after Stephen and Bathsheba Benedict of Rhode Island, Baptist abolitionists who had donated the funds to acquire the property on which the campus sits. Formerly the site of a pre-Civil War plantation, the first classes were held in a dilapidated mansion on the grounds. Benedict Institute was formerly chartered by the South Carolina General Assembly in 1894 and renamed Benedict  From its founding through 1930, Benedict was led by northern White Baptist ministers. In 1930, Reverend John Starks, an alumnus of Benedict, became the school's first African-American president. The heart of its campus has been designated the Benedict College Historic District, consisting of Morgan Hall, Pratt Hall, Duckett Hall, Antisdel Chapel, and Starks  Like Allen University, its neighbor, Benedict College has a long legacy of activism for civil rights and social justice. One of the very first civil rights campaigns in South Carolina was organized at Benedict College in 1937. Students participating in a national NAACP campaign led a demonstration in support of antilynching legislation pending in  One of Benedict's early graduates was Reverend Richard Born into slavery in Barnwell, South Carolina, Reverend Carroll was a prominent Baptist minister in the late 1800s who received honors and appointments from both President William McKinley and President Theodore Other prominent alumni include Modjeska Simkins, a prominent civil rights and public health champion; General Matthew Zimmerman, who served as Chief of Chaplains of the United States Army; and I.Leevy Johnson, the first African-American president of the South Carolina State Bar  In the modern era, under the leadership of President David Swinton, Benedict has grown to a student body of more than 2,800 undergraduate students. In 1995, Swinton revived the football program and marching band 30 years after they had been shut down. He also championed a new sports complex on Two Notch Road in Columbia, which includes a football stadium, tennis courts, baseball fields, and fitness facilities. The liberal arts curriculum now offers degrees in 30 different disciplines. President Swinton also has led the efforts to preserve and restore many of the historic buildings on the campus, in part paid for with Federal funds from the HBCU Historic Preservation Program that we in this Congress have championed.  President Swinton will retire this summer after 23 years of service to the institution. I wish him well and thank him for his leadership.  Today, on the same land where Blacks once toiled in slavery, their descendants are now learning the tools they need to live up to Benedict College's motto: to be powers for good. Like so many HBCUs, Benedict offers a unique religious experience in which students from many different backgrounds share a common struggle for equality, and I am pleased to recognize them today.  ",CREC-2017-02-15-pt1-PgH1225.txt,208,1730,2017.0,15.0,February
4846,topic-id,598,"Mr.Speaker, standing before almost entirely White crowds in North Carolina, Michigan, Virginia, and Ohio, candidate Donald Trump painted a bleak picture of African-American life in 2016, full of crime, high poverty, and failing schools. He went on to say, ``It is a disaster the way African Americans are living,'' and asked, ``What the hell do you have to lose?''  In just 3 short weeks, Mr.Speaker, President Trump has shown the world exactly what a disaster looks like. He has put a White supremacist in the White House as his chief political adviser. He has given us an Attorney General who spent the last 30-plus years working against civil and voting rights. He has appointed a shamefully ill-prepared Secretary of Education whose only qualification seems to be her ability to contribute millions to Republic candidates in what can only be described as the textbook definition of pay to play.  Candidate Trump promised to be the hero of working people, but President Trump is doing the exact opposite. His actions tell a lot more than his tweets. His Cabinet is full of millionaires, many with ethical challenges and conflicts of interest. He has already raised the cost of mortgages for many He is proposing that we abandon the overtime rule that would ensure bigger paychecks for working people. He is working to dismantle Wall Street reform and is proposing a border tax that would give corporations a huge tax break while costing working men and women more on groceries, clothes, and other goods.  The policies of the Trump administration are an extension of the policies that Republics in the House have pushed for years. To candidate Trump's question what do you have to lose, for starters, your voice at the ballot box. A free and fair election is the hallmark of democratic governance, yet the Trump administration and Republics in Congress continue to threaten this basic pillar of democracy. They have promulgated blatant falsehoods about voter fraud, sowing fear and distrust. They have worked and are working across the country to prevent people of color from voting. They are refusing to investigate Russian interference in our elections and are currently moving legislation through the House of Representatives to eliminate the only Federal agency tasked with helping Americans vote and protecting our voting machines from hacking.  As President Trump and his spokespeople continue to make demonstrably false claims about widespread voter fraud and cozying up to the country that attacked our democracy, House Republics just passed out of committee H.634, legislation to eliminate the only Federal agency tasked with certifying the security of our voting machines, the Election Assistance  Forty-seven out of fifty States rely on the EAC's voting machine certification program in some capacity. A recent report by the Institute for Critical Infrastructure Technology concluded, ``Voting machines are neither secure nor complex. In general, these stripped-down computers utilizing outdated operating systems possess virtually every conceivable vulnerability that a device can have.''  In my home State of South Carolina, we currently use voting machines that were rejected by the State of Ohio in 2007 for being ``buggy, unstable and exploitable.'' And even though machines are not supposed to be connected to the internet, they are well past their shelf life and, therefore, more likely to break down, crash, and produce errors. Replacing these outdated machines with updated ones will cost a significant amount of money, and the burden is on the States to do so.  Mr.Speaker, if House Republics are serious about election integrity, they ought to stop working to prevent people of color and start investing in voting infrastructure.                          ____________________",CREC-2017-02-14-pt1-PgH1136.txt,208,STATEMENTS ONINTRODUCED BILLS AND JOINT RESOLUTIONS,2017.0,14.0,January
4715,topic-id,316,"Mr.Speaker, by direction of the Committee on Rules, I call up House Resolution 74 and ask for its immediate consideration.  The Clerk read the resolution, as follows:                               74       Resolved, That upon adoption of this resolution it shall be      in order to consider in the House the joint resolution (H.     36) providing for congressional disapproval under      chapter 8 of title 5, United States Code, of the final rule      of the Bureau of Land Management relating to ``Waste      Prevention, Production Subject to Royalties, and Resource      Conservation''. All points of order against consideration of      the joint resolution are waived. The joint resolution shall      be considered as read. All points of order against provisions      in the joint resolution are waived. The previous question      shall be considered as ordered on the joint resolution and on      any amendment thereto to final passage without intervening      motion except: (1) one hour of debate equally divided and      controlled by the chair and ranking minority member of the      Committee on Natural Resources; and (2) one motion to      recommit.       2. Upon adoption of this resolution it shall be in      order to consider in the House the joint resolution (H.     37) disapproving the rule submitted by the Department of      Defense, the General Services Administration, and the      National Aeronautics and Space Administration relating to the      Federal Acquisition All points of order against      consideration of the joint resolution are waived. The joint      resolution shall be considered as read. All points of order      against provisions in the joint resolution are waived. The      previous question shall be considered as ordered on the joint      resolution and on any amendment thereto to final passage      without intervening motion except: (1) one hour of debate      equally divided and controlled by the chair and ranking      minority member of the Committee on Oversight and Government      Reform; and (2) one motion to recommit.  The SPEAKER pro tempore (Mr.Graves of Louisiana). The gentleman from Oklahoma is recognized for 1 hour.  ",CREC-2017-02-02-pt1-PgH888-3.txt,2259,EXECUTIVE SESSION,2017.0,2.0,March
4716,topic-id,47,"Mr.Speaker, for the purpose of debate only, I yield the customary 30 minutes to the gentleman from Colorado (Mr.Polis), pending which I yield myself such time as I may consume. During consideration of this resolution, all time yielded is for the purpose of debate only.                             General Leave  ",CREC-2017-02-02-pt1-PgH888-3.txt,2259,1730,2017.0,2.0,January
4717,topic-id,37,"Mr.Speaker, I ask unanimous consent that all Members have 5 legislative days to revise and extend their remarks.  The SPEAKER pro tempore. Is there objection to the request of the gentleman from Oklahoma?  There was no objection.  ",CREC-2017-02-02-pt1-PgH888-3.txt,2259,EXECUTIVE SESSION,2017.0,2.0,January
4718,topic-id,553,"Mr.Speaker, on Tuesday, the Rules Committee met and reported a rule for consideration of two important measures, which would overturn two significant onerous regulations finalized in the waning days of the Obama administration.  First, the resolution provides for the consideration of H.36, providing for congressional disapproval of the so-called BLM methane rule. The rule provides for 1 hour of debate, equally divided and controlled by the chair and the ranking member of the Natural Resources Committee and provides for a motion to recommit.  In addition, the resolution provides for consideration of H.37, providing for congressional disapproval of the so-called blacklisting rule. The rule provides 1 hour of debate, equally divided and controlled by the chair and ranking member of the Oversight and Government Reform Committee and provides for a motion to recommit.  Mr.Speaker, burdensome regulations are crippling our businesses. The Obama administration finalized 38 major rules between election day and inauguration day. It is estimated those rules will cost our economy $41.2 billion. Sadly, this was just par for the course with the previous administration. In 2016, the Obama administration finalized over 400 regulations at a cost of over $160 billion to the economy. Over the entire Obama Presidency, over 3,000 regulations, at a cost of $873.6 billion, were finalized.  I am heartened by President Trump's regulatory freeze, which has been estimated to save over $180 billion in regulatory costs, followed by his executive order which aims to revoke two regulations for every new regulation put forward.[[Page H889]]  Specifically, H.36 overturns the BLM methane rule. The rule is a significant regulatory overreach by the Bureau of Land Under the Clean Air Act, the Environmental Protection Agency has the authority to regulate methane emissions, which it currently does. Instead, the BLM has decided to also assert authority over methane in a way that is both duplicative and unnecessary, yet has significant negative impact on jobs, energy production, and Federal, State, and local revenues.  Mr.Speaker, this is a regulation in search of a problem. According to a 2015 EPA study, methane emissions from both natural gas systems and crude oil production have fallen by significant margin, even while oil and natural gas production have exploded. The BLM flaring rule is both costly and unnecessary.  The second rule considered by this resolution is similarly a solution in search of a problem. For decades, the Federal Government has had a suspension and debarment process in place to deny Federal contracts to bad actors who violate basic worker protections. However, President Obama signed an executive order directing various agencies to add another layer of bureaucracy onto the Federal procurement system. Prior to awarding a contract, each agency's contracting officer and a newly created labor compliance adviser will be required to review both violations and alleged violations to determine whether an employer should be awarded a Federal contract. Even the courts have agreed this is overreach. In October of 2016, a Federal district judge blocked enforcement of these rules, citing concerns with the violation of due process rights and executive overreach.  For these reasons, Mr.Speaker, it is critical that we prevent implementation of these rules which are unnecessary and add even more regulatory burdens to our struggling businesses and anemic economy.  Mr.Speaker, I urge support for the rule and the underlying legislation.  I reserve the balance of my time.  ",CREC-2017-02-02-pt1-PgH888-3.txt,2259,PRESIDENT-ELECT TRUMP'S CABINET,2017.0,2.0,February
4720,topic-id,481,"Mr.Speaker, I yield myself such time as I may consume.  Not surprisingly, my friend and I have a number of disagreements on the wisdom of getting rid of these particular regulations. We do agree on the importance of actually capturing methane gases. Frankly, my friend is right. That is a profitable thing, and most companies try to do it on their own.  We do, frankly, need more infrastructure in this area, no question about that. The BLM has been less than cooperative in allowing that infrastructure to be built on Federal land, and that has made this problem more difficult than it needs to be.  But it is important to recognize, overall, the amount of methane gas that actually escapes has gone down steadily and, frankly, dramatically, even as production has moved up. So additional regulation is unlikely to change that process. It may actually complicate it.  In terms of where the appropriate authority lies, again, I would just remind my friend, as he knows, the Environmental Protection Agency has the authority to do this. So if it felt like it needed it, it could.  The BLM has actually moved into a new area beyond its traditional jurisdiction because it does not have authority, under the Clean Air Act, to draft these kind of rules and regulations. The Clean Air Act, again, is already in place. The EPA has the authority. If we need to do something, let's do it.  In terms of the disbarment procedure for contractors, what we have is already awfully robust. Almost 2,000 firms, or on 2,000 occasions, companies were disbarred in 2015 from Federal contracting work. It was the same in 2014. So there is something in place. We don't need additional regulatory expense, additional people working for the government. We can rely on the procedures we already have.  My friend is concerned about the lack of hearings. I would remind him, while we haven't had hearings on these items in this Congress, we certainly did on both of them in the last Congress, in some cases, multiple hearings. There is not any need to rehash and go over the same ground, in my view.  Finally, in terms of just the process itself, the Congressional Review Act actually limits the form in which these sorts of things can be brought forward. If amendments are made in order, frankly, the item loses its privilege in the United States Senate, which, obviously, changes the speed at which you can move and perhaps even the number of votes that are required to actually move forward.  So we think, again, these are items that have been explored, looked at, debated. The evidence is pretty clear. We think it is important to move quickly in these areas, and I would urge the body to do so. Adopt the rule. Support the underlying legislation.  Mr.Speaker, I reserve the balance of my time.  ",CREC-2017-02-02-pt1-PgH888-3.txt,2259,PRESIDENT-ELECT TRUMP'S CABINET,2017.0,2.0,February
4722,topic-id,342,"Mr.Speaker, I yield myself such time as I may consume.  I just want to make a couple of good points. Remember, my friends, disbarment is already a very common procedure. It was invoked over 2,000 times. So having another regulatory hurdle and hoop to jump through, just simply isn't necessary.  Again, these regulations were, frankly, generated in the final waning months of the Obama administration. They haven't been in action, and there is sort of a regulatory fit. It is not, by the way, unusual for just the last administration. All administrations have this tendency near the end, and that is one of the reasons why we have the Congressional Review Act in the first place, so that when administrations, in their waning days, decide they want to leave difficult situations or push through things that they didn't see fit to do over an 8-year period, Congress can expeditiously make sure that those regulations aren't put in place and businesses are forced to begin to comply with them.  As I pointed out in my opening remarks, the regulations released by the last administration--over 3,000 of them in an 8-year period--cost the economy over $870 billion. The regulations that were issued between election day and Inauguration Day cost the economy over $40 billion. That is real money. That is real investment that could go elsewhere and could hire people.  So I would think that these, along with the other Congressional Review Act bills that will be coming forward, and have already come forward, will actually give the economy a much-needed shot in the arm, will help stimulate job creation and movement, and we have a timeframe in which we have to operate.  So if we actually followed all of the procedures my friend suggested, many of these regulations, frankly, would never get reviewed before they went on the books.  So it is better to act quickly. I think it is better for American business.  Again, I urge the support of the rule and the underlying legislation.  I reserve the balance of my time.  ",CREC-2017-02-02-pt1-PgH888-3.txt,2259,EXECUTIVE CALENDAR--Continued,2017.0,2.0,February
4724,topic-id,6,I am certainly prepared to close.  ,CREC-2017-02-02-pt1-PgH888-3.txt,2259,EXECUTIVE CALENDAR--Continued,2017.0,2.0,February
