speech_id,topic_id,word_count,speech_text,file_name,speaker_id,session_title,year,day,month
13102,topic-id,1954,"Mr.Speaker, this Special Order is for the Congressional Progressive Caucus, and I am so proud to be a vice chair of that caucus and to lead the Special Order hour with my colleague, the gentleman from Maryland (Mr.Raskin).  We do this once a week, and we try to take up topics that we think are of great interest across the country to our constituency. So I am very proud to have the Congressional Progressive Caucus leading the way on so many issues that are important, from education to transportation, infrastructure to, of course, today's topic, which is the tax plan that was released yesterday by President  The tax plan that was released yesterday--and I have to start by saying I am not sure this is actually the plan. I am not sure that a one-page document constitutes a plan. This is not even a two-sided document. It is a one-sided document. This is what we are reacting to. And it is similar to the tax plan that candidate Trump spoke about during the campaign.  So we will do our best with what has been put forward as a plan, but this plan, in our estimation, when you look at what it contains, really amounts to nothing more than a one-page document full of handouts to the rich.  The Secretary of the Treasury, Steve Mnuchin, yesterday said, during a press conference, that one thing that this President has done very well--this is a quote: ``One thing this President has done very well is listen.''  Mr.Speaker, I have to disagree with that. Two weekends ago, there were 190,000 Americans in red States and blue States across the country who were on the streets asking for the President to release his tax returns in the same way that every other President of the United States has done in modern history. Unfortunately, this President has not listened. As a candidate, he said he would release his tax returns. As a President, he has refused to do so.[[Page H2931]]  He didn't listen when women and their allies took to the streets in the biggest march in American history to demand that he respect women, protect Planned Parenthood, and support equal rights for women.  And this President certainly didn't listen to the millions of Americans who were outspoken in their opposition to the Republican healthcare plan that essentially took $1 trillion off of the backs of working people and folks who need health care across this country and transferred it to the wealthiest in our country.  The reality is this President, unfortunately, has not been listening to the American people. If you look at that healthcare plan, just as an example, only 17 percent of the American public actually supported This President has not been listening, to now put forward another plan on health care that again suggests that we should actually take away essential health benefits from people, take away the opportunity for people to have preexisting conditions covered, and, once again, leaving an additional 24 million Americans stripped of their health care.                              {time}  1630  So in this tax press conference yesterday, it became very clear that the administration doesn't have really an idea of exactly what the plan is going to look like, except for the fact that it will be good for business.  Secretary Mnuchin said:  ``Under the Trump plan, we will have a massive tax cut for businesses. . . .''  Despite all of President Trump's broken promises, we have to believe that this may actually be true. Let's not forget that the Secretary of the Treasury was a C-level executive at Goldman Sachs and his loyalties have been with Big  The tax plan, as we have been given it on this one-page document, is a gift-wrapped tax cut to the highest earners and corporations. The claim is that it was written to create jobs and spur economic growth and help low- and middle-income families, but what it really does is drastically reduce tax rates for Big Business to just 15 percent. That tax break isn't just for cooperations; it is also for pass-through firms.  Let's be clear about what pass-through firms are. Pass-through firms are entities that wealthy people and companies use in order to funnel money and have lower tax rates. Among these companies is The Trump  This is why, in asking for the President's tax returns, this is not just an ask that doesn't have any meaning. It is not a partisan ask. We have 190,000 Americans in the streets in red States and blue States asking. When we know what is in the President's tax returns, then we have the ability to make sure that we understand, as the American people, whether any plan he proposes is in the interest of the American people or whether it is in his own financial interest.  According to the Center for American Progress, 70 percent of partnership and S corporation income goes to the top 1 percent of U.households by income. So when you propose a tax cut for these pass-through entities, we are talking about a tax cut for the people in the top 1 percent of this country. We are not talking about a tax cut that benefits middle class, working families.  The Center on Budget and Policy Priorities provided a specific example where a lawyer making $1 million a year could funnel their income through that pass-through and could actually save $180,000 a year. There is no doubt that this President would himself benefit from this tax plan, although we can't say exactly how much, because we haven't seen the tax returns and we don't know exactly which financial interests he has and how much he would benefit.  However, his own lawyers reported that nearly all of his 500 or so businesses are--don't be surprised--pass-throughs. If we accept this assertion from his lawyers that his assets are worth more than $10 billion, then this tax plan or tax ploy, depending on how you want to see it, would actually save the President of the United States millions of dollars, but it would not benefit millions of working families across this country who actually need to see our tax system reform so that it is more fair.  When asked how these tax cuts were paid for, Secretary Mnuchin said they would be so effective at bolstering the economy that it would pay for itself. Now, we have seen trickle-down economics before in this country, and it is a nonsensical idea that this tax plan would bolster the economy. We have seen the disastrous effects of trickle-down economics specifically on low-income and middle-income families.  The Tax Foundation estimates that reducing the business rate for companies and pass-throughs to 15 percent would actually reduce revenue in this country by $3.5 trillion over 10 years. They also found that, at the very best, the plan would only spur enough growth to pay for less than half the cost of the tax cuts. Low-and middle-income Americans would ultimately pay the price, not Big  Now, this is similar to what we saw in the healthcare plan. In the healthcare plan, if you remember, what we saw was a proposal to cut $880 billion from Medicaid and take that money and essentially give a trillion dollars in tax cuts to the wealthiest. So if you were in the top 4 percent of income earners in this country, you would have gotten a tax cut of about $200,000 a year. But if you were in that age that we like to call seniors, between 50 and 64, you would have an age tax and you would have to pay up to $15,000 more on your premiums. So that is why some of my colleagues across the aisle actually called that healthcare plan a downpayment on a tax plan. It was supposed to be the beginning of a tax reform plan that, again, moved more money to the wealthiest in our country.  We are seeing a State-level microcosm of this playing out right now in the State of Kansas where the State passed massive tax cuts, including exempting pass-throughs from State taxes.  The result?  More than 333,000 residents changed their income to funnel through pass-throughs in the first year alone.  What happened in Kansas when this was pushed through?  State revenue went down by an additional almost 2 percent, costing $206 million in 2013 and $472 million the following year.  Today, the State faces a $1.1 billion shortfall, and residents are paying the price in lost programming and services. But the promise that was made at the time that this plan was pushed through in Kansas--the same kind of plan that is being proposed today at the Federal level--the promise that was made was that it would kick-start the economy. Unfortunately, but not surprisingly, that hasn't happened either. Economic growth in Kansas is happening at just half the national average.  Because here is the thing: tax cuts don't just pay for themselves, and there are plenty of experts on both sides of the aisle that will attest to that. A sheet of paper is not a plan, and everyone knows it.  When reporters pressed Secretary Mnuchin and the National Economic Council Director Gary Cohn for details, they failed to provide anything of substance. A reporter asked Cohn three times what the tax cut would look like for a family of four making $60,000 per year.  I have a lot of those families, Mr.Speaker, in my district. I believe we have those families in red States and blue States, working people across this country who believe that America should be and must be a land of opportunity for people who work hard. Maybe they are not the richest people in the world. Maybe they are not the richest top 1 percent in this country. But they work hard, they earn a good living, and they deserve to have fairness in our tax plan.  Now, when Mr.Cohn was asked three times by this reporter what the tax cut would look like for a family of four making $60,000 a year, he replied it is ``gonna mean a tax cut'' three times in a row. Instead of getting answers, though, and when he was pressed, reporters were told over and over again that they would get more information later and that the administration is in ``robust talks.''  Well, I am a Member of the House, and supposedly those robust talks are happening with the House and the We all represent the people of the United We want to all be a part[[Page H2932]]of the conversation, and we demand to know specifically, as we look at this plan, how this President, his family, and his Cabinet will benefit from the tax plan. That is only fair, Mr.Speaker, that we understand exactly how this tax plan would benefit the person who is proposing the tax plan.  Is this tax plan for the American people to see relief, or is it for the President and his best friends to see relief?  The reality is that this is about an issue of trust. The American people deserve to know whether they can trust this President and this administration to act on their behalf. So far, unfortunately, this administration has continued to throw the middle class under the bus, whether it is threatening to cut funding for Meals on Wheels, which is part of the budget proposal in cutting the CDBG programs, or whether it is in proposing a healthcare plan that cuts vital health care from millions of So we are intent to stay extremely vigilant.  I see that we have a couple of colleagues from the Progressive  Mr.Speaker, I yield to the distinguished gentlewoman from Texas (",CREC-2017-04-27-pt1-PgH2930.txt,99999999999999,1230,2017.0,27.0,June
13103,topic-id,99,"Mr.Speaker, I thank the gentlewoman from Texas for eloquently articulating so many of the issues that are in front of us right now, including, once again: What exactly is this administration doing for people across this country, both those who voted for him and those who didn't, but middle class Americans who are trying to make sure that this country stays a land of opportunity?  Mr.Speaker, so the gentleman from Maryland (Mr.Raskin), my distinguished vice chair and co-chair of this Special Order hour, may control the remainder of this hour, I yield back the balance of my time.                          ____________________",CREC-2017-04-27-pt1-PgH2930.txt,99999999999999,1230,2017.0,27.0,June
12955,topic-id,324,"Mr.President, today, I am introducing the Fair and Equal Housing Act of 2017, legislation to ensure equal housing opportunities for all This bill would protect Americans from housing discrimination based on gender identity and sexual orientation. No American should be turned away from a home they love because of who they love.  I am a former civil rights attorney. And during my practice, I focused on fair housing and I learned that a home is more than just a door, a roof, rooms, and walls. Your home is critical to your identity and central to the life of every  And a home becomes even more important when you are searching for a safe, stable place to live. But, say you run into problems as you're trying to rent that dream apartment and it is not because you are not a good tenant or a good neighbor. Instead, you learn that the apartment you wanted is suddenly no longer available because, after you met the landlord in person, they don't approve of your personal life or your appearance. Or you learn your rental application cannot be processed because you and your partner share the same sex.  Housing discrimination is real. And it is a reality for LGBT Americans because of incomplete protections in the Fair Housing Act (FHA), the landmark federal housing law. The FHA only prohibits housing discrimination based on race, color, religion, national origin, sex, familial status, or disability. And if someone thinks this is not a real problem, more than 20 states and over 200 localities protect sexual orientation and gender identity in their own housing discrimination statutes.  This is about equality, plain and simple. I want to thank my fellow Virginian, Representative Scott Taylor, for his leadership on this issue. I also want to thank all the civil rights attorneys across the nation who fight for justice on this issue every day. This is the right thing to do.                                 ______                                       By ",CREC-2017-06-08-pt1-PgS3364.txt,2176,1230,2017.0,8.0,July
13027,topic-id,336,"Madam Speaker, I thank the ranking member, Mr.Polis, for yielding me the time.  Madam Speaker, I rise today to oppose the rule and underlying bill by my Republican colleagues. The Republican bill favors big Wall Street megabanks and financial interests over the American people. I would ask my Republican friends: Don't you remember the financial crash of 2008 and who created it?  Their bill repeals a new Consumer Financial Protection Bureau rule which cuts down on those companies' abilities to use so-called forced arbitration clauses which prevent cheated or defrauded consumers from going to court. In other words, they prevent the victims from going to court. They want to handcuff the customers, not the megabanks that took them to the cleaners.  This takes us back to the days of when the fine print in the credit card or other financial agreement prevented consumers from banding together in class action lawsuits to challenge illegal behavior by the most powerful financial giants in the world. Try to deal with one of them as an individual. They don't even return phone calls, for heaven's sake. You get in that robo system for hours and hours, and then the phone call cuts off.  Republicans want to dismantle the Consumer Financial Protection Bureau, even after the agency's work for consumers resulted in $12 billion in relief to 27 million Americans who were harmed, and that is just the beginning.  Why is this Republican-led Congress so keen on protecting companies like Wells Fargo that used arbitration clauses and class action bans to create fraudulent accounts, overcharge customers with debit fees and mortgages, and even avoid responsibility for their misconduct? Criminal misconduct.  You can laugh. Come and meet the millions of people who have lost their homes across this country or are underwater on their mortgages. There is no justice for them.  The idea that banks can rip off consumers by abusing obscure clauses buried deep in their contracts is totally outrageous.  The SPEAKER pro tempore. The time of the gentlewoman has expired.  ",CREC-2017-07-25-pt1-PgH6225-6.txt,616,1230,2017.0,25.0,July
13029,topic-id,93,"The Consumer Financial Protection Bureau's rule banning the use of these clauses is simply a commonsense step to ensure that all consumers have equal access to justice. This is the people's We should protect consumers from the wolves. Our job is to keep them at bay, not make it easier for them to prey on the American people. This is not what President Trump ran on.  Madam Speaker, I urge my colleagues to vote ``no'' and stand with America's consumers over special interests, particularly the financial predators that brought this country to ruin.  ",CREC-2017-07-25-pt1-PgH6225-6.txt,616,NATIONAL DEFENSE AUTHORIZATION ACT FOR FISCAL YEAR 2018,2017.0,25.0,May
13092,topic-id,31,"Mr.Speaker, today, President Trump visited Ohio to tout his infrastructure plan. Well, Ohio needs the good jobs that direct national investment in infrastructure could provide, so my Democratic Ohio colleagues, Mr.Ryan, ",CREC-2017-06-07-pt1-PgH4689-4.txt,616,1700,2017.0,7.0,July
12878,topic-id,284,"Mr.Chair, I thank Chairman Thornberry for yielding and for his great work leading us on the  I would like to address two amendments that are coming up in en bloc packages.  First of all, on Iran, my amendment to the NDAA, 361, requires the President, along with various agencies, to provide the House with a report regarding Iran's use of commercial aircraft for illicit activities. I am doing this with Representative  Diligent research from think tanks, such as the Foundation for Defense of Democracies and the American Enterprise Institute, have demonstrated the need for the intelligence community to provide Congress with a report of their activities.  In total, Iran Air, Mahan Air, Pouya Air, Cham Wings Airlines, and the Iranian Air Force operated at least 404 flights from Iran to Syria since the Iran nuclear deal was adopted on July 14, 2015.  Now, this report does not block the sale of commercial aircraft to Iran, but asks the intelligence community to take a serious look at these sales so Congress can determine if they should continue.  The other amendment I would like to address, Mr.Chairman, is 364 on boost-phase missile defense. Mr.Chair, I thank Chairman Thornberry for including this amendment, which was cosponsored by Mr.Kinzinger, Mr.Hunter, Mr.Franks, and Mr.Wilson from South Carolina, to advance boost-phase missile defense programs.  As you know, ballistic missiles are at their most defenseless when they are in their boost phase, the initial phase of flight. They are at their slowest, and they have not yet deployed decoys and countermeasures that would make it more difficult to shoot them down in later phases of flight.  This amendment will make Americans safer as we move towards advancing this absolutely critical technology.  ",CREC-2017-07-14-pt1-PgH5836-2.txt,1834,IN MEMORY OF PFC JAMES T. STANFORD,2017.0,14.0,July
13037,topic-id,48,"Madam Speaker, on rollcall vote 410 I was unavoidably detained. Had I been present, I would have voted ``nay.''  The SPEAKER pro tempore. The question is on the resolution.  The question was taken; and the Speaker pro tempore announced that the ayes appeared to have it.                             Recorded Vote  ",CREC-2017-07-25-pt1-PgH6225-6.txt,1668,NATIONAL MISSING CHILDREN'S DAY,2017.0,25.0,June
