speech_id,topic_id,word_count,speech_text,file_name,speaker_id,session_title,year,day,month
5691,topic-id,577,"Mr.President, Senate Standing Rule XXVI requires each committee to adopt rules to govern the procedure of the committee and to publish those rules in the Congressional Record not later than March 1 of the first year of each On February 14, 2017, a majority of the members of the Committee on Homeland Security and Governmental Affairs' Subcommittee on Federal Spending Oversight and Emergency Management adopted subcommittee rules of procedure.  Consistent with Standing Rule XXVI, today I ask unanimous consent to have printed in the Record a copy of the rules of procedure of the Subcommittee on Federal Spending Oversight and Emergency  There being no objections, the material was ordered to be printed in the Record, as follows:                   Rules of Procedure for the SenateSubcommittee on Federal Spending Oversight and Emergency Management of       the Committee on Homeland Security and Governmental Affairs       1. Subcommittee rules. The Subcommittee shall be governed,      where applicable, by the rules of the full Committee on      Homeland Security and Government Affairs and the Standing      Rules of the       2.       Transaction of routine business. One-third of the      membership of the Subcommittee shall constitute a quorum for      the transaction of routine business, provided that one Member      of the Minority is present. For the purpose of this      paragraph, the term ``routine business'' includes the      convening of a meeting and the consideration of any business      of the Subcommittee other than reporting to the full      Committee on Homeland Security and Government Affairs any      measures, matters, or recommendations.       Taking testimony. One Member of the Subcommittee shall      constitute a quorum for taking sworn or unsworn testimony.       Proxies prohibited in establishment of quorum. Proxies      shall not be considered for the establishment of a quorum.       3. Subcommittee subpoenas. The Chairman of the      Subcommittee, with the approval of the Ranking Minority      Member of the Subcommittee, is authorized to subpoena the      attendance of witnesses or the production of memoranda,      documents, records, or any other materials at a hearing,      provided that the Chairman may subpoena attendance or      production without the approval of the Ranking Minority      Member where the Chairman or a staff officer designated by      him/her has not received notification from the Ranking      Minority Member or a staff officer designated by him/her of      disapproval of the subpoena within 48 hours, excluding      Saturdays[[Page S1494]]     and Sundays and legal holidays in which the Senate is not in      session, of being notified of the subpoena. If a subpoena is      disapproved by the Ranking Minority Member as provided      herein, the subpoena may be authorized by vote of the Members      of the       Immediately upon authorization of the issuance of a      subpoena under these rules, a written notice of intent to      issue the subpoena shall be provided to the Chairman and      Ranking Minority Member of the full Committee on Homeland      Security and Government Affairs, or staff officers designated      by them, by the Subcommittee Chairman or a staff officer      designated by him/her, and no subpoena shall be issued for at      least 48-hours, excluding Saturdays and Sundays, from      delivery to the appropriate offices, unless the Chairman and      Ranking Minority Member of the full Committee on Homeland      Security and Government Affairs waive the 48-hour waiting      period or unless the Subcommittee Chairman certifies in      writing to the Chairman and Ranking Minority Member of the      full Committee that, in his or her opinion, it is necessary      to issue a subpoena immediately.       When the Subcommittee or its Chairman authorizes subpoenas,      subpoenas may be issued upon the signature of the Chairman or      any other Member of the Subcommittee designated by the                               ____________________",CREC-2017-02-28-pt1-PgS1493.txt,,TOWN HALL MEETING IN CHICAGO,2017.0,28.0,February
5725,topic-id,953,"Mr.President, I rise today to ask my colleagues to support H.37, a resolution disapproving of the Federal Acquisition Regulation issued by the Department of Defense, the General Services Administration, and the National Aeronautics and Space  As is the case in so many of these rules and regulations, it has a really nice name. It sounds really good--the fair pay and safe workplaces rule--but the bottom line is, because of the substance of this rule, it has become commonly known as ``the blacklisting rule.'' Had it been up to me, I would have called it ``the blackmailing rule.'' Let me explain why.  It requires contractors and subcontractors submitting bids on Federal Government contracts to disclose any proven or alleged violations within the last 3 years of 14 different labor laws, plus ``equivalent State laws.''  Now, that may sound reasonable, but it is not. And it is entirely unnecessary. Any competent purchasing manager--again, I come from the private sector, and there are a lot of competent purchasing managers--could readily obtain the information required by this regulation. And, of course, any competent purchasing manager should also always be evaluating the qualifications, integrity, and the past performance record of any kind of potential suppliers.  This rule also has the very real potential of subjecting perfectly innocent contractors to blackmail and extortion tactics during union contract negotiations.  In case anyone thinks I am overstating this threat, listen carefully to the following quote from one union describing an ``ideal message'' their union president should convey to a general manager of a business negotiating a union contract:       Putting it plainly: unless you settle this strike within      the next few days, and the union withdraws its charges--  Those would be those allegations; unless the union withdraws those charges--     you are likely to be marked as a ``repeat labor law      offender,'' one of the highest categories of wrongdoing under      the President's Check this out with your hotshot legal      team.  This union message goes on:       Counting all of its divisions, this corporation has federal      contracts in the hundreds of millions. Do you really want to      jeopardize this pot of gold to save a few hundred thousand      dollars to the union contract?  This is the kind of negotiating tactic that illustrates exactly how this regulation would be used as a form of federally sanctioned blackmail. There would be no due process for contractors wrongly accused. There would be no way for them to defend themselves or avoid being blacklisted.  As if the blackmail potential of the rule isn't bad enough, the Obama administration admitted that the final rule would cost at least $398 million to comply with every single year. And except for the benefit that extortion leverage provides to unions, I can think of no financial benefit to taxpayers or our economy--and neither could the Obama administration, as they were unable to quantify any financial benefit for this rule in their regulatory filings.  In addition to the $398 million annual regulatory cost, the agencies themselves detailed the following regulatory burdens:  The rule will affect over 24,000 contractors. Industry estimates are even higher.  The rule imposes costly reporting requirements on small businesses that many simply cannot bear.  And it also reduces the availability and increases the price of much needed supplies and services, including to our military.  Others have pointed out even more problems with the rule. For example, it does not define what the ``equivalent State laws'' are that have been included in the disclosure requirement. Also, the definition of a violation that is reportable is incredibly broad. It is not limited to government contracts and includes pending and other nonfinal disputes--in other words, mere allegations of wrongdoing.  This, in particular, is a slippery slope. For example, in fiscal year 2016, the National Labor Relations Board received over 21,000 unfair labor practice charges, but more than half of those were withdrawn or dismissed, and less than 6 percent resulted in a formal complaint by the Also in fiscal year 2016, the Equal Employment Opportunity Commission received over 91,000 complaints but issued a ``determination of reasonable cause'' in only 3,113--about 3.4 percent of those--and filed enforcement suits in only 114--about 0.1 percent of the 91,000 complaints that were filed.  Various studies report that it costs $2 trillion per year to comply with Federal Government regulations. That is $14,800 per family per year. Of course, no one writes a check for $14,800. Instead, those costs are realized in reduced opportunities, higher prices to consumers, and stagnated wages and benefits for hard-working  Economic growth is the primary component of a solution for many of our country's problems, yet Washington continues to stifle growth by adding layer upon layer of regulation. The blacklisting rule is just one harmful example.  Fortunately, last October, the U.District Court for the Eastern District of Texas issued a nationwide preliminary injunction the day before this rule was set to go into effect. The judge issuing the order noted there was merit to the claims that this rule violates statute, exceeds Executive authority, and is unconstitutional. The court found that letting this rule go into effect would cause ``irreparable harm.'' But the case is still pending. Until we act to decisively repeal this rule, a significant burden hangs over our country's contractors and suppliers.  Through the use of the Congressional Review Act, we have the opportunity to reduce that regulatory burden and repair a small portion of the damage done by President Obama's regulatory overreach.  We owe it to the American people and American businesses to start providing them with regulatory relief.  I urge my colleagues to vote yes to disapprove and repeal this very harmful, very costly, and completely unnecessary rule.  With that, I yield the floor.  The PRESIDING The Senator from  ",CREC-2017-03-02-pt1-PgS1564.txt,,LEGISLATIVE SESSION,2017.0,2.0,February
5844,topic-id,766,"Mr.Speaker, I rise today to bring attention to President Trump's ever-growing risk of personal and business entanglements. They call into question his ability to serve impartially in the interests of the American people. Both he and his administration remain closely linked to private companies and foreign entities whose interests are often in direct opposition to those of the United  For example, we are well aware of the increasing boldness of the Chinese regime and its efforts to extend their economic and military influence. Despite portraying China publicly as a threat to economic growth of the United States, the President has selected Goldman Sachs' executive, Gary Cohn, to be his director of the National Economic That is about one of seven individuals from Goldman Sachs who have been brought into this administration. Mr.Cohn has just sold his $16 million holding in a Chinese bank. This same state-owned Chinese bank also happens to be the largest tenant in Trump Tower in Isn't that a coincidence?  Wilbur Ross, President Trump's choice for Commerce Secretary, presents similar conflicts of interest. As a man who will play a major role in shaping U.trade policy, Mr.Ross continues to hold a stake worth tens of millions of dollars in the international shipping company, Diamond S Shipping Group, a company that not only operates ships that fly the Chinese flag, but those ships also call on ports in countries, such as Iran and Sudan, that are under U.sanctions for being state sponsors of terrorism.  We also know that The Trump Organization was recently awarded sole rights to the President's name for products sold in He had waited 10 years to get those rights. The case was settled just mere days after President Trump's phone call with Chinese President Xi Jinping, when the President reversed his prior stance on Chinese unification and gave a full-throated endorsement to what he termed ``One China'' policy. That was a reversal from what he had done just after the election.  Meanwhile, according to The New York Times, President Trump's son-in-law, Jared Kushner, was recently negotiating a real estate deal worth hundreds of millions of dollars with a Chinese company closely tied to its government. And while it has been reported that the deal was called off, the fact that Mr.Kushner is continuing to negotiate private real estate deals while serving as a White House employee is deeply troubling.  It was announced last week that Ivanka Trump will now be joining her husband in the White House as an adviser to the President with top secret security clearance. While she has stepped down from her former role at her fashion licensing company that uses the Trump name, her decision to transfer her brand's assets into a trust run by her own brother-in-law--and her arrangement to continue to receive fixed payments from the company--is a matter of serious concern given her role in the administration.  The ever-growing list of valid concerns about the Trump administration's conflicting entanglements are taking place at the same time that the President is proposing $18 billion in reductions for the 2017 appropriations process--while he himself, his daughter, son-in-law, and his Cabinet members continue to benefit off the American taxpayer.  While the President spends millions of tax dollars on securing his residences in New York and in Florida and flying to his so-called southern White House almost every weekend, he is slashing to zero the Great Lakes Restoration Initiative--an absolutely critical program that directly impacts my district and many others responsible for preserving the world's largest body of fresh water from serious and growing environmental threats. What is right about that?  President Trump also wants to eliminate TIGER grants, a highly successful transportation program that provides[[Page H2636]]funding for communities across America with backlogged infrastructure projects that create jobs and produce robust economic benefits. Everyone agrees on that.  He has also called for a nearly $3 billion draconian reduction to foreign operations endangering our national security. We are the leader of the free world the last time I looked, and, meanwhile, he and his family spend millions of American taxpayer dollars on travel and security costs for themselves.  With an investigation into President Trump's possible entanglements with Putin's Russia already underway, and members of the President's family and administration engaging in increasingly brazen conflicts of interest, this Congress should pass legislation to prevent these increasingly apparent conflicts of interest from endangering our Nation and the American people. It is only a matter of time before his conflicts of interest harm our country.  The SPEAKER pro tempore. Members are reminded to refrain from engaging in personalities toward the                          ____________________",CREC-2017-04-04-pt1-PgH2635-2.txt,616,EXECUTIVE SESSION,2017.0,4.0,February
5903,topic-id,201,"Mr.Speaker, the day after our new President spoke to the President of Russia, Vladimir Putin, we saw a surge in Russian aggression and attacks in eastern Every American must realize, Russia is testing our new administration's resolve to stand up for liberty.  Since Russia invaded Crimea in February 2014, 10,000 innocent Ukrainians have been killed by Russian aggression, and this has increased over the past week. Dozens more have been displaced--17,000, in fact.  These actions violated the 1994 Budapest Memorandum on Security Assurances that stated: the Russian Federation would respect the independent sovereignty and existing borders of  Russia's new aggression is another step in its campaign to undermine the democratic order that has existed in our Transatlantic Alliance since the end of World War II and cold war.  America must stand up for the people of Ukraine and our European alliances and denounce the actions of President We have to stand up or we face--Russia will face condemnation by the world community. Russia should withdraw her heavy weapons from that region. They should stop financing separatists. They should allow repairs for critical infrastructure and fulfill all of their agreements under the Minsk accords.  What is happening is a global shame.                          ____________________",CREC-2017-02-02-pt1-PgH921-2.txt,616,LEGISLATIVE PROGRAM,2017.0,2.0,March
5923,topic-id,212,"Mr.Speaker, I am so pleased to join the gentleman from Pennsylvania (Mr.Thompson), my friend and co-chair of the Career and Technical Education Caucus, to recognize February as Career and Technical Education  In Rhode Island and across the country right now, employers are struggling to find workers with the skills that they need to fill jobs in STEM, in manufacturing, in IT, and so many other skilled trades. Hundreds of thousands of high-skilled, high-paying jobs are open right now, going unfilled, and this number is growing.  To close the skills gap, we must better align education and industry to make sure that what we are teaching in classrooms is better meeting the needs of real-world companies right now. We must increase work-based learning and build education pathways to help students become career and college-ready.  Mr.Speaker, I urge my colleagues to support investment in CTE in the 115th Congress, including by reauthorizing the Carl Perkins Career and Technical Education Act to adapt our workforce to the 21st century economy.  Mr.Speaker, this act passed with strong, bipartisan support in the last Congress, and I hope we can quickly bring it up again to pass it with strong bipartisan support in this Congress as well.  I thank the gentleman from Pennsylvania (Mr.Thompson) for his leadership.                          ____________________",CREC-2017-02-13-pt1-PgH1116.txt,1668,LEGISLATIVE PROGRAM,2017.0,13.0,March
5806,topic-id,22,"Mr.President, I ask unanimous consent that the order for the quorum call be rescinded.  The PRESIDING Without objection, it is so ordered.  ",CREC-2017-01-24-pt1-PgS430-2.txt,2050,LEGISLATIVE PROGRAM,2017.0,24.0,February
5807,topic-id,32,"Mr.President, I ask unanimous consent that the order for consideration of the Chao nomination be modified to occur on Tuesday, January 31.  The PRESIDING Without objection, it is so ordered.                          Replacing ObamaCare  ",CREC-2017-01-24-pt1-PgS430-2.txt,2050,LEGISLATIVE PROGRAM,2017.0,24.0,March
