speech_id,topic_id,word_count,speech_text,file_name,speaker_id,session_title,year,day,month
6491,topic-id,635,"Mr.Speaker, I yield myself such time as I may consume.  Mr.Speaker, nearly 16 years after September 11th, our country continues to face the persistent threat of terrorism. From ISIS to al Qaeda, radical groups continue to target the United States and our way of life. Last year alone, we saw more than 131 plots by ISIS alone against the  As terrorists continue to evolve, this body must ensure that the security measures in place to protect the United States and its citizens adapt to meet these threats.  Faced with the most dangerous threat environment since 9/11, the Department of Homeland Security needs to continue to focus on its core mission of protecting Americans from these threats in an increasingly expeditious manner. I am proud that this body is working to continue to strengthen our national security by debating the bill before us today.  H.526, the Counterterrorism Advisory Board Act of 2017, will help integrate intelligence, operations, and policy decisions to ensure the Department of Homeland Security remains adaptable, while eliminating waste and duplication. This same bill was introduced last year and passed the House by overwhelming majority.  Mr.Speaker, with open investigations in all 50 States and more than 119 arrests, this body must continue to take action to protect our homeland. Further, these threats will likely expand as foreign fighters flee places like Raqqa and  Mr.Speaker, the world is witnessing the greatest convergence of radical Islamic threats in its history. More than 40,000 jihadists fighters, many of whom came from the West, have traveled to[[Page H782]]the battlefield in Syria and With this threat environment in mind, I have introduced H.526.  Initially established at the end of 2010, the Counterterrorism Advisory Board brings together the Department of Homeland Security's top echelon counterterrorism decisionmakers to quickly respond to threats.  While my colleagues and I were conducting the bipartisan Task Force on Combating Terrorists and Foreign Fighter Travel, we found that the Counterterrorism Advisory Board, or CTAB as it is referred to, had neither been codified nor had its charter kept pace with evolving terrorist threats.  That is why we need to pass this bill: to ensure that DHS is effectively integrating intelligence, operations, and policy to better compile and understand threat information to successfully fight terrorism.  This legislation formally establishes the CTAB in law and makes it the Department's central coordination body for counterterrorism activities.                              {time}  1500  The bill also updates the Board's charter to effectively respond to tomorrow's challenges and requires the Secretary to appoint a coordinator for counterterrorism to oversee the Board's activities.  Additionally, this legislation requires the CTAB to advise the Secretary of Homeland Security on the issuance of terrorism alerts, ensuring that top counterterrorism intelligence officials play a key role in developing these critical notices and providing them to the public.  Finally, this bill ensures continued congressional oversight by requiring DHS to report on the status and activities of the CTAB so that they can be certain it is meeting its mandate.  I thank Chairman McCaul from the Homeland Security Committee for appointing me to lead the bipartisan Task Force on Combating Terrorist and Foreign Fighter Travel last year. This task force produced 32 key findings and more than 50 recommendations, one of which serves as a basis of the legislation before us today.  I am proud to say we have now acted legislatively on more than half of the task force's findings, largely thanks to the hard work of the members of the task force and their willingness to work across the aisle in a bipartisan manner.  I also thank Mr.Thompson, my colleague in the minority, for working in a bipartisan manner on this and many other bills that we have before us today.  I will end by urging my colleagues to support this measure.  I reserve the balance of my time.  ",CREC-2017-01-31-pt1-PgH781.txt,2264,ADDITIONAL SPONSORS,2017.0,31.0,January
6492,topic-id,85,"Mr.Speaker, I have no further speakers, and I urge Members to support this bill.  I yield back the balance of my time.  The SPEAKER pro tempore (Mr.McClintock). The question is on the motion offered by the gentleman from New York (Mr.Katko) that the House suspend the rules and pass the bill, H.526, as amended.  The question was taken; and (two-thirds being in the affirmative) the rules were suspended and the bill, as amended, was passed.  A motion to reconsider was laid on the table.                          ____________________",CREC-2017-01-31-pt1-PgH781.txt,2264,EDUCATION REFORM,2017.0,31.0,January
6448,topic-id,241,"Mr.Speaker, I yield myself such time as I may consume.  I rise in support of H.677, the CBRN Intelligence and Information Sharing Act of 2017.  Mr.Speaker, last Congress, the Committee on Homeland Security held several hearings to evaluate Federal, State, and local capabilities to prevent, identify, and respond to a chemical, biological, radiological, or nuclear attack, a CBRN threat.  Although the State and local stakeholders we heard from were generally aware of the evolving CBRN threat, there was a consistent message from everyone who testified--from public health professionals to emergency managers, to first responders--improved information sharing would make our communities safer.  H.677 would facilitate improved CBRN information sharing by directing DHS to analyze CBRN-related terrorist threats and share relevant threat information with Federal, State, and local stakeholders. These activities will both improve situational awareness at all levels of government and help DHS grant recipients better target their limited grant dollars to address this particular threat.  The CBRN Intelligence and Information Sharing Act passed the House overwhelmingly last Congress, and I urge my colleagues to support the measure once again.  Information sharing is at the core of our ability to prevent, thwart, and respond to threats posed by bad actors. H.677 would facilitate information sharing in the CBRN space where the threats are constantly evolving. This commonsense legislation costs next to nothing but will reap significant benefits.  I urge my colleagues to support H.677.  I yield back the balance of my time.  ",CREC-2017-01-31-pt1-PgH785.txt,2025,"CONCURRENT RESOLUTION ON THE BUDGET, FISCAL YEAR 2017",2017.0,31.0,January
6416,topic-id,208,"Mr.Speaker, I rise today to say good-bye to a dedicated public servant and a key part of my team. Judith Morrishas served the Olympic Peninsula for a decade, first for my predecessor Norm Dicks, and for the past 4 years in my office.  Judith's knowledge of the peninsula and her dedication is unmatched. There are few that combine her compassion and guidanceto any constituent who had a question or who needed help with a Federal agency. Whether at the office or at the grocery store orat an event, Judith was available.  Mr.Speaker, Judith has served our Nation with distinction, first in the Peace Corps, and now in the United States House ofRepresentatives, making equity and conservation and human rights a tenet of her time in service. Judith's wit, thoughtfulness,and easygoing manner will be missed.  Our entire community thanks her and her husband, David, an outstanding public servant in his own right, who worked for theNational Park Service, for leaving a legacy of integrity, excellence, and service.  I am humbled and honored to offer my sincere thanks to Judith Morris for her dedication to the Sixth Congressional District,and I wish her the best as she continues to explore her passion for travel and service all around this world.                          ____________________",CREC-2017-01-12-pt1-PgH400-9.txt,2169,"ADJOURNMENT FROM FRIDAY, MARCH 24, 2017, TO MONDAY, MARCH 27, 2017",2017.0,12.0,January
6547,topic-id,992,"Mr.Speaker, I move to suspend the rules and pass the bill (H.337) to transfer administrative jurisdiction over certain Bureau of Land Management land from the Secretary of the Interior to the Secretary of Veterans Affairs for inclusion in the Black Hills National Cemetery, and for other purposes.  The Clerk read the title of the bill.  The text of the bill is as follows:                                H.337       Be it enacted by the Senate and House of Representatives of      the United States of America in Congress assembled,     SECTION 1. SHORT       The Act may be cited as the ``Black Hills National Cemetery      Boundary Expansion Act''.     2. WITHDRAWAL AND TRANSFER OF PUBLIC LAND FOR CEMETERY                          (a) Due Diligence.--Prior to the withdrawal and transfer in      subsection (b), the Secretary of Veterans Affairs will      complete appropriate environmental, cultural resource and      other due diligence activities on the public lands identified      in subsection (c), so that the Secretary of Veterans Affairs      may confirm that the land is suitable for cemetery purposes.      The Secretary of Veterans Affairs shall notify the Secretary      of the Interior of such due diligence activities prior to      initiating and shall coordinate as needed during the      performance of such activities.       (b) Withdrawal and Transfer.--After completion of the due      diligence activities in subsection (a) and upon receipt by      the Secretary of the Interior of written confirmation from      the Secretary of Veterans Affairs that the land is suitable      for cemetery purposes, and subject to valid existing rights,      the public lands described in subsection (c) shall be--       (1) withdrawn from all forms of appropriation under the      public land laws, including the mining laws, the mineral      leasing laws, and the geothermal leasing laws, for as long as      the lands remain under the administrative jurisdiction of the      Secretary of Veterans Affairs;       (2) deemed property as defined in section 102(9) of title      40, United States Code, for as long as the lands remain under      the administrative jurisdiction of the Secretary of Veterans      Affairs; and       (3) transferred to the administrative jurisdiction of the      Secretary of Veterans Affairs for use as national cemeteries      under chapter 24 of title 38, United States       (c) Land Description.--The public lands withdrawn, deemed      property, and transferred under subsection (b) shall be the      approximately 200 acres of land adjacent to Black Hills      National Cemetery, South Dakota, generally depicted as      ``Proposed National Cemetery Expansion'' on the map entitled      ``Proposed Expansion of Black Hills National Cemetery--South      Dakota'' and dated June 16, 2016, except the land located      within 100 feet of the centerline of the Centennial Trail      (which runs along the northern boundary of the ``Proposed      National Cemetery Expansion'') and that is located south of      the       (d) Boundary Modification.--Immediately after the public      lands are withdrawn, deemed property, and transferred under      subsection (b), the boundary of the Black Hills National      Cemetery shall be modified to include the public lands      identified in subsection (c).       (e) Modification of Public Land Order.--Immediately after      the public lands under subsection (b) are withdrawn, deemed      property, and transferred under subsection (b), Public Land      Order 2112, dated June 6, 1960 (25 5243), shall be      modified to exclude the lands identified in subsection (c).     3. LEGAL       (a) Preparation of Legal Descriptions.--As soon as      practicable following receipt of written confirmation from      the Secretary of Veterans Affairs that the land is suitable      for cemetery purposes, the Secretary of the Interior shall      publish in the Federal Register a notice containing the legal      descriptions of the public lands withdrawn, deemed property,      and transferred under section 2(b).       (b) Legal Effect.--The legal descriptions prepared under      subsection (a) shall have the same force and effect as if the      legal descriptions were included in this Act, except that the      Secretary of the Interior may correct any clerical and      typographical errors in the legal descriptions.       (c) Availability.--Copies of the map referred to in section      2(c) and the legal descriptions prepared under subsection (a)      shall be available for public inspection in the appropriate      offices of--       (1) the Bureau of Land Management; and       (2) the National Cemetery       (d) Costs.--The Secretary of Veterans Affairs shall      reimburse the Secretary of the Interior for reasonable costs      incurred by the Secretary of the Interior in implementing      this section, including the costs of any surveys.     4. RESTORATION TO PUBLIC LANDS FOR NON-CEMETERY       (a) Notice and Effect.--Upon a determination by the      Secretary of Veterans Affairs that all or a portion of the      lands withdrawn, deemed property, and transferred under      section 2 shall not be used for cemetery purposes, the      Secretary of Veterans Affairs shall notify the Secretary of      the Interior of such determination. Subject to subsections      (b) and (c), the Secretary of Veterans Affairs shall transfer      administrative jurisdiction of the lands subject to such      notice to the Secretary of the       (b) Decontamination.--The Secretary of Veterans Affairs      shall be responsible for costs of any decontamination of the      lands resulting from contamination on the lands withdrawn,      deemed property, and transferred under section 2(b) while the      Secretary of Veterans Affairs exercised jurisdiction over      those lands subject to a notice under subsection (a)      determined by the Secretary of the Interior to be necessary      for the lands to be restored to the public lands.       (c) Restoration to the Public Lands.--The lands subject to      a notice under subsection (a) shall only be restored to the      public lands upon acceptance by the Secretary of the Interior      and a determination by the Secretary of the Interior that      such lands are suitable for restoration to the public lands[[Page H986]]     and operation of one or more of the public land laws.       (d) Opening Order.--If the Secretary of the Interior      accepts the lands subject to such a notice and determines      that the lands are suitable for restoration, in whole or in      part, the Secretary of the Interior may open the lands to      operation of one or more of the public land laws and may      issue an order to that effect.  The SPEAKER pro tempore. Pursuant to the rule, the gentleman from Colorado (Mr.Lamborn) and the gentleman from Colorado (Mr.Polis) each will control 20 minutes.  The Chair recognizes the gentleman from Colorado (Mr.Lamborn).                             General Leave  ",CREC-2017-02-06-pt1-PgH985.txt,1834,IRAQI SPECIAL IMMIGRANT VISAS,2017.0,6.0,January
6548,topic-id,48,"Mr.Speaker, I ask unanimous consent that all Members may have 5 legislative days to revise and extend their remarks and to include extraneous materials on the bill under consideration.  The SPEAKER pro tempore. Is there objection to the request of the gentleman from Colorado?  There was no objection.  ",CREC-2017-02-06-pt1-PgH985.txt,1834,"PROVIDING FOR CONSIDERATION OF H.R. 26, REGULATIONS FROM THE EXECUTIVE",2017.0,6.0,March
6549,topic-id,632,"Mr.Speaker, I yield myself such time as I may consume.  I rise in strong support of H.337, the Black Hills National Cemetery Boundary Expansion Act, sponsored by Congresswoman Kristi Noem of South  This bill expands the Black Hills National Cemetery, outside of Sturgis, South Dakota, by permanently transferring the jurisdictional authority of approximately 200 acres of undeveloped Federal land from the Bureau of Land Management to the Department of Veterans  Originally opened in 1948, the cemetery now houses a memorial carillon, a memorial to Korean war veterans, and is the final resting place of many notable veterans, including Medal of Honor recipient Sergeant Charles With its existing acreage, the cemetery can only accommodate a finite number of additional burials. Transferring jurisdiction of the land from the BLM to the VA will provide space for hundreds of additional grave sites for future generations of American veterans. Without the transfer, the National Cemetery Administration will be forced to close the cemetery to further burials in the very near future.  This is a commonsense piece of legislation that will ensure that the Black Hills National Cemetery can continue to provide proper burial sites and final resting places for America's fallen heroes.  At this point, I include in the Record an exchange of letters with Chairman Roe of the Veterans' Affairs Committee regarding this bill. I thank him for helping to expedite the consideration of this bill today.  I commend Representative Noem for working closely with both the BLM and the VA on this issue, and I urge the adoption of the measure.  I reserve the balance of my time.                                         House of Representatives,                               Committee on Veterans' Affairs,                                 Washington, DC, February 1, 2017.     Rob Bishop,     Chairman, Committee on Natural Resources,     Washington,       Dear Mr.Chairman: I am writing to you concerning H.337,      the Black Hills National Cemetery Boundary Expansion      There are certain provisions in the legislation which fall      within the Rule X jurisdiction of the Committee on Veterans'            In the interest of permitting your committee to proceed      expeditiously to floor consideration of this important bill,      I am willing to waive this committee's right to sequential      referral. I do so with the understanding that by waiving      consideration of the bill, the Committee on Veterans' Affairs      does not waive any future jurisdictional claim over the      subject matters contained in the bill which fall within its      Rule X jurisdiction. I request that you urge the Speaker to      name members of this committee to any conference committee      which is named to consider such provisions.       Please place this letter into the committee report on H.     337 and into the Congressional Record during consideration of      the measure on the House floor. Thank you.           Sincerely,                                               David Roe, M.D.,                                      ____                                         House of Representatives,                               Committee on Natural Resources,                                 Washington, DC, February 2, 2017.     David Roe, M.D.,     Chairman, Committee on Veterans' Affairs,     Washington,       Dear Mr.Chairman: H.337. the Black Hills National      Cemetery Boundary Expansion Act, was introduced on January 5,      2017. The bill was referred primarily to the Committee on      Natural Resources, with an additional referral to the      Committee on Veterans'       I thank you for allowing the Committee on Veterans' Affairs      to be discharged from further consideration of the bill so      that it may be scheduled by the Majority This      discharge in no way affects your jurisdiction over the      subject matter of the bill, and it will not serve as      precedent for future referrals. In addition, should a      conference on the bill be necessary, I would support having      the Committee on Veterans' Affairs represented on the      conference committee. Finally, to memorialize our      understanding, I would be pleased to include your letter and      this response in the Congressional Record when the bill is      considered by the       Thank you for your response and cooperation. I look forward      to further opportunities to work with you this           Sincerely,                                                       Rob Bishop,                         Chairman, Committee on Natural  ",CREC-2017-02-06-pt1-PgH985.txt,1834,PROVIDING FOR A JOINT SESSION OF CONGRESS TO RECEIVE A MESSAGE FROM THE,2017.0,6.0,March
6551,topic-id,30,"Mr.Speaker, I thank the gentleman from Colorado for his gracious remarks.  I yield such time as she may consume to the gentlewoman from the great State of South Dakota (",CREC-2017-02-06-pt1-PgH985.txt,1834,"DEPARTMENT OF DEFENSE APPROPRIATIONS ACT, 2017",2017.0,6.0,March
6554,topic-id,67,"Mr.Speaker, I urge the adoption of this bill.  I yield back the balance of my time.  The SPEAKER pro tempore. The question is on the motion offered by the gentleman from Colorado (Mr.Lamborn) that the House suspend the rules and pass the bill, H.337.  The question was taken.  The SPEAKER pro tempore. In the opinion of the Chair, two-thirds being in the affirmative, the ayes have it.  ",CREC-2017-02-06-pt1-PgH985.txt,1834,50TH ANNIVERSARY OF THE 25TH AMENDMENT AND TRIBUTE TO BIRCH BAYH,2017.0,6.0,January
6555,topic-id,35,"Mr.Speaker, on that I demand the yeas and nays.  The yeas and nays were ordered.  The SPEAKER pro tempore. Pursuant to clause 8 of rule XX, further proceedings on this motion will be postponed.                          ____________________",CREC-2017-02-06-pt1-PgH985.txt,1834,TRANSIT SECURITY GRANT PROGRAM FLEXIBILITY ACT,2017.0,6.0,January
6408,topic-id,191,"Mr.Speaker, ``Never stop believing.'' Those words are going to be on the front page of The Providence Journal tomorrow morning.  Like all true tests of faith, last night's Super Bowl wasn't easy going, and there were times, I have to say, when I was tempted to throw up my hands and just go to bed, but I followed the words of our quarterback and--oh, boy--was I rewarded.  What a game.  If there were any doubts, Mr.Speaker, about who the greatest quarterback of all time is, Tom Brady answered them last night; if there were any who questioned whether Bill Belichick was the best coach on the planet, this morning, they are silent; and I am sure they would all admonish me if I didn't say that football is a team sport. So, for those who had not yet been satisfied that the amazing string of successes my New England Patriots put together makes them the NFL's finest team, Super Bowl LI speaks for itself.  Mr.Speaker, it was truly a team effort, and I offer my heartfelt congratulations to Bob Kraft and to the entire Patriots franchise.  Congratulations, Patriots and Patriots                          ____________________",CREC-2017-02-06-pt1-PgH995.txt,1668,TRANSIT SECURITY GRANT PROGRAM FLEXIBILITY ACT,2017.0,6.0,January
