speech_id,topic_id,word_count,speech_text,file_name,speaker_id,session_title,year,day,month
8580,topic-id,239,"Mr.Speaker, I rise today to speak out against President Trump's Muslim ban, an executive order that emboldens our enemies, undermines our alliances, and offends our American values. This ban has, among other things, blocked visas for interpreters from the Middle East, people who risk their lives to save American lives.  When I was deployed to Afghanistan as an intelligence officer, I worked with many interpreters; and at first, I realized they not only provided accurate information, they kept us safe. As time went along and I got to know them, what I came to realize is that they were the ones who were unsafe. They were the ones who were risking their lives to save our lives.  When I got to know them, I would ask them: Why are you taking this risk? Why are you doing this? And the reason they gave me was similar to the one my grandfather gave me, my Italian immigrant grandfather, as to why he came here to America back in 1921, and that is they came here to give their children a better life.  Mr.Speaker, to me, that is the definition of the American President Trump's executive order not only makes us unsafe, it is against our fundamental values. If people are willing to take risks to live the American Dream, we don't stop them; we welcome them. That is why my family is here. That is why I am here.                          ____________________",CREC-2017-02-03-pt1-PgH950-2.txt,99999999999999,THE RIGHT TO TRY,2017.0,3.0,February
8648,topic-id,182,"Mr.Speaker, this week, we recognized National K9 Veterans It was on March 13, 1942, that the U.Army K9 Corps was officially formed, although dogs have had a role in our military ever since our country's founding. We not only honor military dogs, but also police dogs, customs dogs, border patrol dogs, and other working dogs that work to protect our communities.  These dogs provide an incredible service to our brave men and women overseas. They are responsible for saving lives and preventing injuries, sometimes at their own expense.  Many of our servicemembers form very strong bonds with these loyal companions. That is why I authored the Military Working Dog Military Retirement Act and was proud to see it pass with overwhelming bipartisan support last This new law guarantees that service dogs are returned and retired to the United States after serving overseas. Previously, military members were often forced to spend their own money to bring these animals home.  Mr.Speaker, let us remember and honor these four-legged heroes. They are a valuable component of protecting Americans through their courage and their loyalty.                          ____________________",CREC-2017-03-15-pt1-PgH2072-2.txt,1930,DISAPPROVING THE RULE SUBMITTED BY THE DEPARTMENT OF LABOR RELATING TO,2017.0,15.0,February
8460,topic-id,19,"Madam President, I ask unanimous consent that the order for the quorum call be rescinded.  The PRESIDING OFFICER (",CREC-2017-01-24-pt1-PgS422.txt,2113,HONORING INVESTMENTS IN RECRUITING AND EMPLOYING AMERICAN MILITARY,2017.0,24.0,February
8577,topic-id,738,"Mr.Speaker, the Affordable Care Act has saved thousands of Mainers from losing their lives or going bankrupt simply because they got sick. Quality of care has improved through preventative care, without cost sharing for consumers. Overall costs have been lowered.  Republicans have had 7 years to come up with an alternative healthcare plan that preserves the progress we have made under the Affordable Care Act--one that would not take us back to a time when many without employer-sponsored insurance or a clean bill of health could get coverage.  But after all this time, they have come up with a plan that will cost older Americans up to five times more than younger enrollees; will charge the uninsured 30 percent more to buy coverage; and it will defund, not defend, Planned Parenthood; cut Medicaid significantly; and still has no price tag.  We owe it to Americans to have an open debate on this proposal, and I expect my Republican colleagues not to forget the millions of Americans for whom the Affordable Care Act has been a lifesaver.  In January, I asked my constituents to share their Affordable Care Act stories. Within a few days, more than a thousand stories were submitted. Some shared their ongoing challenges. I agree there are opportunities to strengthen the Affordable Care Act and make it affordable, but the overwhelming number of people shared compelling stories of how the Affordable Care Act has improved their lives.  I am honored to share a few of those powerful stories today, and I hope my Republican colleagues are listening.  Eleanor from Belfast, Maine, said:  ``I am a 63-year-old small-business owner who has health insurance for the first time in my adult life since passage of the Affordable Care The same is true for my partner of 17 years. She was diagnosed with breast cancer this year and has recently undergone a mastectomy with follow-up care. After her diagnosis, I went for my first-ever mammogram.''  The Republican plan puts these preventive services at risk.  Matthew from Brunswick, Maine, said:  ``Five years ago, I left a comfortable job with good benefits to start my own business. Those first years were tough on my family. My wife and I were able to put our children on Maine's Dirigo Health, but we had to do without. . . . Today, through God's grace, hard work, and the support of my wife; my business is prospering. Food assistance is a thing of the past and we're actually contributing more in taxes now than we ever did before. We still have to watch what we spend but we're breathing a lot easier. Each year that I've made more money our subsidy has gone down, and that's just as it should be. That subsidy still matters though. If the ACA were eliminated today and I had to buy health insurance on the open market I'd be paying an extra $4,800 a year. That's real money.''  Under the Republican plan, small-business owners like Matthew may not be able to afford care for their family.  Ret, a 9/11 first responder from Rockland, Maine, said:  `` . . . The ACA means that as a self-employed resident of the state of Maine, I can actually acquire coverage with a pre-existing condition. After working search and rescue/recovery at Ground Zero in 2001, I developed a lung condition necessitating costly medication. Before the ACA, I was terrified of losing my job and losing health care because of my pre-existing condition.''  Under the Republican plan, those with preexisting conditions, like our 9/11 first responders, may not get affordable coverage.  Elisabeth from Phippsburg, Maine, said:  ``In 2014 . . . my husband died from early-onset Alzheimer's. I was 50 when[[Page H1542]]my husband was diagnosed. Eventually I left the workforce to care for him . . . and, of course, lost my employer-provided health insurance at the same time. The ACA has provided me with options ever since then; options that I never had before its passage. In 2014 I had three joints replaced; life changing surgeries that restored my active lifestyle and removed chronic pain from my life. These were only possible because I was able to access health insurance as an individual, at a reasonable cost.''  The Republican plan for increasing costs for older Americans threatens people just like  These stories matter. These lives matter. We must all keep them in mind as we look to change the Affordable Care                          ____________________",CREC-2017-03-07-pt1-PgH1541-2.txt,1927,TRIBUTE TO GARY SCHNEIDERS,2017.0,7.0,January
8414,topic-id,1912,"Mr.Speaker, I thank the gentleman for yielding me the customary 30 minutes, and I yield myself such time as I may consume.  Mr.Speaker, I rise in opposition to the rule, one that provides for consideration of H.1343, the Encouraging Employee Ownership  I strongly support the underlying legislation. I wish it had been brought forward to the floor under an open rule that allowed Democrats and Republicans to freely offer amendments that could be adopted by a simple majority vote.  Before we get to the specifics of the bill, I want to talk about the importance of employee ownership. I join my friend and colleague from my neighboring district in Colorado in extolling the virtues of employee stock ownership, of ensuring that employees in the company are stakeholders and able to benefit from the value that is being created.  You know, we have different stakeholders in our economy, and when you look at a company, you have different stakeholders that that company is responsible to and caters to: You have the shareholders, you have the employees, and you have the customers. In running a company, as I have done, it is always a constant balancing act to make sure that you are able to satisfy the legitimate demands of all those various stakeholders.  Now, one of the things that has been out of whack in our economy the last few decades is that a disproportionate share of the value creation has gone to the shareholders and the customers, often to the detriment of the employees.  Now, everybody has benefited as consumers and as customers with revolutions in prices and consumer technology. It is so exciting to see people, you know, where a flat screen television used to be out of reach, you now see them in nearly every home; and, in many cases, they cost less than a television would have cost that was significantly smaller 10 years ago--not to mention the remarkable mobile computing devices that middle class families and working families carry in their pockets with them that contains more processing power than a $3,000 computer did just a decade ago.  Consumers have benefited and shareholders have benefited. There has been an unprecedented increase in private equity markets, in stocks, a huge amount of value creation in the American economy, both on the balance sheet as well as in the market valuation of companies.  Now, the issue is that, while all of this has happened, wages have largely stagnated. A lot of the increases in efficiency and economic growth have gone to benefit consumers and shareholders. Employees and workers have felt, legitimately so, that they haven't seen their share of value creation.  Now, there are a number of reasons for that. One of those has been the weakening of the union movement that gave workers a collective voice. But if you look at what some of the remedies are, really none can make a bigger impact than employee stock ownership. This bill doesn't change the ball on that. It is a positive step.  There are a lot of other ideas that I hope we can talk about in a bipartisan way. Fundamentally, we need to create an economy that works for everyone, one in which employees and workers can directly benefit from the increase in value of the firm that they helped create. And what better way to do that than employee stock ownership in a variety of models and options for that. This bill deals with one; but we have ESOPs, we have co-ops, we have employee stock option plans, to name a few.  Companies find that it is in their interest to help improve morale and maintain a stable employee base to align the incentives of employees with shareholders and, of course, to help align the success of our economy with the success of all the stakeholders in our economy.  H.1343 is a bipartisan bill. It was passed last year; it will pass again overwhelmingly this year. It sends a strong statement that Democrats and Republicans in the House of Representatives want to make employee stock ownership easier. Hopefully, this is a starting point rather than an ending point.  The two other bills the Chamber is considering are also bipartisan, and I am hopeful that they can move forward expeditiously.  Now, that stands in stark contrast to some of the other actions of this Chamber, for instance, the 15 Congressional Review Act resolutions which simply sought to undo some of the positive steps that President Obama took rather than put forward a proactive agenda of where Republicans actually want to lead the  We also spent countless hours debating healthcare legislation that, thankfully, didn't go anywhere because it would have left 24 million Americans without health insurance and increased premiums by 15 to 20 percent for those who were lucky enough not to lose their insurance altogether.  I am glad that we have been able to move past that towards a more bipartisan discussion here that will fundamentally help American innovators and entrepreneurs and help lead to a fair economy that works better for everybody, that shows that Democrats and Republicans can work together to create a real solution that addresses a real problem and takes a first step towards creating an economy that works for workers, consumers, and shareholders.  I am hopeful that we can continue this trend after the district work period and move forward on bipartisan legislation that will simplify our complex Tax Code and realign incentives in[[Page H2643]]a positive way, fix our broken immigration system, and make sure that we have the infrastructure we need for our country to succeed in the 21st century. I hope that my colleagues are encouraged by the strong bipartisan show of support for H.1343 and we can work together to bring more bipartisan legislation to the floor instead of divisive bills that make problems even larger.  This bill, very simply, updates an SEC rule from 1999 that will allow private companies to offer employees a greater stake in the place they work without requiring additional paperwork or regulation--a simple and good idea.  Currently, a private company that offers over $5 million in securities through compensation for employees is required to provide additional disclosures which can, A, often serve as a detriment to going over the $5 million in compensatory stock for their employees, and, B, take up costs, administrative overhead, should they choose to proceed. H.1343 simply raises that threshold from $5 million to $10 million, and this legislation gives a private company more flexibility to reward and retain employees of all levels.  Employee ownership of various structures has benefits to both the company, the employees, and the overall economy. It helps align the interests. It results in more productivity, higher employee retention. It can help make a business more profitable and more sustainable. It helps make the American economy and the amazing value that is created work for everybody rather than just one of the stakeholder groups.  For many startups and small businesses, giving employees a stake in the business is a great way to provide an additional benefit, an incentive. It gives companies flexibility to attract new employees when they are starting up, to retain talent as a company grows and matures.  Providing workers stakes in their company helps strengthen their retirement savings. Employee stock ownership plans, or ESOPs, are a type of retirement plan that offers employees an ownership stake without upfront costs. In Colorado, there are 118 businesses that use employee-owned ESOPs as a way to promote employee ownership.  A good example of an ESOP is Fire Safety The owner, Jeff, wanted to offer his employees a stake in the business. He converted his business to an ESOP, an employee-owned company, that allowed him to create a succession plan so the business can stay locally owned by the people who worked to create the value. Jeff noted that, after the conversion, employee morale was up and sales were up.  One of our most famous examples of employee-owned companies is in my district in Fort Collins, Colorado: New Belgium From the perspective of the employees, New Belgium has a very strong corporate culture of personal and collective growth. The employee owners are concerned about their own professional development and that of their colleagues. They have a vested stake in the management, economic health, and stability of the company.  This bill is a commonsense approach and makes it easier for companies to give their employees ownership opportunities. It is a small first step towards encouraging an economy that works for everybody.  Now, I want to make sure that this legislation helps employees at all income levels have access to ownership opportunities and that workers' retirement savings are not put in jeopardy by an overconcentration in company stock. That is why I offered an amendment requiring GAO to do a study on the impact of this legislation on employee participation and ownership and the effect this legislation has on securities held by retirement plans that are governed by  I very much look forward and am grateful that the rule has made in order my amendment. This study will give us important information on how these changes impacting employee ownership also affect retirement. It will give this body information that we need to move forward.  The example of my amendment is an example of the many great ideas that Democrats and Republicans could have brought forward had this been brought forward under an open rule. What better bill to bring forward under an open rule than this kind of bipartisan bill where there is nobody in this body who is trying to undermine or sabotage this bill?  There may be some Members who vote against it on both sides, I don't know, but the overwhelming majority are for it. I think there are Democrats and Republicans with great ideas who would love the opportunity to take 10 or 15 minutes--10 minutes as I am afforded under this rule. How many other Republicans and Democrats would love that same opportunity to offer amendments to improve this bill to make it even better?  The good news is employee ownership is not a partisan issue. Employee ownership strengthens our economy, helps small and medium-sized and large businesses across our entire economic spectrum create and retain jobs, and promotes an increased retirement savings for the middle class. These companies are often anchor businesses in our communities that go beyond offering jobs but are involved with sponsoring Little League or being involved with community nonprofits by giving back, by helping local charities and helping support an ecosystem of entrepreneurship by helping other entrepreneurs get off the ground through mentorship networks and angel funding networks.  I am a strong supporter of this bill and, of course, want to point out that it is simply a starting place. We have a long way to go with encouraging employee ownership in all of its forms--ESOPs, co-ops, stock options, outright stock grants--and any other ways that we can come up with or that the private sector can come up with that allow a stake in the company and in the value being created to reside with the employees, aligning their incentive, making our economy work for everybody, and ensuring that stakeholders have balanced benefits from our overall growth.  I support this bill. I wish it had been brought to the floor under an open rule. I oppose the rule.  Mr.Speaker, I reserve the balance of my time.                              {time}  1245  ",CREC-2017-04-04-pt1-PgH2641-4.txt,1910,EXECUTIVE CALENDAR,2017.0,4.0,March
8417,topic-id,484,"Mr.Speaker, I yield myself such time as I may consume.  You know, the beauty of an open rule, which we did see when the Democrats had the majority and we have not seen since the Republicans took the majority, is it allows the floor debate to inspire good ideas. It allows Democrats and Republicans to bring forward amendments, subject to germaneness, that can be considered and voted upon.  Frankly, it seems like the Republicans didn't have much for us to do this week. This would have been a perfect week to try an open rule; and I know that Democrats and Republicans would have, consistent with the spirit of an open rule, brought forth good ideas and offered them. Good ideas would have been included in the bill.  But most importantly, we could have set a precedent that open rules work and an open process that values our contributions as legislators and as representatives of 750,000 Americans who would be able to work to improve legislation. So I think that we need to move in that direction. Let the debate on the floor and the back-and-forth inspire new collaboration between Democrats and Republicans, new ideas, new ways of working together.  Here you have a concept that Democrats and Republicans join together in support of. How can we reduce the costs or the red tape around administering employee ownership? We would love to remove barriers to employee ownership that exist across all forms of employee ownership.  We would love to see an economy that works for everybody, one that values employees and workers as stakeholders that share in the economic growth that they helped create. That is a big part of the answer to the discrepancies in our economy and the simple fact--yes, fact--that the majority of the benefit of our economic growth has resided with a few and, generally, with shareholders and executives rather than workers.  So at the same time we can continue to move forward with conveying value to consumers, I think we can also find a way to make sure that workers are able to participate in the value that is created in our economy. But to be able to do so, we should have an open process that allows Democrats and Republicans to bring forward germane amendments that improve the bill, to create an even better and more comprehensive effort to encourage employee ownership.  Employee ownership ultimately touches a number of different committees. There are issues around employee ownership that affect government procurement. There are issues that would reside in the Ways and Means Committee under taxes. There are issues that reside in the Judiciary Committee, and, yes, Financial Services and regulator issues as well.  I am hopeful that Democrats and Republicans can work together to create a comprehensive omnibus approach to improving access to employee ownership for firms across our country.  Mr.Speaker, I reserve the balance of my time.  ",CREC-2017-04-04-pt1-PgH2641-4.txt,1910,DISAPPROVING A RULE SUBMITTED BY THE DEPARTMENT OF THE INTERIOR--,2017.0,4.0,March
