speech_id,topic_id,word_count,speech_text,file_name,speaker_id,session_title,year,day,month
8515,topic-id,1188,"Mr.President, I rise today, honored to speak after my colleague from New Hampshire and joining my other colleagues in opposing the nomination of Oklahoma attorney general Scott Pruitt to serve as the Administrator of the Environmental Protection  Our beautiful natural resources define my home State of New From the White Mountains to the Seacoast, to our pristine lakes and our forests, our natural resources are critical to our economy, our environment, our way of life, and protecting these resources plays a critical role, as well, in protecting public health.  However, we are already beginning to see the real impacts of climate change in New Hampshire, and these impacts threaten to have major consequences for our natural resources and families and businesses in every corner of my Recognizing that fact, members of both parties have come together in New Hampshire to enact commonsense bipartisan solutions to take on climate change and to grow and maintain our State's renewable clean energy sector. We have worked to protect our land, our air and water, and the health of our citizens.  Unfortunately, it is clear from Mr.Pruitt's opposition to the Agency he will be tasked to lead, his record of working to weaken critical environmental protections that our citizens need to thrive, and his unwillingness to fight climate change, that he is unfit to serve in this position.  The mission of the Environmental Protection Agency begins with protecting our environment and the health of all of our citizens. The EPA does critical work to protect the water we drink and the air we breathe.  In recent years, the EPA has used sound scientific evidence to take strong measures to protect our environment. Unfortunately, President Trump has made clear that he does not support this critical Throughout his campaign, the President has repeatedly attacked the EPA, calling for its elimination and saying that our environment would be ``just fine'' without it. The President has doubled down on his hostility toward this Agency by nominating Mr.Pruitt to serve as its  As attorney general, Mr.Pruitt has been a vocal critic of the very Agency he has now been nominated to lead, and he has been involved in over 20 legal actions against it.  According to the Washington Post, Mr.Pruitt has ``spent much of his energy as attorney general fighting the very agency he is being nominated to lead.''  On social media, Mr.Pruitt has referred to himself as ``a leading advocate against the EPA's activist agenda.'' He has questioned the role of the Agency, stating that ``the EPA was never intended to be our Nation's frontline environmental regulator.''  When asked by one of my colleagues if there were any clean air or clean water EPA regulations in place today that he could support, Mr.Pruitt declined to name a single one.  The foundation of a future where all Americans have an opportunity to thrive starts with a healthy environment and healthy families. The EPA serves an important role in protecting the health of our people. We must do better than having an Administrator who has fought so tirelessly to undermine the work that this Agency does.  I am also concerned by an EPA Administrator who has consistently voiced skepticism about the clear facts on climate change. Throughout my time in office, I have always fought to protect our environment and have been a strong supporter of curbing the impacts of climate change. As a State[[Page S1247]]senator, I sponsored legislation that allowed New Hampshire to join the Regional Greenhouse Gas Initiative, and I helped pass the State's renewable portfolio standard to maintain and grow New Hampshire's clean renewable energy sector.  During my time as Governor, I worked with members of both parties to strengthen and build on those efforts, signing legislation to update the renewable portfolio standard and to maximize the benefits of the Regional Greenhouse Gas  I am proud that my State has long led efforts to cut carbon emissions, and it is crucial that other States follow our lead and take responsibility for the pollution that they cause. That is exactly why I am a strong supporter of measures like the Clean Power  I also strongly support the Paris agreement on climate change and believe that the United States must take action to implement the agreement while also ensuring that our international partners fulfill their obligations.  Mr.Pruitt, however, has been a consistent skeptic on the role of climate change and the role that it has had on our environment.  Mr.Pruitt has stated that we do not know the extent of human impact on climate change and has called climate change a natural occurrence. He has said that climate change is ``one of the major policy debates of our time.''  And he continued:       That debate is far from settled. Scientists continue to      disagree about the degree and extent of global warming and      its connection to the actions of mankind.  Scientists are clear in their understanding of the climate change science. The American Association for the Advancement of Science says the scientific evidence is clear: Global climate change caused by human activities is occurring now, and it is a growing threat to society.  The American Geophysical Union says that humanity is the major influence on the global climate change observed over the past 50 years.  The American Meteorological Society says it is clear from extensive scientific evidence that the dominant cause of the rapid change in climate of the past half a century is human-induced increases in the amount of atmospheric greenhouse gases.  The Intergovernmental Panel on Climate Change says that warming of the climate system is unequivocal and human influence on the climate system is clear.  The EPA is a science-based organization, and it is unacceptable for the EPA Administrator to be at odds with the well-established views of leading scientists. As the Agency's own website says:       EPA is one of the world's leading environmental and human      health research organizations. Science provides the      foundation for Agency policies, actions, and decisions made      on behalf of the American people. Our research incorporates      science and engineering that meet the highest standards      for integrity, peer review, transparency, and ethics.  Mr.Pruitt disagrees with well-established climate science. Simply put, that disqualifies him from leading an agency where ``science provides the foundation for . . . policies, actions, and decisions.'' If you refuse to believe research from the world's leading scientists, you cannot lead a science-based agency.  From protecting our environment to protecting public health, the EPA plays a critical role in protecting the health of Granite Staters and all We know that a cleaner environment plays a key role in the economy, for the economy of New Hampshire and our entire country. We should be building on the critical efforts the EPA has taken to combat climate change and protect public health, not rolling them back.  Mr.Pruitt's hostility to the basic functions of the Environmental Protection Agency and his work to undermine protections for clean air, land, and water make clear that he should not serve in this role.  I will vote against Mr.Pruitt's nomination, and I urge my colleagues to do the same.  I yield the floor.  The PRESIDING The Senator from  ",CREC-2017-02-16-pt1-PgS1230.txt,99999999999999,DISAPPROVING A RULE SUBMITTED BY THE DEPARTMENT OF THE INTERIOR--,2017.0,16.0,February
8602,topic-id,46,"Mr.President, I ask unanimous consent to engage Senator Klobuchar in a colloquy to commemorate Rare Disease Day in order to discuss issues facing patients and the families of those who have been diagnosed with these types of conditions.  The PRESIDING Without objection, it is so ordered.  ",CREC-2017-03-07-pt1-PgS1616-2.txt,1351,EXECUTIVE CALENDAR,2017.0,7.0,March
8603,topic-id,271,"Mr.President, as cochairs of the Rare Disease Caucus, Senator Klobuchar and I have worked hard to bring more hope to patients and their families who are coping with rare diseases on a daily basis.  Today 1 in 20 individuals worldwide is living with one or more of the more than 7,000 rare diseases, 95 percent of which do not have an effective treatment. While the incentives provided by the Orphan Drug Act, first championed by me in 1983, has led to the approval of nearly 600 orphan drugs, much more needs to be done.  Many patients living with rare diseases rely on the FDA to evaluate and approve treatment options for their conditions. That is why it is so important for the FDA to use its authority to accelerate the evaluation and approval of drugs for treating rare diseases and for Congress to ensure that proper incentives exist for research to discover and make affordable treatments and cures available for this community.  To address this issue, Congress passed the FDA Safety and Innovation Act of 2012, which refined and strengthened the tools available to FDA to accelerate the evaluation and approval of new drugs targeting unmet medical needs for rare conditions. I have been paying close attention to how this new authority translates into advances for patients suffering from conditions such as Duchenne muscular dystrophy, atypical hemolytic uremic syndrome, Bertrand-N-glycanase deficiency, and other rare diseases.  In light of these changes over the past few years, I ask my friend from Minnesota whether the current approval process is achieving its goals of safety and efficacy without hampering the development of new therapies.  ",CREC-2017-03-07-pt1-PgS1616-2.txt,1351,HONORING THE LIFE OF CHIEF DEPUTY CLINT GREENWOOD,2017.0,7.0,March
8605,topic-id,211,"I appreciate that question.  We must continue to urge the FDA to fully implement its relatively new authority. Every one of us in this body represents constituents who are battling rare diseases, and I urge the FDA to consider this flexibility as applied in reviewing all candidates' therapies.  I will continue to work closely with my Senate colleagues to ensure that the FDA uses the tools, authorities, and resources required to provide patients and physicians with new treatment options. I have also contacted the FDA frequently during the past year to encourage the agency to listen to the voices of patients during the agency's evaluation process.  When the Senate considers the nominee for FDA Commissioner, I will continue to stress the importance of incorporating a balanced and flexible approach when weighing risks, benefits, and outcomes, especially when dealing with small patient populations with such rapidly progressing prognoses.  Patients with limited or no treatment options are depending on FDA to utilize the flexibility outlined in This law, which provides full and fair review of new drug therapies in a timely manner, gives hope to patients suffering from life threatening diseases and, of course, their families as well.  I ask Senator Klobuchar, how can we move forward into the next user fee agreement?  ",CREC-2017-03-07-pt1-PgS1616-2.txt,1351,AFFORDABLE CARE ACT,2017.0,7.0,March
8607,topic-id,107,"I thank my dear friend, the senior Senator from Minnesota, for her time with me today. It is very meaningful to me and, I think, to everybody who is concerned about this rare disease situation in our country.  This is just the start of our conversation for this There is so much left for us to do, and I am certain we will succeed as long as we stay together and work in a bipartisan way. So I thank my dear colleague for her words and support and the good leadership she provides in the  I yield the floor.  The PRESIDING The Senator from                       Republican Healthcare Bill  ",CREC-2017-03-07-pt1-PgS1616-2.txt,1351,EXECUTIVE CALENDAR,2017.0,7.0,March
8637,topic-id,30,"Mr.President, it is an honor to recognize Jill Hruby and her team for their commitment to the success of Sandia National Laboratories and their commendable service to the  Since 2015, ",CREC-2017-03-29-pt1-PgS2096-2.txt,1937,EXECUTIVE CALENDAR,2017.0,29.0,March
8506,topic-id,1496,"Mr.President, I join my colleagues today to recognize that the environment is critically important. One of the true issues States face is getting back to the promises of the Clean Air Act and Clean Water Act to make sure States enjoy primacy, and I think that is a critical component that is not being discussed today as we look at guaranteed clean water and clean air--making sure that those closest to those issues have the ability to have the input that was anticipated by almost every environmental statute. So I would remind my colleagues that when we focus many times on Federal issues and Federal appointments, one of the most important things that we can do is focus on the fact that these Federal agency heads need to work cooperatively with State organizations.  Scott Pruitt, who is a soon-to-be former attorney general, understands the State role, and I think that is a critical qualification and an important distinction to make.                               Ex-IM Bank  But I didn't come to talk about the appointment of Scott I came to talk about something we could all agree on, and in fact the President and I agree on this, and I think everyone agrees on this almost unanimously, which is that American jobs matter. Putting Americans back to work in manufacturing is one of the most critical things that we can do in the Senate, making sure that our people have an opportunity to succeed, participate, and have an opportunity to produce goods and services that can be exported and can grow the wealth of our country and grow the economy of our country.  Last week I joined President Trump in a small bipartisan lunch. We had a chance to talk about a variety of issues. There are very many issues that divide us, but this issue unites us. I specifically talked with the President about the need to get the Export-Import Bank up and running. I also talked to him about the Export-Import Bank in December and talked about the importance of enabling this institution to function for the American manufacturing worker. The great news is that President Trump agrees, and he informed me that we can in fact say he supports the Ex-Im Bank and that he would be nominating someone soon to serve on the Export-Import  That led off a rash of discussion among the usual naysayers with the Ex-Im Bank, mostly driven by ideology and not fact. So I think it is important to come once again to reiterate the importance of the Ex-Im  I certainly appreciate the President's interest in making American workers a priority. He will be at Boeing in South Carolina on I don't know if he will make any announcement about nominating someone to the Ex-Im I hope he does.  There has been a lot of talk about supporting the economy and boosting American manufacturing jobs, but all that talk falls on deaf ears if we don't take action on the simple issues when we can accomplish those goals, and that simple issue is enabling the Export-Import Bank to function. For decades the Export-Import Bank has leveled the playing field for American workers and businesses. Yet heavy politics is enabling one Senator to put political ideology before the jobs and well-being of thousands of American workers across our country.  We worked very, very hard in 2015. We knew that we were going to be challenged to get the Ex-Im Bank reauthorized. In June of 2015, the Export-Import Bank expired and did not have a charter. It was not authorized for the first time in its more than 80-year history. I fought very hard to reauthorize it, as did a number of my colleagues. Finally, in December 2016, 6 months later, the Bank was given a charter, given an authorization. I want to point out something because I think way too often we think what stops this endeavor is partisan politics. Guess what. Over 70 percent of the House of Representatives voted for the Ex-Im Bank and over 60 percent of the Senate voted for the Ex-Im This is not a partisan issue. There is bipartisan support. Yet there is a narrow group of people who would rather put ideology ahead of American jobs. It is wrong on so many levels.  Despite the fact, unfortunately, that we finally authorized the Ex-Im Bank over a year ago with overwhelming support, we do not have a Bank that can authorize any credits over $10 million. That is because it requires a quorum of Bank board members to make that decision. We only have two out of the five members of the board. That means that we don't have a quorum. So what has been happening is that there is $30 billion--think about that, $30 billion--of American exports waiting in the queue, waiting for approval, hoping desperately to get the[[Page S1243]]Ex-Im Bank up and running so those exports can receive the credit they need and receive the guarantees that those exports need and get people back to work.  Do you know what else has been happening since we haven't had a quorum on the Bank? Thousands of American jobs have been transported to places like France and We are losing thousands of jobs.  When I hear people say the Ex-Im Bank is the bank of Boeing or the bank of GE, trust me, I do not bleed for the executives of I do not bleed for the executives of They will do fine. In fact, they know how to get around this problem. They just move those manufacturing jobs to a country that will recognize the exports and will provide that export credit. That is what is happening. But guess what is happening to the American worker and families across these manufacturing facilities? They are getting pink slips. Why? Because this body refuses to give us a quorum on the Ex-Im  The President understands this. The President understands how important it is to get these American workers back together. Now I want you just to think about what $30 billion of exports is worth to American employment. If we use the numbers that extrapolate, it is hard to know, but it is over 170,000 jobs. Think about the fact that 170,000 jobs are waiting in the wings for us to do the right thing. When we move forward with the Ex-Im Bank, I think we will have a good day--a good bipartisan day when the President of the United States joins with those of us who care about workers and manufacturing in this country--and we will get the Ex-Im Bank up and running. I think if we fail to do it and if we fail to send the signals that help is coming and that the Ex-Im Bank is going to be an effective institution that will once again play a role in American manufacturing and will be in that tool chest of trade opportunities--if we don't do it--then they are going to give up all hope, and they are going to find some other place to manufacture the products that will allow them to access the credit, that will allow them to sell their products overseas. So it is critically important.  I want to leave with one statistic. The Peterson Institute recently estimated that the United States is losing $50 million in exports for every day that a nomination is not confirmed--$50 million of new wealth creation for our country. It is a travesty.  Of all of the things I have seen here--the callous things--that sound so bureaucratic when you talk about the Ex-Im Bank, when you pick up the curtain and you look underneath, what we see are American jobs and American families and American opportunity and new wealth creation for our country and economic growth for our country. And because some institution that could give you a black mark in a political campaign says ``We don't like it,'' it doesn't get done. Shame on us.  Thank you to the President for agreeing to help us move the Ex-Im Bank forward. Thank you to all of my colleagues--64 in the last Congress--who stood with us to get the Ex-Im Bank reauthorized and the over 70 percent of the House of Representatives, on a stand-alone vote, who voted for the Ex-Im Bank, who know how critically important this is. We can get this job done, and we can stop the migration of these jobs to other countries.  I look forward to hearing more this week and hopefully early next week from the As a member of the Banking Committee, I look forward to pushing for a hearing and a vote on this nominee. And I look forward to the day that all of these exporters and these American workers can see that this institution can work for them, and that will be the day that those credits are approved at the Ex-Im  Thank you so much, Mr. I yield the floor.  The PRESIDING The Senator from  ",CREC-2017-02-16-pt1-PgS1230.txt,2174,HONORING INVESTMENTS IN RECRUITING AND EMPLOYING AMERICAN MILITARY,2017.0,16.0,February
8509,topic-id,12,"Mr.President, will my friend from Mississippi yield the floor for one moment?  ",CREC-2017-02-16-pt1-PgS1230.txt,2174,HONORING INVESTMENTS IN RECRUITING AND EMPLOYING AMERICAN MILITARY,2017.0,16.0,February
8510,topic-id,27,"I thank the Senator from  Mr.President, I yield the remainder of my postcloture debate time to Senator  The PRESIDING The Senator has that right.  The Senator from  ",CREC-2017-02-16-pt1-PgS1230.txt,2174,HONORING INVESTMENTS IN RECRUITING AND EMPLOYING AMERICAN MILITARY,2017.0,16.0,February
8419,topic-id,675,"Mr.Speaker, small businesses and entrepreneurs are what drive the American economy. I meet with these folks all the time when I am back home in the Second District, as I know my colleagues do when they are back in their districts, and we see firsthand the benefits that these people's dreams, their innovations, their hard work, and as they provide to our communities that inspiration.  These innovators, entrepreneurs, and risk-takers are critical to our country's economic growth and prosperity. In fact, small businesses are responsible for more than 60 percent of all of the net new jobs. Let me repeat that. Small businesses are responsible for more than 60 percent of all the net new jobs over the past two decades. This isn't just a one-time blip. This is over the last two decades.  So if our Nation is going to have an economy that provides opportunities for every American, then we must promote and encourage success and growth for our small businesses, our startups, and our entrepreneurs. It is this notion that I think brings us to this legislation we are discussing here today.  H.1343, the Encouraging Employee Ownership Act, would simply level the playing field for small companies by updating Federal rules that allow small businesses to better compensate their employees with ownership in those businesses.  Currently, the SEC rule 701 permits private companies to offer their own securities as part of written compensation agreements with employees, directors, general partners, trustees, officers, or other certain consultants without having to comply with rigid Federal securities registration requirements. The SEC rule 701, therefore, allows small companies to reward their employees.  Despite the SEC having the authority to increase the $5 million threshold via a rulemaking, the SEC has once again chosen to prioritize what, I would argue, are highly politicized regulatory undertakings instead of focusing on its core mission, which includes the facilitation of capital formation. That is one of the key core jobs of the Securities and Exchange Well, if the SEC isn't going to focus its priorities, then Congress will help them do that. So that is why we are here today on this bill.  I believe it is imperative that small businesses not only in West Michigan, but across America, have the ability to compete. A critical element of competition and success is, first, that small businesses be able to offer compensation packages that attract and retain top-tier talent in their fields. In today's world, that includes rewarding employees with stock options. To me, this is common sense. Small-business employees have a clear and vested interest in the success of their employers, and oftentimes they are attracted to it.  I know, having some younger children myself that are coming into adulthood, they are looking for that excitement. They are looking for that opportunity. They are looking to be builders themselves.  Well, by increasing the rule 701 threshold to $10 million, it will give these private companies more flexibility to attract, reward, and retain those employees. This simple change would allow companies to offer twice as much stock to their employees annually without having to trigger additional disclosure information to investors about those compensation packages that include securities offerings.  By reforming this regulatory burden, Mr.Speaker, startups, small businesses, and emerging growth companies will be better equipped to attract highly talented individuals from companies that are better capitalized and able to provide cash compensation. By incentivizing employees with stock options, small businesses will now be able to compete on a more level playing field in order to retain those valuable employees rather than seeing them flee to cash, frankly.  This bill is an example, I believe, of positive, bipartisan results that can be achieved when Republicans and Democrats reach across the aisle. I commend our sponsors of the bills, Representative Hultgren, who spoke a little earlier; Representatives Delaney, Higgins, MacArthur, Sinema, and Stivers, for their leadership on this issue; and my friend from Colorado, as well, and what he is doing.  I encourage all my colleagues to support this rule and the underlying bill.  ",CREC-2017-04-04-pt1-PgH2641-4.txt,2028,EXECUTIVE CALENDAR,2017.0,4.0,January
