speech_id,topic_id,word_count,speech_text,file_name,speaker_id,session_title,year,day,month
6163,topic-id,353,"Mr.Speaker, over the weekend, a very destructive storm system moved across my home State of Texas, the Midwest, and the Southeast, killing 15 of our fellow citizens and destroying whole communities in its wake.  In Van Zandt County in the Fifth Congressional District of Texas, which I have the privilege to represent, four constituents lost their lives in a series of four violent tornadoes that shattered homes, shattered lives, and devastated neighbors in the Fifth District and the Fourth District of  These storms also tragically killed seven people in Washington, Carroll, and Madison Counties in Arkansas; two people in Rankin and Holmes Counties in Mississippi; one person in Nashville, Tennessee; and one person from Billings, Many more, Mr.Speaker, have been hospitalized.  Joining me here today are some of the Members whose communities were affected: Congressman Womack and Congressman Crawford of Arkansas, Congressman Harper of Mississippi, Congressman Thompson of Mississippi, Congressman Cooper of Tennessee, Congressman Long of Missouri, and my fellow Texan, Congressman John Ratcliffe--again, Mr.Speaker, all who represent communities that were tragically affected.  Mr.Speaker, our citizens who were lost have left a void in their families and left a void in their communities. Our hearts are heavy. Our prayers are sincere for the loved ones they leave behind and for those who recover from their wounds.  For many of us, in our faith, there is a time to mourn. Mr.Speaker, now is the time to mourn. But as we have, in our faith, a time to mourn, we also have faith, Mr.Speaker, that one day our citizens will heal and they will heal and rebuild their communities as well.  Mr.Speaker, at this time, I would ask the House to help us in honoring those who lost their lives in these deadly storms and the families and loved ones they leave behind by joining us in observing a moment of silence.  The SPEAKER pro tempore. Without objection, 5-minute voting will continue.  There was no objection.  The SPEAKER pro tempore. The question is on the resolution.  The question was taken; and the Speaker pro tempore announced that the ayes appeared to have it.                             Recorded Vote  ",CREC-2017-05-03-pt1-PgH3080-3.txt,1749,NATIONAL SEERSUCKER DAY,2017.0,3.0,July
6342,topic-id,535,"Mr.President, earlier this month, the Senate passed by voice vote the Department of Veterans Affairs Accountability and Whistleblower Protection Act of 2017. I recognize this bill is the result of a bipartisan compromise, and I commend Senator Tester, ranking member of the Senate Veterans' Affairs Committee, for his efforts to find agreement on this particularly challenging issue.  Everyone in a position of public trust, particularly those serving at the VA, must be held accountable for their actions. Whistleblowers must also be protected so that misconduct can be brought to light. This balance between accountability and transparency is essential to ensure that the services provided to the public--particularly to veterans--are of the highest quality and that we can attract the best and brightest to Federal service.  Unfortunately, while the bill passed by Congress seeks to strike the appropriate balance, I remain seriously concerned about some of the bill's provisions which would expedite the process of terminating employees of the Department of Veterans Affairs, VA, by reducing current due process protections.  To ensure the integrity of the Federal civil service, it is essential that Federal employees have access to constitutionally protected due process rights. Specifically, the bill lowered the evidentiary standard for firing rank-and-file employees for misconduct from ``preponderance'' of the evidence, 50 percent or more, to substantial, 30 percent or more. Reducing due process protections for rank-and-file VA employees in this manner will make it harder for the Federal Government to attract the best and brightest to public service.  During the Senate Veterans' Affairs Committee's consideration of the bill, I cosponsored an amendment offered by Senator Brown to strike the section of the bill lowering the evidentiary standard. Unfortunately, the amendment was not adopted. Going forward, I intend to closely monitor the VA's implementation of the act to see that these new authorities are not abused in order to retaliate against VA workers. Not only would this be unfair, but it would also exacerbate the Department's challenging retention issues.  I am also disappointed that this bill does not address the longstanding recruitment and retention issues facing the According to the VA, there are over 30,000 vacancies across the VA, including over 150 in Hawaii, for frontline medical personnel that this administration has not filled as of the end of January 2017.  The over 40,000 veterans in Hawaii who are enrolled in the VA healthcare system deserve the best healthcare and highest ethical and professional standards from those they depend on to provide that care. While we must ensure whistleblowers can come forward without fear of retaliation and those who violate the pub trust are held accountable, the VA cannot effectively carry out its mission without being fully staffed.  While this legislation was supported by VA Secretary Shulkin and makes some useful changes to improve accountability, we still have much work to do to ensure that veterans in Hawaii and across the country have access to the best healthcare we can provide.  Therefore, going forward, I will closely monitor the VA's implementation of this law to ensure that the changes made are not abused. I will also continue working to see that the staff vacancies in Hawaii and across the country are filled with qualified personnel.                          ____________________",CREC-2017-06-21-pt1-PgS3680-2.txt,1844,"PROVIDING FOR CONSIDERATION OF SENATE AMENDMENTS TO H.R. 244, HONORING",2017.0,21.0,May
6235,topic-id,25,"Mr.President, I suggest the absence of a quorum.  The PRESIDING The clerk will call the roll.  The assistant bill clerk proceeded to call the roll.  ",CREC-2017-04-25-pt1-PgS2518.txt,2079,NATIONAL DEFENSE AUTHORIZATION ACT FOR FISCAL YEAR 2018,2017.0,25.0,July
6291,topic-id,547,"Mr.President today I wish pay tribute to a great leader and an exceptional Army officer, MG Laura Richardson, the Chief Legislative Liaison for the Office of the Secretary of the Army, as she prepares to leave this position for one of even greater importance.  Major General Richardson has served our Army and our Nation for more than 30 years. She was a true professional--a dedicated soldier, leader, officer, spouse, and mother. Throughout her career, she commanded our great soldiers at many levels, deployed to combat numerous times in defense of our Nation, and was assigned to some of the most critical positions in our military. As the Army's Chief Legislative Liaison, Major General Richardson continues to provide outstanding leadership, advice, and sound professional judgment on numerous critical issues of enduring importance to the Army, Congress, and this  A native of Colorado, Major General Richardson was commissioned a second lieutenant of aviation upon graduation from Metropolitan State College in Her first assignment after flight school was in Korea with the 17th Aviation Brigade, where she served as a platoon leader, company executive officer, brigade staff officer, and company commander. She next served at Fort Hood, TX, on the III Corps staff and in the 6th Cavalry Brigade as a company commander and brigade adjutant. In 1999, General Richardson was selected to serve as the military aide to Vice President Al Gore at the White House in Washington, Following that assignment, she moved to Fort Campbell, KY, to serve as the Division Deputy G-3 of the 101st Airborne Division, Air Assault, and later commanded the 5th Battalion, 101st Aviation Regiment, including a deployment to Iraq in support of Operation Iraqi  Major General Richardson has served in a variety of joint and Army staff positions to include: an assault helicopter battalion operations officer and executive officer; deputy director, then director for the Army's Transformation Office; and the Army's liaison officer to the U.She also served as the garrison commander of Fort McNair and Fort Myer,  Major General Richardson's assignments as a general officer include commanding general of the U.Army Operational Test Command, deputy commanding general of the 1st Cavalry Division at Fort Hood, TX, and most recently, deputy chief of staff for communications with Headquarters, International Security Assistance Force, ISAF, in support of Operation Enduring Freedom,  For the past 3 years, Major General Richardson was the Chief of the U.Army Legislative During this period of extraordinary change and challenge for the Army, Major General Richardson implemented and fostered improved strategic partnership with Through her leadership, the Army significantly enhanced relationships with both legislative chambers, improving understanding and broadening congressional support for Army priorities. Major General Richardson managed some of the most complex issues our Army faced through three legislative cycles with unparalleled results, enabling the Army to receive the necessary resources to support combat operations in two theaters of war, sustain the All-Volunteer Force, and improve the quality of life for our soldiers, their families, and our civilians.  On behalf of Congress and the United States of America, I thank Laura, her husband, MG Jim Richardson, and their entire family for their continued commitment, sacrifice, and contribution to this great nation. I join my colleagues in wishing her future success as she continues to serve our great Army and                          ____________________",CREC-2017-05-24-pt1-PgS3137.txt,583,ADDITIONAL STATEMENTS,2017.0,24.0,May
6306,topic-id,1696,"Mr.President, I also take to the floor to talk about healthcare. I appreciate my colleagues who are here, earnestly pleading with all of our colleagues to be about a process--Democrats and Republicans and the committee process that we have in the Senate--that does the work that we are supposed to be doing, which is listening to the American public and improving our healthcare system.  Let me tell you about my first meeting of the day. It was an amazing one. I had a mom, Rebecca, and her 5-year-old daughter, Charlie, in my office. They had asked for the opportunity to meet with me to talk about healthcare. Here is their story.  Charlie is just about 5 years old. She starts kindergarten in the Charlottesville public schools in She was born at 26 weeks, or about 14 weeks early. She weighed 1 pound and 11 ounces at birth. She went through the NICU and had great care. When she was released to go home, the doctors thought she would be fine, but within a couple of months, it was pretty clear that she had some significant challenges as she has the diagnosis of cerebral palsy, and she gets 80 percent of her food through a feeding tube. This family has many, many needs.  Charlie, from a cognitive standpoint, is very, very sharp and is excited about starting school, but she has significant needs. Her mother Rebecca said that Charlie is like the case study for why a repeal of the ACA would be a disaster. Charlie has a preexisting condition because of the CP and her challenges. Charlie has already hit all of the lifetime caps that would have rendered her unable to get insurance pre- In the hospital, because of her dramatically low birth weight, Charlie was the recipient of Medicaid funds that would be cut under the current bill. Charlie is currently the recipient of a Medicaid waiver, which will help her afford supplies for her feeding tube. When she starts kindergarten in the Charlottesville public schools, Charlie will be given an individualized education plan under the Individuals with Disabilities Education Act, and some of those expenses are being compensated by  The preexisting condition, lifetime caps, and Medicaid cuts all affect this dynamic, young 5-year-old, who is as entitled as any of us to try to be all she can be. If we persist on the path that we are on now with regard to the bill that is being proposed, we will hurt families like these, and we do not need to do that. Instead, we can help them.  Before the passage of the Affordable Care Act, we know that Americans, like Charlie, who had preexisting conditions faced unfair barriers to accessing health coverage. There are challenges that we need to fix, but let's celebrate a few things. Since 2010, the rate of uninsured Americans has declined to a historic low. More than 20 million people have gained access and have healthcare coverage--many for the first time in their lives. Another statistic that is interesting is that the number of bankruptcies in our Nation has been cut in half. Pre-ACA, medical costs had driven up bankruptcies, but the ACA has brought the bankruptcy rate down. We have to move forward to make healthcare stronger, not to destroy it.  The Republican bill that is being discussed right now, because of its reductions of coverage, slashing Medicaid, and increases to premiums for seniors, would make the matter worse. The proposed amendment by the Senators from Texas and Utah has led insurance companies to come out and say that this will create a two-tiered system that will punish those with preexisting conditions. The latest plan, which was discussed this morning by the majority leader, would just be a straight repeal of the Affordable Care Act with a promise that we would fix it in a couple of years. It has been scored by the CBO, and the CBO says that it would cause 32 million Americans to lose their coverage and would dramatically increase premiums. Yet we do need to find improvements, and we should be working on that together.  There have been some actions taken by this administration that have compounded challenges. In January, the President signed an Executive order that directed relevant agencies not to enforce key elements of the Affordable Care They terminated components of outreach and enrollment spending. The administration has also threatened to end cost-sharing reduction payments. These actions and additional inactions have created such uncertainty in the individual marketplace that rates have been unstable, and, in some areas, companies are not writing individual policies. The amendment I discussed earlier, from the Senators from Texas and Utah, would make these problems even worse.  There is a better way. There is a way forward, and I am here to just briefly reference a bill that Senator Carper and I have put on the table that we think will do a good job and should have strong bipartisan support. It is the Individual Health Insurance Marketplace Improvement  One of the ways to address uncertainty in the individual market is to establish a permanent reinsurance program that will stabilize premiums and will give insurance companies some stability so that they can stay in markets, but it will also enable those companies to write premiums at an average level and not have to take into account the high-cost claims. We think it could reduce premiums dramatically all over the country.  Now, the idea of reinsurance should not be controversial. We use it in other[[Page S4034]]programs--flood insurance, crop insurance, and Medicare Part A key part of Medicare that was achieved under the Bush administration includes a reinsurance provision. The Affordable Care Act had a reinsurance in its first 3 years, but it expired. That reinsurance helped to maintain stable premiums. This is an idea that is not a Democratic idea. It is an idea that is tested.  Senator Carper and I introduced the bill to the Senators on the Finance I am on the HELP We are just waiting for the opportunity to be able to present it and get a hearing for it. We ought to be able to work together on reinsurance, on the cost-sharing guarantees that Senator Shaheen has proposed, and on a variety of other ideas. Senators Cassidy and Collins have a bill in that uses auto enrollment, which is an interesting concept that we should be tackling.  I am just going to conclude and tell you how naive I am.  I was a mayor and a Governor before I got here to the When you are a mayor and a Governor, what you know is education and healthcare. We have a Governor here and a Governor here and a Governor here. We have four former Governors who are sitting on the floor. What you know is education, which was your biggest line item, and your second biggest line item is Medicaid--healthcare. I tried to get on the committee when I got to the Senate, and I was not put on the committee. I was very disappointed. For 4 years I tried to get on the HELP I got on it on January 3. I was so excited. Finally, I am working on something that I know about.  I got a group together of 13 Democratic Within 48 hours of getting on that committee, on January 5, I wrote a letter to my committee chair, Senator Alexander, a great committee chair, as well as to the Finance chair, Senator Hatch, and to the majority leader, Senator McConnell: If you want to fix healthcare, we are here to sit down with you right now and fix it. I was naive enough to think that, because I was on the HELP Committee, I might be included in a discussion about healthcare. We have had hearings in our committee--many hearings--on nominees, on pensions, on higher ed, on the FDA, but there has been one taboo topic on the HELP Committee since I got on it in We are not allowed to have a hearing about healthcare. We haven't had a hearing about the House bill. We haven't had a hearing about Senate proposals. We are being told that we are not going to have a hearing, that we are just going to rush whatever we do to the floor either on a House proposal, a Senate proposal, or a Senate repeal. We are going to completely skip the committee.  Now, you know a little bit about this committee. We have a doctor on the committee, Senator Cassidy from Our chair of the committee, Senator Alexander, was a He had a Medicaid He was the president of the University of He had a hospital. He had a medical school. He had physician practice groups. There are people on the HELP Committee who know something about healthcare. There are people on the Finance Committee, which covers Medicaid and Medicare, who know something about healthcare, but we have not been allowed to have a hearing about this. When you have a hearing, you bring people up to the witness table, patients like Charlie, who was in my office this morning, and doctors and hospitals. You ask them what works, what doesn't work, and what can be fixed. We haven't had the opportunity to hear from folks.  So why wouldn't we do exactly what Senator McCain said yesterday? Senator McCain said: We have gone about this the wrong way. We should be the U.We should take advantage of the Senate procedures and the expertise on the Senate committees, including staff expertise, and we should assign these various bills to the relevant committees and have hearings and then come forward with a proposal that will actually improve healthcare for this country.  I am completely confident that if we let the committees do the work they are supposed to do, we will find improvements that can get bipartisan support and that will help Virginians and help That doesn't seem too much to ask. I hope my colleagues will consider that, and I hope we will be engaged in those discussions soon.  With that, I yield the floor.  The PRESIDING The Senator from  ",CREC-2017-07-18-pt1-PgS4031.txt,2176,NATIONAL DEFENSE AUTHORIZATION ACT FOR FISCAL YEAR 2018,2017.0,18.0,June
6069,topic-id,265,"Mr.Speaker, as NAFTA renegotiation approaches, I rise to call attention to the mammoth U.trade deficit with our NAFTA nation partners.  Our current deficit with NAFTA nations is $74 billion. This red on the chart translates into tens of thousands of lost U.jobs, all while wages are depressed for North America's struggling workers. Since NAFTA's passage, there hasn't been a single year of trade balance for this country. That translates into lost jobs.  Thus far, President Trump has failed to correct these trade deficits. In fact, the trade deficit this year has ballooned to more than $22 billion from the same period in 2016.  Balanced trade accounts in 5 years should be first on our agenda. My bill, the Balancing Trade Act, H.2766, requires the administration to address trade deficits of more than $10 billion with any nation.  As negotiations near, let's focus on key principles such as vigorously enforcing a first world rule of law; including labor provisions that allow workers across this continent to improve their standard of living and outlaw labor trafficking; enact environmental standards for human health and forge an agricultural labor agreement that helps displaced farmers; reform the unaccountable tribunals called Investor-State Dispute Settlements so that they work for people, not just big corporations; address currency manipulation; and, finally, stamp out the illegal drug trade that is plaguing this continent.  The wealth NAFTA created has not been shared by all, but only a very few, and often only the very rich. Our foundational principle for NAFTA reform must be free and fair trade among free people with a rule of law.  ",CREC-2017-06-28-pt1-PgH5289-2.txt,616,EXECUTIVE SESSION,2017.0,28.0,June
6254,topic-id,222,"Mr.Speaker, today is Arbor Day, and I rise to reintroduce my bill, the 21st Century Civilian Conservation Corps  In drafting this bill, I was inspired by the CCC Act first established by President Franklin Roosevelt in 1933 as part of his New This historic initiative generated more than 3 million jobs, especially for America's young people, and inspired a widespread appreciation of America's wealth of natural resources and our responsibility as stewards of these assets.  Through current Federal programs like the Great Lakes Restoration Initiative and other conservation and restoration investments, Americans are once again connecting the dots between clean water, clean land, clean air, and thriving regional ecosystems and economies.  With recent attacks on programs that help our Great Lakes, we should remember we don't have to choose between protecting our environment and natural treasures and creating jobs. We can do both at the same time.  Just Ohio and Michigan, alone, need 20 million new trees planted to make up for the devastation that the emerald ash borer and Asian longhorned beetle have done to our forest populations.  I urge my colleagues to support this bill and its goal of putting young people to work across our country that will prosper our Nation and steward its resources forward. I am confident the young people of America will welcome this challenge.                          ____________________",CREC-2017-04-28-pt1-PgH2960.txt,616,TRANSPORTATION AND INFRASTRUCTURE,2017.0,28.0,July
