speech_id,topic_id,word_count,speech_text,file_name,speaker_id,session_title,year,day,month
6470,topic-id,248,"Mr.President, I call up amendment 52 and ask unanimous consent that it be reported by number.  The ACTING PRESIDENT pro tempore. Without objection, it is so ordered.  The clerk will report the amendment by number.  The senior assistant legislative clerk read as follows:       The Senator from Wyoming [Mr.Enzi], for Mr.Flake,      proposes an amendment numbered 52.  The amendment is as follows:(Purpose: To strengthen Social Security and Medicare without raiding it  to pay for new Government programs, like Obamacare, that have failed  Americans by increasing premiums and reducing affordable health care   options, to reform Medicaid without prioritizing able-bodied adults    over the disabled, and to return regulation of insurance to State                               governments)       At the end of title III, add the following:     3___. DEFICIT-NEUTRAL RESERVE FUND RELATING TO                    PROTECTIONS FOR THE ELDERLY AND       The Chairman of the Committee on the Budget of the Senate      may revise the allocations of a committee or committees,      aggregates, and other appropriate levels in this resolution      for one or more bills, joint resolutions, amendments,      amendments between the Houses, motions, or conference reports      relating to protections for the elderly and vulnerable, which      may include strengthening Social Security and Medicare,      improving Medicaid, housing reform, and returning regulation      of health insurance markets to the States, by the amounts      provided in such legislation for those purposes, provided      that such legislation would not increase the deficit over      either the period of the total of fiscal years 2017 through      2021 or the period of the total of fiscal years 2017 through      2026.                          ____________________",CREC-2017-01-10-pt1-PgS184-2.txt,1542,ADDITIONAL STATEMENTS,2017.0,10.0,January
6541,topic-id,96,"Mr.President, I ask unanimous consent that when the Senate completes its business today, it adjourn until 12 noon, Wednesday, January 11; further, that following the prayer and pledge, the morning hour be deemed expired, the Journal of proceedings be approved to date, and the time for the two leaders be reserved for their use later in the day; finally, that following leader remarks, the Senate resume consideration of 3, with 3 hours of debate remaining on the resolution for the majority and 3 hours for the minority.  The PRESIDING Without objection, it is so ordered.                          ____________________",CREC-2017-01-10-pt1-PgS220-3.txt,1542,"PROVIDING FOR CONSIDERATION OF H.R. 26, REGULATIONS FROM THE EXECUTIVE",2017.0,10.0,January
6419,topic-id,184,"Mr.Speaker, this morning, President Trump has released the first budget proposal of his administration.  In reading through the budget proposal, I am reminded of what President Trump said in the summer when he was speaking to the African-American community in a rally in  He said: What do you have to lose?  This is what we have to lose: eliminating the Department of Housing and Urban Development's Community Development Block Grant program, whose sole purpose is to combat poverty nationwide.  This is what we have to lose: cutting funding for Head Start and before- and after-school programs for our kids does not give them a chance to get ahead.  This is what we have to lose: stripping funding for Medicaid in your new healthcare law that provides critical services for our most vulnerable.  This is what we have to lose: all of those cuts do not give our seniors, our children, and our working families a chance to get ahead.  Our communities have too much to lose, Mr.Our communities need the opportunity to make crucial investments that make our neighborhoods stronger block by block.                          ____________________",CREC-2017-03-16-pt1-PgH2093.txt,99999999999999,"ORDERS FOR WEDNESDAY, JANUARY 11, 2017",2017.0,16.0,January
6535,topic-id,182,"Mr.Speaker, I thank the gentleman from Georgia for yielding.  Mr.Speaker, I support this rule and the underlying legislation. Today the Federal Government's rules exceed 97,000 pages--the most in American history. So we ask ourselves: Do we really need 20 pages of rules governing vending machines? Could we cover fuel standards in less than 578 pages? Would the Union crumble if we didn't have 61 pages of regulations on residential dehumidifiers?  Each of these rules has compliance costs that exceed $100 million.  In my home State of Florida, we passed a version of the REINS The result has been repeal or replacement of over 4,000 job-killing regulations. We can only make America great again if we make Americans free again--free from the tyranny of unelected Washington bureaucrats huddled in windowless cubicles dictating to Americans how they should live their lives, build their businesses, and protect their own property. Voters sent us here to drain the swamp, but with so many regulations, we would be lucky to get permission to mop up a puddle.  Mr.Mr.Speaker, I continue to reserve the balance of my time.  ",CREC-2017-01-05-pt1-PgH113-2.txt,99999999999999,"CONCURRENT RESOLUTION ON THE BUDGET, FISCAL YEAR 2017",2017.0,5.0,January
6487,topic-id,126,"Mr.Speaker, I am joined today by Members of the Virginia delegation and Members who were affected by the horrific attack by a gunman at Virginia Tech on April 16, 2007. Today, we ask that all pause to remember the victims of this attack.  Although 10 years have passed, those whose lives were tragically cut short or altered forever will not be forgotten. As we approach April 16, I ask that we keep the families and loved ones of the victims in our thoughts and our prayers.  May God bless the Hokie community, their courage, their spirit, and their determination to honor the memory of those not here today.  Accordingly, I would ask that all Members join me at this time in a moment of silence.                          ____________________",CREC-2017-04-05-pt1-PgH2732-2.txt,2070,NATIONAL AGRICULTURE DAY,2017.0,5.0,March
6600,topic-id,369,"Mr President, today I wish to ask my colleagues to join me in recognizing Tom Burack and honoring his more than a decade of service to the State of New As commissioner of the New Hampshire Department of Environmental Services, he has been a strong advocate for our State and our environment.  Our economic vitality as a State hinges on our pristine lakes and rivers, our clean air, and our strong protection of these natural resources. Under Tom's leadership, the department has focused on combating the serious challenge of climate change and ensuring that New Hampshire citizens and visitors have access to clean air, water, and land while providing excellent customer service--all of which is critical to our State's economy and future success. This includes the development of the 2009 Climate Action Plan, New Hampshire's entrance into the Regional Greenhouse Gas Initiative, RGGI, the creation of the MtBE Remediation Bureau, and the formation of the State Government Energy Committee, among many others.  Tom has also led and facilitated a voluntary, informal network of State agency commissioners for 8 years, helping to bring agencies together to improve the operations of and drive innovation and efficiency in State government. He is a leader on the regional and national levels as well, including envisioning and coleading an overall modernization of how environmental protection services are delivered nationwide through a joint State-tribal-Federal initiative known as E-Enterprise for the All of these actions and the many others that are too numerous to list have helped to strengthen our environment, protect public health, and combat climate change.  New Hampshire's natural resources and scenic beauty must be protected, and doing so requires strong collaboration. As commissioner, Tom embodied New Hampshire's ``all-hands-on-deck'' spirit, working collaboratively with our neighboring States on issues like RGGI, local communities on issues like water quality and contamination, other State agencies on issues like State government energy efficiency, and partners at the Federal level.[[Page S745]]  New Hampshire and our country have benefitted enormously from Tom's vision, energy, and leadership, and I thank Tom for his tireless dedication to protecting our environment and his immense contributions that have helped make New Hampshire a special place to live, work, visit, and raise a family.                          ____________________",CREC-2017-02-06-pt1-PgS744-3.txt,99999999999999,NATIONAL AGRICULTURE DAY,2017.0,6.0,March
6534,topic-id,174,"Mr.Speaker, I rise today in support of the rule and the underlying REINS Act because I was sent to Congress to help hardworking Hoosiers create jobs, keep jobs, and raise wages. As a small-business owner myself, I understand how difficult it is to build a business in today's economy, and I want the Hoosiers of Indiana's Ninth Congressional District to have control over their futures without fear of unaccountable government bureaucrats with political agendas creating regulations to restrict their pursuit of success.  I believe the REINS Act will ensure the constituents in Indiana's Ninth District will not only have a voice, but also a choice in the laws that govern this great Hardworking Hoosiers are shining examples of what Americans can do with the freedom to make their own economic decisions, and I don't want unelected bureaucrats in Washington impeding the job-creating growth of Indiana's and America's businesses.  Mr.Speaker, I encourage my colleagues to vote ``yes'' on the rule and vote ``yes'' on the underlying bill.  Mr.Mr.Speaker, I reserve the balance of my time.  ",CREC-2017-01-05-pt1-PgH113-2.txt,99999999999999,TRANSIT SECURITY GRANT PROGRAM FLEXIBILITY ACT,2017.0,5.0,February
6536,topic-id,16,"Will the gentleman yield?  Mr.I yield to the gentleman from Maryland, my colleague, the minority whip.  ",CREC-2017-01-05-pt1-PgH113-2.txt,566,TRANSIT SECURITY GRANT PROGRAM FLEXIBILITY ACT,2017.0,5.0,February
6537,topic-id,1095,"Mr.Speaker, I thank my friend, the majority leader, Mr.McCarthy, for yielding.  I rise to thank and to pay tribute to Tim  Mr.Speaker, the American public sees us so often when we are confronting one another--disagreeing strenuously sometimes and disagreeing sometimes disagreeably. What they don't see is the staff working with staffs across the aisle in a constructive effort to reach consensus and to move democracy forward. What they don't see is the collegiality that is engendered through the years between staff who have the responsibility of ensuring not only that their Members have full knowledge of what is being considered and their advice and counsel, but also of assuring that there is positive communication across the aisle even when we disagree.  Tim Berry has been one of the most adept, most cordial, most positive, and most effective staffers in effecting that end. We Members sometimes mask how effective our staffs are. I am sure they will lament that from time to time.  Tim Berry, I want you to know--we are very proud--is from Silver Spring, He grew up in Silver Spring and grew up in our Tim Berry is a proud son of our Yes, he is a Republican; yes, he has been on staff on the other side of the aisle; but he is an American first, who has cared about his country, who has cared about this institution, and who has cared about showing respect and concern for staffs on both sides of the aisle.  I have had a number of chiefs of staff, one of whom is Cory Alexander, now the vice president of Cory Alexander and Tim are good friends. They worked together very constructively when Tim was with Tom Mr.McCarthy is in that office, and I had the privilege of using that office for 4 years. There was never a time when we walked down that hallway that we didn't think of Detective Gibson losing his life and Officer Chestnut losing his life outside that door. Tim Berry was there to serve. Tim Berry served, notwithstanding the dangers that were self-evident.  Lisa is in the gallery and his children who have been mentioned by Leader Young people, you can be extraordinarily proud of your dad. I know, Lisa, you are as well. He has made this institution a better institution. He has made the relationship between the parties more positive in times when it was greatly strained.  Tim, thank you. Thank you for your service to the Congress, thank you for your service to the country, and thank you for your service to each and every one of us. God bless you and  The SPEAKER pro tempore (Mr.Hultgren). Without objection, 5-minute voting will continue.  There was no objection.  The SPEAKER pro tempore. The question is on the resolution.  The question was taken; and the Speaker pro tempore announced that the ayes appeared to have it.                             Recorded Vote  Mr.Mr.Speaker, I demand a recorded vote.  A recorded vote was ordered.  The SPEAKER pro tempore. This is a 5-minute vote.  The vote was taken by electronic device, and there were--ayes 231, noes 187, not voting 15, as follows:                             [Roll 10]                               AYES--231     Abraham     Aderholt     Allen     Amash     Amodei     Arrington     Babin     Bacon     Banks (IN)     Barletta     Barr     Barton     Bergman     Beutler     Biggs     Bilirakis     Bishop (MI)     Bishop (UT)     Black     Blackburn     Blum     Bost     Brady (TX)     Brat     Bridenstine     Brooks (AL)     Brooks (IN)     Buck     Bucshon     Budd     Burgess     Byrne     Calvert     Carter (GA)     Carter (TX)     Chabot     Chaffetz     Cheney     Coffman     Cole     Collins (GA)     Comer     Comstock     Conaway     Cook     Costello (PA)     Cramer     Crawford     Culberson     Curbelo (FL)     Davidson     Davis, Rodney     Denham     Dent     DeSantis     DesJarlais     Diaz-Balart     Donovan     Duffy     Duncan (SC)     Duncan (TN)     Dunn     Emmer     Farenthold     Faso     Ferguson     Fitzpatrick     Fleischmann     Flores     Fortenberry     Foxx     Franks (AZ)     Frelinghuysen     Gaetz     Gallagher[[Page H124]]     Garrett     Gibbs     Gohmert     Goodlatte     Gosar     Gowdy     Granger     Graves (GA)     Graves (LA)     Graves (MO)     Griffith     Grothman     Guthrie     Harper     Harris     Hartzler     Hensarling     Hice, Jody     Higgins (LA)     Hill     Holding     Hollingsworth     Hudson     Huizenga     Hultgren     Hunter     Hurd     Issa     Jenkins (KS)     Jenkins (WV)     Johnson (LA)     Johnson (OH)     Johnson, Sam     Jordan     Joyce (OH)     Katko     Kelly (MS)     Kelly (PA)     King (IA)     King (NY)     Kinzinger     Knight     Kustoff (TN)     Labrador     LaHood     LaMalfa     Lamborn     Lance     Latta     Lewis (MN)     LoBiondo     Long     Loudermilk     Love     Lucas     Luetkemeyer     MacArthur     Marchant     Marino     Marshall     Massie     Mast     McCarthy     McCaul     McClintock     McHenry     McKinley     McMorris Rodgers     McSally     Meadows     Meehan     Messer     Mitchell     Moolenaar     Mooney (WV)     Mullin     Murphy (PA)     Newhouse     Noem     Nunes     Olson     Palazzo     Palmer     Paulsen     Pearce     Perry     Pittenger     Poe (TX)     Poliquin     Posey     Ratcliffe     Reed     Reichert     Renacci     Roby     Roe (TN)     Rogers (AL)     Rogers (KY)     Rohrabacher     Rokita     Rooney, Francis     Rooney, Thomas     Ros-Lehtinen     Roskam     Ross     Rothfus     Rouzer     Royce (CA)     Russell     Rutherford     Sanford     Scalise     Schweikert     Scott, Austin     Sensenbrenner     Sessions     Shimkus     Shuster     Simpson     Smith (MO)     Smith (NE)     Smith (NJ)     Smith (TX)     Smucker     Stefanik     Stewart     Stivers     Taylor     Tenney     Thompson (PA)     Thornberry     Tiberi     Tipton     Trott     Turner     Upton     Valadao     Wagner     Walden     Walker     Walorski     Walters, Mimi     Weber (TX)     Webster (FL)     Wenstrup     Westerman     Williams     Wilson (SC)     Wittman     Womack     Woodall     Yoder     Yoho     Young (AK)     Young (IA)     Zeldin                               NOES--187     Adams     Aguilar     Barragan     Bass     Beatty     Bera     Beyer     Bishop (GA)     Blumenauer     Blunt Rochester     Bonamici     Boyle, Brendan     Brady (PA)     Brown (MD)     Brownley (CA)     Bustos     Capuano     Carbajal     Cardenas     Carson (IN)     Cartwright     Castor (FL)     Castro (TX)     Chu, Judy     Cicilline     Clark (MA)     Clarke (NY)     Clay     Cleaver     Clyburn     Cohen     Connolly     Conyers     Cooper     Correa     Costa     Courtney     Crist     Crowley     Cuellar     Cummings     Davis (CA)     Davis, Danny     DeFazio     DeGette     Delaney     DeLauro     DelBene     Demings     DeSaulnier     Deutch     Dingell     Doggett     Doyle, Michael     Ellison     Engel     Eshoo     Espaillat     Esty     Evans     Foster     Frankel (FL)     Fudge     Gabbard     Garamendi     Gonzalez (TX)     Gottheimer     Green, Al     Green, Gene     Grijalva     Gutierrez     Hanabusa     Hastings     Heck     Higgins (NY)     Himes     Hoyer     Huffman     Jackson Lee     Jayapal     Jeffries     Johnson (GA)     Johnson,     Jones     Kaptur     Keating     Kelly (IL)     Kennedy     Khanna     Kihuen     Kildee     Kilmer     Kind     Krishnamoorthi     Kuster (NH)     Langevin     Larsen (WA)     Larson (CT)     Lawrence     Lawson (FL)     Lee     Levin     Lewis (GA)     Lieu, Ted     Lipinski     Loebsack     Lofgren     Lowenthal     Lowey     Lujan Grisham,     Lujan, Ben Ray     Lynch     Maloney, Carolyn     Maloney, Sean     Matsui     McCollum     McEachin     McGovern     McNerney     Meng     Moore     Moulton     Murphy (FL)     Nadler     Napolitano     Neal     Nolan     Norcross     O'Halleran     O'Rourke     Pallone     Panetta     Pascrell     Payne     Pelosi     Perlmutter     Peters     Peterson     Pingree     Pocan     Polis     Price (NC)     Quigley     Raskin     Rice (NY)     Rosen     Roybal-Allard     Ruiz     Ruppersberger     Ryan (OH)     Sanchez     Sarbanes     Schakowsky     Schiff     Schneider     Scott (VA)     Scott, David     Serrano     Sewell (AL)     Shea-Porter     Sherman     Sinema     Sires     Slaughter     Smith (WA)     Soto     Speier     Suozzi     Swalwell (CA)     Takano     Thompson (CA)     Thompson (MS)     Titus     Tonko     Torres     Tsongas     Vargas     Veasey     Vela     Visclosky     Walz     Wasserman Schultz     Waters, Maxine     Watson Coleman     Welch     Wilson (FL)     Yarmuth                             NOT VOTING--15     Becerra     Buchanan     Butterfield     Collins (NY)     Gallego     Meeks     Mulvaney     Pompeo     Price, Tom (GA)     Rice (SC)     Richmond     Rush     Velazquez     Walberg     Zinke                              {time}  1430  So the resolution was agreed to.  The result of the vote was announced as above recorded.  A motion to reconsider was laid on the table.                          ____________________",CREC-2017-01-05-pt1-PgH113-2.txt,566,"PROVIDING FOR CONSIDERATION OF H.R. 26, REGULATIONS FROM THE EXECUTIVE",2017.0,5.0,February
6514,topic-id,47,"Mr.Speaker, I ask unanimous consent that all Members have 5 legislative days to revise and extend their remarks and include extraneous material on the subject of my Special  The SPEAKER pro tempore. Is there objection to the request of the gentlewoman from Washington?  There was no objection.  ",CREC-2017-03-16-pt1-PgH2139-3.txt,99999999999999,PROVIDING FOR A JOINT SESSION OF CONGRESS TO RECEIVE A MESSAGE FROM THE,2017.0,16.0,February
