speech_id,topic_id,word_count,speech_text,file_name,speaker_id,session_title,year,day,month
3210,topic-id,1581,"Mr.Speaker, I move to suspend the rules and pass the bill (H.2834) to improve the well-being of, and improve permanency outcomes for, children and families affected by heroin, opioids, and other substance abuse, as amended.  The Clerk read the title of the bill.  The text of the bill is as follows:                               H.2834       Be it enacted by the Senate and House of Representatives of      the United States of America in Congress assembled,     SECTION 1. SHORT       This Act may be cited as the ``Partnership Grants to      Strengthen Families Affected by Parental Substance Abuse      Act''.     2. ENHANCEMENTS TO GRANTS TO IMPROVE WELL-BEING OF                    FAMILIES AFFECTED BY SUBSTANCE       Section 437(f) of the Social Security Act (42 U.S.     629g(f)) is amended--       (1) in the subsection heading, by striking ``Increase the      Well-being of, and to Improve the Permanency Outcomes for,      Children Affected by'' and inserting ``Implement IV-E      Prevention Services, and Improve the Well-being of, and      Improve Permanency Outcomes for, Children and Families      Affected by Heroin, Opioids, and Other'';       (2) by striking paragraph (2) and inserting the following:       ``(2) Regional partnership defined.--In this subsection,      the term `regional partnership' means a collaborative      agreement (which may be established on an interstate, State,      or intrastate basis) entered into by the following:       ``(A) Mandatory partners for all partnership grants.--       ``(i) The State child welfare agency that is responsible      for the administration of the State plan under this part and      part       ``(ii) The State agency responsible for administering the      substance abuse prevention and treatment block grant provided      under subpart II of part B of title XIX of the Public Health      Service       ``(B) Mandatory partners for partnership grants proposing      to serve children in out-of-home placements.--If the      partnership proposes to serve children in out-of-home      placements, the Juvenile Court or Administrative Office of      the Court that is most appropriate to oversee the      administration of court programs in the region to address the      population of families who come to the attention of the court      due to child abuse or neglect.       ``(C) Optional partners.--At the option of the partnership,      any of the following:       ``(i) An Indian tribe or tribal consortium.       ``(ii) Nonprofit child welfare service providers.       ``(iii) For-profit child welfare service providers.       ``(iv) Community health service providers, including      substance abuse treatment providers.       ``(v) Community mental health providers.       ``(vi) Local law enforcement agencies.       ``(vii) School personnel.       ``(viii) Tribal child welfare agencies (or a consortia of      the agencies).       ``(ix) Any other providers, agencies, personnel, officials,      or entities that are related to the provision of child and      family services under a State plan approved under this      subpart.       ``(D) Exception for regional partnerships where the lead      applicant is an indian tribe or tribal consortia.--If an      Indian tribe or tribal consortium enters into a regional      partnership for purposes of this subsection, the Indian tribe      or tribal consortium--       ``(i) may (but is not required to) include the State child      welfare agency as a partner in the collaborative agreement;       ``(ii) may not enter into a collaborative agreement only      with tribal child welfare agencies (or a consortium of the      agencies); and       ``(iii) if the condition described in paragraph (2)(B)      applies, may include tribal court organizations in lieu of      other judicial partners.'';       (3) in paragraph (3)--       (A) in subparagraph (A), by striking ``$500,000 and not      more than $1,000,000'' and inserting ``$250,000 and not more      than $1,000,000'';       (B) in subparagraph (B)--       (i) in the subparagraph heading, by inserting ``;      planning'' after ``approval'';       (ii) in clause (i), by striking ``clause (ii)'' and      inserting ``clauses (ii) and (iii)''; and       (iii) by adding at the end the following:       ``(iii) Sufficient planning.--A grant awarded under this      subsection shall be disbursed in two phases: a planning phase      (not to exceed 2 years) and an implementation phase. The      total disbursement to a grantee for the planning phase may      not exceed $250,000, and may not exceed the total anticipated      funding for the implementation phase.''; and       (C) by adding at the end the following:       ``(D) Limitation on payment for a fiscal year.--No payment      shall be made under subparagraph (A) or (C) for a fiscal year      until the Secretary determines that the eligible partnership      has made sufficient progress in meeting the goals of the      grant and that the members of the eligible partnership are      coordinating to a reasonable degree with the other members of      the eligible partnership.'';       (4) in paragraph (4)--       (A) in subparagraph (B)--       (i) in clause (i), by inserting ``, parents, and families''      after ``children'';       (ii) in clause (ii), by striking ``safety and permanence      for such children; and'' and inserting ``safe, permanent      caregiving relationships for the children;'';       (iii) in clause (iii), by striking ``or'' and inserting      ``increase reunification rates for children who have been      placed in out-of-home care, or decrease''; and       (iv) by redesignating clause (iii) as clause (v) and      inserting after clause (ii) the following:       ``(iii) improve the substance abuse treatment outcomes for      parents including retention in treatment and successful      completion of treatment;       ``(iv) facilitate the implementation, delivery, and      effectiveness of prevention services and programs under      section 471(e); and'';       (B) in subparagraph (D), by striking ``where      appropriate,''; and       (C) by striking subparagraphs (E) and (F) and inserting the      following:       ``(E) A description of a plan for sustaining the services      provided by or activities funded under the grant after the      conclusion of the grant period, including through the use of      prevention services and programs under section 471(e) and      other funds provided to the State for child welfare and      substance abuse prevention and treatment services.       ``(F) Additional information needed by the Secretary to      determine that the proposed activities and implementation      will be consistent with research or evaluations showing which      practices and approaches are most effective.'';       (5) in paragraph (5)(A), by striking ``abuse treatment''      and inserting ``use disorder treatment including medication      assisted treatment and in-home substance abuse disorder      treatment and recovery'';       (6) in paragraph (7)--       (A) by striking ``and'' at the end of subparagraph (C); and       (B) by redesignating subparagraph (D) as subparagraph (E)      and inserting after subparagraph (C) the following:       ``(D) demonstrate a track record of successful      collaboration among child welfare, substance abuse disorder      treatment and mental health agencies; and'';       (7) in paragraph (8)--       (A) in subparagraph (A)--       (i) by striking ``establish indicators that will be'' and      inserting ``review indicators that are''; and       (ii) by striking ``in using funds made available under such      grants to achieve the purpose of this subsection'' and      inserting ``and establish a set of core indicators related to      child safety, parental recovery, parenting capacity, and      family well-being. In developing the core indicators, to the      extent possible, indicators shall be made consistent with the      outcome measures described in section 471(e)(6)''; and       (B) in subparagraph (B)--       (i) in the matter preceding clause (i), by inserting ``base      the performance measures on lessons learned from prior rounds      of regional partnership grants under this subsection, and''      before ``consult''; and       (ii) by striking clauses (iii) and (iv) and inserting the      following:       ``(iii) Other stakeholders or constituencies as determined      by the Secretary.''; and       (8) in paragraph (9)(A), by striking clause (i) and      inserting the following:       ``(i) Semiannual reports.--Not later than September 30 of      each fiscal year in which a recipient of a grant under this      subsection is paid funds under the grant, and every 6 months      thereafter, the grant recipient shall submit to the Secretary      a report on the services provided and activities carried out      during the reporting period, progress made in achieving the      goals of the program, the number of children, adults, and      families receiving services, and such additional information      as the Secretary determines is necessary. The report due not      later than September 30 of the last such fiscal year shall      include, at a minimum, data on each of the performance[[Page H4967]]     indicators included in the evaluation of the regional      partnership.''.     3. EFFECTIVE       (a) In General.--Subject to subsection (b), the amendments      made by this Act shall take effect on October 1, 2017.       (b) Transition Rule.--       (1) In general.--In the case of a State plan under part B      of title IV of the Social Security Act which the Secretary of      Health and Human Services determines requires State      legislation (other than legislation appropriating funds) in      order for the plan to meet the additional requirements      imposed by the amendments made by this Act, the State plan      shall not be regarded as failing to comply with the      requirements of such part solely on the basis of the failure      of the plan to meet such additional requirements before the      first day of the first calendar quarter beginning after the      close of the first regular session of the State legislature      that begins after the date of enactment of this For      purposes of the previous sentence, in the case of a State      that has a 2-year legislative session, each year of the      session shall be deemed to be a separate regular session of      the State legislature.       (2) Application to programs operated by indian tribal      organizations.--In the case of an Indian tribe, tribal      organization, or tribal consortium which the Secretary of      Health and Human Services determines requires time to take      action necessary to comply with the additional requirements      imposed by the amendments made by this Act (whether the      tribe, organization, or tribal consortium has a plan under      section 479B of the Social Security Act or a cooperative      agreement or contract entered into with a State), the      Secretary shall provide the tribe, organization, or tribal      consortium with such additional time as the Secretary      determines is necessary for the tribe, organization, or      tribal consortium to take the action to comply with the      additional requirements before being regarded as failing to      comply with the requirements.  The SPEAKER pro tempore. Pursuant to the rule, the gentlewoman from South Dakota (",CREC-2017-06-20-pt1-PgH4966.txt,2060,IMPROVING SUPPORT FOR MISSING AND EXPLOITED CHILDREN ACT OF 2017,2017.0,20.0,June
3211,topic-id,50,"Mr.Speaker, I ask unanimous consent that all Members may have 5 legislative days within which to revise and extend their remarks and include extraneous material on H.2834, currently under consideration.  The SPEAKER pro tempore. Is there objection to the request of the gentlewoman from South Dakota?  There was no objection.  ",CREC-2017-06-20-pt1-PgH4966.txt,2060,IMPROVING SUPPORT FOR MISSING AND EXPLOITED CHILDREN ACT OF 2017,2017.0,20.0,June
3212,topic-id,336,"Mr.Speaker, I yield myself such time as I may consume.  Mr.Speaker, I rise today in support of the Partnership Grants to Strengthen Families Affected by Parental Substance Abuse I applaud Mr.Davis for all of the excellent work he has done on this issue.  Most substantiated child abuse and neglect cases involve substance abuse by a parent or a guardian. This is something we are seeing all too often in places like my home State of South Substance abuse, especially alcohol and meth, result in far too many instances of child abuse, domestic abuse, and other kinds of violent crime and behavior.  Historically, a lack of coordination and collaboration has hindered the ability of those working in the fields of child welfare and substance abuse, and even the courts, from fully supporting families in substance abuse crisis.  Families involved with child welfare have complex needs. No two cases are alike. It is for this reason that improving outcomes for parents and children require a coordinated effort among all systems.  This bill strengthens the Regional Partnership Grants program, which provides funding to State and regional grantees seeking to provide evidence-based services to prevent child abuse and neglect related to substance abuse. Most importantly, this bill updates the RPG program to specifically address the opioid and heroin epidemics.  By ensuring better coordination, this bill will also encourage States to address the well-being of the family as a whole, using evidence-based approaches to help parents and children at the same time, so many children can stay safely at home with their families.  Finally, this bill is noncontroversial and it is bipartisan. Provisions in this bill were contained in the Family First Prevention Services Act last Congress, which passed the House by a voice vote. The Family First Act, as you recall, was supported by over 500 State and local organizations representing a wide range of practitioners and advocacy organizations.  Mr.Speaker, I appreciate the opportunity to stand with Mr.Davis in supporting this bill today.  I reserve the balance of my time.  ",CREC-2017-06-20-pt1-PgH4966.txt,2060,COUNTERING IRAN'S DESTABILIZING ACTIVITIES ACT OF 2017,2017.0,20.0,June
3213,topic-id,8,"Mr.Speaker, I reserve the balance of my time.  ",CREC-2017-06-20-pt1-PgH4966.txt,2060,COUNTERING IRAN'S DESTABILIZING ACTIVITIES ACT OF 2017,2017.0,20.0,June
3215,topic-id,8,"Mr.Speaker, I reserve the balance of my time.  ",CREC-2017-06-20-pt1-PgH4966.txt,2060,MANCHESTER ATTACK,2017.0,20.0,June
3216,topic-id,137,"Mr.Speaker, I yield myself such time as I may consume.  Mr.Speaker, I, again, want to applaud Mr.Davis for all of his work on this issue. I know he is passionate and has a big heart for our children, especially those that are in difficult situations such as we are discussing today.  This bill will help us protect the fundamental element of our society, and that is the family. It will keep families together. It will empower courts and child welfare workers to coordinate for the good of children, and I am proud to support this bill.  I ask for the support of this legislation that is before us, Mr.Speaker, and I yield back the balance of my time.  The SPEAKER pro tempore (Mr.Hollingsworth). The question is on the motion offered by the gentlewoman from South Dakota (",CREC-2017-06-20-pt1-PgH4966.txt,2060,"ADJOURNMENT FROM THURSDAY, MAY 4, 2017, TO MONDAY, MAY 8, 2017",2017.0,20.0,June
2946,topic-id,515,"Mr.Speaker, I thank my good friend for yielding me this time, and I am pleased to support this bipartisan bill, the Improving Support for Missing and Exploited Children  I support it because it does exactly what its title says. It fills the gaps in our prior legislation on missing and exploited children. We need to look at such legislation very often because of what we are learning about missing and exploited children.  There are many parts of this bill I support, but I particularly support a provision that we didn't have nearly as much knowledge of during the passage of the last bill: to improve the protection of children in State care. These are often foster children or children without parents. These are the children who may be most susceptible to trafficking and other exploitation.  I certainly would appreciate the efforts of the committee in making sure that provisions of my bill that, I believe, got to you too late, are included in the final House and Senate bill because they are entirely consistent with the bill on the floor today. They come from recent experience of the District of  The D.police began to do something, which I urge all of you to do, and that is to use social media to let people know when there are missing children. It unnerved residents of the District of Columbia until they recognized that the city didn't have any more missing children than any other jurisdiction. Still, I support what the District did in using social media. Still, we simply don't know enough.  My provisions would have the government collect subsets of data that it does not collect today. For example, we found in the District that there were more missing girls of color than boys. We ought to have known that from national statistics. You don't know it because there are no national statistics on the subsets of children.  My bill would collect and publish demographic characteristics that simply are not published today on race, gender, sexual orientation, and gender identity. If you think of those categories, you will understand why these may be the children in particular need of protection.  In addition, there is no current comprehensive count of missing children in the United So, we need more work on this bill. We need to break down to these subsets so that jurisdictions, like my own, will know where to focus when we are focusing on missing children.  Again, I am pleased that the District turned out not to have any more missing children than the average jurisdiction, but I am also pleased that it got a rise out of people who never would have paid attention to this issue until the police department decided to go on social media.  We want to make sure that we cover all of our children and that we do what this bill does.  What are the gaps? Where do we need to fill in?  Mr.Speaker, this is the first bill on missing children in a number of years. We must make sure no children are left behind.[[Page H4456]]    ",CREC-2017-05-23-pt1-PgH4453.txt,868,SENATE RESOLUTION 243--EXPRESSING THE SENSE OF THE SENATE THAT JOSEPH,2017.0,23.0,June
2959,topic-id,174,"Mr.Speaker, I thank the gentleman for his work on this on a bipartisan basis with Mr. I rise today in strong support of H.1808, the Improving Support for Missing and Exploited Children This important initiative, it builds on the bipartisan work we have already accomplished to combat sex trafficking and child exploitation.  Since its creation in 1984, the National Center for Missing & Exploited Children has worked tirelessly to protect children from being exploited, to reunite missing children with their families, and to provide resources and training to our law enforcement community to help assist in this effort.  This legislation today will assist the Center in strengthening its prevention and its recovery programs. One of those programs is the CyberTipline which, since being launched in 1998, has received 12.7 million reports of suspected child sexual exploitation. It is programs like this, Mr.Speaker, that go a long way to helping us save lives and put an end to sexual exploitation and trafficking of children.  I encourage all of my colleagues to support this bipartisan bill.  ",CREC-2017-05-23-pt1-PgH4453.txt,1930,IMPROVING SUPPORT FOR MISSING AND EXPLOITED CHILDREN ACT OF 2017,2017.0,23.0,June
3152,topic-id,792,"Well, first, I thank the gentlewoman from the Virgin Islands, Congresswoman Plaskett, and the gentleman from Texas, Marc Veasey, for hosting tonight's Special Order hour on such an important topic: racism and discrimination.  Before I begin, I want to take a moment to mark the 1-year anniversary of the Pulse Nightclub shooting and to remember the 49 lives that were cut short in the deadliest mass shooting in our Nation's history.  As we grieve for the victims and their families, we must continue to stand in solidarity with the survivors and with the LGBTQ community against hate, intolerance, for love, in support of our Nation's values of equality and dignity for all.[[Page H4840]]  The kind of intolerance, hate, and violence on display that day in Orlando has become an alarming trend in this country, a trend that has disturbingly been fueled by President According to the Southern Poverty Law Center, 37 percent of the 1,094 bias-related incidents in just the first month after the election referenced the President, his campaign slogans, or his remarks about sexual assault.  As he did throughout his campaign, President Trump continues to speak the language of racial and cultural grievance, pitting Americans against one another and perpetuating the viciousness he pretends to despise. The result is what you would expect: a spike in hate crimes and hate speech.  I have seen in my district in New Jersey where anti-Semitic graffiti was plastered on a pedestrian bridge. We have seen it at American University and just down the road at the National Museum of African American History and Culture, where nooses were found last month. Communities of color know this pain all too well.  Mr.Speaker, I am really fortunate to be able to discuss an issue of such importance to this This is one nation, under God, indivisible, with liberty and justice for all.  You know, I have been very fortunate in my life to have been born into a situation where a great American prior to me held this seat for 23 years in the 10th Congressional District of the State of New His name was Donald He was my father and he afforded me a lifestyle, one of which I did not know of his suffering and pain growing up as a young African American in this country. But even in that situation, I have found myself--irrespective of being in that position, I found myself in situations that have been dangerous and uncomfortable.  As a young, 20-year-old--you know, when we are 20, we do things that we probably shouldn't be doing at times. I was on my lunchtime going downtown to pay a bill at a department store where I had my first credit card, and I was running late. So what I decided to do was make a U-turn on the main street, Broad Street, in Newark, New Jersey, which is the largest street in the town. And I made a U-turn to come in front of the store.  Naturally, you know, with my luck, a motorcycle police officer was coming down the street at the same time. So he pulled me over, as he should, and I was wrong. But I was using my cousin's car. So when he asked me for my license and registration, I could not find the papers that I needed and I was fumbling and nervous.  The officer leaned into the car and used the N-word and said: If you don't find those documents in a minute, I will throw you so far under the jail that they will never find you.  So this is very frightening for any citizen to go through. So I was able to get my license, and I handed it to him. Just before that, they would throw me so far under the jail that they would never find me again. Once I handed him my license and it said that I was Donald Payne, Jr., whose father was a sitting councilman in the city of Newark, his whole attitude changed.  ``Don't you know that you could get hurt, or you could hurt someone, or you have to be careful.'' A minute ago I was nothing. I would be so far under the jail, they would never find me. But now that I am connected to something or someone, all of a sudden we have become paternal.  Mr.Speaker, there are millions of people in this country that aren't connected to someone, and these are the types of things that they go through. So I am just here to say that we must be vigilant. I believe in this country; I believe in its greatness. I believe in the words in the Pledge of I believe in the We must make it work for all  ",CREC-2017-06-12-pt1-PgH4838.txt,2097,PASS A HEALTHCARE BILL THAT WORKS FOR THE AMERICAN PEOPLE,2017.0,12.0,June
3225,topic-id,33,"Mr.President, I ask unanimous consent that the Senate stand adjourned under the previous order.  There being no objection, the Senate, at 11:19 p.m., adjourned until Tuesday, July 25, 2017, at 12 noon.                          ____________________",CREC-2017-07-24-pt1-PgS4163.txt,2286,PROTECTING ACCESS TO CARE ACT OF 2017,2017.0,24.0,June
