speech_id,topic_id,word_count,speech_text,file_name,speaker_id,session_title,year,day,month
13946,topic-id,212,"Mr.Speaker, I rise today in strong support of International Women's Day, A Day Without a Woman strike. Today we are here and are joined by many of our sisters around the Nation to declare, once and for all, that women's rights are human rights. We are here to stand in solidarity with women across the country to send a clear message: We will not rest until we create a society where all women--all women--have equal rights under the law.  We are resisting and letting President Trump and the Republicans know that we will not go back. We stand with the millions around the Nation who have walked out today, and today we are walking out for them. We are raising our voices for the millions of women who can't because they might get fired or because they can't afford to lose their meager wages.  I encourage all of my Democratic colleagues to join us, along with Leader Pelosi, the Democratic Women's Working Group, Congresswoman Katherine Clark, and so many others, for a walkout following these 1 minutes and attend the press conference on the House steps right outside in solidarity and in honor of all of the women in the world who are marching today and striking today for equal rights.                          ____________________",CREC-2017-03-08-pt1-PgH1604.txt,1501,DISAPPROVING RULE SUBMITTED BY DEPARTMENT OF THE INTERIOR RELATING TO,2017.0,8.0,February
14172,topic-id,1038,"Mr.Speaker, I want to thank the gentlewoman from New Jersey for yielding, but also for her tremendous leadershipon so many issues, including as a champion for women and women's health and reproductive health care, and also for thisimportant discussion tonight.                              {time}  1915  I just want to mention that I serve on the Budget Committee, and you mentioned a nominee, Congressman Tom Price ofGeorgia, for Secretary of Health and Human Once again, we see President-elect Donald Trump making recommendations ofthose individuals who want to dismantle the safety net and dismantle health care within the agencies that they are going to run.This is a very, very troubling development in terms of these cabinet appointee nominees.  I note that--and many know--President-elect Trump ran one of the most divisive and prejudiced campaigns that we have witnessedin modern history. Since winning the Presidency, he has nominated billionaires to serve in his cabinet, proving that he willgovern just as he campaigned. Also, he has nominated individuals who want to dismantle, for the most part, the agencies thatthey will have jurisdiction over.  Another example is his choice for Secretary of State, which Congresswoman Watson Coleman mentioned, and that is I serve on the State, Foreign Operations, and Related Programs Subcommittee of the Appropriations Committee andunderstand the importance of our diplomatic initiatives, our USAID initiatives, and our efforts to really bring education andhealth care to the poorest of the poor around the world. Our Secretary of State serves as the Nation's chief diplomat andrepresents America's interests around the world. I have the opportunity and the privilege to serve on the committee that fundsthe majority of these efforts.  So the nomination of Secretary of State Rex Tillerson really troubles me. His extensive ties to the Kremlin raises thequestion: Whose interest will he represent?  Our country cannot afford a Secretary of State who will place private corporate interests over the needs of the Americanpeople and our national security interests. His recent confirmation hearing revealed what we have known all along in Republican-controlled Washington, that cabinet officials will cater to special interests, not to American families, based on the nomineesthat we have seen come forward.  It is not just the Secretary of State we should be concerned about. Here at home, President-elect Trump has nominatedcabinet officials that would turn back the clock on progress. His nomination for Secretary of Labor, Andrew Puzder, is anothermillionaire CEO who benefits from an economy rigged against families struggling to make ends meet. He earns more than $1 milliona year, but opposes a raise for low-wage workers earning just $15,000 a year. He says that food assistance programs keep low-wage workers like those he employs at, I believe, Carl's and Hardee's--he says that if low-wage workers apply for these foodassistance programs, then the programs actually discourage work. There are millions of people who are working two jobs beingpaid minimum wage who need food assistance, who need food stamps, because they can't survive in today's economy.  So the working, poor, low-income individuals, should be very troubled by this appointment as Secretary of Labor, which issupposed to look out for the rights of working men and women. We need a Labor Secretary committed to helping working familiesand addressing the epidemic of poverty, not one who caters to the most affluent.  Also, by nominating Senator Sessions to lead the Justice Department, President-elect Donald Trump is making it clearthat he will abandon our fundamental civil and human rights. Senator Sessions has a long history of opposing civil rightsand equality. I am very proud of members of the Congressional Black Caucus for really setting forth his record and his history,such as laying out the fact that he was rejected from serving as a Federal judge due to his blatantly racist comment. Heforcefully degraded the LGBT community, opposed the Violence Against Women Act, and violated the Voting Rights Act, calling itan intrusive piece of legislation.  Clearly, someone who has publicly shown prejudice and intolerance is not qualified to serve as the chief law enforcement forour civil rights laws. Once again, you see a nominee who really doesn't believe in the values of liberty and justice for all, aperson to head an agency that is supposed to be an agency that ensures the civil and human rights for all. Let me be clear,these nominations are a chilling indication of how a Trump administration intends to govern.  Our Nation has made tremendous progress in the fight to protect, preserve, and expand civil rights, civil liberties, andhuman rights for all We will not allow a Trump administration to drag us back into the past.  Finally, let me just say something that is troubling me tremendously at this point in our history. Our Nation prides itselfon being a democracy. We actually promote democracy abroad through our democracy programs, which, of course, I have historicallyopposed. The point I am trying to make and want to make clear is that this new administration, when you look at the majority ofcabinet nominees, they are very, very wealthy and do not fundamentally believe in a strong public sector and in many ways do notsupport the mission of the cabinets they are actually asked to lead.  Privatizing Medicare and other public sector programs that ensure that the most vulnerable have a safety net and anopportunity to live the American Dream by privatizing these agencies is dangerous. It will lead to chaos. Private sectortakeover of the government is dangerous and it erodes our public institutions that are required in a democracy.  So, Congresswoman Watson Coleman, I believe this is the dangerous, slippery slope that this administration has embarkedupon, and we need to expose every step of the way who these individuals are, their background, and we have to urge that theycomply with the ethics requirement and submit their financial disclosure statements and all the required ethics forms so thatthe public will know who they are. We must be transparent and, of course, we would like for our President-elect to release hisincome taxes also.  Again, we kind of see what is taking place now. We knew this during the campaign. I thought that we were going to see nowmore of an effort to unify the country, but, unfortunately, I think these nominees show us which direction, unfortunately, thisnew administration will take.  ",CREC-2017-01-12-pt1-PgH460.txt,1501,DISAPPROVING RULE SUBMITTED BY DEPARTMENT OF THE INTERIOR RELATING TO,2017.0,12.0,April
14089,topic-id,484,"Mr.Speaker, I really appreciate Representative Collins of Georgia's leadership on this issue. There is really no one in this body--maybe with the exception of Representative Carter of Georgia--who can tell the story of community pharmacists the way Representative Doug Collins does.  I thank Representative Collins of Georgia for putting this Special Order hour together. He has been such a strong leader on pharmacy issues. He has been a great partner on the legislation that we will be discussing this evening.  I am proud to say that this is a bipartisan issue, one of the few in this Congress at this point. It is one of the few in Washington, D.C., at this point. We have been able to find a consensus on this, at least with respect to one bill, and I think we are probably going to be able to do it with respect to others as well.  We know for a fact that pharmacists across the country serve as the first line of healthcare services for so many patients around this country.                              {time}  1845  People count on pharmacists' training and expertise to stay healthy and to stay informed and, most importantly, to stay out of urgent care centers and out of hospitals. That is why I am proud to stand here today with my colleagues to recognize the quality and the affordable and the personal care that pharmacists provide every day.  Within that group of pharmacists, we have got a subset of pharmacists, and that is the community pharmacists and their pharmacies. They are also a great source not only of the expertise they provide, but economic growth in rural communities like those in my district and across the State of  As Mr.Collins mentioned, rural areas are very important in this as well. I am a member of the Small Business I recognize how challenging it can be for some of these small pharmacists to compete with the bigger companies. I appreciate their hard work to serve our communities.  Like most small-business owners, community pharmacists, they have to face challenges to compete and negotiate on a day-to-day basis with large entities as far as their business transactions are concerned. I frequently visit community pharmacists and I see the great job they are doing.  One pressing challenge facing many of our community pharmacists in particular that will be discussed tonight is the ambiguity and the uncertainty surrounding the reimbursement of generic drugs. Generic prescription drugs account for the majority of drugs dispensed by pharmacists, making transparency in reimbursement absolutely critical to the financial health of these small pharmacies.  But we know that pharmacists are reimbursed for generic drugs through what is called maximum allowable cost, or And this is a price list that outlines the upper limit or the maximum amount that an insurance plan will pay for a generic drug. These lists are created by pharmacy benefit managers, as Mr.Collins mentions, PB",CREC-2017-03-01-pt1-PgH1449-4.txt,1846,DISAPPROVING RULE SUBMITTED BY DEPARTMENT OF THE INTERIOR RELATING TO,2017.0,1.0,February
13978,topic-id,148,"Mr.Speaker, Hoosiers don't like ObamaCare, and they have worked hard for 6 years to stop it: electing a Republican House majority, a Republican Senate majority, and, eventually, President Trump, all on the promise to repeal and replace this failed law.[[Page H2448]]  That is what has made last week's failure to vote in the House so disheartening. It is inside baseball, politics as usual, and it is not okay.  It is not okay to the millions of families facing soaring premiums and worse health care under ObamaCare, and it shouldn't be okay to any of us. We cannot walk away now without even a vote with so much at stake.  This debate has gotten really complicated, but to me, it is really simple. We need to do what we said we would do: keep our promise to the American people, and repeal this failed law with something better.                          ____________________",CREC-2017-03-27-pt1-PgH2447-10.txt,2130,DISAPPROVING RULE SUBMITTED BY DEPARTMENT OF THE INTERIOR RELATING TO,2017.0,27.0,February
14173,topic-id,947,"I thank the gentlewoman from New Jersey for yielding, for hosting this Special Order, and for granting me thisopportunity to speak.  Since the first nomination was announced by President-elect Trump's transition team, phones in my office have been ringingoff the hook; and not a day goes by when I do not hear from my neighbors, friends, and constituents of their angst, frustration,and discontent. I share their anger and dread--that feeling of being punched in the gut--as name after name has been released.Each nomination from President-elect Trump has put the fox in charge of the henhouse.[[Page H463]]  We are not talking about simple differences in partisan ideology. We are talking about nominees who have devoted much oftheir professional lives to undermining the small-d democratic institutions that are the foundation of our country. This newadministration is so extreme that we cannot, in any good faith, give this President-elect the traditional deference to name acabinet that represents his governing philosophy because the appointments show it to be a philosophy that seeks to corrupt, ifnot fully destroy, our institutions, traditions, and values.  Senator Jeff Sessions, the nominee for Attorney General, was considered too racist to serve on the Federal bench by aRepublican Senate, much less to head the Justice Department, and is someone who has so little respect for women's rights hevoted against the Violence Against Women Act and called Roe v. Wade a colossal mistake.  Ben Carson, the nominee for HUD Secretary, said today in his confirmation hearing that he was against protecting LGBTAmericans from housing discrimination because protecting them from housing discrimination would be granting them extra rights,refusing to recognize that LGBT Americans deserve equal rights.  Tom Price, the nominee for HHS Secretary, wants to eliminate Medicare and Medicaid as we know them, repeal theAffordable Care Act without a second thought for the millions of Americans who would lose coverage or would be subject to limitson preexisting conditions and would be subject to lifetime and annual limits, and has so little understanding of women's healththat he insisted that not a single woman would lose access to contraception if contraception coverage were eliminated.  Betsy DeVos, the nominee for Education Secretary, advocated for years to move taxpayer dollars away from public schools andtowards for-profit, private schools that would leave behind low-income students, minority students, and children withdisabilities.  Scott Pruitt, the nominee for EPA administrator, does not believe in climate change and is so linked to the fossil fuelindustry that he has sued the EPA a dozen times to block environmental regulations designed to protect us from the effects ofclimate change.  The list goes on and on, each more horrifying than the one before. These are not the values the majority of Americans votedfor in November, and I don't just mean because Hillary Clinton won the popular vote by 3 million. I cannot imagine that thevoters who wanted to drain the swamp and voted for Mr.Trump for that purpose and have the needs of working people representedare thrilled to see him name the wealthiest cabinet--with the greatest collection of Wall Street insiders--in American history.  The fact is, President-elect Trump and the Republican Party do not have any mandate from the people to carry out thedystopian horror show this cabinet presents. Rather than rubber stamping the most extreme cabinet I have seen in my 25 years inWashington, the Senate should reject these extreme nominees, and then both Houses should do their constitutional duty to conductoversight of the administration.  I am ready to do that work. Over a month ago, along with my Democratic Judiciary Committee colleagues, I sent a letter toChairman Goodlatte asking him to hold hearings on the conflict of interest and ethics provisions that apply to thePresident of the United I have not heard a response. Every Democrat in this House signedon to the Protect Our Democracy Act, legislation to create an independent, bipartisan-appointed commission to investigateRussian hacking in the 2016 election and to make recommendations to ensure nothing like that happens again. It is interestingthat not a single House Republican has joined us.  I join my constituents and millions of Americans in wanting to know why Republicans are working so hard to protectPresident-elect Trump from having to answer questions about Russian influence in this election. Why are Republicans working sohard to support President-elect Trump's extreme and out-of-touch cabinet? Why aren't Republicans asking the same questions abouthow President-elect Trump will avoid conflicts of interest?  I have served in this body for nearly 25 years. I have seen this body take on the big questions of our time--the role ofgovernment in the lives of everyday Americans, the threat of terrorism in the city I call home and around the country, the rightof every American to marry whomever they love, the right of every American to vote free of intimidation, and the right of everyAmerican to make their own healthcare choices. I have seen us come through those battles bruised and battered but stronger.  That is why I refuse to despair. I refuse to put my head down and hide. I refuse to give up on I will stand hereand fight for the country we all believe in. I will do everything in my power to represent the strong progressive values of themen and women who sent me here.  I will work with my colleagues here in the House and the Senate to stand united against any effort to undermine the rightswe have fought so hard to achieve, whether it comes from the other end of the world or the other end of Pennsylvania  But if there is to be any check on this administration, congressional Republicans will need to join in that fight, and itstarts with rejecting the shameful slate of nominees.  ",CREC-2017-01-12-pt1-PgH460.txt,850,DISAPPROVING RULE SUBMITTED BY DEPARTMENT OF THE INTERIOR RELATING TO,2017.0,12.0,February
14015,topic-id,929,"Mr.Speaker, by direction of the Committee on Rules, I call up House Resolution 40 and ask for its immediateconsideration.  The Clerk read the resolution, as follows:                               40       Resolved, That at any time after adoption of this      resolution the Speaker may, pursuant toclause 2(b) of rule      XVIII, declare the House resolved into the Committee of the      Whole House on the state of the Union forconsideration of the      bill (H.78) to improve the consideration by the Securities      and Exchange Commission of the costs andbenefits of its      regulations and orders. The first reading of the bill shall      be dispensed with. All points of order againstconsideration      of the bill are waived. General debate shall be confined to      the bill and shall not exceed one hour equally dividedand      controlled by the chair and ranking minority member of the      Committee on Financial Services or their respective      designees.After general debate the bill shall be considered      for amendment under the five-minute rule. The bill shall be      considered asread. All points of order against provisions in      the bill are waived. No amendment to the bill shall be in      order except thoseprinted in part A of the report of the      Committee on Rules accompanying this resolution. Each such      amendment may be offered onlyin the order printed in the      report, may be offered only by a Member designated in the      report, shall be considered as read, shallbe debatable for      the time specified in the report equally divided and      controlled by the proponent and an opponent, shall not      besubject to amendment, and shall not be subject to a demand      for division of the question in the House or in the Committee      of theAll points of order against such amendments are      waived. At the conclusion of consideration of the bill for      amendment theCommittee shall rise and report the bill to the      House with such amendments as may have been adopted. The      previous question shallbe considered as ordered on the bill      and amendments thereto to final passage without intervening      motion except one motion torecommit with or without      instructions.       2.  At any time after adoption of this resolution the      Speaker may,pursuant to clause 2(b) of rule XVIII, declare      the House resolved into the Committee of the Whole House on      the state of theUnion for consideration of the bill (H.     238) to reauthorize the Commodity Futures Trading Commission,      to better protectfutures customers, to provide end-users with      market certainty, to make basic reforms to ensure      transparency and accountabilityat the Commission, to help      farmers, ranchers, and end-users manage risks, to help keep      consumer costs low, and for otherpurposes. The first reading      of the bill shall be dispensed with. All points of order      against consideration of the bill arewaived. General debate      shall be confined to the bill and shall not exceed one hour      equally divided and controlled by theMajority Leader and the      Minority Leader or their respective designees. After general      debate the bill shall be considered foramendment under the      five-minute rule. It shall be in order to consider as an      original bill for the purpose of amendment underthe five-     minute rule an amendment in the nature of a substitute      consisting of the text of Rules Committee Print 115-2.      Thatamendment in the nature of a substitute shall be      considered as read. All points of order against that      amendment in the nature ofa substitute are waived. No      amendment to that amendment in the nature of a substitute      shall be in order except those printed inpart B of the report      of the Committee on Rules accompanying this resolution. Each      such amendment may be offered only in theorder printed in the      report, may be offered only by a Member designated in the      report, shall be considered as read, shall bedebatable for      the time specified in the report equally divided and      controlled by the proponent and an opponent, shall not      besubject to amendment, and shall not be subject to a demand      for division of the question in the House or in the Committee      of theAll points of order against such amendments are      waived. At the conclusion of consideration of the bill for      amendment theCommittee shall rise and report the bill to the      House with such amendments as may have been adopted. Any      Member may demand aseparate vote in the House on any      amendment adopted in the Committee of the Whole to the bill      or to the amendment in the natureof a substitute made in      order as original text. The previous question shall be      considered as ordered on the bill and amendmentsthereto to      final passage without intervening motion except one motion to      recommit with or without instructions.       3. On any legislative day during the period from      January 16, 2017, through January 20, 2017--        (a) the Journal of theproceedings of the previous day      shall be considered as approved; and       (b) the Chair may at any time declare the Houseadjourned to      meet at a date and time,[[Page H317]]     within the limits of clause 4, section 5, article I of the      Constitution, to beannounced by the Chair in declaring the      adjournment.       4.  The Speaker may appoint Members to perform the      duties ofthe Chair for the duration of the period addressed      by section 3 of this resolution as though under clause 8(a)      of rule       5.  It shall be in order at any time on the      legislative day of January 13, 2017, for the Speaker to      entertainmotions that the House suspend the rules as though      under clause 1 of rule The Speaker or his designee shall      consult with theMinority Leader or her designee on the      designation of any matter for consideration pursuant to this      section.  The SPEAKER pro tempore (Mr.Bost). The gentleman from Washington is recognized for 1 hour.  ",CREC-2017-01-11-pt1-PgH316-3.txt,2275,DISAPPROVING RULE SUBMITTED BY DEPARTMENT OF THE INTERIOR RELATING TO,2017.0,11.0,February
14016,topic-id,48,"Mr.Speaker, for the purpose of debate only, I yield the customary 30 minutes to the gentleman from Colorado(Mr.Polis), my good friend, pending which I yield myself such time as I may consume. During consideration of thisresolution, all time yielded is for the purpose of debate only.                             General Leave  ",CREC-2017-01-11-pt1-PgH316-3.txt,2275,"PROVIDING FOR CONSIDERATION OF S. CON. RES. 3, CONCURRENT RESOLUTION ON",2017.0,11.0,February
14017,topic-id,36,"Mr.Speaker, I ask unanimous consent that all Members have 5 legislative days to revise and extend theirremarks.  The SPEAKER pro tempore. Is there objection to the request of the gentleman from Washington?  There was no objection.  ",CREC-2017-01-11-pt1-PgH316-3.txt,2275,THE JOURNAL,2017.0,11.0,February
