speech_id,topic_id,word_count,speech_text,file_name,speaker_id,session_title,year,day,month
8618,topic-id,22,"Mr.President, I ask unanimous consent that the order for the quorum call be rescinded.  The PRESIDING Without objection, it is so ordered.  ",CREC-2017-03-07-pt1-PgS1616-2.txt,172,DISAPPROVING A RULE SUBMITTED BY THE DEPARTMENT OF THE INTERIOR--,2017.0,7.0,April
8619,topic-id,523,"Mr.President, we had a chance earlier today to talk about this Congressional Review Act resolution before us that I urge my colleagues to turn down. This resolution basically would negate a very important aspect of a rule that was put in place to help the public have more input on public lands.  The rule was pretty straightforward--common sense--to make sure that there was a lot of increased public input to bolster the decisionmaking process and to ensure that there are 21st century management policies in place.  There is nothing in this rule that was implemented in the last administration that erodes or takes away from the States' and local governments' planning processes and the decisionmaking they do.  So it is very important to me that we continue to have the transparency and openness and sunshine in our public planning. I think one editorial from the Post-Register from Idaho said it best. So I will read from it.       Resource management planning. Sound boring? But if      you are a Westerner, it definitely shouldn't be.       Resource management planning (RMP) affects how you can or      can't use the vast swaths of public lands outside your back      door for things like hunting, camping, four-wheeling, hiking,      fishing, and rock climbing--a lot of the things you probably      love about being a       With a new Republican presidential administration in power      and the GOP-controlled Congress rubbing its hands together in      delight, ready to implement part one of its grand scheme for      public lands--cashing in on[[Page S1625]]     those resources--RMPs should get a whole lot more interesting      to       Since 2014, BLM officials have been toiling away,      rebuilding the current rules for land use planning in a      significant way for the first time since 1983. . . .       One important change is that Planning 2.0 would let the BLM      take into account local impacts from the beginning.  Going on to read from the editorial:       The Republican-controlled House has already passed a      resolution to strike Planning 2.0 from the books once and for      all. The Senate will vote within days on whether or not      they'll use the same sledgehammer--the Congressional Review      Act (CRA). It's an especially diabolical weapon.       Once the CRA is used on Planning 2.0, it will be gone      forever. It prevents future BLM rules for planning land use      from being introduced if they are ``substantially the same.''       The utterly confounding part is why this rule is being      picked on in the first place. . . .       Planning 2.0 actually mandates more local control, gives it      more often and is a smarter, more elegant solution to sharing      use of our public lands.  I couldn't say it better than that editorial. Local communities are watching. They want more sunshine. They want more input. They want a smoother process. They don't want lawsuits that take forever. They want us to work in a collaborative fashion, guaranteeing the public input of local governments, States, and our citizens in how we manage our Federal lands.  I urge my colleagues to turn down this resolution.  I suggest the absence of a quorum.  The PRESIDING OFFICER (Mr.Strange). The clerk will call the roll.  The bill clerk proceeded to call the roll.  ",CREC-2017-03-07-pt1-PgS1616-2.txt,172,DISAPPROVING A RULE SUBMITTED BY THE DEPARTMENT OF THE INTERIOR--,2017.0,7.0,April
8620,topic-id,22,"Mr.President, I ask unanimous consent that the order for the quorum call be rescinded.  The PRESIDING Without objection, it is so ordered.  ",CREC-2017-03-07-pt1-PgS1616-2.txt,172,EXECUTIVE CALENDAR,2017.0,7.0,April
8621,topic-id,48,"Mr.President, I yield back the remaining time.  The PRESIDING All time is yielded back.  The joint resolution was ordered to a third reading and was read the third time.  The PRESIDING The joint resolution having been read the third time, the question is, Shall the joint resolution pass?  ",CREC-2017-03-07-pt1-PgS1616-2.txt,172,EXECUTIVE CALENDAR,2017.0,7.0,April
8350,topic-id,19,"Madam President, I ask unanimous consent that the order for the quorum call be rescinded.  The PRESIDING OFFICER (",CREC-2017-01-30-pt1-PgS464-3.txt,1676,EXECUTIVE CALENDAR,2017.0,30.0,March
8493,topic-id,1166,"Mr.President, I am here to address an issue that I think is of great importance to this country and to this administration; that is, the nomination of Scott Pruitt to be the new EPA  We are nearly 8 years removed now from what we consider--many of us, I think, particularly as we look back--the great recession. However, many American workers, their families, and their communities have yet to feel the benefits of any kind of a recovery. A key component to a slow recovery--the[[Page S1235]]slowest recovery since World War I--is the regulatory overreach coming out of this city--Washington,  Since the end of the recession in June 2009, Federal agencies have burdened a weakened economy with thousands of pages of new rules, costing consumers billions of dollars. Tens of thousands of workers have lost their jobs. The EPA has perhaps become the poster child for this overreach, from restricting carbon emissions without the direction of Congress--and according to the clean air direction of Congress of what is important--to federalizing every stream, every pond, every wetland under the waters of the United States rule, to unilaterally banning virtually Appalachian coal mining by obstructing the permitting process and pursuing ozone standards that the vast majority of the country cannot meet. The vast majority of the country is still trying to meet the ozone standards that were established under the last regulation.  I support the mission of the EPA in protecting human health, in protecting our air and our water, but there has to be a balance. There has to be a balance between growing the economy and preserving the environment. Over the last several years, we have seen that balance very disrupted. This disruption is at odds with the law and the well-being of many of our working families.  This has been acutely felt in my State of West Virginia where we have lost more than 35 percent of our coal jobs since the year 2011. That is more than 7,000 jobs eliminated in a relatively small State like West Virginia, and many of these jobs are very high-paying jobs.  As a nation, we have lost more than 60,000 coal miners in the same timeframe. This has hurt our workers, our families, our communities, and our  The loss of good-paying jobs means less commercial activity. It means less tax revenue to support our education, our county school systems, our county ambulances, our county sheriff's departments, and our law enforcement. For example, little old Wayne County in West Virginia has lost 88 percent of its coal severance taxes between 2013 and 2016. This year, our Governor and our legislature are struggling right now with a $500 million budget deficit, largely due to the loss of our coal jobs.  Patching that shortfall could mean significant tax increases, painful cuts in public services, or both, which could further hurt and cripple our local economy. It will be a long road undoing the legal and economic damages suffered over the last several years.  Voters in my State and across the country have made it clear that fixing Washington includes meaningful reforms for the way that the EPA operates and has been operating.  So what do we have before us? We have a great nominee for EPA Administrator, Scott Pruitt, who is presently the attorney general of another energy-producing State--Scott is committed to returning the Agency to its core mission of protecting our air, our water, and our land without undercutting the economy. At least, we know that he will listen to the other side and try to be reasonable.  He will ensure that the EPA abides by congressional intent, and he will be an active partner with State and local stakeholders in the rulemaking process.  Going back to the stream buffer rule and the reason that fell apart--and I am so pleased that the President is going to be signing the CRA on that today--the EPA invited States to come in and speak about the rulemaking process. Within months, it became very apparent to the States that are charged with protecting the water that this is just window dressing. They realized: They are not listening to us, and they don't really want us to buy in. Eight of those States left.  So as the attorney general for the State of Oklahoma, he has held industry to account as well protected lakes and streams in his I asked him in the committee: If the State or local government doesn't intervene in what looks to be an environmental issue--not just a crisis, but if they are not doing their job in protecting the air and the water--what would you do as the EPA Administrator? He said: That is where we should be stepping in. That is where we should be helping those States meet those standards, helping those States get the right information.  So I think he is going to be unafraid to take on the EPA when it is set to ignore a State's sovereignty.  Mr.Pruitt is the most thoroughly vetted candidate for this position in history. He fielded 6 hours' worth of questioning before the Committee on Environment and Public Works, where I serve. During that hearing, he assured me that he will engage directly with the State of West Virginia and visit our We could never get the EPA Administrator to visit our State and listen to our side. He will visit our State, listen to our side, and reform the rulemaking process to prevent another open assault on our economy by unelected bureaucrats.  He also committed to me that he would pursue full implementation of the bipartisan Frank Lautenberg Chemical Safety for the 21st Century Act, a bill on which we joined together--Republicans and Democrats, both sides of the aisle, with President Obama--to modernize our toxic chemical regulations in terms of water.  This is important to me. I was talking to my colleague from Michigan about this issue. We had a water crisis in West Virginia where we had a large chemical spill. This bill, under Scott Pruitt's leadership and my pressing for the implementation, as others will be, will help us in situations like this.  Beyond the over 200 questions he answered in the hearing, he answered more than 1,000 followup questions. He is the most thoroughly vetted nominee for Administrator in the history of the I am confident--very confident--as he assured me in committee and in personal meetings, and I have watched him in action in terms of questioning the overreach in the court systems. He has worked with our attorney general, Patrick Morrisey, to be the leader in this.  I have confidence that he embodies the leadership that we need to restore the balance and accountability to the EPA in a way that will benefit the public health and benefit environmental preservation, as well as restore much-needed economic growth that needs to be a part of the balance that we want to see restored back to the  With that, I yield the floor.  The PRESIDING The Senator from  ",CREC-2017-02-16-pt1-PgS1230.txt,1676,EXECUTIVE CALENDAR,2017.0,16.0,January
8529,topic-id,2437,"Mr.President, I take this time to explain to my colleagues why I will be opposing the nomination of Scott Pruitt, the attorney general of Oklahoma, to be the next Administrator of the Environmental Protection  I first want to start by saying I had an opportunity to visit with Attorney General He is a person who wants to serve our country, and we very much appreciate that. He has a distinguished career in public service, and we appreciate his willingness to continue to serve at the national level.  My reason for opposing his nomination is that he has opposed most of the missions of the Environmental Protection Agency as the attorney general of He has filed numerous lawsuits that would compromise the ability of the Environmental Protection Agency to protect our environment.  I come to this debate acknowledging that there are national responsibilities to protect our environment. The United States must also be engaged in global leadership as it relates to our environment. The people of Maryland want clean air. The people of Maryland want clean water. No State can guarantee to its citizens that its air will be clean or that its water will be safe. These issues go well beyond State boundaries. They go beyond national boundaries. It is for that reason that we need an Administrator of the Environmental Protection Agency who will lead our Nation both in the appropriate controls and regulations to protect our air and water but also work for our country in regard to the global efforts to protect our environment for future generations.  Let me talk about the issue of climate change. Climate change is one of the greatest threats of our times. We know that this year, according to NASA--they looked at the temperature rise in 2016 and found it to be the hottest year ever recorded. We know something is happening in regard to global climate change. It is affecting so many different areas. We have eroding shorelines that our constituents see. We have major military installations located along our coast that are at risk as a result of rising sea levels from ice melt. We have populations that are at risk in the United  Let me give one example, if I might. Smith Island, MD, is a very proud community. It is a community that historically has been one of the strongest in regard to watermen and dealing with the fruits of the Chesapeake It is a proud community, and it is in danger of disappearing because we have sea level rises resulting from ice melting from climate change. We know there is a problem developing that we need to deal with. It is affecting our economy.  In my State of Maryland, the seafood industry is concerned about the future of the blue crab crop. They know that juvenile crabs need sea grass in order to be able to be protected and mature into full-blown blue crabs. With water becoming warmer, the future of sea grass is challenged, putting the blue crab at risk.  That is just one example. There are many more examples I can give about how it is affecting the economy of my It is affecting our ability to enjoy our environment, the recreation itself, and it is certainly providing a real risk in regard to the real estate. We have some very nice real estate located right on the coast or on barrier islands that is at risk of being lost as a result of climate change. We see more and more major weather events occur on a much more regular basis, causing billions of dollars of damage and putting lives at risk.  We know climate change is here. It is happening. The science is pretty clear. When we asked Attorney General Pruitt his view about the science of climate change, his answer was ``far from settled.''  The science is well understood. What we do here on Earth--the release of carbon emissions--is causing an abnormal warming of our climate. There are activities that we can do to reduce that effect on our climate. We know that. That is what science tells us. We know we can affect the adverse impacts of climate change if we take action. That is what scientists are telling us.  The world came together on this issue in I was proud to head a delegation of 10 Members of the U.Senate as we went to Paris to make it clear to the international community that the United States wanted to be part of a global solution to climate change. Not any one country can reverse the trendline that we are on that is catastrophic; we need all nations to do everything they can to reduce the impact of climate change by reducing their carbon and greenhouse emissions. That is what the global community needs to do, but we have been unable to get the global community for all countries to live up to their responsibilities.  Under President Obama and our leadership, we were able to get the world community--over 190 nations--to come together in Paris, in COP21, for every nation to take responsibility to reduce their carbon emissions so that we all can benefit from that effort.  I am concerned as to whether Mr.Pruitt, if confirmed as the EPA Administrator, will continue that U.leadership. He has not been at all committed to U.programs on dealing with climate change, let alone our international responsibilities to lead other countries to do what they need to do. I will give one example. Part of our way of showing the international community that we are serious about the climate issue was the powerplant rule issued under the Obama administration. Attorney General Pruitt joined a group in opposing that powerplant rule through filing suit against the implementation of that particular law.  We need someone who is going to lead on this effort in America and understand that we have responsibilities to lead the international community. We are at great risk from the impact of climate change, and that needs to be understood and recognized by the leader of the Environmental Protection I am not convinced Attorney General Pruitt would do that.  I want to talk a little bit about clean air. Maryland has taken pretty aggressive steps to improve the air quality from emissions within the geographical boundary of the State of That is what every State should do. But here is the challenge: Maryland is downwind from many other States' emissions, so we are seeing days in which our air quality is below what it should be, not because we haven't taken action but because we don't have a national policy to protect our clean air.  The health of Marylanders depends on the Federal Government being aggressive in guaranteeing that all citizens of this country--that steps are taken to protect the air they breathe. I can tell you the number of children who have asthma who suffer when the air quality is not what it should be. It is not only wrong from the point of[[Page S1257]]view that we have an obligation to our children to make sure we give them the healthiest air to breathe, it is also costing our economy because every day that child stays home, a parent cannot go to work. The child loses their time in school; they are being disadvantaged. If they have to take a day off from summer camp, the parent has to stay home, and it is wasting resources in this country.  For many reasons, we need an Administrator of the EPA who is committed to a national effort to make sure the air we breathe is clean and healthy.  Likewise with clean water. Some of us remember when the Cuyahoga River caught fire in 1969. We know that pollution was so bad, you literally could set our rivers afire. We took steps. And it was not partisan--Democrats and Republicans came together with the Clean Water We recognized that the Federal Government has the responsibility to protect the quality of our water so that we have safe, clean water in  I think we have been working to improve the Clean Water Act consistently on a nonpartisan basis, but now we have Supreme Court decisions that challenge what water the Federal Government can regulate. Congress has not taken steps to clarify that. The administration took efforts to try to clarify that under the waters of the United States, only to see a Court action to put that on hold in which Mr.Pruitt joined as the attorney general of Oklahoma, once again slowing down our effort to protect the clean waters of  I have spoken numerous times on the floor of the Congress about the Chesapeake Bay and how proud I am to be a Senator from Maryland, one of the six States that are in the Chesapeake Bay watershed, along with the District of  We know that the Chesapeake Bay is a national treasure. It has been so designated by many Presidents of the United It is the latest estuary in our hemisphere. The watershed contains 64,000 square miles, has over 11,000 miles of shoreline, and 17 million people live in the Chesapeake Bay watershed--150 major rivers, $1 trillion to our economy. It is part of the heritage of my State and our region. We are proud that it is part of our life. It is part of why people like to live in this region. They know the Chesapeake Bay makes their life so much more enriched and so much more valuable.  The Chesapeake Bay is in trouble. I could talk about it from a technical point of view. It doesn't flush itself as quickly as other water bodies. The historic oyster population is not what it has been. We have to, therefore, make special efforts to clean up the Chesapeake Over 30 years ago, almost 40 years now, while I was in the State legislature, when I was speaker of the house, I worked with Governor Harry Hughes, and we developed a State program to deal with the Chesapeake  We did it the right way. We started at the local levels. We got all the stakeholders together: the farmers, the developers, the local governments, the private sector, our local governments, the State government. We worked with Pennsylvania because Pennsylvania is where the Susquehanna River flows, and that produces most of the fresh water that goes into the Chesapeake We worked with Delaware, Virginia, New York, and West Virginia, and we developed the Chesapeake Bay Program that is worked from the local level up. We get together to determine what is reasonable: What does science tell us we can do?  We have all the stakeholders sitting around the table as we develop these plans. They all sign up. Our farmers recognize that clean water will make their agriculture more profitable. They recognize that. Developers understand that we need a clean Chesapeake Bay as part of our ability to develop profitable real estate in our community. These are not inconsistent. A serene environment, clean agriculture, a strong agriculture, a strong economy are all hand in hand together.  It is not a choice between one or the other. We recognize that. That is why the Chesapeake Bay Program has never been partisan in We have had Democratic and Republican Governors who supported the Chesapeake Bay We have had legislators lead this effort from both parties. Senator Mac Mathias, who served as the U.Senator from Maryland, was the champion of bringing the Federal Government into the Chesapeake Bay The program is working. It is making the bay safer today, but we still have a long way to go.  We enforce it through the TMDL, the Total Maximum Daily Loads, so we can monitor that we are making the progress we said we could make, based upon best science. And that is what the local stakeholders have signed up for.  When we did our TMDL's, it was challenged. It was challenged in the courts. Mr.Pruitt was one of those who brought a challenge against the TMDL Program in I am thankful that the Third Circuit upheld the legal right of the TMDL, and the Supreme Court affirmed that decision by the Third So we won the legal case.  But it troubles me that a program that is from the ground up, from the local governments up, in which the Federal government is a partner--why it would be challenged when it was supported by the local communities. To me, that case should never have been challenged.  We need the Federal Government to continue to participate with us. The Chesapeake Bay Program is supported through the farm bill, through the Water Resources Development Act, through the Clean Water Act, and through annual appropriations. So we need continued support at the Federal level for the Chesapeake Bay And we need a champion in the Environmental Protection Agency that will help us in that regard.  I want to talk briefly about the Safe Drinking Water Safe drinking water is critically important. We know that in recent years, we have found too much lead in drinking water. We all know, of course, the story of Flint, I could take you to Baltimore where our schools have to cut off their water fountains because of the unsafe levels of lead in the drinking water, if they were permitted to drink from the water fountains.  We can tell you about so many communities in the Nation that have a desperate need to clean up their safe drinking water so that we can protect our children from lead poisoning. I hope my colleagues understand that there is no safe level of lead in the blood. It robs children of their future. It poisons them. I think most people are familiar with the Freddie Gray tragedy in Freddie Gray was a victim of lead poisoning when he was young.  We owe it to our children to make sure we do everything we can so they are not exposed to lead. I asked questions about that during the confirmation hearing of Mr.The answers were less than acceptable and showed his lack of real information about the dangers of lead.  Every Congress should look at their responsibility to build on the record, to leave a cleaner and safer environment for the next generation. The EPA Administrator should be committed to that goal. I do not believe Mr.Pruitt will be that type of leader. For that reason, I will vote against his confirmation.  With that, I suggest the absence of a quorum.  The PRESIDING The clerk will call the roll.  The senior assistant legislative clerk proceeded to call the roll.  ",CREC-2017-02-16-pt1-PgS1230.txt,,ADJOURNMENT,2017.0,16.0,March
8533,topic-id,20,"Mr.President, I yield the remaining time I have to Senator  The PRESIDING The Senator has that right.  The Senator from  ",CREC-2017-02-16-pt1-PgS1230.txt,,EXECUTIVE CALENDAR,2017.0,16.0,February
