speech_id,topic_id,word_count,speech_text,file_name,speaker_id,session_title,year,day,month
7737,topic-id,334,"Mr.Chairman, I yield myself such time as I may consume.  Since this bill was marked up in the last Congress, the very same plausibility standard used in this bill was adopted by the Federal Circuit Court of Appeals in which fraudulent joinder cases arise with the greatest frequency.  Last Congress, Ranking Member Conyers said of the bill, it should simply pick one of the existing articulations in the fraudulent joinder standard and codify that into law. At the time, the plausibility approach was applied by some district courts, but just last year, the Fifth Circuit Court of Appeals adopted the same plausibility standard this bill contains in a case called International  The Fifth Circuit stated: We must consider whether the plaintiff pleaded ``enough facts to state a claim to relieve that is plausible on its face.'' The plaintiff in that case petitioned for rehearing en banc, but the rehearing was denied, with not a single judge on the Fifth Circuit requesting a vote.  In just the last year, district courts in the Fifth Circuit have issued more than 40 fraudulent joinder decisions without much difficulty and with the results that indicate just the sort of reasonable reform that would occur nationwide when we get this bill passed into law.  So this is about making the system work and opening the door to the Federal courts so companies from foreign states are not unfairly, potentially disadvantaged.  The other piece of this that is easy to neglect is the local defendant. I don't know if the gentleman across the aisle has ever been sued. I have friends who have been sued. It is an emotionally and financially devastating procedure. You have got to take time off from your life and business to defend it. You have got to hire a lawyer, which is incredibly expensive. This is to protect the innocent third parties and open the doors to the Federal courts and just make it fairer and easier.  Mr.Chairman, I reserve the balance of my time.  ",CREC-2017-03-09-pt1-PgH1968-2.txt,2067,EXECUTIVE CALENDAR--Continued,2017.0,9.0,March
7740,topic-id,184,"Mr.Chairman, I yield myself such time as I may consume.  Mr.Chairman, this bill is not about protecting big corporations. This bill is about protecting the small-business owner or the employee who is fraudulently joined into a case who has to go out and hire his or her own lawyer.  I remember something my law school professor once told me back in the day at Mary's University School of Law in San Antonio, Texas, and it stuck in my mind ever since: When you get sued, you may be able to beat the rap, but you can't beat the ride.  It is expensive, it is emotionally draining, and it is time consuming.  I have no problem at all, and this bill is not designed to protect corporations. It is designed to protect, just as its name states, innocent parties. These are people who are joined solely to defeat diversity jurisdiction. We are just changing the standard slightly to one adopted by the Fifth Circuit Court of Appeals to make it much more fair to these innocent parties.  Mr.Chairman, I reserve the balance of my time.  ",CREC-2017-03-09-pt1-PgH1968-2.txt,2067,INNOCENT PARTY PROTECTION ACT,2017.0,9.0,March
7742,topic-id,134,"Mr.Chairman, in the gentleman from Georgia's example, this bill wouldn't apply at all. If my grandmother were assaulted in a nursing home, I would certainly sue the nursing home company. I would also join the person who actually did it who most likely definitely will be a resident of the State that the lawsuit was going in. There would clearly be a plausible cause of action against that tortfeasor.  Mr.Chairman, I didn't practice personal injury law. I was an agriculture lawyer. But this would be an easy case for me to prove in his example. We are not trying to protect anybody who has done something wrong. We are trying to protect people who are joined into a lawsuit solely for the purpose of forum shopping.  Mr.Chairman, I reserve the balance of my time.  ",CREC-2017-03-09-pt1-PgH1968-2.txt,2067,INNOCENT PARTY PROTECTION ACT,2017.0,9.0,March
7744,topic-id,663,"Mr.Chairman, I yield myself the balance of my time.  Mr.Chairman, this really is about trying to stop bringing phony cases in. You are bringing phony defendants in, and that is what we are trying to stop. We have got to be fair about this.  It is not often that we have the opportunity to protect innocent local folks and businesses from costly and meritless lawsuits. This is an opportunity to rein in forum shopping and abuses by trial lawyers and hold them to a good faith standard in litigation. We can do that by passing a bill that is just a few pages long. That is the opportunity we have today.  All this bill does--all this bill does--is say that innocent, local parties--mostly small businesses--can't be added to a lawsuit for forum shopping purposes, and it only prohibits this when there is no plausible case against these small businesses or the case against them isn't brought in good faith.  Who could argue with that?  Mr.Chairman, for that reason, I urge all my colleagues to support this legislation, and I yield back the balance of my time.  The Acting CHAIR (Mr.Simpson). All time for general debate has expired.  Pursuant to the rule, the bill shall be considered for amendment under the 5-minute rule, and shall be considered as read.  The text of the bill is as follow:                                H.725       Be it enacted by the Senate and House of Representatives of      the United States of America in Congress assembled,     SECTION 1. SHORT       This Act may be cited as the ``Innocent Party Protection      Act''.     2. PREVENTION OF FRAUDULENT       Section 1447 of title 28, United States Code, is amended by      adding at the end the following:       ``(f) Fraudulent Joinder.--       ``(1) This subsection shall apply to any case in which--       ``(A) a civil action is removed solely on the basis of the      jurisdiction conferred by section 1332(a);       ``(B) a motion to remand is made on the ground that--       ``(i) one or more defendants are citizens of the same State      as one or more plaintiffs; or       ``(ii) one or more defendants properly joined and served      are citizens of the State in which the action was brought;      and       ``(C) the motion is opposed on the ground that the joinder      of the defendant or defendants described in subparagraph (B)      is fraudulent.       ``(2) The joinder of a defendant described in paragraph      (1)(B) is fraudulent if the court finds that--       ``(A) there is actual fraud in the pleading of      jurisdictional facts with respect to that defendant;       ``(B) based on the complaint and the materials submitted      under paragraph (3), it is not plausible to conclude that      applicable State law would impose liability on that      defendant;       ``(C) State or Federal law clearly bars all claims in the      complaint against that defendant; or       ``(D) objective evidence clearly demonstrates that there is      no good faith intention to prosecute the action against that      defendant or to seek a joint judgment including that      defendant.       ``(3) In determining whether to grant or deny a motion      under paragraph (1)(B), the court may permit the pleadings to      be amended, and shall consider the pleadings, affidavits, and      other evidence submitted by the parties.       ``(4) If the court finds that all defendants described in      paragraph (1)(B) have been fraudulently joined under      paragraph (2), it shall dismiss without prejudice the claims      against those defendants and shall deny the motion described      in paragraph (1)(B).''.  The Acting No amendment to the bill shall be in order except those printed in House Report 115-27. Each such amendment may be offered only in the order printed in the report, by a Member designated in the report, shall be considered read, shall be debatable for the time specified in the report, equally divided and controlled by the proponent and an opponent, shall not be subject to amendment, and shall not be subject to a demand for division of the question.                  Amendment 1 Offered by Mr.Soto  The Acting It is now in order to consider amendment 1 printed in House Report 115-27.  ",CREC-2017-03-09-pt1-PgH1968-2.txt,2067,INNOCENT PARTY PROTECTION ACT,2017.0,9.0,March
7747,topic-id,18,"Mr.Chairman, I claim the time in opposition.  The Acting The gentleman from Texas is recognized for 5 minutes.  ",CREC-2017-03-09-pt1-PgH1968-2.txt,2067,INNOCENT PARTY PROTECTION ACT,2017.0,9.0,March
7748,topic-id,324,"Mr.Chairman, this amendment should be roundly opposed for the simple reason it doesn't protect any victims, but it also victimizes local parties in the types of cases covered by the amendment.  The purpose of the underlying bill is to allow judges greater discretion to free innocent local parties--that is, innocent people and innocent small businesses--from lawsuits when those innocent local parties are dragged into a case solely because a plaintiff's attorney wants to do some forum shopping.  These innocent local parties have, at most, an attenuated connection to the claims made by the trial lawyer against some national company a thousand miles away. These innocent local parties shouldn't have to suffer the time, expense, and emotional drain of a lawsuit when the plaintiff can't even come up with a plausible claim. The base bill protects these innocent local parties from being dragged into a lawsuit as a party just to keep the case in State court.  Now, let's bring in this amendment, which denies the bill's protection to innocent local parties adjoined to a lawsuit simply because the legal allegations in the case fall into one arbitrary category and that one is in another. It is terribly unfair.  This amendment would allow these things to happen to innocent people in the name of allowing trial lawyers to scuttle the hydraulic fracking industry through lawsuits. Innocent people are innocent people, and they should be protected against being dragged into lawsuits regardless of the nature of the case.  This doesn't deny anybody access to the courts. It protects innocent parties from being dragged into a case for forum shopping.  Every single one of the gentleman's cases will be heard in court. They will have their day in court and they will have justice based on the facts.  This bill does not protect wrongdoing corporations. This bill protects people who are dragged into a lawsuit strictly for procedural purposes.  Mr.Chairman, I reserve the balance of my time.  ",CREC-2017-03-09-pt1-PgH1968-2.txt,2067,INNOCENT PARTY PROTECTION ACT,2017.0,9.0,March
7752,topic-id,171,"Mr.Chairman, I am not going to get sucked into a debate of hydraulic fracking. Being from Texas, we might have a whole difference of opinion on that.  But I do want to point out, with respect to this bill, it doesn't deny anyone access to courts, it doesn't deny anyone access to justice regardless of what claim. I don't think it is fair we take out one particular claim or not one particular claim. That seems to go against fundamental fairness as well.  This bill is all about fairness. It is about fairness to keep people from being dragged into court solely because a plaintiff's attorney needs a local defendant to avoid diversity jurisdiction.  I oppose this amendment. I urge my colleagues to support this amendment and support the underlying bill.  Mr.Chairman, I yield back the balance of my time.  The Acting The question is on the amendment offered by the gentleman from Florida (Mr.Soto).  The question was taken; and the Acting Chair announced that the noes appeared to have it.  ",CREC-2017-03-09-pt1-PgH1968-2.txt,2067,PROVIDING FOR CONGRESSIONAL DISAPPROVAL OF FINAL RULE BY SECRETARY OF,2017.0,9.0,March
7756,topic-id,18,"Mr.Chair, I claim the time in opposition.  The Acting The gentleman from Texas is recognized for 5 minutes.  ",CREC-2017-03-09-pt1-PgH1968-2.txt,2067,PROVIDING FOR CONGRESSIONAL DISAPPROVAL OF FINAL RULE BY SECRETARY OF,2017.0,9.0,March
7757,topic-id,593,"Mr.Chairman, this amendment continues to victimize innocent local parties just because they happen to be in an insurance case.  The underlying bill is designed to protect folks from being dragged into a lawsuit just to facilitate forum shopping by plaintiffs' attorneys.  The purpose of this bill is to allow judges greater discretion to free these innocent local parties. They are the ones that are suffering as a result of this.  This amendment denies the bill's protection to innocent local parties joined to a lawsuit simply because the legal allegations in the case fall into one arbitrary category rather than another, just like the previous amendment. It is terribly unfair. Innocent people are innocent people, and they should be protected from being dragged into a lawsuit regardless of the nature of the case.  The rules we have developed in this great country to protect the innocent are rules of general application, such as the rules protecting people's rights to have their side of the story told and the rules protecting people from biased or inaccurate testimony.  We should all be appalled by the suggestion that these general protections designed to protect innocent people from criminal liability should be suspended because the case is one of assault and battery or murder or somehow relates to insurance. It is the same kind of logic.                              {time}  1545  Our country is rightfully proud of its principles providing due process and equal protection, but these concepts are meaningless if they are only selectively applied to some type of cases and not others. And for the same reason, we should all be outraged at the suggestion that the rules of fairness, designed to protect the innocent, should be suspended in civil law cases because a case involves one particular subject matter or another. But that is exactly what this misguided amendment does.  This amendment would allow a plaintiff's lawyer to drag an individual insurance adjuster into a lawsuit even when the applicable State law makes it absolutely clear that only insurers, not individual people, are subject to bad faith claims. How does the sponsor explain this to a person like Jack Stout, why a lawyer pulled him into a bad faith lawsuit targeting State Farm? Mr.Stout was a local insurance agent who merely sold a policy to the plaintiff, met and spoke with the plaintiff once, and had nothing to do with processing the plaintiff's homeowner's insurance claim. A Federal District Court in Oklahoma found he was fraudulently joined and dismissed the claim against him, but under this amendment, the innocent person would have been stuck back in the lawsuit.  What about a person like Douglas Bradley, where the plaintiff's lawyer named him as a defendant in a bad faith lawsuit against an insurer? In that case, the complaint included Mr.Bradley, an insurance agent, as a defendant in the caption of the case. It referred to defendant, singular, not defendants. Throughout the entire pleadings, it didn't even mention his name. A Federal District Court in Indiana dismissed this claim against him as fraudulently joined, but under this amendment, this innocent person would have been stuck back in the lawsuit. It is not fair, it is expensive, and it is emotionally draining to these innocent parties.  For that reason, I urge opposition to the amendment and support of the underlying bill.  Mr.Chairman, I yield back the balance of my time.  The Acting The question is on the amendment offered by the gentleman from Pennsylvania (Mr.Cartwright).  The question was taken; and the Acting Chair announced that the noes appeared to have it.  ",CREC-2017-03-09-pt1-PgH1968-2.txt,2067,DIGITAL GLOBAL ACCESS POLICY ACT OF 2017,2017.0,9.0,February
7759,topic-id,73,"Mr.Chairman, I move that the Committee do now rise.  The motion was agreed to.  Accordingly, the Committee rose; and the Speaker pro tempore (Mr.Nunes) having assumed the chair, Mr.Simpson, Acting Chair of the Committee of the Whole House on the state of the Union, reported that that Committee, having had under consideration the bill (H.725) to amend title 28, United States Code, to prevent fraudulent joinder, had come to no resolution thereon.                          ____________________",CREC-2017-03-09-pt1-PgH1968-2.txt,2067,DIGITAL GLOBAL ACCESS POLICY ACT OF 2017,2017.0,9.0,March
