speech_id,topic_id,word_count,speech_text,file_name,speaker_id,session_title,year,day,month
7927,topic-id,877,"Mr.President, I come to the floor with a labor of love before the U.We are talking about confirmations of people for Secretary positions on the Cabinet of the new We are talking about all kinds of things. We are in a budget period of time. We are talking about this year having two budgets--one we are going to use early and one we are going to use late.  The truth is, since 1980, we haven't passed all 12 appropriations bills in the year but twice. In other words, in the last 37 years, we have only twice done our job that we ought to do every year. So 2 years out of 37 we did it; 35 years we did not do it.  I am joining with the distinguished Senator from New Hampshire, a great Governor of that State and now a great Member of the U.Senate, to propound for the third Congress in a row an idea that is so simple and so great that it works and it works for all the American people. It is called a biennial budget process. What it does is it embraces a discipline for how you budget to bring about the right solutions in terms of what you do budget.  What the biennial budget process does is it says this. We would be far better off if we had more oversight of spending, more authorization projects, and more discipline in the way we spend money we are already spending before we start appropriating more.  Therefore, in every even-numbered year, we ought to do oversight of our spending, we ought to do accountability in our spending processes, we ought to do accountability in our spending process, and we ought to do no appropriations.  In our odd-numbered years, the nonelection years, is when you appropriate. Every other year you are spending, and then every other year you are doing accountability. What that causes is the cream to rise to the top. All of a sudden in 1 year, instead of departments coming to say we don't have time to oversight, we have to authorize more, they come to you and say: Here is how we spent our money, here are the savings we have found, and here is how we want to move forward in a more efficient way.  It is a little bit like my kitchen table and my family. All the way through my 49 years of marriage, my wife and I and our kids have sat around the kitchen table, decided what our family priorities are, from our vacations to our jobs, and then we budget our money for that year so we can pay our bills, enjoy the time we had together, and end up not being broke at the of the year.  What happens when you don't do that and you are a government is you end up owing $19 trillion and don't know how to pay for it. We cannot continue to spend at the escalated rate that we are spending without more accountability on the process so I think the biennial process is the right way to go.  There is some documentation for that. The distinguished Senator from New Hampshire was a Governor of her State who had a biennial budget, but 19 of the 50 States have biennial budgets already. They work, and they work fine. They give them the luxury of doing what we don't do in Washington, they give them the luxury of having the time to study their appropriations, find savings in existing taxation before they start raising anybody's taxes or appropriating anymore.  It is a simple, disciplined way to go about the business of spending the people's money in the same way they make their determination.  I ran a pretty large company for 19 years and was in business for 35 years before I came to I know that running a business is hard, but it is not hard because it is complex; it is hard because it is tough. Prioritizing your appropriations is tough business.[[Page S842]]Somebody has to do it, and the people who are elected to the Congress of the United States are elected to do that job.  I am proud to join Senator Shaheen on the floor today and urge all Members to vote for a biennial budget process in the Congress of the United I remind everyone in the room that we had this vote a few years ago as a test vote on an all-night vote-arama on the budget, and we got 72 votes, if I remember correctly, in favor of the biennial budget. We have had past Budget Committee chairmen vote in favor of the biennial budget.  We have had people from the majority and the minority vote for it. The fact is, it is a good idea whose time has come. I am pleased to join Senator Shaheen from New Hampshire and plead to the Members of the U.Senate to do what we ask the American people to do. Let's prioritize the way we spend our money, find savings where we can, and run a more efficient, more honest government, and a more transparent government for all.  Mr.President, I yield to the distinguished Senator from New  The PRESIDING The Senator from New  ",CREC-2017-02-06-pt2-PgS825.txt,1608,PROVIDING FOR CONGRESSIONAL DISAPPROVAL OF FINAL RULE BY SECRETARY OF,2017.0,6.0,February
7844,topic-id,191,"Madam Speaker, I rise in strong opposition to this resolution. For many people, particularly women, title X funding literally means the difference between receiving reproductive health care or being forced to go without birth control, critical cancer screenings, and other preventive care.  For the 4 in 10 women who access health care at title X-funded providers, cutting this funding would mean cutting their access to health care altogether. For people of color, rural communities, and those who struggle to make ends meet, cutting title X funds will certainly have a disproportionate impact.  Let's be very clear that these funds are not controversial, but the Republican majority in Congress and anti-choice groups are doing their best to create a false narrative in order to demonize this funding, which has done nothing but improve the lives of millions of people. Cutting this funding would actually increase the number of unwanted pregnancies by nearly 1 million in just a year alone and would increase abortions by 33 percent.  Women need title X so they can continue to make decisions with their doctors. It is 2017, and a woman's uterus is not a political football.  ",CREC-2017-02-16-pt1-PgH1268.txt,99999999999999,PROVIDING FOR CONGRESSIONAL DISAPPROVAL OF FINAL RULE BY SECRETARY OF,2017.0,16.0,February
8107,topic-id,144,"Mr.Speaker, I have a new name for the process Republicans are using to destroy the Affordable Care Instead of repeal and replace, how about we name it ``we cut and gut''? Cut taxes for millionaires and billionaires, and gut coverage for hardworking  The bill would also undermine the Medicaid expansion in the Affordable Care In Nevada, our own Governor Brian Sandoval, a Republican, made the decision to work with Democrats and expand the Medicaid program. Because we expanded Medicaid, 320,000 Nevadans now have health coverage, and Nevada's uninsured rate has dropped from 23 percent to 12 percent, one of the largest declines in the entire country.  So, Mr.Speaker, I would ask my Republican colleagues: Do you really want to turn your backs on hardworking families just to give billionaires a tax cut that they don't need or deserve?  Mr.Speaker, the silence is deafening.                          ____________________",CREC-2017-03-10-pt1-PgH2045-5.txt,99999999999999,PROVIDING FOR CONGRESSIONAL DISAPPROVAL OF FINAL RULE BY SECRETARY OF,2017.0,10.0,February
7850,topic-id,194,"Madam Speaker, I thank my friend for her incredible leadership on this issue.  Rather than working across the aisle with Democrats to grow our economy, to rebuild older communities, to create new jobs, Republicans are, again, focused on attacking women's health, undermining healthcare programs that provide preventive care for over 4 million Americans, many low-income women who would otherwise be uninsured.  Eliminating this rule makes it harder for women and families to have access to lifesaving cancer screenings, for example, birth control, and other vital health services. These funds are providing necessary health services, Madam Speaker, and everyone in this debate knows what this is about. These dollars do not support abortion. We know Federal law prohibits these dollars from being used for that purpose, but to hear our friends on the other side, they would imply that is the case.  Now, there is and should be a legitimate debate on that subject, but it has been the law and it continues to be the law that these dollars are not used for abortion services. This is about health care. This is about lifesaving health[[Page H1276]]care for women, and it ought to be preserved.  ",CREC-2017-02-16-pt1-PgH1268.txt,2134,PROVIDING FOR CONGRESSIONAL DISAPPROVAL OF FINAL RULE BY SECRETARY OF,2017.0,16.0,February
7929,topic-id,22,"Mr.President, I ask unanimous consent that the order for the quorum call be rescinded.  The PRESIDING Without objection, it is so ordered.  ",CREC-2017-02-06-pt2-PgS825.txt,1724,PROVIDING FOR CONGRESSIONAL DISAPPROVAL OF FINAL RULE BY SECRETARY OF,2017.0,6.0,February
7930,topic-id,22,"Mr.President, I yield the remainder of my post closure debate time to Senator Feinstein from  The PRESIDING The Senator has that right.  ",CREC-2017-02-06-pt2-PgS825.txt,1724,PROVIDING FOR CONGRESSIONAL DISAPPROVAL OF FINAL RULE BY SECRETARY OF,2017.0,6.0,February
7931,topic-id,24,"Mr.President, I suggest the absence of a quorum.  The PRESIDING The clerk will call the roll.  The bill clerk proceeded to call the roll.  ",CREC-2017-02-06-pt2-PgS825.txt,1724,PROVIDING FOR CONGRESSIONAL DISAPPROVAL OF FINAL RULE BY SECRETARY OF,2017.0,6.0,March
7965,topic-id,11,"Mr.President, Parliamentary inquiry.  The PRESIDING The Senator will state his inquiry.  ",CREC-2017-02-06-pt2-PgS825.txt,1724,WORKING TO INTEGRATE NETWORKS GUARANTEEING MEMBER ACCESS NOW ACT,2017.0,6.0,February
7966,topic-id,38,"In the opinion of the Chair, would one Senator calling another Senator a liar during debate on the floor of the Senate be a violation of rule XIX?  The PRESIDING In the opinion of the Chair, it would.  ",CREC-2017-02-06-pt2-PgS825.txt,1724,WORKING TO INTEGRATE NETWORKS GUARANTEEING MEMBER ACCESS NOW ACT,2017.0,6.0,February
7967,topic-id,50,"Thank you, Mr. I yield back.  The PRESIDING The Senate majority leader.  Mr.Here is what transpired. Senator Warren was giving a lengthy speech. She had appeared to violate the rule. She was warned. She was given an explanation. Nevertheless, she persisted.  I yield the floor.  The PRESIDING The Senator from  ",CREC-2017-02-06-pt2-PgS825.txt,1724,"HONORING THE MEMORY OF COLONEL HOWARD MERRITT STEELE, JR.",2017.0,6.0,February
7947,topic-id,1813,"Mr.President, I rise today to join my colleagues and make remarks on Senator Sessions' nomination to serve as Attorney I will be coming back later this evening to focus on voting rights and some of the other issues at hand--freedom of the press, antitrust. I am actually the ranking member on that subcommittee, and while Senator Sessions has assured me that if confirmed, he will keep the independence of that part of the Justice Department away from outside influence from the White House, I am very focused on that because I think we have seen a wave of mergers, and I want to address that more in depth later.  I worked successfully with Senator Sessions on a number of UC's over the years such as adoption and human trafficking. We have worked together well, and if he is confirmed, I am sure we will find some areas of common agreement. I am not supporting him, however, and I have told him this in person and I have talked about it at the Judiciary Committee because of my concerns relating to some of his views on some of the core functions of the Justice Department, and that is enforcing voting rights, the handling of immigration issues, the freedom of the press, and the Violence Against Women  Now, he has assured me that he will keep the Office on Violence Against Women funded--which I appreciate--in the Justice Department, but I was very concerned that he had actually voted against the Violence Against Women Act Reauthorization recently. It was something that the majority of Republican Senators voted for and every single woman Senator, Democrat or Republican, voted in favor of.  As a prosecutor and a U.Senator, one of my main criminal justice priorities has been enforcing and reauthorizing VAWA or the Violence Against Women It is a bill that took roots in my State, thanks to the efforts on the initial bill of former Senator Paul Wellstone and his wife Both of them tragically died in a plane crash, and we miss them very much. But Paul and Sheila's legacy lives on in the work of the Violence Against Women  It has a long history, as the President knows, of bipartisan support. Since it was first passed in 1994, we have made great strides in raising awareness that these are serious crimes, not shameful secrets. Since the enactment of the Violence Against Women Act, annual domestic violence rates have fallen by 50 percent, but the statistics make clear that domestic violence, stalking, and sexual assault are still a major problem in According to data from the Centers for Disease Control and Prevention, for every minute, 20 people in the United States are victims of physical violence by an intimate partner. That is about 10 million people every year.  Millions more individuals are the victims of stalking crimes each year, with approximately 15 percent of women at some point during their lifetime experiencing stalking, during which they feel very fearful or believe that they or someone close to them could be harmed or killed.  I would like to note briefly that I am pleased that the Senate recently passed the resolution that Senator Perdue and I introduced on stalking to raise awareness. I have been confronted by these issues of domestic violence and stalking since before I became a In fact, that is when I was Hennepin County attorney. That is the largest prosecutor's office in our I managed an office of about 400 people. With that big office handling everything from representing our State's biggest public hospital to violent murder cases, the poster that you saw when you walked into our office and down the hallway so that everyone could see it was a picture of a woman who was beaten up. She had a Band-Aid over her nose, and she was holding a little baby boy. The words read: Beat your wife, and it is your son that goes to jail. Why? That poster reminds everyone that domestic violence and sexual assault just don't hurt the immediate victims. They hurt children, families, and entire communities. We know that kids who see violence happen are twice as likely to commit it themselves and to continue the cycle. That is why I worked with Senator Leahy along with Senator Crapo to make sure that the Violence Against Women Act was reauthorized.  What does this legislation do? The legislation ensures that law enforcement has the tools to prosecute domestic and sexual violence and ensures that victims have the support they need to get back on their feet. But we also made some important updates on the law, including addressing the problem of above average levels of domestic violence in tribal areas, by allowing tribal courts to prosecute and to handle cases with people who are tribal members and in very specific cases when violence is committed on the reservation.  Providing a uniform nondiscrimination provision was also included to ensure services are available to everyone who needs them, including victims in same-sex relationships. The new bill included stronger housing protections for victims and increased accountability for grant recipients. It also strengthened and updated anti-stalking laws to better address the new technologies that predators are using to harass their victims. This was a bipartisan provision that I authored with Republican former Senator Kay Bailey Hutchison of  As I said, all 20 women Senators supported this critical legislation, and it passed with bipartisan support on a vote of 78 to 22, with support from a majority of Senators in Senator Sessions' own party, not to mention men and women across the country.  The reason Senator Sessions had for not voting for the bill was that it was the tribal provisions that he didn't like because of the dual jurisdiction. That just doesn't hold up for me, given what I have seen in my  Now, what does this really mean to people? Let me end this portion of my remarks with two stories. The first is about a case that our office handled, and a prosecutor in our office who was very well thought of handled it in our office, involving two immigrants. This was a case where this man was from Russia, and he beat up his wife repeatedly over the years. They had a little daughter. One day he killed his wife, and then he went to Home Depot and he bought a saw. And then he basically dismembered her and put her in a garbage bag and brought her to another State and dumped her in a river. He left the head in his trunk, and he brought it back to the Twin He eventually confessed to his crime.  The family gathered--and they were a very small family. The mom and dad came from Russia, and then there was the little girl who had been left behind with really no parent to take care of[[Page S848]]her anymore. I went to meet with the family before the funeral with our prosecutor and our victim witness advocate. I heard the story then that at the airport--the little girl had never met her deceased mother's twin sister. They were identical twins. And as they got off the airplane and her grandparents and that aunt got off the airplane, the little girl ran up to that aunt and grabbed her and said ``Mommy, Mommy'' because she thought that it was her mother and that her mother was still alive.  Those are the victims of domestic violence. It is not just the immediate victim; it is everyone around them.  Or, the case in Lake City, MN, of Officer Shawn Schneider, an incredibly brave police officer who was called one day to a domestic violence case. It was a man who was clearly affected by mental illness, who was threatening his 17-year-old girlfriend, and the cop went up to the door, and there he was. He had his bullet proof vest on, but the man shot the police officer in the head, and he died. I attended that funeral.  When I was there, I saw their young family, the two young little boys and this little girl. I heard the story about the last time they were in their church for the nativity play, and the dad was sitting there--the police officer--in the pew, watching his family and his children perform. The next time they were in the church was when that little girl with the blue dress covered in stars was walking down the aisle for her dad's funeral.  That is domestic violence. It does concern me that we did not get support from the nominee. I do appreciate that he said he would continue to fund the Office on Violence Against Women, and I believe that that is very important to the functioning of the Justice  Since its inception in 1995, the Office on Violence Against Women has provided financial and technical assistance to communities nationwide--very important to the Department of  The last thing I want to mention--and I will come back again to some of these other priorities that I think are important, if Senator Sessions is confirmed, to continue to be a focus in the Justice Department, as well as other concerns that I have--is the funding of the COPS program. Republican Senator Murkowski and I are leading that effort. We have always had, especially in the House of Representatives, bipartisan support for the COPS program.  During Senator Sessions' hearing, I made a special note to discuss that issue with Chuck Canterbury, who is the president of the Fraternal Order of Police, and we had a good discussion about that. He stated that he shared my view that this is a very important program, particularly with the sharp decrease in staffing levels we have seen for law enforcement around the country in recent years, including training funding--something that is really important.  The Community Oriented Policing Services, or the COPS program, was established many years ago. It helped to place more than 129,000 police officers on the beat in more than 13,000 State, local, and tribal law enforcement agencies. In fiscal year 2015, the COPS office was able to award grants to just 209 of the over 1,000 law enforcement agencies that applied. It translated into about 915 officers, which is still a lot, but, in fact, there were requests for over 3,000 officers.  I think we can all agree, and hope the administration agrees, that this is a very important program. I will continue to work with Senator Sessions, if he is confirmed, to make sure we have the support from the administration for this program, which, again, is one of the top priorities of the Fraternal Order of Police and other police organizations across the country.  I look forward to discussing other issues when I return, but for now, I yield the floor. Thank you.  The PRESIDING The Senator from  ",CREC-2017-02-06-pt2-PgS825.txt,1826,PROVIDING FOR CONGRESSIONAL DISAPPROVAL OF FINAL RULE BY SECRETARY OF,2017.0,6.0,February
