speech_id,topic_id,word_count,speech_text,file_name,speaker_id,session_title,year,day,month
296,topic-id,714,"Mr.President, I rise in favor of amendment 82. This amendment would make it so anyone inCongress trying to destroy the Affordable Care Act would not be allowed to touch women's health care services.  I have beenlistening to my colleague from Montana and my colleagues in this Chamber speak about health care in our country, and after manyhours, I am worried there is a lack of concern. I am worried there is a basic lack of empathy of what is going to actuallyhappen to millions of Americans, and I am particularly worried about what will happen to women and their children and theirfamilies. So I want to spend a moment just talking about what the ACA actually provides for women and what actually will happenwhen it is no longer there.  I am very concerned that we are barely 1 week into the new Congress and too many of mycolleagues have already made it clear that their most urgent priority this year is to take our country back to its darker dayswhen women could be denied coverage and charged higher health care premiums just because they are women. I am outraged by this,and I stand with millions of American women and men, moms and dads, sons and daughters who are outraged too. The Affordable CareAct uniquely gave women access to health care on a level that was unprecedented. In fact, 9.5 million more women now have accessto basic health care because of that law.  In my State alone, thanks to the Affordable Care Act, women can now have access tocontraceptive care, cancer screenings, and mammograms. Millions of women who were pregnant or survived diseases like cancer areable to keep seeing their doctors without fear that their health insurance companies will take it away, but too many people inthis Chamber don't seem to understand that consequence or seem to care about that consequence. After years of talking about it,some of my colleagues now seem determined--even entitled--to take away this lifesaving health care for millions of women.  Theelection in November was not about women's health care. No one came to Congress with a mandate to take away women's access tomammograms and cancer screenings, but now we are one big step closer to once again making it impossible for millions of Americanwomen to see a doctor when they need to in order to access basic medicine and reproductive health care services so they can livehealthy, happy, productive lives. For some, there is a very real risk that if they do get cancer or some other life-threateningdisease, they will have to declare bankruptcy just to pay for the health care they need. This is something we must standtogether to stop. It will show the American people that we understand what is happening to them. The consequences are too realand too dangerous, and for too many families the consequences are actually life or death.  We should never go back to thedays when insurance companies can tell a woman: You are no longer economic for us. We can't make money insuring pregnant women.We cannot go back to the days where insurance companies can tell a breast cancer survivor to go elsewhere because theirinsurance costs too much. I don't think we can ever go back to the days when insurance companies can simply charge women morefor the same plan than men. We should not turn back women's basic health care rights.  My amendment makes it very clear thatthe Senate would be forbidden from directing the committees to cut funding for basic women's health care services. It wouldensure that the women's health care protections we put into the Affordable Care Act would stay there and women would have accessgoing forward. It protects vital services such as disease screenings and comprehensive reproductive care that millions of womenin my State rely on.  If my colleagues destroy the Affordable Care Act, it will have real, direct, and painful consequencesfor a lot of women and the families who love them. I think it would be what we call the ultimate overreach by Congress, and itwould take years to fix.  I urge my colleagues to not let these protections be taken away from American women and theirfamilies, and I urge my colleagues to join me in supporting this very simple amendment.  I yield the floor.  The The minority leader.  ",CREC-2017-01-11-pt1-PgS224-2.txt,1866,"CONCURRENTRESOLUTION ON THE BUDGET, FISCAL YEAR 2017",2017.0,11.0,February
172,topic-id,213,"Mr.Speaker, I rise today for my first statement from the House floor, honored and humbled to serve as theRepresentative from New Jersey's Fifth Congressional I vow to work tirelessly on their behalf.  We are all tired of Washington's partisanship, and I will work across the aisle, whenever possible, to get things done. NewJersey families and businesses are struggling with high taxes and not seeing good return on investment for the hard-earned taxdollars they send to Washington each year.  I will work to bring those dollars home to fight domestic terror, deal with opioid abuse, improve our schools, and fix ourcrumbling roads and bridges. I will work to bring good-paying jobs back to New Jersey and keep them there, to lower our taxes,cut wasteful spending and unnecessary regulations, and ensure every tax dollar is used wisely.  I will stand up for New Jersey values, ensuring that women, minorities, and the LGBT community are always treated withrespect. I will have the backs of our veterans, law enforcement, firefighters, and all first responders. I will stand withIsrael, ensure our children have clean drinking water, and stand up for equal pay and a woman's right to choose. I will work foreveryone in the  Working together, I believe our best days will always be ahead of us.                          ____________________",CREC-2017-01-11-pt1-PgH315-4.txt,99999999999999,"CONCURRENTRESOLUTION ON THE BUDGET, FISCAL YEAR 2017",2017.0,11.0,January
313,topic-id,664,"Madam President, thereare a lot of pressing issues going on in the country and in the world. These are tough, turbulent times. But Senator Scottand I are going to take a moment or two to talk about a topic that I think millions of Americans appreciate: college football.  In the South, where Tim and I come from, it is as close to being a religion as you can get, and we are here tocelebrate Clemson University becoming the national champion in college football, beating Alabama in the best college footballplayoff game I have ever witnessed in my life.  To the people of Alabama: You had one heck of a ride, a 26-game winningstreak, something you should be proud of.  To the Tigers: You beat the best team in the country, and, to me, the way you wonis as important as the outcome.  DeShaun Watson is probably going to go in the very top of the draft to the I would sayhe is the best college football player in What DeShaun has won for Clemson is unbelievable. The way he has done it iseven more unbelievable. He graduated in 3 years. He is one of the nicest young men I have ever met in my life. His faith means alot to him.  He threw the ball to Hunter Renfrow, who was a walk-on--a young man from a small town in South Carolina whowalked on to the Clemson University team. Because of Coach Dabo Swinney, he had a shot at making the team and wound up catchingthe winning pass to win the national title.  How is this possible? It is possible because of leadership at the top. PresidentClements, our new president, has a vision of Clemson University as aggressive and bold off the field as Dabo has had on thefield. I think Dabo Swinney represents the best in college sports. The Clemson team is truly a family. If I had a son, I wouldwant him to play for  If you are looking for a place to go to school where you would be academically challenged, go toIf you are looking for a place to go to school or to be a part of a community, something bigger than yourself, go toIf you are looking for a place to watch sports at the highest level possible, go to  So I congratulate theWho you beat was impressive, but more impressive is how you have conducted yourself over the last couple of years.  The Clemson program is a model for college athletics. Dabo has an uncanny ability to take people from different backgroundsand mold them into a team. He loves his players and they love him.  I live 5 miles from Clemson University and went to theUniversity of South Carolina, and most of you don't know what that means: the biggest rivalry.  I am proud of I grewup in the shadow of the university, 5 miles from the stadium. I have been around the Clemson Tiger family all my life. Theyconferred an honorary degree upon me a couple of years ago. Given the academic standards at Clemson, that is the only way Iwould have ever graduated from  So I want to tell the Tiger Nation that all of us in South Carolina are so proud ofyour victory on the field, but equally proud of the way you conduct yourself off the field. Clemson University is in the top 20public schools in the country, with no end in sight.  Next year, if I were an Alabama fan, I would be very optimistic. Thisyoung freshman quarterback is coming back. He is an incredible talent. The people of Alabama should be proud of their footballteam and their coaching staff because you have been on top of the mountain for a very long time. I hope you believe that Clemsonis a worthy successor.  Dabo said it best, ``The [tiger] paw is flying on the top of the mountain'' of college football, andthat is saying a lot.  Go  The PRESIDING The Senator from South  ",CREC-2017-01-11-pt1-PgS224-2.txt,2234,1915,2017.0,11.0,January
398,topic-id,151,"Madam President, ObamaCare exacerbated financial pressures on the Medicaid Program at a time when manyStates were already facing difficult choices. Even before ObamaCare, Medicaid was plagued by quality issues and the law didnothing to address these problems. Instead, under ObamaCare, able-bodied adults not previously eligible, including someprisoners, are now covered by Medicaid which has strained already limited resources at the State level.  Republicans arecommitted to working with States, stakeholders, and the American public to improve the quality of the Medicaid Program, ensuringits long-term sustainability. That is reflected in my amendment. My amendment would create a reserve fund to allow for reformsto Medicaid and ensure the program has the right priorities.  I urge my colleagues to vote for my amendment and against theMenendez amendment, which is simply designed to prevent the repeal of ObamaCare and enshrine its flawed approach to Medicaid ina budget point of order.  The PRESIDING The Senator from New  ",CREC-2017-01-11-pt1-PgS224-2.txt,1351,SHILOH NATIONAL MILITARY PARK BOUNDARY ADJUSTMENT AND PARKER'S,2017.0,11.0,April
399,topic-id,59,"Madam President, I move to waive theapplicable provisions of the Budget Act with respect to my amendment, and I ask for the yeas and nays.  The Is there a sufficient second?  There appears to be a sufficient second.  The question is on agreeing to themotion to waive.  The clerk will call the roll.  The legislative clerk called the roll.  ",CREC-2017-01-11-pt1-PgS224-2.txt,1351,SUPPORTING AMERICA'S,2017.0,11.0,April
353,topic-id,118,"Mr.President, amendment 167 is a side-by-side. This amendment makes good on twopromises to the American people. One is to[[Page S255]]repeal ObamaCare, which has increased costs, limited health care choices, andhas raised $1.1 trillion in taxes on the American people in the middle class.  It also makes good on a second promise; thatis, Congress will replace ObamaCare with health care reforms that provide access to quality, affordable health care coverage,not just to dependents under the age of 26 but to all Americans--women, children, seniors, and disabled. We shouldn't be choosingwinners and losers.  A vote against this amendment is a vote against affordable, quality health care for all, and I urge mycolleagues to support it.  The PRESIDING The Senator from  ",CREC-2017-01-11-pt1-PgS224-2.txt,1863,SUPPORTING AMERICA'S,2017.0,11.0,April
356,topic-id,50,"Mr.President, pursuant to section 904 of the CongressionalBudget Act of 1974 and the waiver provisions of applicable budget resolutions, I move to waive all applicable sections of thatact and applicable budget resolutions for the purposes of my amendment, and I ask for the yeas and nays.  The The Senator from  ",CREC-2017-01-11-pt1-PgS224-2.txt,1863,SUPPORTING AMERICA'S,2017.0,11.0,January
39,topic-id,22,"Mr.President, I ask unanimous consent that the order for the quorum call be rescinded.  The PRESIDING Without objection, it is so ordered.  ",CREC-2017-02-28-pt1-PgS1463-2.txt,1844,SUPPORTING AMERICA'S,2017.0,28.0,January
40,topic-id,1260,"Mr.President, last November, I was in Maui celebrating the 100th anniversary of Haleakala National The weather at the summit of the volcano was terrible. It was raining in sheets, with 40-mile-per-hour wind driving the rain sideways, but I was there with over 40 schoolchildren to plant Haleakala silverswords--a special, threatened plant that only grows in the harsh climate at the summit of Haleakala volcano. The silversword can live for almost 100 years before it flowers, spreads its seeds into the wind, and dies.  Silverswords have dotted the landscape of Haleakala's summit for millennia, but invasive species, human activity, and climate change have pushed the plant to near extinction. In the early 1900s, scientists estimated that as few as 50 plants remained on the volcano, but this changed after Haleakala became a national park in 1916. In the 100 years since, park rangers and visitors have made a concerted effort to protect the silverswords from feral goats and sheep and to make sure hikers don't go off the trail and trample their shallow root systems.  After the passage of the Endangered Species Act, the silversword became listed as a threatened species. Through the law, conservationists have provided resources to help restore the silversword population on Haleakala for the hundreds of thousands of people who visit the park every year. Groups of students, including those whom I joined on that cold November day, have planted over 1,000 silverswords to supplement the population of silverswords. They were there to commemorate the 100th anniversary of the Haleakala National  I share this story because it demonstrates many of the reasons the Department of Interior is so important in the role it plays in preserving our public lands.  Business is booming at our national parks. In 2015, our national parks hosted 305 million visitors--a new record--and these visitors generated $17 billion in economic activity in nearby communities.  Our national parks are suffering from an overwhelming deferred maintenance backlog of $12 billion. Our national parks are also understaffed. Because of sequestration and a variety of other factors, 10 percent fewer people work in our national parks today than 5 years ago. This is at a time when visitors to our parks are ever growing. This means fewer rangers and support staff dedicated to maintaining parks like Haleakala and protecting species like the silversword. To add to this, the administration has put a 90-day hiring freeze in place that threatens nearly 2,000 permanent vacancies that are critical to helping our national parks function.  We need an Interior Secretary capable of standing up to the President to make preserving our public lands a priority. But during my meeting with Nominee Zinke and his confirmation hearing before the Committee on Energy and Natural Resources, on which I sit--and his record as a Member of Congress--I did not receive the assurances and commitments I needed to support his confirmation as Interior Although he expressed some support for the Land and Water Conservation Fund, or the LWCF--an important program that funds land purchases to add to protective areas like our national parks--he said the program could benefit from some ``changes.'' The only change I wish to see is to permanently reauthorize and fully fund the LWCF, which has suffered from chronic underfunding throughout its history, and I will continue to work with my colleagues, like Senator Maria Cantwell, who is ranking member of the Committee on Energy and Natural Resources in the Senate, to accomplish this goal.  We also need an Interior Secretary committed to preserving our public lands, not exploiting them for fossil fuel production. Congressman Zinke and the Trump administration are too wedded to the fossil fuel industry and fail this test as well.  Supporting alternative and renewable energy development is an issue people in Hawaii and, I would say, a lot of people in the rest of our country care about.  Earlier this year, I received a letter from Michael from Pahoa, who said that Representative Zinke ``has consistently voted for carbon heavy energy sources. His anti-environmental record shows a leaning that could well move exploration and extraction to areas formerly closed to exploitation. With interests in oil pipelines, he has a conflict of interest in moving away from fossil fuels and into alternative and renewable resources. We have destroyed enough of the country for the enrichment of the 1% with little to no benefit to the rest of our citizens. He is a destroyer, not a fixer. Not someone for the environment or the people.''[[Page S1466]]  Congressman Zinke also does not share a commitment to protecting endangered and threatened species like the silversword. While in the House, Congressman Zinke voted to block funding for any listed endangered species on which the Fish and Wildlife Service failed to conduct a 5-year review. It didn't seem to matter to Congressman Zinke that the reason these reviews did not take place was because Republicans in Congress failed to appropriate the necessary funding to conduct these reviews. Cutting funding in this way would devastate conservation and recovery efforts for as many as 850 species across the Nation, 137 of which are in Hawaii and 1 of which is the Haleakala silversword.  During the confirmation process, I asked Congressman Zinke if as Secretary he would work with Congress to ensure that the Fish and Wildlife Service would receive sufficient funding to conduct these reviews and recover our Nation's endangered species. He responded by saying that he would ``work closely with Congress to ensure recovery programs are appropriately funded.'' I don't know what he means by ``appropriate,'' but I do have a feeling that my view of sufficient funding, which is the question I asked him, and his answer that he would support appropriate funding are probably very different. In fact, I wonder if, under Secretary Zinke, there would have been the funding necessary to help Maui students plant their 1,000 silverswords on Haleakala's summit. This is wrong.  Congressman Zinke also does not share a commitment to combating climate change or supporting research that will help in that effort.  Washington, DC--do you notice how warm it is? It is It is 60 degrees. Washington, DC, is on track to have experienced the warmest February on record. We have a new administration stocked full of climate deniers. As Secretary of the Interior, Congressman Zinke will be leading the U.Geological Survey, the USGS, an agency that lists climate change as one of its top mission areas.  During his confirmation process, I asked Congressman Zinke if he would try to limit the USGS's work on climate change in any way. Unfortunately, Congressman Zinke did not provide a definitive answer--only saying that he would need to learn about the USGS's role in climate change research. His answer did not reassure me that he will allow USGS and other agencies in his Department to continue to make climate change research a priority or to protect the right of these scientists to pursue their research without interference. This is particularly concerning in light of the Trump administration's ongoing efforts to silence our Federal workers, including those within the National Park Service, who are speaking out about the threat of climate change.  We need a Secretary of the Interior who will protect our public lands, make investments to conserve our endangered and threatened species, and who will continue to confront climate change. His record of past statements demonstrates that Congressman Zinke is not the right person to lead the Department of Interior at this juncture, at this critical stage. I urge my colleagues to oppose his nomination.  I yield the floor.  ",CREC-2017-02-28-pt1-PgS1463-2.txt,1844,SUPPORTING AMERICA'S,2017.0,28.0,January
42,topic-id,23,I suggest the absence of a quorum.  The PRESIDING The clerk will call the roll.  The bill clerk proceeded to call the roll.  ,CREC-2017-02-28-pt1-PgS1463-2.txt,1844,SUPPORTING AMERICA'S,2017.0,28.0,January
121,topic-id,23,"Mr.President, I ask unanimous consent that the order for the quorum call be rescinded.  The PRESIDING Without objection, it is so ordered.                          ____________________",CREC-2017-03-28-pt1-PgS2039-2.txt,1844,MORNING BUSINESS,2017.0,28.0,January
