speech_id,topic_id,word_count,speech_text,file_name,speaker_id,session_title,year,day,month
13018,topic-id,585,"Madam Speaker, this letter, which I think my colleagues will find convincing, has 310 groups that have signed on in support of this rule, including groups from across the ideological spectrum, across the States, many faith-based groups, and many others, including from my friend from Colorado's and my home State, the Interfaith Alliance of Colorado; the National Council of Jewish Women, Colorado Section; the NAACP State Conference of Colorado; the Colorado Fiscal Institute; the Colorado Council of Churches; the Colorado Alliance of Retired Americans, and many others.                              {time}  1245  So I am glad that this will appear in the Record for all of Congress to see. I will encourage my colleagues to read this letter and see who signed it before casting your vote on the repeal of this rule, the Congressional disapproval resolution. So this will appear in the Record, and I know that my colleagues will study that Record before making their decision.  Prior to the creation of the Consumer Financial Protection Bureau, Federal consumer protection laws were enforced by a number of different regulators and different agencies. This was uneven and, after the 2008 financial crisis, I was personally glad that we were able to pull together the efforts to protect consumers in the Consumer Financial Protection  But despite their success, Republicans have been going after the Consumer Financial Protection Bureau ever since. Despite record profits by banks and Wall Street, here we are trying to go back to a time when there was nobody to keep them in check. Despite the Consumer Financial Protection Bureau returning nearly $12 billion to harmed consumers, the Republicans continue to attack the agency.  This is entirely the purpose that the Consumer Financial Protection Bureau was created, this type of rule. Congress specifically authorized the Consumer Financial Protection Bureau to study forced arbitration agreements, and determine what steps were necessary.  The Bureau undertook an extensive rulemaking process that had public comments. I hope my colleagues across the aisle who support this repeal were active in that public comment process because that was an important time to be heard. The banks participated in that, consumer groups, and so many other stakeholders before the final rule was issued.  My colleagues across the aisle have not offered any evidence in support of this resolution of disapproval. Why are you seeking to strip rights away from consumers in this fashion?  The Consumer Financial Protection Bureau found that just 400 consumers per year pursue claims in arbitration, with only 16 receiving any cash relief. Again, when you are ripped off of a relatively small amount of money, you don't have redress in the courts as a sole plaintiff. You don't have redress--I shouldn't say you don't; you technically do--you don't have an economic form of redress in the courts, and you don't have an economically viable form of redress through arbitration.  So the only true mechanism, if you have a million people, each of whom are deprived of $20 or $50, the only realistic legal mechanism is a class action lawsuit, which this rule would protect.  There is also no evidence to show, no studies--I would challenge my colleagues to cite them if there are--to show that removing this type of clause can somehow increase costs to consumers.  Frankly, this resolution of disapproval is just a giveaway to big banks at the expense of you, me, everybody who has a credit card, everybody who has a loan--the wrong direction for the country.  Madam Speaker, I reserve the balance of my time.  ",CREC-2017-07-25-pt1-PgH6225-6.txt,1910,AUTHORIZING USE OF CAPITOL GROUNDS FOR NATIONAL PEACE OFFICERS MEMORIAL,2017.0,25.0,April
13021,topic-id,17,"It is wonderful to have so many Coloradans here, isn't it, Madam Speaker?  The SPEAKER pro tempore.  ",CREC-2017-07-25-pt1-PgH6225-6.txt,1910,NATIONAL DEFENSE AUTHORIZATION ACT FOR FISCAL YEAR 2018,2017.0,25.0,May
13022,topic-id,20,"Madam Speaker, I yield 3 minutes to the gentleman from Texas (Mr.Doggett), another great State that borders the State of  ",CREC-2017-07-25-pt1-PgH6225-6.txt,1910,VOICING SUPPORT FOR SCIENTISTS AND FEDERAL WORKERS,2017.0,25.0,July
13026,topic-id,12,"Madam Speaker, I yield 2 minutes to the gentlewoman from Ohio (",CREC-2017-07-25-pt1-PgH6225-6.txt,1910,IMMIGRATION,2017.0,25.0,April
13028,topic-id,11,"Madam Speaker, I yield an additional 1 minute to the gentlewoman.  ",CREC-2017-07-25-pt1-PgH6225-6.txt,1910,IMMIGRATION,2017.0,25.0,April
13030,topic-id,204,"Madam Speaker, I yield myself such time as I may consume.  Madam Speaker, for months now we have been debating bills that hurt hardworking Americans--bills that kick millions, tens of millions, of people off health insurance; bills that gut safety and environmental protections that would keep our air clean; bills that prioritize the interests of Wall Street over Main  This is not what my constituents want. It is also not what the constituents of many of us want. Madam Speaker, for this reason, Democrats have unveiled an agenda to increase wages, reduce costs for everyday expenses, and give workers the training they need to compete in 21st century jobs.  Madam Speaker, if we defeat the previous question, I will offer an amendment to the rule to bring up Representative Pocan's Leveraging Effective Apprenticeships to Rebuild National Skills Act, H.2933, which would promote effective apprenticeships that would give students and workers more opportunities to find good-paying jobs.  Madam Speaker, I ask unanimous consent to insert the text of my amendment in the Record, along with extraneous material, immediately prior to the vote of the previous question.  The SPEAKER pro tempore. Is there objection to the request of the gentleman from Colorado?  There was no objection.  ",CREC-2017-07-25-pt1-PgH6225-6.txt,1910,BANKRUPTCY JUDGESHIP ACT OF 2017,2017.0,25.0,April
13031,topic-id,138,"Madam Speaker, we have less than 4 days left before the scheduled August recess. I hope in that time we can focus on strengthening the economy and empowering consumers rather than taking away consumers' rights, like this bill does.  We should focus on fixing our broken immigration system to create more economic growth and reduce our deficit, and we should create jobs and make sure that more people are covered by healthcare, not less.  Instead, here we are, spending time on the floor of the House stripping away consumer protections and spending American taxpayer money on an unwanted border wall, in direct violation of President Trump's promise.  Madam Speaker, I oppose this rule, and I oppose the underlying legislation. I strongly urge my colleagues to vote ``no'' on both, and I yield back the balance of my time.  ",CREC-2017-07-25-pt1-PgH6225-6.txt,1910,BANKRUPTCY JUDGESHIP ACT OF 2017,2017.0,25.0,April
13034,topic-id,634,"Madam Speaker, on that I demand the yeas and nays.  The yeas and nays were ordered.  The SPEAKER pro tempore. Pursuant to clause 9 of rule XX, the Chair will reduce to 5 minutes the minimum time for any electronic vote on the question of adoption of the resolution.  The vote was taken by electronic device, and there were--yeas 229, nays 184, not voting 20, as follows:                             [Roll 410]                               YEAS--229     Abraham     Aderholt     Allen     Amash     Amodei     Arrington     Babin     Bacon     Banks (IN)     Barletta     Barr     Barton     Bergman     Biggs     Bilirakis     Bishop (MI)     Bishop (UT)     Black     Blackburn     Blum     Bost     Brady (TX)     Brat     Bridenstine     Brooks (IN)     Buchanan     Buck     Bucshon     Budd     Burgess     Byrne     Calvert     Carter (GA)     Carter (TX)     Chabot     Coffman     Cole     Collins (GA)     Collins (NY)     Comer     Comstock     Conaway     Cook     Crawford     Culberson     Curbelo (FL)     Davidson     Davis, Rodney     Denham     Dent     DeSantis     DesJarlais     Diaz-Balart     Donovan     Duffy     Duncan (TN)     Dunn     Emmer     Estes (KS)     Farenthold     Faso     Ferguson     Fitzpatrick     Fleischmann     Flores     Fortenberry     Foxx     Franks (AZ)     Frelinghuysen     Gaetz     Gallagher     Garrett     Gianforte     Gibbs     Gohmert     Goodlatte     Gosar     Gowdy     Granger     Graves (GA)     Graves (LA)     Griffith     Grothman     Guthrie     Handel     Harper     Harris     Hartzler     Hensarling     Herrera Beutler     Hice, Jody     Higgins (LA)     Hill     Holding     Hollingsworth     Hudson     Huizenga     Hultgren     Hunter     Hurd     Issa     Jenkins (KS)     Jenkins (WV)     Johnson (LA)     Johnson (OH)     Johnson, Sam     Jones     Jordan     Joyce (OH)     Katko     Kelly (MS)     Kelly (PA)     King (IA)     King (NY)     Kinzinger     Knight     Kustoff (TN)     Labrador     LaHood     LaMalfa     Lamborn     Lance     Latta     Lewis (MN)     LoBiondo     Long     Loudermilk     Love     Lucas     Luetkemeyer     MacArthur     Marchant     Marino     Marshall     Massie     Mast     McCarthy     McCaul     McClintock     McHenry     McKinley     McMorris Rodgers     McSally     Meehan     Messer     Mitchell     Moolenaar     Mooney (WV)     Mullin     Murphy (PA)     Newhouse     Noem     Norman     Nunes     Olson     Palazzo     Palmer     Paulsen     Pearce     Perry     Pittenger     Poe (TX)     Poliquin     Posey     Ratcliffe     Reed     Reichert     Rice (SC)     Roby     Roe (TN)     Rogers (AL)     Rogers (KY)     Rohrabacher     Rokita     Rooney, Francis     Rooney, Thomas     Ros-Lehtinen     Roskam     Ross     Rothfus     Rouzer     Royce (CA)     Russell     Rutherford     Sanford     Schweikert     Scott, Austin     Sensenbrenner     Sessions     Shimkus     Shuster     Simpson     Smith (MO)     Smith (NE)     Smith (NJ)     Smith (TX)     Smucker     Stefanik     Stewart     Stivers     Taylor     Tenney     Thompson (PA)     Thornberry     Tiberi     Tipton     Trott     Turner     Upton     Valadao     Wagner     Walberg     Walden     Walker     Walorski     Walters, Mimi     Weber (TX)     Webster (FL)     Wenstrup     Westerman     Williams     Wilson (SC)     Womack     Woodall     Yoder     Yoho     Young (AK)     Young (IA)     Zeldin                               NAYS--184     Adams     Aguilar     Barragan     Beatty     Bera     Beyer     Bishop (GA)     Blumenauer     Blunt Rochester     Bonamici     Boyle, Brendan     Brady (PA)     Brown (MD)     Brownley (CA)     Bustos     Butterfield     Capuano     Carbajal     Cardenas     Carson (IN)     Cartwright     Castor (FL)     Castro (TX)     Chu, Judy     Cicilline     Clark (MA)     Clarke (NY)     Clay     Cleaver     Clyburn     Cohen     Connolly     Conyers     Cooper     Correa     Costa     Courtney     Crist     Cuellar     Davis (CA)     DeFazio     DeGette     Delaney     DeLauro     DelBene     Demings     DeSaulnier     Deutch     Dingell     Doggett     Doyle, Michael     Ellison     Engel     Eshoo     Espaillat     Esty (CT)     Evans     Foster     Gabbard     Gallego     Garamendi     Gomez     Gonzalez (TX)     Gottheimer     Green, Gene     Grijalva     Gutierrez     Hanabusa     Hastings     Heck     Higgins (NY)     Himes     Hoyer     Huffman     Jackson Lee     Jayapal     Jeffries     Johnson (GA)     Johnson,     Kaptur     Keating     Kelly (IL)     Kennedy     Khanna     Kihuen     Kildee     Kilmer     Kind     Krishnamoorthi     Kuster (NH)     Larsen (WA)     Larson (CT)     Lawrence     Lawson (FL)     Lee     Levin     Lewis (GA)     Lieu, Ted     Lipinski     Loebsack     Lofgren     Lowenthal     Lowey     Lujan Grisham,     Lujan, Ben Ray     Lynch     Maloney, Carolyn     Maloney, Sean     Matsui     McCollum     McEachin     McGovern     McNerney     Meeks     Meng     Moore     Moulton     Murphy (FL)     Nadler     Neal     Nolan     Norcross     O'Halleran     O'Rourke     Pallone     Panetta     Pascrell     Payne     Pelosi     Perlmutter     Peters     Peterson     Pingree     Pocan     Polis     Price (NC)     Quigley     Raskin     Rice (NY)     Rosen     Roybal-Allard     Ruiz     Ruppersberger     Rush     Ryan (OH)     Sanchez     Sarbanes     Schakowsky     Schiff     Schneider     Schrader     Scott (VA)     Scott, David     Serrano     Sewell (AL)     Shea-Porter     Sherman     Sinema     Sires     Slaughter     Smith (WA)     Soto     Speier     Suozzi     Swalwell (CA)     Takano     Thompson (CA)     Thompson (MS)     Titus     Tonko     Torres     Tsongas     Vargas     Veasey     Vela     Velazquez     Visclosky     Walz     Wasserman Schultz     Waters, Maxine     Watson Coleman     Welch     Wilson (FL)     Yarmuth                             NOT VOTING--20     Bass     Brooks (AL)     Cheney     Costello (PA)     Cramer     Crowley     Cummings     Davis, Danny     Duncan (SC)     Frankel (FL)     Fudge     Graves (MO)     Green, Al     Langevin     Meadows     Napolitano     Renacci     Richmond     Scalise     Wittman                              {time}  1330  So the previous question was ordered.  The result of the vote was announced as above recorded.  Stated for:  ",CREC-2017-07-25-pt1-PgH6225-6.txt,1910,STRENGTHENING CHILDREN'S SAFETY ACT OF 2017,2017.0,25.0,June
13038,topic-id,615,"Madam Speaker, I demand a recorded vote.[[Page H6233]]  A recorded vote was ordered.  The SPEAKER pro tempore. This is a 5-minute vote.  The vote was taken by electronic device, and there were--ayes 233, noes 188, not voting 12, as follows:                             [Roll 411]                               AYES--233     Abraham     Aderholt     Allen     Amash     Amodei     Arrington     Babin     Bacon     Banks (IN)     Barletta     Barr     Barton     Bergman     Biggs     Bilirakis     Bishop (MI)     Bishop (UT)     Black     Blackburn     Blum     Bost     Brady (TX)     Brat     Bridenstine     Brooks (IN)     Buchanan     Buck     Bucshon     Budd     Burgess     Byrne     Calvert     Carter (GA)     Carter (TX)     Chabot     Cheney     Coffman     Cole     Collins (GA)     Collins (NY)     Comer     Comstock     Conaway     Cook     Cramer     Crawford     Culberson     Curbelo (FL)     Davidson     Davis, Rodney     Denham     Dent     DeSantis     DesJarlais     Diaz-Balart     Donovan     Duffy     Duncan (SC)     Duncan (TN)     Dunn     Emmer     Estes (KS)     Farenthold     Faso     Ferguson     Fitzpatrick     Fleischmann     Flores     Fortenberry     Foxx     Franks (AZ)     Frelinghuysen     Gaetz     Gallagher     Garrett     Gianforte     Gibbs     Gohmert     Goodlatte     Gosar     Gowdy     Granger     Graves (GA)     Graves (LA)     Griffith     Grothman     Guthrie     Handel     Harper     Harris     Hartzler     Hensarling     Herrera Beutler     Hice, Jody     Higgins (LA)     Hill     Holding     Hollingsworth     Hudson     Huizenga     Hultgren     Hunter     Hurd     Issa     Jenkins (KS)     Jenkins (WV)     Johnson (LA)     Johnson (OH)     Johnson, Sam     Jones     Jordan     Joyce (OH)     Katko     Kelly (MS)     Kelly (PA)     King (IA)     King (NY)     Kinzinger     Knight     Kustoff (TN)     Labrador     LaHood     LaMalfa     Lamborn     Lance     Latta     Lewis (MN)     LoBiondo     Long     Loudermilk     Love     Lucas     Luetkemeyer     MacArthur     Marchant     Marino     Marshall     Massie     Mast     McCarthy     McCaul     McClintock     McHenry     McKinley     McMorris Rodgers     McSally     Meehan     Messer     Mitchell     Moolenaar     Mooney (WV)     Mullin     Murphy (PA)     Newhouse     Noem     Norman     Nunes     Olson     Palazzo     Palmer     Paulsen     Pearce     Perry     Pittenger     Poe (TX)     Poliquin     Posey     Ratcliffe     Reed     Reichert     Rice (SC)     Roby     Roe (TN)     Rogers (AL)     Rogers (KY)     Rohrabacher     Rokita     Rooney, Francis     Rooney, Thomas     Ros-Lehtinen     Roskam     Ross     Rothfus     Rouzer     Royce (CA)     Russell     Rutherford     Sanford     Schweikert     Scott, Austin     Sensenbrenner     Sessions     Shimkus     Shuster     Simpson     Smith (MO)     Smith (NE)     Smith (NJ)     Smith (TX)     Smucker     Stefanik     Stewart     Stivers     Taylor     Tenney     Thompson (PA)     Thornberry     Tiberi     Tipton     Trott     Turner     Upton     Valadao     Wagner     Walberg     Walden     Walker     Walorski     Walters, Mimi     Weber (TX)     Webster (FL)     Wenstrup     Westerman     Williams     Wilson (SC)     Wittman     Womack     Woodall     Yoder     Yoho     Young (AK)     Young (IA)     Zeldin                               NOES--188     Adams     Aguilar     Barragan     Beatty     Bera     Beyer     Bishop (GA)     Blumenauer     Blunt Rochester     Bonamici     Boyle, Brendan     Brady (PA)     Brown (MD)     Brownley (CA)     Bustos     Butterfield     Capuano     Carbajal     Cardenas     Carson (IN)     Cartwright     Castor (FL)     Castro (TX)     Chu, Judy     Cicilline     Clark (MA)     Clarke (NY)     Clay     Cleaver     Clyburn     Cohen     Connolly     Conyers     Cooper     Correa     Costa     Courtney     Crist     Cuellar     Davis (CA)     DeFazio     DeGette     Delaney     DeLauro     DelBene     Demings     DeSaulnier     Deutch     Dingell     Doggett     Doyle, Michael     Ellison     Engel     Eshoo     Espaillat     Esty (CT)     Evans     Foster     Frankel (FL)     Fudge     Gabbard     Gallego     Garamendi     Gomez     Gonzalez (TX)     Gottheimer     Green, Gene     Grijalva     Gutierrez     Hanabusa     Hastings     Heck     Higgins (NY)     Himes     Hoyer     Huffman     Jackson Lee     Jayapal     Jeffries     Johnson (GA)     Johnson,     Kaptur     Keating     Kelly (IL)     Kennedy     Khanna     Kihuen     Kildee     Kilmer     Kind     Krishnamoorthi     Kuster (NH)     Langevin     Larsen (WA)     Larson (CT)     Lawrence     Lawson (FL)     Lee     Levin     Lewis (GA)     Lieu, Ted     Lipinski     Loebsack     Lofgren     Lowenthal     Lowey     Lujan Grisham,     Lujan, Ben Ray     Lynch     Maloney, Carolyn     Maloney, Sean     Matsui     McCollum     McEachin     McGovern     McNerney     Meeks     Meng     Moore     Moulton     Murphy (FL)     Nadler     Neal     Nolan     Norcross     O'Halleran     O'Rourke     Pallone     Panetta     Pascrell     Payne     Pelosi     Perlmutter     Peters     Peterson     Pingree     Pocan     Polis     Price (NC)     Quigley     Raskin     Rice (NY)     Richmond     Rosen     Roybal-Allard     Ruiz     Ruppersberger     Rush     Ryan (OH)     Sanchez     Sarbanes     Schakowsky     Schiff     Schneider     Schrader     Scott (VA)     Scott, David     Serrano     Sewell (AL)     Shea-Porter     Sherman     Sinema     Sires     Slaughter     Smith (WA)     Soto     Speier     Suozzi     Swalwell (CA)     Takano     Thompson (CA)     Thompson (MS)     Titus     Tonko     Torres     Tsongas     Vargas     Veasey     Vela     Velazquez     Visclosky     Walz     Wasserman Schultz     Waters, Maxine     Watson Coleman     Welch     Wilson (FL)     Yarmuth                             NOT VOTING--12     Bass     Brooks (AL)     Costello (PA)     Crowley     Cummings     Davis, Danny     Graves (MO)     Green, Al     Meadows     Napolitano     Renacci     Scalise                              {time}  1337  So the resolution was agreed to.  The result of the vote was announced as above recorded.  A motion to reconsider was laid on the table.                          ____________________",CREC-2017-07-25-pt1-PgH6225-6.txt,1910,STRENGTHENING CHILDREN'S SAFETY ACT OF 2017,2017.0,25.0,June
12759,topic-id,23,"Mr.President, I ask unanimous consent that the order for the quorum call be rescinded.  The PRESIDING Without objection, it is so ordered.                          ____________________",CREC-2017-08-01-pt1-PgS4663-4.txt,924,STRENGTHENING CHILDREN'S SAFETY ACT OF 2017,2017.0,1.0,July
12937,topic-id,72,"Mr.President, I ask unanimous consent that the Senate proceed to the immediate consideration of Calendar 95, 190.  The PRESIDING The clerk will report the bill by title.  The legislative clerk read as follows:       A bill (190) to provide for consideration of the      extension under the Energy Policy and Conservation Act of      nonapplication of No-Load Mode energy efficiency standards to      certain security or life safety alarms or surveillance      systems, and for other purposes.  ",CREC-2017-08-01-pt1-PgS4681-3.txt,924,GRANTING CONSENT AND APPROVAL OF CONGRESS TO ESTABLISH WASHINGTON,2017.0,1.0,August
12938,topic-id,239,"Mr.President, I ask unanimous consent that the bill be considered read a third time and passed, and the motion to reconsider be considered made and laid upon the table.  The PRESIDING Without objection, it is so ordered.  The bill (190) was ordered to be engrossed for a third reading, was read the third time, and passed, as follows:                                 190       Be it enacted by the Senate and House of Representatives of      the United States of America in Congress assembled,     SECTION 1. SHORT       This Act may be cited as the ``Power And Security Systems      (PASS) Act''.     2. EXTENSION OF NONAPPLICATION OF NO-LOAD MODE ENERGY                    EFFICIENCY STANDARD TO CERTAIN SECURITY OR LIFE                    SAFETY ALARM OR SURVEILLANCE       (a) Section 325(u)(3)(D)(ii) of the Energy Policy and      Conservation Act (42 U.S.6295(u)(3)(D)(ii)) is amended--       (1) by striking ``2015'' each place it appears and      inserting ``2021''; and       (2) by striking ``2017'' and inserting ``2023''.       (b) Section 325(u)(3)(E) of the Energy Policy and      Conservation Act (42 U.S.6295(u)(3)(E)) is amended--       (1) in clause (ii), by striking ``July 1, 2017,'' and      inserting ``the effective date of the amendment under      subparagraph (D)(ii)''; and       (2) by adding at the end the following:       ``(iv) Treatment in rule.--In the rule under subparagraph      (D)(ii) and subsequent amendments the Secretary may treat      some or all external power supplies designed to be connected      to a security or life safety alarm or surveillance system as      a separate product class or may extend the nonapplication      under clause (ii).''.                          ____________________",CREC-2017-08-01-pt1-PgS4681-3.txt,924,GRANTING CONSENT AND APPROVAL OF CONGRESS TO ESTABLISH WASHINGTON,2017.0,1.0,May
13048,topic-id,536,"Mr.Speaker, I yield myself such time as I may consume.  Mr.Speaker, I rise in strong support of H.76. This very important legislation grants congressional consent and approval to Maryland, Virginia, and the District of Columbia to enter into a compact under Article I, section 10 of the Constitution, establishing the Metrorail Safety Importantly, Federal transit funds have been suspended by the Federal Transit Authority until Congress grants its assent to these amendments to the WMATA compact, as H.76 would do.  I want to thank my friend, the distinguished minority whip, Steny Hoyer, for taking the lead on this measure, and all of our colleagues in the Virginia and Maryland delegations and District of Columbia delegation for supporting it in such a strong, bipartisan, and cross-Potomac River fashion. I am proud to join them.  Mr.Speaker, I did want to take a moment to say a word about the Metro system.  WMATA is not just the Metro that serves the Washington area. It is truly America's Metro system. It is the second largest system in the Nation, behind only New York It is 117 miles long. It has 91 stations, and it includes more than 12,000 employees.  It is critical to the functioning of the Federal Government because it moves more than 40 percent of the Federal workforce every day to and from work and also during the day for various missions that people go on during the normal workday. It is essential to national security. If we didn't have the Metro system, what is already one of the most traffic-plagued and congested regions in the country would be absolutely paralyzed.  It is also the mechanism that moves millions of Americans who come from all over the United States, all of our constituents here in Congress, to visit us. That is how people get to the White House and the Capitol and go to the Pentagon and go to see NIH and visit the museums and the battlefields and so on.  So the Metro is critical not just to the people who live and work here every day and make the Federal Government go, but also to all American citizens who rely on the efficiency of the Federal Government and come to Washington to petition for redress of grievances and to partake in the processes of government.  I am thrilled that this legislation, responding to the safety needs of the system, is moving forward with speed now. It is essential that we continue to invest in the Metro, to upgrade its safety, to upgrade its efficiency and its reliability.  The Federal Government was instrumental in the creation of Metro at the beginning, along with Virginia, Maryland, and the District of We all send representatives to the board of The Federal Government has representatives on the board of We are equal partners in it, and I want to make sure that everyone here in Congress feels deeply invested in the success of Metro, which, after all, gets a lot of our staffers to work every day.  With passage of H.76, Congress reaffirms its fundamental commitment to America's Metro system. Accordingly, I urge my colleagues to support the swift passage of this resolution.  I reserve the balance of my time.  ",CREC-2017-07-17-pt1-PgH5894.txt,99999999999999,GRANTING CONSENT AND APPROVAL OF CONGRESS TO ESTABLISH WASHINGTON,2017.0,17.0,June
