speech_id,topic_id,word_count,speech_text,file_name,speaker_id,session_title,year,day,month
13043,topic-id,211,"Mr.Speaker, this morning, I would like to recognize Marine Private First Class James Stanford for his duty, his selfless service, and his sacrifice to our great  Stanford was a native of Gadsden, Alabama, and he lost his life back in 1954 after a devastating explosion on board the aircraft carrier USS I am honored to recognize Private First Class Stanford this morning, who made the ultimate sacrifice in service to our great  Stanford attended Gadsden High School in Gadsden, Alabama, before enlisting in the United States Marine Corps on February 21, 1953. After completing basic training at Parris Island, South Carolina, he was assigned to the USS Bennington in June 1953.  On May 26, 1954, the USS Bennington was sailing off the coast of Rhode Island for aircraft carrier qualification when hydraulic fluid from a forward catapult caught fire. The resulting explosion caused massive damage to the forward portion of the ship. It resulted in over 200 casualties, including 103 sailors and marines who lost their lives that day.  On May 28, 1954, Private First Class James Stanford, at just 20 years old, succumbed to his critical burn wounds and passed away at Newport Naval Hospital in Rhode By his side were his wife, the former Lou Moore; and his father, ",CREC-2017-07-27-pt1-PgH6473-2.txt,1460,1230,2017.0,27.0,May
12789,topic-id,284,"Mr.Speaker, I rise in support of H.2742, the Modernizing the Interstate Placement of Children in Foster Care  Children who cannot be safely returned home deserve to be placed in the best setting possible for them, regardless of the State where the setting is located; and no child should have to wait to move to that best setting because it is across the State line.                              {time}  1715  Separation from a parent or long-term caregiver is always traumatic for a child. Even if relatives come forward right away, it may take months to get licensed, months in which the child may bond with the foster family. When the relative lives in another State, the licensing process can often take as long as 6 months, so that might mean 6 months in foster care. Sometimes our well-intentioned efforts to protect children actually do them more harm.  H.2742 provides States with resources to automate this process so that social workers no longer have to photocopy documents and submit them on paper through a succession of offices.  Last year, the National Foster Youth Institute organized a listening tour in Representative Vicky Hartzler's district; and during a meeting with child welfare professionals, they described the challenges they face when relatives are identified in different States and they are unable to quickly place the child with family and must keep the child in foster care. The judges, social workers, and families specifically requested Members of Congress to change the law and asked the National Foster Youth Institute to please advocate for change. I look forward to communicating with Representative Hartzler and her constituents about this legislation.  I ask my colleagues to support the legislation sponsored by Representatives Walorski and Davis, H.2742.  ",CREC-2017-06-20-pt1-PgH4963.txt,1996,NATIONAL DEFENSE AUTHORIZATION ACT FOR FISCAL YEAR 2018,2017.0,20.0,July
12738,topic-id,246,"Mr.Speaker, today is National Missing Children's This day of recognition was started by President Reagan in 1983 to raise awareness of the threat of child abduction, and reminds us today that we still have work to do.  Following the tragic murder of 9-year-old Amber Hagerman in 1996, Congress authorized the AMBER Alert system to create a coordinated alert system to assist law enforcement in finding abducted children in the important first hours after an abduction. Since its inception, more than 800 children have been recovered through the use of the AMBER Alert system.  However, the original legislation did not include Indian Tribes as eligible users of the program, and we saw the tragic effects of this exclusion when 11-year-old Ashlynne Mike was abducted and murdered on the Navajo  For this reason, I have introduced the AMBER Alert in Indian Country This act will include our 567 Federally recognized tribes as partners in the AMBER Alert Program to ensure that everyone is able to utilize this important tool. My bill is a bipartisan effort and it is endorsed by criminal justice, child safety groups, and Indian Tribes around the country.  Mr.Speaker, the AMBER Alert has helped many families experience the joy of being reunited with an abducted child. It is time we extend this alert to Indian Country so that no child is outside the jurisdiction of this vital program.  I urge my colleagues to support this legislation so we can continue to protect our children.                          ____________________",CREC-2017-05-25-pt1-PgH4592-3.txt,99999999999999,NATIONAL DEFENSE AUTHORIZATION ACT FOR FISCAL YEAR 2018,2017.0,25.0,July
12910,topic-id,73,"Mr.Speaker, because of a funeral of a family member, I was not present on Friday, July 14, for votes during National Defense Authorization Act of 2017. Had I been here I would have voted in the following manner.  Rollcall Vote 372--``Yea''  Rollcall Vote 373--``Yea''  Rollcall Vote 374--``Yea''  Rollcall Vote 375--``Yea''  Rollcall Vote 376--``Yea''  Rollcall Vote 377--MTR--``Nay''  Rollcall Vote 378--Final Passage--``Yea''Announcement by Committee on Rules Regarding Amendment Process on H.                     218, H.2910, and H.2883  ",CREC-2017-07-14-pt1-PgH5836-2.txt,1838,1700,2017.0,14.0,July
13013,topic-id,167,"Madam Speaker, by direction of the Committee on Rules, I call up House Resolution 468 and ask for its immediate consideration.  The Clerk read the resolution, as follows:                              468       Resolved, That upon adoption of this resolution it shall be      in order to consider in the House the joint resolution (H.     111) providing for congressional disapproval under      chapter 8 of title 5, United States Code, of the rule      submitted by Bureau of Consumer Financial Protection relating      to ``Arbitration Agreements''. All points of order against      consideration of the joint resolution are waived. The joint      resolution shall be considered as read. All points of order      against provisions in the joint resolution are waived. The      previous question shall be considered as ordered on the joint      resolution and on any amendment thereto to final passage      without intervening motion except: (1) one hour of debate      equally divided and controlled by the chair and ranking      minority member of the Committee on Financial Services; and      (2) one motion to recommit.  The SPEAKER pro tempore (",CREC-2017-07-25-pt1-PgH6225-6.txt,2233,1700,2017.0,25.0,July
13014,topic-id,48,"Madam Speaker, for the purpose of debate only, I yield the customary 30 minutes to the gentleman from Colorado (Mr.Polis), pending which I yield myself such time as I may consume. During consideration of this resolution, all time yielded is for the purpose of debate only.                             General Leave  ",CREC-2017-07-25-pt1-PgH6225-6.txt,2233,1700,2017.0,25.0,July
13015,topic-id,41,"Madam Speaker, I ask unanimous consent that all Members may have 5 legislative days in which to revise and extend their remarks.  The SPEAKER pro tempore. Is there objection to the request of the gentleman from Colorado?  There was no objection.  ",CREC-2017-07-25-pt1-PgH6225-6.txt,2233,EXTENDING A PROJECT INVOLVING THE CANNONSVILLE DAM,2017.0,25.0,June
13016,topic-id,624,"Madam Speaker, I rise today in support of the rule and the underlying resolution.  Congressional Review Act resolutions must follow a prescribed form according to law. This rule provides for consideration of H.111 in keeping with that form.[[Page H6226]]  Madam Speaker, we are here today to prevent Federal overreach by the Consumer Financial Protection Bureau, also known as the According to the D.Circuit Court, this unaccountable government agency has more unilateral authority than any single commissioner or board member in any other independent agency in the United States  On July 10, 2017, the CFPB exercised that vast authority by issuing a 776-page final rule that restricts the ability of consumers to enter into arbitration agreements. The CFPB's misguided rule effectively eliminates arbitration clauses, instead forcing consumers into significantly more burdensome court proceedings. Eliminating this overbearing rule is a big win for consumers.  Arbitration is an alternative to the judicial system, and it often results in a better outcome for consumers. According to the CFPB's own study, arbitration can be up to 12 times faster than litigation. This study also found that a class action lawsuit's average payout was just $32 per person, not even close to the $5,389 awarded on average from arbitration.  Moreover, it costs less for consumers to file an arbitration complaint than it does to file a new complaint in Federal court, making the arbitration system more accessible to all  Arbitration allows parties to use an independent mediator, instead of hiring expensive lawyers, to settle a dispute. While the rule promulgated by the Consumer Financial Protection Bureau is a bad deal for consumers, it is a huge win for trial lawyers, who make an average of $1 million per case.  The legislation being considered today would eliminate the CFPB's prohibition on an individual's right to enter into contracts that include arbitration agreements.  The Congressional Review Act allows Congress to eliminate a rule from the executive branch, and prevents a substantially similar rule from being proposed in its place.  Checks and balances between the three branches of government are the cornerstone of our The Congressional Review Act allows Congress to exercise our Article I authority and stop executive overreach that was never intended by the original legislation.  The Congressional Review Act is a powerful tool because it only requires 51 votes to pass in the To date, Congress has passed 14 CRAs that have been signed by the One by one, we have eliminated Obama administration rules that harm Americans and small businesses across this country.  Despite the work we have ahead, these CRAs are important to bringing regulatory relief to millions of President Trump campaigned on a promise to end government overregulation that hurts Americans and small businesses. He turned those words into action by signing an executive order that requires two regulations be eliminated for every new regulation that is proposed.  President Trump has exceeded those expectations in his first 6 months. For every new proposed rule, he has eliminated 16 regulations.  Unfortunately, he has limited tools to rein in the Consumer Financial Protection Bureau, because it was designed to be unaccountable under Dodd-This is an agency that continues to be run by an unchecked The structure of the bureau has even been ruled unconstitutional by the judicial branch.  A few weeks ago, the House of Representatives passed legislation to restructure the Consumer Financial Protection Bureau, restoring congressional oversight duties and moving the agency back under the regular legislative appropriations process. I hope the Senate will consider this bill and bring accountability to the Consumer Financial Protection  I urge my colleagues to support this resolution and the underlying bill, and eliminate the bad antiarbitration rule issued by the Consumer Financial Protection  Madam Speaker, I reserve the balance of my time.  ",CREC-2017-07-25-pt1-PgH6225-6.txt,2233,EXTENDING A PROJECT INVOLVING THE CANNONSVILLE DAM,2017.0,25.0,June
13019,topic-id,17,"Madam Speaker, I yield 4 minutes to the gentleman from Pennsylvania (Mr.Rothfus), the author of this resolution.  ",CREC-2017-07-25-pt1-PgH6225-6.txt,2233,EXTENDING A PROJECT INVOLVING THE CANNONSVILLE DAM,2017.0,25.0,June
13024,topic-id,21,"Madam Speaker, I yield 3 minutes to the gentleman from Missouri (Mr.Luetkemeyer), the chairman of the Financial Institutions and Consumer Credit  ",CREC-2017-07-25-pt1-PgH6225-6.txt,2233,EXECUTIVE CALENDAR--Continued,2017.0,25.0,June
13032,topic-id,1055,"Madam Speaker, I yield myself the balance of my time.  The Consumer Financial Protection Bureau has been a continuous example of Federal overreach. Once again, bureaucrats in Washington have created a rule that will hurt consumers and make their lives more difficult.  The last 8 years of overregulation have crippled our economy. Today, we have a chance to end this antiarbitration rule and empower consumers with an alternative to spending years in a courtroom.  We can't let concerns about the trial lawyer lobby impact the way we treat consumers. Trial lawyers love this rule enacted by the Consumer Financial Protection Bureau because they will be the biggest beneficiaries. They will walk home with the big winnings, while the individuals who have been harmed walk away with little.  Arbitration allows harmed individuals to receive payouts on the merits of their case without enriching the pockets of trial lawyers at the same time. This legislation is for consumers. It is for the average American who relies on our financial system every day.  Madam Speaker, I thank Chairman Sessions and Chairman Hensarling for bringing this bill to the floor. I urge my colleagues now to vote ``yes'' on the resolution, and then to vote ``yes'' on the underlying bill.  The material previously referred to by Mr.Polis is as follows:            An Amendment to 468 Offered by Mr.Polis       At the end of the resolution, add the following new      sections:       Sec 2. Immediately upon adoption of this resolution the      Speaker shall, pursuant to clause 2(b) of rule XVIII, declare      the House resolved into the Committee of the Whole House on      the state of the Union for consideration of the bill (H.     2933) to promote effective registered apprenticeships, for      skills, credentials, and employment, and for other purposes.      The first reading of the bill shall be dispensed with. All      points of order against consideration of the bill are waived.      General debate shall be confined to the bill and shall not      exceed one hour equally divided and controlled by the chair      and ranking minority member of the Committee on Education and      the After general debate the bill shall be      considered for amendment under the five-minute rule. All      points of order against provisions in the bill are waived. At      the conclusion of consideration of the bill for amendment the      Committee shall rise and report the bill to the House with      such amendments as may have been adopted. The previous      question shall be considered as ordered on the bill and      amendments thereto to final passage without intervening      motion except one motion to recommit with or without      instructions. If the Committee of the Whole rises and reports      that it has come to no resolution on the bill, then on the      next legislative day the House shall, immediately after the      third daily order of business under clause 1 of rule XIV,      resolve into the Committee of the Whole for further      consideration of the bill.       3. Clause 1(c) of rule XIX shall not apply to the      consideration of H.2933.                                  ____        The Vote on the Previous Question: What It Really Means       This vote, the vote on whether to order the previous      question on a special rule, is not[[Page H6232]]     merely a procedural vote. A vote against ordering the      previous question is a vote against the Republican majority      agenda and a vote to allow the Democratic minority to offer      an alternative plan. It is a vote about what the House should      be debating.       Mr.Clarence Cannon's Precedents of the House of      Representatives (VI, 308-311), describes the vote on the      previous question on the rule as ``a motion to direct or      control the consideration of the subject before the House      being made by the Member in charge.'' To defeat the previous      question is to give the opposition a chance to decide the      subject before the Cannon cites the Speaker's ruling      of January 13, 1920, to the effect that ``the refusal of the      House to sustain the demand for the previous question passes      the control of the resolution to the opposition'' in order to      offer an amendment. On March 15, 1909, a member of the      majority party offered a rule resolution. The House defeated      the previous question and a member of the opposition rose to      a parliamentary inquiry, asking who was entitled to      recognition. Speaker Joseph Cannon (R-Illinois) said:      ``The previous question having been refused, the gentleman      from New York, Mr.Fitzgerald, who had asked the gentleman to      yield to him for an amendment, is entitled to the first      recognition.''       The Republican majority may say ``the vote on the previous      question is simply a vote on whether to proceed to an      immediate vote on adopting the resolution . . . [and] has no      substantive legislative or policy implications whatsoever.''      But that is not what they have always said. Listen to the      Republican Leadership Manual on the Legislative Process in      the United States House of Representatives, (6th edition,      page 135). Here's how the Republicans describe the previous      question vote in their own manual: ``Although it is generally      not possible to amend the rule because the majority Member      controlling the time will not yield for the purpose of      offering an amendment, the same result may be achieved by      voting down the previous question on the rule. . . . When the      motion for the previous question is defeated, control of the      time passes to the Member who led the opposition to ordering      the previous question. That Member, because he then controls      the time, may offer an amendment to the rule, or yield for      the purpose of amendment.''       In Deschler's Procedure in the U.House of      Representatives, the subchapter titled ``Amending Special      Rules'' states: ``a refusal to order the previous question on      such a rule [a special rule reported from the Committee on      Rules] opens the resolution to amendment and further      debate.'' (Chapter 21, section 21.2) Section 21.3 continues:      ``Upon rejection of the motion for the previous question on a      resolution reported from the Committee on Rules, control      shifts to the Member leading the opposition to the previous      question, who may offer a proper amendment or motion and who      controls the time for debate thereon.''       Clearly, the vote on the previous question on a rule does      have substantive policy implications. It is one of the only      available tools for those who oppose the Republican      majority's agenda and allows those with alternative views the      opportunity to offer an alternative plan.  ",CREC-2017-07-25-pt1-PgH6225-6.txt,2233,NATIONAL DEFENSE AUTHORIZATION ACT FOR FISCAL YEAR 2018,2017.0,25.0,June
13033,topic-id,48,"Madam Speaker, I yield back the balance of my time, and I move the previous question on the resolution.  The SPEAKER pro tempore. The question is on ordering the previous question.  The question was taken; and the Speaker pro tempore announced that the ayes appeared to have it.  ",CREC-2017-07-25-pt1-PgH6225-6.txt,2233,NATIONAL DEFENSE AUTHORIZATION ACT FOR FISCAL YEAR 2018,2017.0,25.0,June
12801,topic-id,676,"Mr.Speaker, I move to suspend the rules and pass the bill (H.1492) to amend the Controlled Substances Act to direct the Attorney General to register practitioners to transport controlled substances to States in which the practitioner is not registered under the Act for the purpose of administering the substances (under applicable State law) at locations other than principal places of business or professional practice.  The Clerk read the title of the bill.  The text of the bill is as follows:                               H.1492       Be it enacted by the Senate and House of Representatives of      the United States of America in Congress assembled,     SECTION 1. SHORT       This Act may be cited as the ``Medical Controlled      Substances Transportation Act of 2017''.     2. REGISTRATION FOR TRANSPORT OF CONTROLLED SUBSTANCES                    TO STATES IN WHICH THE PRACTITIONER IS NOT                    REGISTERED UNDER THE CONTROLLED SUBSTANCES ACT                    FOR THE PURPOSE OF ADMINISTERING THE SUBSTANCES                    AT LOCATIONS OTHER THAN PRINCIPAL PLACES OF                    BUSINESS OR PROFESSIONAL       Section 303 of the Controlled Substances Act (21 U.S.     823) is amended by adding at the end the following:       ``(k) Registration for Transport of Controlled Substances      to States in Which the Practitioner Is Not Registered for the      Purpose of Administering the Substances at Locations Other      Than Principal Places of Business or Professional Practice.--       ``(1) In general.--Upon application by a practitioner      (other than a pharmacy) who is registered under subsection      (f), the Attorney General shall issue a separate registration      to the practitioner authorizing the practitioner--       ``(A) to transport one or more controlled substances in      schedule II, III, IV, or V from the practitioner's registered      location in a State to one or more States in which the      practitioner is not registered under subsection (f) for the      purpose of the practitioner administering the substances at      locations other than a principal place of business or      professional practice; and       ``(B) to so administer the substances.       ``(2) Requirements.--For a practitioner to be authorized to      transport and administer controlled substances pursuant to a      registration issued under paragraph (1), all of the following      conditions must be satisfied:       ``(A) The practitioner must be licensed, registered, or      otherwise permitted by the State in which the controlled      substances are administered to carry out such activity at the      location where it occurs.       ``(B) The practitioner must--       ``(i) limit the time of transport and administering of any      controlled substance pursuant to such registration to not      more than 72 consecutive hours; and       ``(ii) by the conclusion of such 72 hours, return any such      controlled substance so transported but not administered to      the registered location from which such substance was      obtained.       ``(C)(i) The practitioner must maintain records of the      transporting and administering of any controlled substance      pursuant to this subsection.       ``(ii) Such records shall be maintained, in accordance with      the requirements of section 307(b), at the practitioner's      registered location from which the controlled substances were      obtained and shall include--       ``(I) the location where the controlled substance was      administered; and       ``(II) such other information as may be required by      regulation of the Attorney General with respect to records      for dispensers of controlled substances.       ``(iii) Notwithstanding clause (ii), the exception in      subsection 307(c)(1)(B) shall not apply to records required      by this subparagraph.       ``(3) Grounds for denial or revocation.--The Attorney      General may deny an application for registration under this      subsection, or a renewal thereof, or revoke such      registration, based on the criteria listed in section 304(a),      except that the applicant shall not be required, as a      condition of initially obtaining such registration, to      present proof of State authorization to administer controlled      substances.       ``(4) Automatic termination.--A registration issued under      this subsection shall automatically terminate if the      practitioner no longer has an active registration under      subsection (f) due to revocation, suspension, surrender, or      other termination.       ``(5) Definition.--In this subsection, the term `registered      location' means, with respect to each registration issued to      a practitioner under subsection (f), the address that appears      on the certificate of registration.''.  The SPEAKER pro tempore. Pursuant to the rule, the gentleman from Texas (Mr.Burgess) and the gentleman from Texas (Mr.Gene Green) each will control 20 minutes.  The Chair recognizes the gentleman from Texas (Mr.Burgess).[[Page H5397]]                               General Leave  ",CREC-2017-07-11-pt1-PgH5396-6.txt,1751,NATIONAL DEFENSE AUTHORIZATION ACT FOR FISCAL YEAR 2018,2017.0,11.0,June
12802,topic-id,50,"Mr.Speaker, I ask unanimous consent that all Members may have 5 legislative days in which to revise and extend their remarks and insert extraneous material into the Record on the bill.  The SPEAKER pro tempore. Is there objection to the request of the gentleman from Texas?  There was no objection.  ",CREC-2017-07-11-pt1-PgH5396-6.txt,1751,NATIONAL DEFENSE AUTHORIZATION ACT FOR FISCAL YEAR 2018,2017.0,11.0,June
12803,topic-id,26,"Mr.Speaker, it is my pleasure to yield such time as he may consume to the gentleman from Texas (Mr.Sessions), who is the chairman of the Rules  ",CREC-2017-07-11-pt1-PgH5396-6.txt,1751,NATIONAL DEFENSE AUTHORIZATION ACT FOR FISCAL YEAR 2018,2017.0,11.0,June
