speech_id,topic_id,word_count,speech_text,file_name,speaker_id,session_title,year,day,month
12693,topic-id,632,"Mr.Speaker, I demand a recorded vote.  A recorded vote was ordered.  The SPEAKER pro tempore. This is a 5-minute vote.  The vote was taken by electronic device, and there were--ayes 233, noes 183, not voting 18, as follows:                             [Roll 27]                               AYES--233     Abraham     Aderholt     Allen     Amash     Amodei     Arrington     Babin     Bacon     Banks (IN)     Barletta     Barr     Barton     Bergman     Beutler     Biggs     Bilirakis     Bishop (MI)     Bishop (UT)     Black     Blackburn     Blum     Bost     Brady (TX)     Brat     Bridenstine     Brooks (AL)     Brooks (IN)     Buchanan     Buck     Bucshon     Budd     Burgess     Byrne     Calvert     Carter (GA)     Carter (TX)     Chabot     Chaffetz     Cheney     Coffman     Cole     Collins (GA)     Collins (NY)     Comer     Comstock     Conaway     Cook     Costello (PA)     Cramer     Crawford     Culberson     Curbelo (FL)     Davidson     Davis, Rodney     Denham     Dent     DeSantis     DesJarlais     Diaz-Balart     Donovan     Duffy     Duncan (TN)     Dunn     Emmer     Farenthold     Faso     Ferguson     Fitzpatrick     Fleischmann     Flores     Fortenberry     Foxx     Franks (AZ)     Frelinghuysen     Gaetz     Gallagher     Garrett     Gibbs     Gohmert     Goodlatte     Gosar     Gowdy     Granger     Graves (GA)     Graves (LA)     Graves (MO)     Griffith     Grothman     Guthrie     Harper     Harris     Hartzler     Hensarling     Hice, Jody     Higgins (LA)     Hill     Holding     Hollingsworth     Hudson     Huizenga     Hultgren     Hunter     Hurd     Issa     Jenkins (KS)     Jenkins (WV)     Johnson (LA)     Johnson (OH)     Johnson, Sam     Jordan     Joyce (OH)     Katko     Kelly (MS)     Kelly (PA)     King (IA)     King (NY)     Kinzinger     Knight     Kustoff (TN)     Labrador     LaHood     LaMalfa     Lamborn     Lance     Latta     Lewis (MN)     LoBiondo     Long     Loudermilk     Love     Lucas     Luetkemeyer     MacArthur     Marchant     Marino     Marshall     Massie     Mast     McCarthy     McClintock     McHenry     McKinley     McMorris Rodgers     McSally     Meadows     Meehan     Messer     Mitchell     Moolenaar     Mooney (WV)     Mullin     Murphy (PA)     Newhouse     Noem     Nunes     Olson     Palazzo     Palmer     Paulsen     Pearce     Perry     Pittenger     Poe (TX)     Poliquin     Posey     Ratcliffe     Reed     Reichert     Renacci     Rice (SC)     Roby     Roe (TN)     Rogers (AL)[[Page H258]]     Rogers (KY)     Rohrabacher     Rokita     Rooney, Francis     Rooney, Thomas     Ros-Lehtinen     Roskam     Ross     Rothfus     Rouzer     Royce (CA)     Russell     Rutherford     Sanford     Scalise     Schweikert     Scott, Austin     Sensenbrenner     Sessions     Shimkus     Shuster     Simpson     Smith (MO)     Smith (NE)     Smith (NJ)     Smith (TX)     Smucker     Stefanik     Stewart     Stivers     Taylor     Tenney     Thompson (PA)     Thornberry     Tiberi     Tipton     Trott     Turner     Upton     Valadao     Wagner     Walberg     Walden     Walker     Walorski     Walters, Mimi     Weber (TX)     Webster (FL)     Wenstrup     Westerman     Williams     Wilson (SC)     Wittman     Womack     Woodall     Yoder     Yoho     Young (AK)     Young (IA)     Zeldin                               NOES--183     Adams     Aguilar     Barragan     Bass     Beatty     Bera     Beyer     Bishop (GA)     Blumenauer     Blunt Rochester     Bonamici     Boyle, Brendan     Brady (PA)     Brown (MD)     Brownley (CA)     Bustos     Butterfield     Capuano     Carbajal     Cardenas     Carson (IN)     Cartwright     Castor (FL)     Castro (TX)     Chu, Judy     Cicilline     Clark (MA)     Clarke (NY)     Clay     Cleaver     Clyburn     Cohen     Connolly     Conyers     Cooper     Correa     Costa     Courtney     Crist     Crowley     Cuellar     Cummings     Davis (CA)     DeFazio     DeGette     Delaney     DeLauro     DelBene     Demings     DeSaulnier     Deutch     Doggett     Doyle, Michael     Ellison     Engel     Eshoo     Espaillat     Esty     Evans     Foster     Frankel (FL)     Fudge     Gabbard     Gallego     Garamendi     Gonzalez (TX)     Gottheimer     Green, Al     Green, Gene     Grijalva     Hanabusa     Hastings     Heck     Higgins (NY)     Himes     Hoyer     Huffman     Jackson Lee     Jayapal     Jeffries     Johnson,     Kaptur     Keating     Kennedy     Khanna     Kihuen     Kildee     Kilmer     Kind     Krishnamoorthi     Kuster (NH)     Langevin     Larsen (WA)     Larson (CT)     Lawrence     Lawson (FL)     Lee     Levin     Lewis (GA)     Lieu, Ted     Lipinski     Loebsack     Lofgren     Lowenthal     Lowey     Lujan Grisham,     Lujan, Ben Ray     Lynch     Maloney, Carolyn     Maloney, Sean     Matsui     McCollum     McEachin     McGovern     McNerney     Meeks     Meng     Moore     Moulton     Murphy (FL)     Nadler     Napolitano     Neal     Nolan     Norcross     O'Halleran     O'Rourke     Pallone     Panetta     Pascrell     Payne     Pelosi     Peters     Peterson     Pingree     Pocan     Polis     Price (NC)     Quigley     Raskin     Rice (NY)     Richmond     Rosen     Roybal-Allard     Ruiz     Ruppersberger     Sanchez     Sarbanes     Schiff     Schneider     Schrader     Scott (VA)     Scott, David     Serrano     Sewell (AL)     Shea-Porter     Sherman     Sinema     Sires     Slaughter     Smith (WA)     Soto     Speier     Suozzi     Swalwell (CA)     Thompson (CA)     Thompson (MS)     Titus     Tonko     Torres     Tsongas     Vargas     Veasey     Vela     Velazquez     Visclosky     Walz     Wasserman Schultz     Waters, Maxine     Watson Coleman     Welch     Wilson (FL)     Yarmuth                             NOT VOTING--18     Becerra     Davis, Danny     Dingell     Duncan (SC)     Gutierrez     Johnson (GA)     Jones     Kelly (IL)     McCaul     Mulvaney     Perlmutter     Pompeo     Price, Tom (GA)     Rush     Ryan (OH)     Schakowsky     Takano     Zinke                Announcement by the Speaker Pro Tempore  The SPEAKER pro tempore (during the vote). There are 2 minutes remaining.                              {time}  1357  So the resolution was agreed to.  The result of the vote was announced as above recorded.  A motion to reconsider was laid on the table.                          ____________________",CREC-2017-01-10-pt1-PgH249-6.txt,1910,"FAIR RATEPAYER ACCOUNTABILITY, TRANSPARENCY, AND EFFICIENCY STANDARDS",2017.0,10.0,April
12775,topic-id,243,"Mr.Speaker, today, I would like to talk about a constituent in my district, Jacki Dixon Jacki is anentrepreneur. She owns a historic storefront in downtown In fact, she is the only woman who owns commercial space inthe neighborhood. She runs a gallery featuring the work of over 100 local artisans, actively supporting jobs and contributing toour community.  Jacki was also a competitive long-distance runner. In 1972, she won the first women's only road race in New York, and shecontinues to run.  Finally, she has a pacemaker. She suffers from cardiomyopathy, a rare heart disease she developed after contracting the flu.While the doctor gave her only 2 years to live, she exceeded that prognosis by three decades, but her health depends onreplacing her pacemaker every 7 to 8 years.  Jacki is one of countless Americans for whom insurance through the Affordable Care Act is literally a matter of life ordeath. She says she pays a lot for her coverage, about 900 a month, but she told me she is excited to pay it. Before theAffordable Care Act, her precondition meant no coverage at all.  When I asked Jacki what message she wanted me to share with my colleagues in Congress, she made clear that I should sharethe message that her situation is not unique. We need to act to make sure that people like Jacki continue to have healthcarecoverage rather than ending the provisions of the Affordable Care Act that they rely on.                          ____________________",CREC-2017-01-11-pt1-PgH316-2.txt,1910,"FAIR RATEPAYER ACCOUNTABILITY, TRANSPARENCY, AND EFFICIENCY STANDARDS",2017.0,11.0,April
12625,topic-id,343,"Mr.President, I also wanted to talk briefly, if I could, about the legislation we just passed, 89. It has to do with the Delta The Delta Queen is a wooden ship that is very important to my community of It is part of our Queen City heritage.  The boat was actually in Cincinnati during my childhood. From 1946 until 1985, it called Cincinnati home. It is a beautiful paddle wheeler, and people love to get on it and go down the Mississippi  It is no longer docked in Cincinnati, which is why the folks in Missouri were interested in this legislation tonight too. We just had a big vote, over 80 votes in favor of simply saying, for the first time since 2008: Let's allow people to spend the night on this boat and go overnight on this boat, despite the fact that there is legislation called the 1966 Safety at Sea law, which prohibits wooden boats of a certain size from carrying overnight passengers. Let's make an exception here because the Delta Queen is willing to undergo the kind of renovations that are necessary to make it safe. It also requires new safety requirements for the Delta Queen going forward.  So I really appreciate the fact this vote was taken tonight. It is about a treasured part of our history. It is also about the economy because it will produce tourism and economic advancements all along the river everywhere the river stops, including in my hometown of We are going to welcome the Delta Queen back if this legislation can be enacted into law.  It is now going over to the It is in committee there. We hope that the House will do as the Senate did tonight and pass this legislation.  This is my button. It says ``Save the Delta Queen,'' which I am not going to wear on the floor of the Senate because of the rules. It doesn't mean I don't care.  I thank my colleagues tonight for helping us to be able to get this legislation through.                          ____________________",CREC-2017-04-03-pt1-PgS2172.txt,924,BOLTS DITCH ACCESS AND USE ACT,2017.0,3.0,April
12567,topic-id,313,"Mr.Speaker, I yield myself such time as I may consume.  Mr.Speaker, I rise in support of H.690. I would like to thank the gentleman from New York, Congressman Donovan, for his help and support and his bipartisanship.  Mr.Speaker, H.690 is based on a bipartisan bill I introduced last year, H.5391, which passed the House in  For decades, security experts have warned of the danger that radioactive materials could be smuggled within and across our borders and used in an act of nuclear terrorism. The DHS Domestic Nuclear Detection Office, or DNDO, brings together expertise from across the Federal Government to detect and prevent the illicit transport, storage, and assembly of nuclear and radiological weapons. These interagency partners coordinate their efforts using a multilayered framework--the Global Nuclear Detection Architecture, or GNDA describes Federal programs, guidelines, and detection technologies and identifies research challenges and security gaps.  In 2015, GAO looked at how DNDO manages its $350 million research and development program. The report found that DNDO needs to do a better job of documenting how it chooses which projects to fund and how these investments align with security gaps and research challenges--especially for vulnerabilities identified in the  H.690 would resolve these issues by requiring DNDO to document the rationale it uses to prioritize research topics, explain how selected investments align with gaps and research challenges, and develop a systematic approach to evaluate the outcomes for individual projects. Such documentation is essential to ensure that DNDO is making the right research investments to keep the Nation secure.[[Page H796]]  Mr.Speaker, my bill, H.690, would help DNDO use its limited resources toward projects that actually close the vulnerability gaps. Preventing and detecting nuclear smuggling is a complex endeavor. It requires seamless coordination between law enforcement and intelligence officials across the Federal  Mr.Speaker, I urge my colleagues to support H.690, and I yield back the balance of my time.  ",CREC-2017-01-31-pt1-PgH794.txt,2023,BOLTS DITCH ACCESS AND USE ACT,2017.0,31.0,February
12591,topic-id,237,"Mr.Speaker, I yield myself such time as I may consume.  Mr.Speaker, I rise in support of H.655.  For over a decade, the Securing the Cities program has provided a growing number of first responders from New York City and Newark, New Jersey to Los Angeles and Long Beach to Washington, D.C., Houston, and Chicago with the tools they need to detect radiological and nuclear threats.  Securing the Cities is administered by the Department of Homeland Security's Domestic Nuclear Detection Office, DNDO, which houses the Department's experts on preparing for and responding to rad/nuc events.  The program makes funding available to participating jurisdictions for planning and analysis related to radiological and nuclear threats, as well as equipment purchases, training, and exercises.  Through this program, DNDO supports grantees by providing subject matter expertise, training, coordination, and technological support. H.655 would formally authorize the existing Securing the Cities program and improve it by directing the Government Accountability Office to assess the program and offer recommendations for how it could become more effective.  Mr.Speaker, this bill passed the House last Congress by a vote of 441-4.  Mr.Speaker, the Securing the Cities program plays a critical role in protecting communities across America from the threat posed by radiological and nuclear weapons.  H.655 will ensure that this important program continues and becomes more robust in future years. I urge my colleagues to support H.655.  Mr.Speaker, I yield back the balance of my time.  ",CREC-2017-01-31-pt1-PgH796.txt,2023,BOLTS DITCH ACCESS AND USE ACT,2017.0,31.0,February
12747,topic-id,552,"Mr.Speaker, if today's vote on the previous question fails, we will have the opportunity to vote on my bill, H.1868, Restoring American Privacy Act of 2017, which will reverse last night's disastrous action by President Trump when he signed a partisan congressional resolution allowing internet providers to sell their customers' personal information without their knowledge or consent.  Before my time in Congress, I started my career as a systems analyst. I have firsthand experience writing code, and I can tell you that the first thing to protect vulnerable and sensitive data is to make sure it is kept private.  S.34, which the House passed last Tuesday, unraveled those vital protections for sensitive information belonging to millions of Americans nationwide.                              {time}  1330  The resolution negating essential protections for private citizens was signed by President Trump last night. The October 2016 FCC rule was the only rule that required internet service providers to obtain consumers' permission before selling their private internet browsing history and other sensitive information.  I am simply shocked that my colleagues across the aisle would vote for a measure that violates American privacy by selling your most personal and intimate information, including your email content and your app usage, all without your consent. Not only is this wrong and a blatant violation of policy, but it jeopardizes Americans' personal data and puts them at risk of hacking.  Repealing the FCC rule with S.34 allows broadband providers to turn over your info to the highest bidder or anyone else they want, including the government, without a warrant, without ever telling you. That is right. I will repeat it. Repealing the FCC rule with S.34 allows broadband providers to turn over your private information to the highest bidder or anyone else they want, including the government, without a warrant, without ever telling you.  Even worse, S.34 also tells providers they no longer have to use reasonable measures to protect consumers' personal information. This is absolutely unacceptable. We are living in a time where identity theft and internet hacking has become the new norm. We must provide consumers with these protections. No American wants their most personal information to be up for grabs.  Eliminating this rule prevents the FCC from publishing rules that are substantially the same absent additional legislation, establishing a very dangerous precedent for private citizens. Americans should have the right to decide how their internet providers use their personal information.  What this bill does, Mr.Speaker, is simple. This bill makes clear that the American people's browser histories are not for sale. The American people's health information: not for sale. The American people's financial information: not for sale. And the American people's location data: not for sale.  It is a simple concept and one I hope my colleagues across the aisle will recognize and support. The American people don't want the legislation that was signed last night. In overwhelming numbers, they are calling Congress and letting it be known that they want to keep their private information private.  I am proud to stand up for the American people by introducing the Restoring American Privacy Act of 2017, which reverses this misguided resolution and says, once and for all, that ISPs cannot sell customers' personal information without their knowledge, without their permission. This bill says that your privacy is not for sale, period.  ",CREC-2017-04-04-pt1-PgH2647.txt,99999999999999,IMPROVING RURAL CALL QUALITY AND RELIABILITY ACT OF 2017,2017.0,4.0,March
12657,topic-id,22,"Mr.President, I ask unanimous consent that the order for the quorum call be rescinded.  The PRESIDING Without objection, it is so ordered.  ",CREC-2017-03-27-pt1-PgS1982-3.txt,2084,IMPROVING RURAL CALL QUALITY AND RELIABILITY ACT OF 2017,2017.0,27.0,March
12658,topic-id,1124,"Mr.President, I am pleased that in the Senate we are about to take a vote on ratifying the protocol of the accession of Montenegro to  What I wanted to do was to take a few moments to explain to people why I think this is an important vote and an important moment for our security as a nation but also to protect our interests abroad and that of our allies.  We all know that NATO--the North Atlantic Treaty Organization--was started right after World War It was primarily designed in the Cold War to confront the threats posed by the Soviet Union and its allies in the Warsaw Of course those threats have changed since the end of that Cold  Here is what hasn't changed. What hasn't changed is the need for America and her allies in a strong way to remain engaged in the world. That need has not changed. What has not changed is the need for democracies to be able to come together and collectively defend not just their interests but the interests of all people around the world where freedom is threatened. The difficult, painful lesson of history is that dictators and tyrants are never pleased with what they have. They always want more. They always need more. That is why it is so important that those nations on Earth--luckily and in a blessed way, more people than ever before find themselves living in societies where the people get to choose their leaders.  These alliances we have around the world--NATO being chief among them--help advance our strategic and economic interests, but most importantly, they help to keep our country safe.  There is a lot of talk about how much countries are paying into NATO, and it is true that the United States is by far the largest contributor to I think that is a combination of two things: one, decisions that were made by some of our allies in Europe on how they want to spend their government's money, and the other is just the reality that we are the United States of America, and as the United States of America, we will always find that we are always making a disproportionate share and contribution on everything, from global aid to fight off hunger and disease, to collective security.  While we can urge our allies, encourage our allies, and ask our allies to make a greater contribution to their own defense, we should not fall into the trap of diminishing what they are doing and what they have done.  First of all, in Europe today, many of our NATO allies are increasing their defense spending. They are doing so in response to Russia's aggression in Ukraine and its increased aggression elsewhere in the region. Their soldiers are joining ours in deploying to Central and Eastern Europe to reassure our allies who are facing aggression and potential aggression from Vladimir  With all this talk about NATO and money and how much everyone is giving, I think it is important to take a moment to also understand that our NATO allies have fought beside us and have died beside Americans in Afghanistan, where more than 1,100 soldiers of the NATO-led coalition paid the ultimate price with their lives. It is important to note this because on September 11, 2001, Paris was not attacked, Berlin was not attacked, and London was not attacked on that horrible day; yet these nations and others, our partners, invoked a shared commitment that led them to stand beside us on the other side of the world in an effort to prevent another attack like September 11 from taking place again on American soil or anywhere in the world.  Montenegro is not even a member of NATO yet. Yet it sent hundreds of servicemembers to join the American-led coalition in  I have always argued that when our alliances, such as NATO, are under pressure from our potential adversaries and foes, we need to continue to expand and allow countries that meet the standards set by the alliance to join. That has never been more important than it is now, given the uncertainty and security challenges we face in Europe, especially as Vladimir Putin continues his aggression and continues to threaten stability in the region.  To be frank, Putin would love nothing more than to destroy In fact, you can see him trying to do that on a regular basis. He has tried to divide these countries, turn them against each other. He supports candidates throughout Europe who would take their countries out of NATO, constantly calling into question its viability. Vladimir Putin wants countries like Montenegro to remain in his sphere of influence and what I would call his sphere of threat, as his recent attempts to deploy his asymmetrical tools to influence Montenegrin politics have shown. That is why it is so important that we are moving to ratify Montenegro's access to NATO and to strengthen our relationship with Montenegro through  As the Senate and as a country, we are sending a clear message to Vladimir Putin that we will not accept the establishment of a Russian sphere of influence over countries that desire to[[Page S1987]]ally themselves with the free and democratic community of nations.  Today, I have tried to refrain from using the term ``Russian'' sphere of influence or ``Russia'' because the fact is, as I said to someone earlier today or yesterday, there is a difference between Russia and Vladimir Putin, and the events of the last 48 hours remind us of that. We are watching as many Russians who also desire to join the community of nations have turned out in cities and in places across Moscow and in other places in the thousands. They have turned out to protest the rampant corruption that fuels the Putin regime. And the Putin regime, as all totalitarian regimes do, has cracked down. They have arrested and detained hundreds of peaceful protesters. I ask you to compare that to Montenegro, whose membership in NATO will help the United States and Montenegro deepen our already strong bilateral relationship.  The stakes here are extraordinarily high for the United States and for our European allies. The Senate needs to send a strong message of solidarity with those in Europe who are standing up to the anti-democratic tactics of Vladimir Putin and his cronies.  That is why today I will be proud to cast my vote in support of Montenegro's accession into NATO, and I hope my colleagues here in the Senate will do the same and join me in doing so as well.  Mr.President, I yield the floor.  I suggest the absence of a quorum.  The PRESIDING The clerk will call the roll.  The bill clerk proceeded to call the roll.  ",CREC-2017-03-27-pt1-PgS1982-3.txt,2084,IMPROVING RURAL CALL QUALITY AND RELIABILITY ACT OF 2017,2017.0,27.0,March
12653,topic-id,25,"Mr.President, I ask unanimous consent that the order for the quorum call be rescinded.  The PRESIDING Without objection, it is so ordered.                         Border Adjustment Tax  ",CREC-2017-03-27-pt1-PgS1982-3.txt,2173,PRIVILEGES OF THE FLOOR,2017.0,27.0,March
