speech_id,topic_id,word_count,speech_text,file_name,speaker_id,session_title,year,day,month
1569,topic-id,331,"Mr.Chairman, again, I think we are stumbling over the fact that my colleagues on the other side of the aislebelieve that we are somehow paid by the words put into the Federal Registry here.  The SEC is already covered by both governmentwide ethics laws and regulations as well as SEC supplemental ethics regulationswhich apply to all SEC employees, including the  Perhaps the sponsor of the amendment is not aware that under existing Federal law, the SEC Chairman cannot participatepersonally in any matter that would have a direct and predictable effect on her financial interests or imputed financialinterest, and I would invite the sponsor to review the code at this point.  Additionally, SEC supplemental regulations prohibit SEC employees, including the Chair, from holding any security in adirectly regulated entity, and they must also preclear all purchases and sales of securities.  Further, the Chairman or Commissioner must not engage in any other business, employment, or vocation while in office, normay she ever use the power of her office or the influence of her name to promote the business interests of others.  Finally, the amendment does not seem to address what I believe Congressman DeSaulnier's description is intending toaddress as it is the Federal Reserve, not the Securities and Exchange Commission, that regulates the too-big-to-fail banks or,as the amendment states, financial institutions.  The SEC does not regulate financial institutions. The code defines the term ``financial institution,'' and the definitionincludes ``a bank, a foreign bank, and a savings association.''  Since the SEC does not regulate any of these entities, the amendment would require the SEC Chair to divest of exactly zeroentities. So notwithstanding that important discrepancy here, I ask my colleagues to join me in opposing the amendment.  Mr.Chairman, I reserve the balance of my time.  Mr.Mr.Chairman, I honestly respect the tutorial, but, with all due respect, I do think that thisamendment complements the existing rules and protects the investors.  Mr.Chairman, I yield such time as she may consume to the gentlewoman from Wisconsin (",CREC-2017-01-12-pt1-PgH441-2.txt,2028,LEGISLATIVE PRIORITIES,2017.0,12.0,April
1571,topic-id,122,"Mr.Chairman, at this time I am prepared to close, and I reserve the balance of my time.  Mr.Mr.Chairman, with all due respect, I really think this is, as intended, a commonsense amendment. I dothink it complements rather than adds on to the existing requirements to protect investors. And I really think this House, withall due respect, would want to see the markets work efficiently. We also want to ensure that the integrity of those markets andthe investors are also strengthened. So I think transparency in this case with the acknowledgment that there are other alreadyexisting regulations and the belief that this amendment complements those, I would ask for the House's support.  Mr.Chairman, I yield back the balance of my time.                              {time}  1600  ",CREC-2017-01-12-pt1-PgH441-2.txt,2028,REPLACING THE AFFORDABLE CARE ACT,2017.0,12.0,April
1572,topic-id,199,"Mr.Chairman, I would just point out again that this[[Page H442]]amendment does not hit the target. The SEC does notregulate financial institutions. 15 U.S.78c defines the term ``financial institutions,'' and that definition includes a bank,a foreign bank, and a savings association. The SEC does not regulate any of the entities that are described in this.  In addition to that, the Securities and Exchange Commission's Chair--Chairwoman in this instance, who will be resigningsoon--is covered under governmentwide ethics rules and laws. The SEC has additional SEC-specific rules that are in place. Thisamendment would do absolutely nothing to support or diminish those because it doesn't actually address any situation that theyhave.  Mr.Chairman, I yield back the balance of my time.  The Acting The question is on the amendment offered by the gentleman from California (Mr.DeSaulnier).  The question was taken; and the Acting Chair announced that the noes appeared to have it.  Mr.Mr.Chairman, I demand a recorded vote.  The Acting Pursuant to clause 6 of rule XVIII, further proceedings on the amendment offered by the gentleman fromCalifornia will be postponed.                 Amendment 5 Offered by Mr.Raskin  The Acting It is now in order to consider amendment 5 printed in part A of House Report 115-3.  ",CREC-2017-01-12-pt1-PgH441-2.txt,2028,FORSYTH ACADEMY,2017.0,12.0,April
1575,topic-id,19,"Mr.Chairman, I rise in opposition to this amendment.  The Acting The gentleman from Michigan is recognized for 5 minutes.  ",CREC-2017-01-12-pt1-PgH441-2.txt,2028,WHAT IS HAPPENING IN OUR COUNTRY,2017.0,12.0,April
1576,topic-id,377,"Mr.Chairman, I believe the sponsor of the amendment was in the Chamber when we were discussing this on thelast amendment. Federal law, as well as SEC supplemental regulations, already govern ethics and conflicts of interest.  It is well-known, especially if you check out my Twitter account, I think, that most people who support this President don'tbelieve I support this President enough. A number of people would say that I haven't supported the SEC Chairman to the levelthat I should. This, frankly, is insulting to the current President as well as the Implying somehow that this Chair haspreyed off of poor people until they went bankrupt, as was just sort of laid out by the sponsor of this, is an insult.  To believe this of the SEC Chair, who is typically--and I know in this particular case is--a very accomplished professional,is amazingly shortsighted, I believe. Additionally, the Chair is required to receive personal annual ethics training as well asan initial ethics briefing. I direct the sponsor to review the statute on this.  Additionally, the Chairman and the Commissioners are required to file an ethics agreement letter in which she will agree todivest prohibited assets, and if she has not done so prior to the appointment, she is to recuse herself from matters in whichshe has financial conflict or the impartiality conflict, which can be found also in code.  Finally, the Chairman or a Commissioner is prohibited from engaging in any other business, employment, or vocation while inoffice, or she may never use the power of her office or her name to promote or influence a business interest.  Once again, I think that what we are trying to do here with the underlying bill is to make sure that the SEC follows throughon what the courts have mandated in previous rulings in that they use a cost-benefit analysis. This is not about fraud. This isnot about whether Mary Jo White needs ethics training. This is about making sure that the SEC has an identifiable target andgoal with the rules that it is putting in place and then analyzing whether the costs and the benefits weigh in favor ofprotecting the consumer. Ultimately, this amendment does nothing to forward that. I oppose the amendment.  I reserve the balance of my time.  ",CREC-2017-01-12-pt1-PgH441-2.txt,2028,ENCOURAGING EMPLOYEE OWNERSHIP ACT OF 2017,2017.0,12.0,April
1578,topic-id,233,"Mr.Chairman, I understand that the sponsor is a constitutional law professor.  I direct the gentleman to 5 CFR 2638.305 and 5 CFR 2638.304, which read:       The Chair of the SECis required to receive in person annual      ethics training as well as an initial ethics briefing.      Additionally, Chairmen andCommissioners are required to file      ethics agreement letters in which they agree to divest.  The bottom line is that we don't need additional words in the Federal Register to do what is already being done.  The sponsor of the amendment mentioned that cost-benefit analysis is not in the U.Constitution, but neither is the SEC.However, due process is in the Constitution, and what we are trying to get at is due process to make sure that we have--us, as alegislative body--properly involved and engaged in this and that we understand what the goals and objectives of the Securitiesand Exchange Commission are when it is issuing a rule and whether that rule is going to effect the change intended.  What are those benefits? Is it going to benefit and protect the consumer?  Again, I reiterate the three elements of the mission of the Securities and Exchange Commission: number one, to protectinvestors; number two, to maintain fair and orderly and efficient markets; and number three, to facilitate capital formation.Those are the stated goals and is the job of the Securities and Exchange  I reserve the balance of my time.  ",CREC-2017-01-12-pt1-PgH441-2.txt,2028,PROVIDING FOR CONGRESSIONAL DISAPPROVAL OF A RULE SUBMITTED BY THE,2017.0,12.0,April
1580,topic-id,47,"Mr.Chairman, I maintain my opposition to this amendment.  I yield back the balance of my time.  The Acting The question is on the amendment offered by the gentleman from Maryland (Mr.Raskin).  The question was taken; and the Acting Chair announced that the noes appeared to have it.  ",CREC-2017-01-12-pt1-PgH441-2.txt,2028,ENCOURAGING EMPLOYEE OWNERSHIP ACT OF 2017,2017.0,12.0,April
1585,topic-id,20,"Mr.Speaker, I claim the time in opposition.  The SPEAKER pro tempore. The gentleman from Michigan is recognized for 5 minutes.  ",CREC-2017-01-12-pt1-PgH441-2.txt,2028,THE NEED FOR IMMIGRATION REFORM,2017.0,12.0,April
1586,topic-id,336,"Mr.Speaker, I have to commend my colleague. This is close, but this isn't horseshoes. Words have meaning. AndI have to tell you that our underlying bill does actually do what you are talking about.                              {time}  1700  I will direct you to page 4.  Page 4: ``evaluate whether, consistent with obtaining regulatory objectives, the regulation is tailored to impose the leastburden on society, including market participants, individuals, businesses of different sizes, and other entities, includingState and local government entities, taking into account, to the extent practicable, the cumulative costs of regulations.''[[Page H447]]  So, what we have here, Mr.Speaker, is a problem. We have a problem with U.businesses not performing the way that theyshould. We have to understand, though, why that is happening.  I have to point out to my colleague that, frankly, we have fewer publicly traded companies in this country right now. Youhave to ask yourself why.  We have virtually no IPOs happening in this country. You have to ask yourself why.  Well, we know the answer. It is because we have overly burdened ourselves in this country and are no longer competitive.  In fact, here is what I look forward to on January 21: I look forward to repealing the Tax Code that we have, and then wedon't have to worry; I am looking forward to repealing ObamaCare, and then we don't have to worry; I am looking forward to realregulatory reform, and then we don't have to worry about that as a country.  So, while this may be close on the objective of what our sponsor is trying to do, I would recommend voting against thismotion to recommit and vote for the underlying bill.  Mr.Speaker, I yield back the balance of my time.  The SPEAKER pro tempore. Without objection, the previous question is ordered on the motion to recommit.  There was no objection.  The SPEAKER pro tempore. The question is on the motion to recommit.  The question was taken; and the Speaker pro tempore announced that the noes appeared to have it.                             Recorded Vote  ",CREC-2017-01-12-pt1-PgH441-2.txt,2028,CLOTURE MOTION,2017.0,12.0,April
1652,topic-id,586,"Mr.Speaker, I yield myself such time as I may consume, and I thank the chairman for his leadership on this particular issue.  Mr.Speaker, small businesses and entrepreneurs are what drive the American economy. I meet with them in my district, the Second District of Michigan, all the time. I know my colleagues do as well back in their districts.  We see them firsthand. We see firsthand the benefits that their dreams, their innovations, their inspiration, and their hard work provide to our communities.  These innovators, entrepreneurs, and risk-takers are critical for our country's economic growth and prosperity. In fact, small businesses are responsible for 60 percent of the Nation's net new jobs over the past two decades. Not 2 years, not 10 years, but over the last 20 years, the last two decades.  If our Nation is going to have an economy that provides opportunity for every American, then we must promote and encourage success and growth in our small businesses and our startups. It is this notion that brings us this legislation we are discussing today.  H.1343, Encouraging Employee Ownership Act, would simply level the playing field for small companies by updating Federal rules that allow small businesses to better compensate their employees with ownership in their own businesses.  Currently, Securities and Exchange Commission rule 701 permits private companies to offer their securities as part of written compensation agreements to employees, directors, general partners, trustees, officers, or certain consultants without having to comply with rigid Federal securities registration requirements. SEC rule 701, therefore, allows small companies to reward its employees.  Despite the SEC having the authority to increase the $5 million threshold disclosure via rulemaking, the SEC has once again chosen to prioritize highly politicized regulatory undertakings instead of focusing on its core mission. That mission includes facilitating capital formation. If the SEC cannot or will not focus its priorities, Congress will.  It is imperative that small businesses in west Michigan, all of Michigan, and across America have the ability to compete. A critical element of competition and success is for those small businesses to be able to offer compensation packages that attract and retain top-tier talent.  In today's world, that includes rewarding employees in stock options. To me, this just makes common sense. Small-business employees have a clear and vested interest in the success of their employer.  By increasing the rule 701 threshold to $10 million, it will give private companies more flexibility to attract, reward, and retain those highly valuable employees. This simple change will allow companies to offer twice as much stock to their employers annually, as they currently can, without having to trigger additional disclosure information to investors about compensation packages that include these security offerings.  By reforming this regulatory burden, startups, small businesses, and emerging growth companies will be better equipped to attract highly talented individuals from companies that are better capitalized and able to maybe provide some additional cash compensation.  By incentivizing employees with stock options, small businesses will now be able to compete on a more level playing field with older, larger, and maybe more established companies. They are going to be able to retain their invaluable employees as well.  This bill is an example of the positive bipartisan results that can be achieved when Republicans and Democrats reach across the aisle. I commend the sponsors of the bill, Representatives Hultgren, Delaney, Higgins, MacArthur, Sinema, and Stivers for their leadership on this issue. I encourage my colleagues to support H.1343.  Mr.Speaker, I reserve the balance of my time.  ",CREC-2017-04-04-pt1-PgH2667.txt,2028,HOUR OF MEETING ON TOMORROW,2017.0,4.0,April
1657,topic-id,15,"Mr.Speaker, I yield 2 minutes to the gentleman from Missouri (Mr.Luetkemeyer), my fellow subcommittee chairman.  ",CREC-2017-04-04-pt1-PgH2667.txt,2028,SEC REGULATORY ACCOUNTABILITY ACT,2017.0,4.0,April
1663,topic-id,20,"Mr.Speaker, I yield such time as he may consume to the gentleman from Illinois (Mr.Hultgren), the author of this legislation.  ",CREC-2017-04-04-pt1-PgH2667.txt,2028,SEC REGULATORY ACCOUNTABILITY ACT,2017.0,4.0,April
1667,topic-id,16,"Mr.Speaker, I yield such time as he may consume to the distinguished gentleman from Arkansas (Mr.Hill).  ",CREC-2017-04-04-pt1-PgH2667.txt,2028,DISCHARGE AND REFERRAL--H.R. 590,2017.0,4.0,April
1671,topic-id,36,"Mr.Speaker, may I inquire as to the balance of time remaining on each side?  The SPEAKER pro tempore. The gentleman from Michigan (Mr.Huizenga) has 10 minutes remaining. The gentleman from Michigan (Mr.Kildee) has 10 minutes remaining.  ",CREC-2017-04-04-pt1-PgH2667.txt,2028,SEC REGULATORY ACCOUNTABILITY ACT,2017.0,4.0,April
1672,topic-id,11,"Mr.Speaker, I yield 3 minutes to the gentleman from Georgia (Mr.Loudermilk).  ",CREC-2017-04-04-pt1-PgH2667.txt,2028,SEC REGULATORY ACCOUNTABILITY ACT,2017.0,4.0,April
1675,topic-id,13,"Mr.Speaker, I yield 2 minutes to the gentleman from Michigan (Mr.Trott), my fellow  ",CREC-2017-04-04-pt1-PgH2667.txt,2028,BLACK HISTORY MONTH,2017.0,4.0,April
1678,topic-id,12,"Mr.Speaker, I yield 2 minutes to the gentleman from New York (Mr.Zeldin).  ",CREC-2017-04-04-pt1-PgH2667.txt,2028,ORDER FOR ADJOURNMENT,2017.0,4.0,January
1681,topic-id,37,"Mr.Speaker, may I inquire as to the balance of time remaining on each side?  The SPEAKER pro tempore (Mr.Shimkus). The gentleman from Michigan (Mr.Huizenga) has 3\1/2\ minutes remaining. The gentleman from Michigan (Mr.Kildee) has 9 minutes remaining.  ",CREC-2017-04-04-pt1-PgH2667.txt,2028,ENCOURAGING EMPLOYEE OWNERSHIP ACT OF 2017,2017.0,4.0,January
1682,topic-id,12,"Mr.Speaker, I yield 2 minutes to the gentlewoman from New York (",CREC-2017-04-04-pt1-PgH2667.txt,2028,1215,2017.0,4.0,January
1685,topic-id,469,"Mr.Speaker, I yield myself the balance of my time to close.  My colleague on the other side is trying to maybe split some hairs. We heard some rhetoric earlier on the floor here which, I think, shows why many on both sides of the aisle scratch their heads in opposition to this bill. We heard about monied interests. We heard about corporate wish lists. We heard about Enron which is, by the way, a publicly traded company which has absolutely nothing to do with this bill. Now, that all might play really well on a leftwing political base, but that is detached from the realities of what our economy is about.  As we have talked, 60 percent of all new job creation happens in small businesses. These are not corporations. These are LLCs, limited liability corporations. These are subchapter S sole proprietorships. These are small entrepreneurs and innovators.  By the way, I looked up the definition of innovator. It is a person who introduces new methods, ideas, or products. Those are the kind of dynamic elements that we are seeing here. And I think this confusion between corporations and Enron and what we are trying to do here is really a disservice to the American people.  This is about making sure that we update basically an inflation escalator from 1988. We update a rule that the SEC could have the power to do, which it has not done, that benefits employees and benefits those owner-employer's workers who oftentimes, more often than not, work alongside their employees. So they are the ones who are seeing this on a daily basis.  I can just say to you that, as was pointed out by my colleague from across the aisle from Maryland, if we don't do this, what most of those small businesses are going to do is say: You know what, it is just not worth the effort; I am not going to do it. And we will see that lack of upside going to those employees.  As was pointed out by my fellow colleague from Michigan, this is beyond their salary, this is beyond bonuses. This is an additional way to make sure that those relationships get cemented in.  So, at a minimum, all you would be doing is voting to confirm the inflation escalator from 1988. It is not a radical change to the law. This is a commonsense, I believe, innovative way of trying to make sure that this next generation of workers has the ability to really reap the benefits of success here in the United  I yield back the balance of my time.  The SPEAKER pro tempore. All time for debate has expired.                  Amendment 1 Offered by Mr.Polis  The SPEAKER pro tempore. It is now in order to consider amendment 1 printed in House Report 115-75.  ",CREC-2017-04-04-pt1-PgH2667.txt,2028,CLOTURE MOTION,2017.0,4.0,January
1690,topic-id,23,"Mr.Speaker, I claim the time in opposition to the motion.  The SPEAKER pro tempore. The gentleman from Michigan is recognized for 5 minutes.  ",CREC-2017-04-04-pt1-PgH2667.txt,2028,ENCOURAGING EMPLOYEE OWNERSHIP ACT OF 2017,2017.0,4.0,January
1691,topic-id,159,"Mr.Speaker, I just want to point out a couple of things.  The Senate Banking Committee has moved an identical bill forward, unanimously, recently.  Regarding the subject matter that the gentleman from California was throwing out, this bill is not about anything other than providing hardworking Americans an opportunity to succeed. It is not about relitigating the last election or even about Susan Rice illegally unmasking American citizens. This is about an underlying bill that will help American citizens.  I urge my colleagues to vote ``no'' on this motion to recommit, and I urge them to vote ``yes'' on the underlying bill.  Mr.Speaker, I yield back the balance of my time.  The SPEAKER pro tempore. Without objection, the previous question is ordered on the motion to recommit.  There was no objection.  The SPEAKER pro tempore. The question is on the motion to recommit.  The question was taken; and the Speaker pro tempore announced that the noes appeared to have it.  ",CREC-2017-04-04-pt1-PgH2667.txt,2028,AFFORDABLE CARE ACT REPEAL AND REPLACE,2017.0,4.0,January
