speech_id,topic_id,word_count,speech_text,file_name,speaker_id,session_title,year,day,month
2952,topic-id,320,"Mr.Speaker, I thank my colleague for yielding.  I proudly stand today in support of H.1808, the Improving Support for Missing and Exploited Children  This bipartisan legislation reflects both Democrats' and Republicans' desire to protect and care for our greatest resource: our children.  In my home State of North Carolina, the trafficking of young women has become an epidemic. There were 181 human trafficking cases reported in North Carolina in 2016, and Charlotte was home to more of them than anywhere else.                              {time}  1430  That figure gave us the dishonor of being ranked among the top 10 States in the Nation in the number of trafficking reports, and that doesn't even account for those children who have not yet been identified as victims of this shameful practice.  In North Carolina, lawmakers have sponsored efforts to establish pilot programs to help victims and train law enforcement to recognize the signs of trafficking. It is time Congress does its part and passes H.1808 to support States in their efforts.  This bill would improve efforts by both law enforcement and the general public to combat trafficking, and it would enhance the identification and location of missing children and their abductors.  It would protect children from being victims to online predators and keep a promise that was made 33 years ago, when Congress first passed the Missing Children's Assistance Act and we vowed to assist the National Center for Missing & Exploited Children in protecting and recovering our missing and vulnerable youth.  I am a parent, I am a grandparent, Mr.Speaker, and I am a concerned member of my community; and my district and my State have been torn apart by human trafficking.  This is an opportunity for us to come together as Americans and support an initiative that could save lives. I urge my colleagues to pass H.1808 and prove that we can all put politics aside when it comes to protecting our children.  ",CREC-2017-05-23-pt1-PgH4453.txt,2201,75TH ANNIVERSARY OF EXECUTIVE ORDER 9066,2017.0,23.0,May
3131,topic-id,202,"Mr.Chair, I have an amendment at the desk.  The The Clerk will designate the amendment.  The text of the amendment is as follows:       Add, at the end of the bill, the following (and amend the      table of contents accordingly):     11. AFFIRMATIVE       (a) In General.--In the case of a health care lawsuit, it      shall be an affirmative defense to any health care liability      claim alleged therein that the defendant complied with a      clinical practice guideline that was established, published,      maintained, and updated on a regular basis by an eligible      professional organization and that is applicable to the      provision or use of health care services or medical products      for which the health care liability claim is brought.       (b) Definitions.--For purposes of this section:[[Page H5282]]       (1) Clinical practice guideline.--The term ``clinical      practice guideline'' means systematically developed      statements based on the review of clinical evidence for      assisting a health care provider to determine the appropriate      health care in specific clinical circumstances.       (2) Eligible professional organization.--The term      ``eligible professional organization'' means a national or      State medical society or medical specialty society.  The Pursuant to House Resolution 382, the gentleman from Kentucky (Mr.Barr) and a Member opposed each will control 5 minutes.  The Chair recognizes the gentleman from  ",CREC-2017-06-28-pt1-PgH5263.txt,2238,COUNTERING IRAN'S DESTABILIZING ACTIVITIES ACT OF 2017,2017.0,28.0,May
3132,topic-id,485,"Mr.Chairman, I first want to commend Chairman Goodlatte and Congressman King and others who worked on H.1215, the Protecting Access to Care Act, which aims to address the real problem of junk lawsuits in the context of medical care.  Seventy-five percent of the doctors will face a malpractice lawsuit over the course of their careers, and many of these claims are frivolous, which drives up the cost of healthcare, encourages defensive medicine, and contributes to the Nation's severe shortage of doctors and nurses, especially in high-risk areas such as obstetrics, neurosurgery, and emergency medicine.  We need to enact sensible medical malpractice reform, and given the clear Federal interest in reducing taxpayer costs wherever Federal policy affects the distribution of healthcare, I support H.1215.  However, H.1215 does not go far enough to discourage the practice of defensive medicine, the provision of health services, tests, and procedures designed to shield the provider from legal liability but which may not be medically necessary or in the best interests of the patient.  Defensive medicine is a major driver of healthcare costs and also reduces the quality of patient care.                              {time}  1615  In that spirit, I offer this amendment, which would expand upon the reforms in H.1215, to protect physicians from frivolous lawsuits, while promoting the practice of evidence-based medicine to lower costs and improve healthcare quality.  My amendment offers a legal safe harbor in the form of an affirmative defense for defendants who can show that they adhered to clinical practice guidelines in their area of medical practice. Rather than Washington-based care, the guidelines would be developed by the physician community-based on the best available scientific evidence. This allows doctors to focus on practicing medicine and improves healthcare quality by encouraging the practice of evidence-based, not defensive medicine.  A New England Journal of Medicine study on clinical practice guidelines and tort reform stated that ``Safe harbor rules hold promise for realigning legal incentives with good medical practice and promoting fast uptake of proven modes of care.'' By promoting adherence to clinical practice guidelines that are already maintained by medical specialty groups, this amendment would encourage physicians to provide higher quality care, while reducing medical errors and waste.  Several States have already adopted safe harbor legislation and have significantly lowered the length and costs associated with medical malpractice cases. My amendment would build on the success of State safe harbor laws by expanding it to a national level, while not infringing on States' ability to implement additional tort reform.  Americans deserve healthcare reform that will help lower the cost of care and protect the sacred doctor-patient relationship. The current reforms within H.1215 are an important first step to reducing the high costs of medical malpractice claims. My amendment will further strengthen this legislation to promote affordable evidence-based patient care, reduce defensive medicine, and allow health professionals to focus on patients' actual needs.  Mr.Chairman, I reserve the balance of my time.  ",CREC-2017-06-28-pt1-PgH5263.txt,2238,COUNTERING IRAN'S DESTABILIZING ACTIVITIES ACT OF 2017,2017.0,28.0,June
3135,topic-id,55,"Mr.Chairman, in brief response to my friend from Tennessee, the safe harbor legislation would not supplant the standard of care, but it would allow for evidence-based medicine to improve healthcare quality. Those standards would be developed by local doctors participating in their medical societies.  Mr.Chairman, I yield to the gentleman from Iowa (Mr.King), my friend.  ",CREC-2017-06-28-pt1-PgH5263.txt,2238,VETERANS' COMPENSATION COST-OF-LIVING ADJUSTMENT ACT OF 2017,2017.0,28.0,June
3136,topic-id,181,"Mr.Chairman, I thank the gentleman for those comments.  Mr.Chairman, the clinical practice guideline safe harbor policies have been supported by the American for Tax Reform, American College of Radiology, Healthcare Leadership Council, American Academy of Orthopedic Surgeons, American Society of Anesthesiologists, American Academy of Neurology, American Urological Association, American College of Surgeons, American Health Care Association, American College of Obstetricians and Gynecologists, American Association of Neurological Surgeons, Alliance of Specialty Medicine, Third Way, American College of Physicians, American College of Emergency Physicians, American Osteopathic Association, American College of Cardiologists, and the American Academy of  As originally drafted, the amendment set forth the procedure in detail.  Nevertheless, the process by which clinical practice guidelines are proved and published is well established and well known. The text of the amendment clearly references that existing and well-defined process that provides for guidelines to be proposed, submitted, approved, and published through the National Guideline Clearinghouse under the Agency for Healthcare Research and This is a process that ensures the integrity and quality of the applicable guidelines.  Mr.Chairman, I yield back the balance of my time.  ",CREC-2017-06-28-pt1-PgH5263.txt,2238,VETERANS' COMPENSATION COST-OF-LIVING ADJUSTMENT ACT OF 2017,2017.0,28.0,June
3138,topic-id,734,"Mr.Chairman, I demand a recorded vote.  The Acting Pursuant to clause 6 of rule XVIII, further proceedings on the amendment offered by the gentleman from Kentucky will be postponed.                    Announcement by the Acting Chair  The Acting Pursuant to clause 6 of rule XVIII, proceedings will now resume on those amendments printed in House Report 115-179 on which further proceedings were postponed, in the following order:  Amendment 4 by Mr.Hudson of North  Amendment 5 by Mr.Barr of  The Chair will reduce to 2 minutes the minimum time for any electronic vote after the first vote in this series.                 Amendment 4 Offered by Mr.Hudson  The Acting The unfinished business is the demand for a recorded vote on the amendment offered by the gentleman from North Carolina (Mr.Hudson) on which further proceedings were postponed and on which the ayes prevailed by voice vote.  The Clerk will redesignate the amendment.  The Clerk redesignated the amendment.                             Recorded Vote  The Acting A recorded vote has been demanded.  A recorded vote was ordered.  The vote was taken by electronic device, and there were--ayes 222, noes 197, not voting 14, as follows:                             [Roll 334]                               AYES--222     Abraham     Aderholt     Allen     Arrington     Babin     Bacon     Banks (IN)     Barletta     Barr     Barton     Bera     Bergman     Biggs     Bilirakis     Bishop (MI)     Bishop (UT)     Blackburn     Blum     Bost     Brady (TX)     Brat     Bridenstine     Brooks (AL)     Brooks (IN)     Buchanan     Buck     Bucshon     Budd     Burgess     Byrne     Calvert     Carter (GA)     Carter (TX)     Chabot     Chaffetz     Cheney     Coffman     Cole     Collins (GA)     Collins (NY)     Comer     Comstock     Conaway     Cook     Correa     Costello (PA)     Cramer     Crawford     Cuellar     Culberson     Davis, Rodney     Denham     Dent     DeSantis     DesJarlais     Donovan     Duffy     Duncan (SC)     Dunn     Emmer     Estes (KS)     Farenthold     Faso     Ferguson     Fitzpatrick     Fleischmann     Flores     Fortenberry     Foxx     Franks (AZ)     Frelinghuysen     Gaetz     Gallagher     Gianforte     Gibbs     Gohmert     Goodlatte     Gosar     Gowdy     Granger     Graves (GA)     Graves (LA)     Graves (MO)     Grothman     Guthrie     Handel     Harper     Harris     Hartzler     Hensarling     Herrera Beutler     Hice, Jody     Higgins (LA)     Hill     Holding     Hollingsworth     Hudson     Huizenga     Hultgren     Hunter     Hurd     Issa     Jenkins (KS)     Jenkins (WV)     Johnson (LA)     Johnson (OH)     Johnson, Sam     Jordan     Joyce (OH)     Katko     Kelly (MS)     Kelly (PA)     King (IA)     King (NY)     Kinzinger     Knight     Kustoff (TN)     Labrador     LaHood     LaMalfa     Lamborn     Lance     Latta     Lewis (MN)     Loudermilk     Love     Lucas     Luetkemeyer     MacArthur     Marchant     Marino     Marshall     Mast     McCarthy     McCaul     McClintock     McHenry     McKinley     McMorris Rodgers     McSally     Meadows     Meehan     Messer     Mitchell     Moolenaar     Mooney (WV)     Mullin     Murphy (PA)     Newhouse     Noem     Norman     Nunes     Olson     Palazzo     Palmer     Paulsen     Pearce     Peters     Peterson     Pittenger     Poliquin     Ratcliffe     Reed     Reichert     Rice (SC)     Roby     Roe (TN)     Rogers (KY)     Rohrabacher     Rokita     Rooney, Francis     Rooney, Thomas     Rosen     Roskam     Ross     Rothfus     Rouzer     Royce (CA)     Ruiz     Rutherford     Schweikert     Scott, Austin     Sensenbrenner     Sessions     Shimkus     Shuster     Simpson     Smith (MO)     Smith (NE)     Smith (TX)     Smucker     Stefanik     Stewart     Taylor     Tenney     Thompson (PA)     Thornberry     Tiberi     Tipton     Trott     Upton     Valadao     Wagner     Walberg     Walden     Walker     Walorski     Walters, Mimi     Weber (TX)     Webster (FL)     Wenstrup     Westerman     Williams     Wilson (SC)     Wittman     Womack     Woodall     Yoder     Yoho     Young (AK)     Young (IA)     Zeldin                               NOES--197     Adams     Aguilar     Amash     Barragan     Bass     Beatty     Beyer     Bishop (GA)     Blumenauer     Blunt Rochester     Bonamici     Boyle, Brendan     Brady (PA)     Brown (MD)     Brownley (CA)     Bustos     Butterfield     Capuano     Carbajal     Cardenas     Carson (IN)     Cartwright     Castor (FL)     Castro (TX)     Chu, Judy     Cicilline     Clark (MA)     Clarke (NY)     Clay     Cleaver     Clyburn     Cohen     Connolly     Conyers     Cooper     Costa     Courtney     Crist     Crowley     Curbelo (FL)     Davidson     Davis (CA)     Davis, Danny     DeFazio     DeGette     Delaney     DeLauro     DelBene     Demings     DeSaulnier     Deutch     Diaz-Balart     Dingell     Doggett     Doyle, Michael     Duncan (TN)     Ellison     Engel     Eshoo     Espaillat     Esty (CT)     Evans     Foster     Frankel (FL)     Fudge     Gabbard     Gallego     Garamendi     Garrett     Gonzalez (TX)     Gottheimer     Green, Al     Green, Gene     Griffith     Grijalva     Gutierrez     Hanabusa     Hastings     Heck     Higgins (NY)     Himes     Hoyer     Huffman     Jackson Lee     Jayapal     Jeffries     Johnson (GA)     Kaptur     Keating     Kelly (IL)     Kennedy     Khanna     Kihuen     Kildee     Kilmer     Kind     Krishnamoorthi     Kuster (NH)     Larsen (WA)     Larson (CT)     Lawrence     Lawson (FL)     Lee     Levin     Lewis (GA)     Lieu, Ted     Lipinski     LoBiondo     Loebsack     Lofgren     Lowenthal     Lowey     Lujan Grisham,     Lujan, Ben Ray     Lynch     Maloney, Carolyn     Maloney, Sean     Massie     Matsui     McCollum     McEachin     McGovern     Meng     Moore     Moulton     Murphy (FL)     Nadler     Neal     Nolan     Norcross     O'Halleran     O'Rourke     Pallone     Panetta     Pascrell     Payne     Pelosi     Perlmutter     Perry     Pingree[[Page H5284]]     Pocan     Poe (TX)     Polis     Posey     Price (NC)     Quigley     Raskin     Rice (NY)     Richmond     Ros-Lehtinen     Roybal-Allard     Ruppersberger     Rush     Russell     Ryan (OH)     Sanchez     Sanford     Sarbanes     Schakowsky     Schiff     Schneider     Schrader     Scott (VA)     Scott, David     Serrano     Sewell (AL)     Shea-Porter     Sherman     Sinema     Sires     Slaughter     Smith (NJ)     Smith (WA)     Soto     Speier     Suozzi     Swalwell (CA)     Takano     Thompson (CA)     Thompson (MS)     Titus     Tonko     Torres     Tsongas     Turner     Vargas     Veasey     Vela     Velazquez     Visclosky     Walz     Wasserman Schultz     Waters, Maxine     Watson Coleman     Welch     Wilson (FL)     Yarmuth                             NOT VOTING--14     Amodei     Black     Cummings     Johnson,     Jones     Langevin     Long     McNerney     Meeks     Napolitano     Renacci     Rogers (AL)     Scalise     Stivers                              {time}  1646  ",CREC-2017-06-28-pt1-PgH5263.txt,2238,IMPROVING SUPPORT FOR MISSING AND EXPLOITED CHILDREN ACT OF 2017,2017.0,28.0,June
3095,topic-id,144,"Mr.Chairman, I rise today in opposition to H.1215 and to express my extreme concerns with this bill.  I am from California, and I am an attorney, and I can tell you that this bill goes beyond medical malpractice. It goes way beyond that. It includes cases involving unsafe drugs and nursing home abuse and neglect. That is not happening in  If passed, it would prevent cases where seniors have endured tragic deaths and injuries, like an 88-year-old California woman who was sexually assaulted by her nursing assistant after she suffered a stroke, resulting in lifelong mental and physical pain.  Over 80 senior and healthcare groups, including the American Association for Justice and the California Advocates for Nursing Home Reform, have come out against this bill. They recognize that we need to protect our vulnerable seniors.  Mr.Chairman, I urge my colleagues to oppose this bill.  ",CREC-2017-06-28-pt1-PgH5263.txt,99999999999999,APPOINT A SPECIAL COUNSEL TO INVESTIGATE RUSSIAN CONNECTIONS,2017.0,28.0,May
