speech_id,topic_id,word_count,speech_text,file_name,speaker_id,session_title,year,day,month
5503,topic-id,11,"Mr.Speaker, I yield 1 minute to the gentlewoman from Florida (",CREC-2017-06-27-pt1-PgH5211.txt,344,NO SANCTUARY FOR CRIMINALS ACT,2017.0,27.0,August
5504,topic-id,22,"Mr.Speaker, I yield 4 minutes to the gentleman from Maryland (Mr.Hoyer), the Democratic whip, who is an original cosponsor of this resolution.  ",CREC-2017-06-27-pt1-PgH5211.txt,344,NO SANCTUARY FOR CRIMINALS ACT,2017.0,27.0,August
5506,topic-id,149,"Mr.Speaker, we should be clear that Vladimir Putin is testing us. He attacked our democracy in last year's election, he is working to create divisions among our allies, and he would love nothing more than to see NATO fail.  If the United States offers anything less than our full-throated support for the alliance, and our ironclad commitments to article 5, Moscow will see that as an invitation to undercut transatlantic unity and fracture our critical bond with  I am glad the House is coming together to ensure that it doesn't happen. I hope we can continue to work in a bipartisan way to shore up our alliances and push back on Russian aggregation. This is a real threat. Russia is not our ally.  Mr.Speaker, I am pleased to support this measure, and I urge all Members to do the same.  Mr.Speaker, I yield back the balance of my time.  ",CREC-2017-06-27-pt1-PgH5211.txt,344,EXECUTIVE SESSION,2017.0,27.0,August
5603,topic-id,197,"Mr.Speaker, I rise today to recognize the Honorable Reverend Nathaniel On Sunday, Reverend Dixon will be giving his last sermon at Stephen's United Methodist  While this Sunday may be his last sermon, I have no doubt that the lives he has touched, parishioners, colleagues, neighbors, all of us, will continue to uphold the lessons he taught us and will remember the action he has taken over a long and hard-fought career.  Reverend Dixon is a true renaissance man whose life has always been committed to New York For 27 years, he was a music teacher and, later, an administrator, and also an executive director of the Saxrack Learning  Old Satchmo, the great Louie Armstrong, once said: ``Musicians don't retire; they just stop when there's no more music in them.''  Reverend Dixon never stopped teaching music, and he has inculcated this love and passion into the lives of students and parishioners. ``Music helps,'' he said, ``because there is awe in them.''  Thank you, Reverend Dixon, for your commitment and willingness to become a leader and a role model for many years to come in New York's 13th Congressional  We love you and wish you the very best.                          ____________________",CREC-2017-06-23-pt1-PgH5126.txt,99999999999999,SILVER STAR,2017.0,23.0,August
5621,topic-id,1043,"Mr.President, I thank the distinguished Senator from Connecticut for his remarks, and I would like to make a few remarks with respect to my position as ranking member on the Judiciary  As has been well described, shortly, we will vote on the nomination of Christopher Wray to be the next Director of the Federal Bureau of The Judiciary Committee has reviewed his record and held a full and complete hearing. His nomination was sent to the floor for consideration by a vote of 20 to 0--a very good vote. I am very satisfied that Mr.Wray has the qualifications and independence necessary to lead the FBI, so I will support Mr.Wray's nomination to be FBI  I wish to begin by saying just a few words about what I think, after 24 years in this place, is necessary in going forward.  First, it is really important that we have a strong FBI There can be no manipulation.  Second, Special Counsel Robert Mueller must be allowed to proceed with his investigation undisturbed.  Third, the FBI Director must manage and speak for the FBI on the basis of the Constitution and the laws of the United States, not at the dictates or requests or statements of any politically elected person in this country.  Fourth, the FBI Director must be independent from the White House and any political figure.  This is what the FBI and the American people need now.  As you and I know, the FBI is a critically important law enforcement agency. It must be able to move forward with its work and with its senior leadership in place. As I noted at Mr.Wray's hearing and just noted again, the FBI must be an independent law enforcement organization that is free from political influence.  During his hearing and in his written responses to followup questions, Mr.Wray stated that the FBI Director must maintain ``strict independence,'' and he committed to doing the job ``by the book'' and ``without regard to any partisan political influence.'' He also testified that his loyalty is to the Constitution and the rule of law, not to any ideology or any individual, including the He was believable to all of us in those statements.  Mr.Wray also testified that he would resist any efforts to interfere with FBI investigations and that he would not ``pull any punches.'' When asked what he would do if the President asked him to do something unlawful or unethical, Mr.Wray replied that he would first try to talk him out of it and that, if that failed, he would resign.  These commitments are important. Especially at this moment in history, we need an FBI Director who has the strength and fortitude to stand up and do what is right by the law when tested.  Mr.Wray has received bipartisan support from more than 100 former U.attorneys, who enthusiastically endorsed his nomination and stated their belief that Mr.Wray ``is a strong and effective leader with unassailable integrity, judgment and courage.'' According to this group, which included former Bush administration Justice Department officials like Larry Thompson and Ken Wainstein, as well as Eric Holder and Sally Yates, Mr.Wray will discharge the duties of FBI Director ``with honor, independence, and a tireless commitment to the rule of law.''  Earlier this year, when we considered other nominees for the Justice Department, I pointed out that we need leaders with steel spines, not weak knees. I believe that Mr.Wray will be such a leader.  The issue of torture is very important to me. On this issue, I was encouraged by Mr.Wray's acknowledgment that torture is wrong, unacceptable, illegal, and ineffective. He testified under oath that he did not participate in the drafting of the so-called torture memos that were issued by the Office of Legal Counsel some time ago. Mr.Wray has further testified that interrogation techniques, such as waterboarding, painful stress positions, threatening detainees with dogs, forced nudity, and mock execution, are ``abusive under all circumstances.''  Importantly, for me, he has committed that the FBI, under his leadership, will never engage in such techniques or other forms of torture and that it will adhere to the policy of using the Informed Interrogation Approach as outlined in the Army Field Manual, which, thanks to John McCain, was added as a new law to last year's military authorization bill. Mr.Wray also committed to me that he will read the Senate Intelligence Committee's report on the CIA's detention and interrogation program under a former administration.  On the issue of torture, as well as his independence and integrity, I take Mr.Wray at his word. As we discussed when Mr.Wray and I met in my office, I believe the next FBI Director's independence, integrity, and commitment to the rule of law, sadly, will likely be tested by this administration.  One early test may come in relation to the investigations being conducted by Special Counsel Mueller, this committee, and other committees in Mr.Wray has committed to supporting and protecting the investigation being conducted by Special Counsel Mueller, and I trust Mr.Wray will keep the Judiciary Committee of our House informed of any attempts to interfere with that investigation.  Now, he has a tough job ahead of him. The FBI is our premier law enforcement agency. It faces new criminal terrorism threats every day. I remember FBI Director Comey telling us the FBI had a counterterrorism investigation going on in virtually every State in the That was last year, but I assume many are still going on. On top of that, his predecessor was, as we all know, suddenly fired by the President for reasons that are questionable, and that is the subject of ongoing investigations. Lately, we have seen the President attempt to bully his own Attorney General, but even in the light of these challenging circumstances, I believe Mr.Wray is up to the task.  Based on his testimony and the commitments he has made to me and other members of our Judiciary Committee, I believe we on the committee will all vote to support his nomination, and, if he is confirmed, I commit to working with him to support the FBI, its mission, and the some 30-plus thousand FBI agents and employees who work every day to help protect our  Mr.President, I yield the floor.  The PRESIDING The Senator from  ",CREC-2017-08-01-pt1-PgS4640-2.txt,1332,EXECUTIVE CALENDAR,2017.0,1.0,July
5458,topic-id,231,"Mr.Speaker, I rise today to recognize the hard work of the students and faculty at Flat Rock Middle School in Tyrone,  Four years ago, Monica Reckley decided to found a STEM program at Flat Rock to give her students more than just a traditional classroom experience. She hoped to show them how science, technology, math, and engineering could lead to future careers.  Today, the program has 150 students spread over 6th, 7th, and 8th grades, and it is helping students develop an interest that could lead them to new professional opportunities. The program introduces students to STEM, brings in speakers from these fields, and allows students to participate in related competitions.  Last month, 10 students from the program participated in the Georgia Tech InVenture Challenge and had several inventions showcased. These inventions included a bulletproof vest designed specifically for female police officers, a wireless vital signs monitoring device for elderly patients, a dental floss guard to make flossing easier, and an extension cord and power outlet combination that reduces the number of electrical outlets needed in a home.  I am so proud of these students and the opportunities this school district has provided to encourage young people to explore careers in the 21st century.  I am a proud supporter of career and technical education programs because they prepare students and young people for work and careers in the modern workforce.                          ____________________",CREC-2017-05-23-pt1-PgH4431-2.txt,99999999999999,EXECUTIVE SESSION,2017.0,23.0,June
5465,topic-id,207,"Mr.Speaker, I rise today to honor George Dillard, whose leadership and guidance have made him a valuable member of the community in Peachtree City and Georgia's Third District.[[Page H6477]]  George was born in 1958, in Jacksonville, Florida, while his dad served in the He grew up in the Eastpoint Christian Church where he was ordained into ministry in 1982.  He graduated with a bachelor of science degree from Atlanta Christian College in 1983, and answered the call for the First Christian Church in Rincon, Georgia, in 1985, where he began his first full-time ministry.  In 1993, George and his family moved to Peachtree City to serve the Peachtree City Christian Church, where he continues today.  George has been married to his wife, Renee, since 1988, and they have three children and one grandchild. George and his family live in Peachtree City,  I want to commend Dillard for his commitment to our community. There is not a week that goes by where George isn't a visible and welcoming part of the Fayette County community.  The grace and love he has shown his parishioners and neighbors throughout his 24 years in Peachtree City is unparalleled.  I am truly honored to have George Dillard here with us here today.                          ____________________",CREC-2017-07-27-pt1-PgH6476-7.txt,99999999999999,1415,2017.0,27.0,June
5546,topic-id,179,"Mr.Speaker, as we celebrate National Charter Schools Week, I want to highlight my recent visit to Success Academy Harlem 1, which is 1 of 41 charter schools in the largest and highest performing public charter school network in New York  Success Academy current serves 14,000 students and has more than 16,000 families on its wait list. Founded in 2006, Harlem 1 is Success Academy's first school, and founder Eva Moskowitz served as its first principal.  With a focus on developing the whole child, Success Academy aims to make its schools joyful places of learning. I am here to tell you that these schools are getting results, and they are joyful.  Five of the top five schools in the State of New York in math and two of the top five schools in English are Success Academy schools.  Every student in every school deserves an excellent education, but unfortunately we are falling far short of that goal as a nation. Thankfully, innovative charter schools like Success Academy Harlem 1 are providing thousands of families with new hope and opportunity.                          ____________________",CREC-2017-05-01-pt1-PgH2995.txt,1791,1415,2017.0,1.0,May
5589,topic-id,370,"Mr.Speaker, I thank both of my colleagues for their leadership on H.2664 and bringing this important matter to the attention of the  I rise to express my strong support for this bill, and to commend, again, my colleagues for making a difference in the fight to end modern slavery.  Over the past few years, we have only begun to comprehend the horrors of human trafficking and how it established a foothold in this country. Thanks to the vigilance of faith-based groups, humanitarians across the globe, and the courage of survivors, we are learning more about the tactics and loopholes human traffickers exploit to prey on the most vulnerable among us.  Children are often the ones most vulnerable to exploitation. It is estimated that one in six endangered runaways are likely victims of this horrific crime. Earlier this year, with the leadership of Representatives Guthrie and Courtney, the House passed the Improving Support for Missing and Exploited Children  That bipartisan legislation supports the critical efforts of the National Center for Missing & Exploited It includes positive reforms to encourage new and innovative ways to recover and protect missing and exploited children, including those who are victims of trafficking. We need to do everything possible to ensure this vital work will continue, and that is what H.1808 was all about.  But this is an issue that demands our ongoing attention. More solutions are needed, and that is why we are here today, to build on the bipartisan work we have already accomplished.  The Department of Labor has a unique vantage point for spotting violations in workplaces that can be telltale signs of modern slavery and labor exploitation. This bill equips DOL personnel to form partnerships with law enforcement to detect and address signs of human trafficking in America's workplaces.  Mr.Speaker, if we can shed light in any corner where this evil may lurk, we must.  Again, I commend Mr.Walberg's leadership on this issue and Mr.Sablan for working with him so passionately. I am proud that the Committee on Education and the Workforce could do its part to support their work and bring this bill to the floor.  I urge all Members to vote in favor of the Enhancing Detection of Human Trafficking  ",CREC-2017-07-12-pt1-PgH5486-2.txt,1791,NO SANCTUARY FOR CRIMINALS ACT,2017.0,12.0,June
5674,topic-id,370,"Mr.Speaker, I thank the gentleman for yielding.  While we have heard a good amount of inflammatory rhetoric, my remarks will speak solely to the facts.  Mr.Speaker, I rise today in support of keeping America safe. In less than 2 years, over 8,000 undocumented immigrants, all subject to ICE detainment, were released because of local noncooperation policies.  Sixty-three percent of those illegal aliens had prior convictions or had been marked a public safety concern. After being released, they went on to be rearrested nearly 4,300 times, committing nearly 7,500 new offenses.  The facts are clear: States and local governments that do not comply with our immigration laws are putting American citizens at risk.  The U.Sentencing Commission found that, in 2014, 75 percent of all criminal defendants who were convicted and sentenced for Federal drug offenses were illegal immigrants. As of 2014, illegal immigrants made up roughly 3.5 percent of our population but committed over 10 percent of all murders.  Refusing to turn over criminal illegal immigrants poses a threat to our society, our safety, and our economy. American citizens pay nearly $19 million a day to house and care for the 450,000 criminal immigrants in jails and prisons who are all eligible for deportation.  When cities ignore Federal immigration laws, the results are often tragic.  The sheriff of Travis County, Texas, decided she would only turn over illegal aliens who have committed a narrow list of crimes. Her policy allowed one illegal alien to be released on bail despite sexually abusing his girlfriend's 9-year-old daughter.  A Cook County sheriff released an illegal immigrant after he served a brief domestic assault sentence, despite an ICE detainer. Soon after, he went on to kill a 15-year-old girl.  America wept as 32-year-old Kate Steinle was killed by a stray bullet. The illegal immigrant who shot that gun had seven previous felony convictions.  There are thousands more stories of innocent lives lost, of families destroyed, and of crimes that could have[[Page H5324]]been prevented. Every day in America, another family grieves because of the policies of sanctuary cities.  Mr.Speaker, I rise for the protection of our citizens, the safety of our communities, the defense of our country, and to ultimately see the end of sanctuary cities.  ",CREC-2017-06-29-pt1-PgH5316.txt,99999999999999,NO SANCTUARY FOR CRIMINALS ACT,2017.0,29.0,May
