speech_id,topic_id,word_count,speech_text,file_name,speaker_id,session_title,year,day,month
6552,topic-id,488,"I thank the gentleman for yielding.  Mr.Speaker, I rise in support of H.337, the Black Hills National Cemetery Boundary Expansion  I thank the chairman of the committee and his staff for working so hard to move this bill through Their support means so much to our veterans and to their families.  Those who have served and those families who have sacrificed beside them deserve our Nation's eternal gratitude. Since 1948, the Black Hills National Cemetery has been one way that we have shown that appreciation to them. The cemetery currently covers about 100 acres of land and is home to the Korean War Veterans Its peaceful landscape serves as the final resting place for hundreds of servicemembers and their family members.[[Page H987]]  Chief David Beautiful Bald Eagle is among the brave men and women buried here. Born in a tepee in 1919, Chief Bald Eagle served our country in World War II as a paratrooper and as one of the legendary Lakota code talkers. We lost him last summer, but his life continues to be an inspiration to the Lakota people and those who knew him.  Brigadier General Richard Ellsworth was also laid to rest there. He was a man who flew 400 combat missions during World War He earned numerous medals and returned to the U.S., where he eventually became wing commander of the Rapid City Air Force In 1953, that base was renamed in his honor.  The surrounding community also does its part to honor this hallowed ground. On a brisk day this past December, Pennington County 4-H, the Sturgis Boy Scouts, the Veterans of Foreign Wars Auxiliary, and community members came together and placed over 1,000 wreaths on the graves of servicemembers who were laid to rest at this cemetery. They upheld the vow that those laid to rest should never be forgotten. Now we must do our part to uphold that very same vow.  So we honor the legacy of these veterans and many others at the Black Hills National Cemetery, but the facility is not going to have the room it needs to continue serving future veterans without expansion. This bill would allow that expansion by transferring around 200 acres of adjacent land near Sturgis, South Dakota, from the Bureau of Land Management's jurisdiction to the Department of Veterans My office worked with these agencies and the stakeholders in crafting this legislation, and all agreed that this land transfer is necessary.  The transfer of this land will provide the Black Hills National Cemetery with the additional burial space that is needed to assure that today's veterans and servicemembers, as well as their families, will be able to utilize the space and that we will be able to uphold our commitment and offer this Nation's eternal gratitude for everything that they have done for us.  Again, I thank the committee, my colleagues, and the chairman for supporting this bill. I urge a ``yes'' vote.  ",CREC-2017-02-06-pt1-PgH985.txt,2060,1715,2017.0,6.0,January
6438,topic-id,271,"Mr.Speaker, I yield myself such time as I may consume.  I rise in support of H.549, the Transit Security Grant Program Flexibility  As the threats to our homeland continue to evolve, transit systems, domestically and abroad, have become a leading target for terrorists. Last year, the Committee on Homeland Security's Subcommittee for Emergency Preparedness, Response, and Communications held field hearings in New Jersey to assess how transit owners and operators and local first responders were coordinating efforts to secure domestic mass transit and to determine what the Federal Government could do to assist those efforts.  At the hearing, transit operators repeatedly praised the transit security grant program, although they raised serious concerns about funding, which has decreased dramatically since its peak in 2009. Witnesses also testified that the period of the performance for the transit safety grant program was too short to support infrastructure-hardening projects.  Under H.549, the period of performance for security-hardening projects would be extended from 36 months to 55[[Page H792]]months in order to make it possible for transit agencies to complete projects that may take longer than the time period allowed under current law.  This bipartisan bill was passed in the House last Congress, and I urge my colleagues to again support this measure.  It is very important that we give transit professionals the flexibility that they need to keep our transit systems safe and secure. H.549 will allow transit security grant program grantees to use the funds designated for security-hardening projects more efficiently and within a more reasonable timeframe.  I urge my colleagues to support this important measure.  Mr.Speaker, I yield back the balance of my time.  ",CREC-2017-01-31-pt1-PgH791.txt,2097,1715,2017.0,31.0,January
6550,topic-id,391,"Mr.Speaker, I yield myself such time as I may consume.  This bill provides the Veterans Administration with 200 acres of Federal land, which are currently managed by the Bureau of Land Management, in order to expand the Black Hills National  National cemeteries are reserved for the brave men and women who make the ultimate personal sacrifice while serving in the military in defense of our freedom, and it is important that we have the sufficient space to meet all of those interment requests. These heroes have served our country and deserve to permanently rest in a cemetery that honors their sacrifice and commitment to the ideals that hold us together as a nation.  With respect to the Black Hills National Cemetery specifically, the BLM and the VA determined that only Congress can provide the permanent jurisdiction transfer that is needed for this particular expansion; thus, we are considering this bill and, after passage, are encouraging our friends in the Senate to do the same.  Of course, this bill represents a small fraction of the ways we can support our veterans and need to support our veterans to demonstrate our appreciation for those who have served. We need to improve access to education and job training. We need to increase funding and raise the bar on accountability for the Department of Veterans We should work to shorten wait times at VA hospitals by allowing nurses to practice to the full extent of their licensure to ensure quality care in a quicker way at a reasonable cost, and there are many other things we need to do to make sure that those who proudly put their lives on the line--or in this case, who have paid the ultimate price to protect our freedom--and their families and loved ones are cared for by this country in recognition of their sacrifice.  I do believe this simple change in land ownership will have an impact by providing the men and women who have bravely served a final resting place. Expanding the Black Hills National Cemetery is a noble and worthy cause that deserves our support.  I thank my colleague from South Dakota for bringing this issue forward and for her hard work in guiding this bill through I urge my colleagues to join me in supporting this bill.  Mr.Speaker, I reserve the balance of my time.  ",CREC-2017-02-06-pt1-PgH985.txt,1910,1715,2017.0,6.0,January
6553,topic-id,21,"Mr.Speaker, I urge my colleagues to support this bill that supports our veterans.  I yield back the balance of my time.  ",CREC-2017-02-06-pt1-PgH985.txt,1910,MICHIGANDERS WILL LOSE COVERAGE,2017.0,6.0,March
6516,topic-id,1997,"Mr.Speaker, we are so proud of the leadership Congresswoman Jayapal is showing in both Washington State and Washington, D.C., in resisting these terrible cuts to the domestic budget of the people of the United States, in showing leadership, also especially in defending American values when it comes to immigration and affording a refuge to people fleeing political and religious repression all over the world.  She is a true leader and we are very proud of her. I am grateful that she is sharing a couple of minutes with me tonight to talk about the astonishing news of the day, which is the most dramatic and draconian budget cuts offered perhaps in our lifetime to the domestic budget of the United  It is going to take us many days--many weeks, indeed--to fully analyze what exactly will be axed with these budget proposals, but I wanted to start with a little exchange that took place today with Mick Mulvaney, who is leading the budget effort for the  He had a press conference and he was asked about the implications of these billions of dollars of cuts to Meals on He was asked about one specific program, and he had no problem basically casting Meals on Wheels to the curbside, saying: ``It's just not showing any results.'' Which is why the Trump administration apparently feels good about slashing the domestic budget, including the community development block grants which help support Meals on Wheels across the country.  Well, let's just take this one tiny little example, then. Meals on Wheels actually serves 2.4 million Americans between the ages of 60 and 100. These are people who, for reasons of illness or physical infirmity or simply poverty, cannot go grocery shopping for themselves or prepare meals for themselves.  Why don't we take a moment to praise the people at Meals on Wheels who actually do something constructive and patriotic for their country. They bring food to older people who might otherwise go without.  You might say: Well, that is just kind of mushy-headed and soft-hearted. We are in the age of the budget ax. We need to destroy these domestic programs that are a terrible burden on the taxpayers.  Check out a 2013 review of studies on the issue of home-delivered meal programs like Meals on The study says that these programs ``significantly improve diet quality, increase nutrient intake, and reduce food insecurity and nutritional risk among participants. Other beneficial outcomes include increased socialization opportunities, improvement in dietary adherence, and higher quality of life.''  Well, maybe you don't care about any of those things. Maybe you just consider about the bottom line.  Consider this finding. These programs are aligned with the Federal cost-containment policy to rebalance long-term care away from nursing homes to home and community-based services by helping older adults maintain independence and remain in their homes and communities as their health and functioning decline.  You see, for Mr.Mulvaney and President Trump and the Cabinet of billionaires and CEOs and ethically challenged Russian-influenced corporate titans, they don't care about how the program is actually working right here in American communities.  They don't care about facts. We know they have contempt for facts, which is why they give us their alternative facts. They don't care about studies and books because we know the President is their leader and he doesn't read books.  They definitely don't care about the elderly people who can't make it to the grocery store or who can't afford nutritious meals on their own. These are the same people, after all, that they propose to throw to the curb on Medicaid, with their proposal released last week in the cloak of darkness to repeal the Affordable Care Act and gut Medicaid and replace it with a monstrosity of a program which even their own Members can't support. Under their plan, 14 million would lose their healthcare insurance. Millions of elderly people would lose their insurance.  Now, with this mean-spirited little proposal to take a relative crumb away from the community development block grant and from Meals on Wheels, they would deprive a lot of people even of a wholesome dinner delivered to their home.  Why do they want to slash all of these programs across the board: the EPA, the State Department, the Agriculture Department, the Labor Department, the Department of Health and Human Services, the Commerce Department, the Education Department, HUD, Transportation, Interior, and so on? Why?  Well, the President has announced he wants to take $54 billion out of that slice of the pie for nondefense discretionary spending, which accounts for only 16 percent of the overall budget, and put that $54 billion directly into the  Just to repeat, they want to take $54 billion out of the domestic budget, nondefense discretionary spending, and put it into the Pentagon for a military buildup.  But for what?  The world's second largest military power is We outspend them 10 to 1. We are a giant and they are a dwarf.  Vladimir Putin, in any event, is Donald Trump's best friend, his BFF, his bosom buddy. The Trump-Putin relationship may be the President's most successful long-term relationship, at least politically speaking.  All that money that goes to the Pentagon, why? What is it for? Is it possible that Mr.Bannon and Mr.Trump are thinking about a war drive?  The President has tweeted about World War III in a very cavalier and flippant way.  It is disturbing. Nobody really knows. But one thing we do know is that all of that money that goes over to the Pentagon, if history is any record, will be available for the beltway bandits, the inside players with political influence and the mega corporations to go and make a buck off of the American taxpayer.  We will strip it from the EPA, and we will strip it from the Department of State, and we will strip it from education and we will put it in the Pentagon, and that is where we know a lot of people are going to get rich.                              {time}  1900  They are going from Meals on Wheels to deals on wheels. That is the name of the game. No more Meals on It is all about deals on wheels. You have got to know the President, you have got to know the inside players in the[[Page H2142]]billionaire Cabinet, and then you can make some money.  Who are they going to sacrifice for this operation announced this week?  Well, it would take us all night to go through all of the domestic programs and projects that the American people depend on that are going to be sliced and diced because of this budget proposal, at least if it goes through.  But let's start with the National Institutes of Health, the The administration proposes to cut nearly $6 billion from the NIH--$5.8 billion they want to get rid of.  Now, what is the NIH, which happens to be in my congressional district in Rockville--and I am so proud of that--where we have got doctors and nurses and researchers and scientists who are working every day as part of the institutional world leader in biomedical research?  This is an entity that supports hundreds of thousands of jobs. These cuts would devastate the NIH and their ability to research lifesaving cures and treatments for diseases.  What kinds of diseases are being treated there?  I am not going to be able to go through all of them because there are hundreds of them that are being researched, where treatments are being developed, where patients are being seen, where progress is being made. Acute respiratory distress syndrome, Agent Orange and dioxin, aging, alcoholism, Alzheimer's disease, ALS, anorexia, anthrax, antimicrobial resistance, anxiety disorders, aphasia, arthritis, assistive technology, asthma, attention deficit disorder, autism, autoimmune disease. That is just the A's.  Let's keep going a little bit. Batten disease, biodefense, bioengineering, biotechnology, bipolar disorder, brain cancer, brain disorders, breast cancer, cancer, cannabinoid research, cardiovascular, cerebral palsy, cervical cancer, child abuse and neglect research, Charcot-Marie-Tooth disease, childhood leukemia, chronic fatigue syndrome, chronic liver disease and cirrhosis, chronic obstructive pulmonary disease, climate change, climate-related exposures and conditions, colorectal cancer, and on and on. That is just the A's, the B's, and the C's.  They want to cut $6 billion from the NIH, which is working to cure, address, study, and manage the diseases and the sicknesses that our people are dealing with; and just cavalierly they say they want to slash it so they can pour all of this money over to the military side for a reason unknown.  When they came down with their executive orders, which have now been struck down by multiple Federal District Courts as unconstitutional, as a violation of the Establishment Clause, as a violation likely of due process and equal protection and so on, what they cited was 9/11 multiple times. They cited 9/11. The odd thing, though, was that the three source countries for the 9/11 hijackers--Saudi Arabia, Egypt, and the United Arab Emirates--were left off their executive orders, even right up until today.  Why?  Some people say it is because Donald Trump has extensive business dealings with corporations and governments in those three countries. Nobody really knows. But they developed those orders, which the GOP proudly once called the Muslim ban, in response allegedly to 9/11. Even if you could blame an entire people for the acts of individual terrorists, they didn't do it. They turned to some other countries because that didn't interfere with the President's business interests.  So we have got this huge military buildup and we have got the siphoning away of tens of billions of dollars of the American people's hard-earned money away from medical research and diseases and environmental protection all into the For what reason, nobody knows, and they haven't told us.  What a dangerous moment this is in the life of the American What a perilous time this is for a nation built on the principle that that great Republican President Abraham Lincoln called government of the people, by the people, and for the people.  Their budget proposal is a job killer. It is going to kill hundreds of thousands of jobs. It devastates and ruins the search for cures, the progress we are making in diseases like cystic fibrosis and diabetes. Diseases that afflict hundreds of thousands, millions of our people, they are just going to pull the plug on that. They are ransacking our children's education. They are hollowing out the rural communities. They are making urban life far more dangerous. They are weakening our leadership overseas. And, of course, because they don't believe in climate change, they are undermining our ability to respond to the great peril that faces us as a people.  Just like the proposal to trash the Affordable Care Act cannot go through this body because there must be a majority of responsible Members of this body who will not accept that terrible proposal that will throw 24 million of our people off their insurance, this body also cannot accept this terrible budget. It must have arrived here  If a foreign government, a rival to America, an enemy of America, had come up with this budget, we would regard it as an act of aggression against the American people. You could view it as a declaration of war against the prosperity, the health, and the welfare of our own people. But, alas, it didn't come from abroad. At least it was addressed that it came from the White It appears to have come from the administration, yet it threatens our way of life.  I would urge all of my colleagues to very carefully study this budget proposal over the next week or two and make clear that these are not the priorities of the American people, make clear that these are not the values of the American people, and this is not the future of the American people. We must continue to make progress. That means we must reject the Trump budget.  ",CREC-2017-03-16-pt1-PgH2139-3.txt,99999999999999,SENATOR DIANNE FEINSTEIN BECOMING RANKING MEMBER OF THE SENATE,2017.0,16.0,January
6391,topic-id,276,"Mr.Speaker, I rise today to recognize American Heart Month and the need to encourage and support one another to be proactive in preventative heart care.  I would like to thank President Trump for honoring the tradition of dedicating February as American Heart Month so that we may continue our fight against heart disease and heart defects as a nation.  Heart disease is the leading cause of death in the United Every year, one in four deaths is caused by heart disease, and approximately 40,000 babies are born in the U.with a congenital heart defect, including myself.  The good news is that heart disease can often be detected earlier and even prevented when we are proactive, make healthy choices, manage our health conditions, and keep up with our annual physicals.  Communities, health professionals, and families can work together to create opportunities for people to make healthier life choices and to lessen the stigma and fear of simply going to the doctor.  As this is American Heart Month, I encourage all Americans to use this month to raise awareness about heart disease and heart defects, and how we can prevent, treat, and cope with them, both at home and throughout our communities.  Through the support of my family and friends, the guidance of my doctors, and the grace of God, I am blessed to be standing here to support those across our Nation who are affected in some way by heart disease and heart defects. My prayers and thoughts go out to every one of you.  I ask my colleagues to join me in promoting American Heart Month so that we can all help save precious lives.                          ____________________",CREC-2017-02-15-pt1-PgH1191-5.txt,2003,"PROVIDING FOR CONSIDERATION OF H.R. 26, REGULATIONS FROM THE EXECUTIVE",2017.0,15.0,March
6527,topic-id,434,"Mr.Speaker, I thank my friend from Georgia for yielding.  I rise today to support this rule and to express my strong disapproval of President Obama and his administration's refusal to veto the anti-Israel resolution adopted by the United Nations Security Council on December 23, 2016.  Since its establishment, Israel has worked tirelessly to forge peace with its neighbors. They have sought neither violence nor conflict. In fact, the territories discussed in the misguided U.resolution were areas Israel gained in self-defense during the 1967 Six-Day These areas include the Old City, with the Temple Mount and Western Wall, areas that, thousands of years ago, were the origin of the Israeli culture, heritage, and religion.  Israel did not seek to take this land. Rather, when threatened by their Arab neighbors in 1967, they were forced to act in self-defense and repel these attacks. Since that time, Israel has successfully reached peaceful agreements with many of the Arab countries who, at that time, sought to wipe them off the map.  Israel is the only thriving democracy in the Middle East who practices and protects human rights regardless of ethnicity, gender, religion, or citizenship. Additionally, the State of Israel has been committed to implementing initiatives to promote economic growth in the region, including creating opportunities for Palestinians and others. Israel is a shining example of taking care of those who are around them, even as they face constant threat of violence and terrorist attacks.  I have been appalled over what has taken place under the direction of President Obama and Secretary Kerry and others within the administration. In response, I also introduced a resolution condemning these intolerable actions. By failing to direct the United States to veto the one-sided, anti-Israel U.Security Council resolution, the President turned his back on Israel and, as a result, turned his back on  The anti-Israel resolution adopted by the U.Security Council threatens peace and stability in the Middle It will most likely incentivize further violence and radical boycotts.  While President Obama and Secretary Kerry's long list of foreign policy failures has been well-documented over the years, none to date have been this deliberate and calculated. That is why I have come to the floor to support Chairman Royce's bipartisan resolution.  As Republicans and Democrats alike have expressed their contempt for the President's lack of action, I look forward to working with my colleagues and President-elect Trump in correcting President Obama's anti-Israeli tactics as we work to form a stronger bond with Israel and as we work to promote peace in the Middle  Mr.Mr.Speaker, I yield 2 minutes to the gentleman from Vermont (Mr.Welch).  ",CREC-2017-01-05-pt1-PgH113-2.txt,2003,BRING HADAR HOME,2017.0,5.0,February
