speech_id,topic_id,word_count,speech_text,file_name,speaker_id,session_title,year,day,month
5528,topic-id,450,"Mr.President, today I wish to recognize Steve Schley who is stepping down as president of Pingree Associates after nearly three decades of leadership later this month. Eight generations after his descendant initiated this effort, Steve Schley has, in his 32 years of service both to Pingree Associates, of which he was president for 28 years, and to the State of Maine, continued a tradition of leadership in the development and fiscal health of Maine's forest products industry as well as the sustainability of Maine's forests. Steve's retirement provides an opportunity to honor his wide array of accomplishments and contributions to the State of Maine--all achieved in the spirit and essence of his lineage.  In the year 1820, Maine, as included in the the Missouri Compromise, was ushered into the Union as a new That same year, a prominent Massachusetts shipping merchant named David Pingree initiated what would become a historic and indispensable string of investments in Maine forestlands. Over the next nearly 200 years, sudden growth and advancement of Maine's forest product industry, and thus statewide economic development, blossomed from the easement agreements signed and purchases made of Maine forest land by the Pingree family.  Today Pingree Associates is in possession of close to 1 million acres of Maine forest land, bringing a great burden of responsibility upon the president of the association. In every respect, Steve has thrived under this burden. During his tenure as president, he has undertaken initiatives to revitalize Maine's struggling wood-products industry by collaborating with the University of Maine's Forest Bio-products Research Institute to help nurture the next generation of innovators and leaders in the bioproducts industry, setting the stage for the development and integration of sustainable, forward-thinking forest products. By ``paying it forward'' through the youth of Maine, he is ensuring that his integrity and hard work will continue to live on through these kids for generations to come. Steve's sustainability and conservation efforts were not limited to just ensuring a bright future. Back in 2001, when I was Governor, I announced Steve's success in closing the largest forestland conservation easement in the history of the United States between Pingree Associates and the New England Forestry Foundation, which independently protected 762,192 acres from development and opened up the land to recreation for Mainers and all U.S citizens for time immemorial.  Because of Steve's hard work and leadership as president of Pingree Associates, Mainers of all ages will continue to benefit from his successes in Maine's forest industry, as well as in conserving land for their recreation. Steve has honored our collective heritage as well as his own, and I thank him for his friendship and his many contributions towards bettering our State.[[Page S3486]]                            ____________________",CREC-2017-06-14-pt1-PgS3485.txt,1724,HARRY W. COLMERY VETERANS EDUCATIONAL ASSISTANCE ACT OF 2017,2017.0,14.0,August
5616,topic-id,24,"Mr.President, I ask unanimous consent that the order for the quorum call be rescinded.  The PRESIDING OFFICER (Mr.Hoeven). Without objection, it is so ordered  ",CREC-2017-08-01-pt1-PgS4640-2.txt,1826,1500,2017.0,1.0,June
5617,topic-id,2468,"Mr.President, I rise today to recognize the 10th anniversary of the collapse of the I-35W bridge and to pay tribute to those who lost their lives on that tragic summer day, as well as all the first responders, healthcare workers, and ordinary citizens who did extraordinary things on this day 10 years ago.  First, I want to acknowledge one other topic; that is, this evening we will be voting on the nomination of Christopher Wray to serve as the FBI I was proud to join all of my colleagues on the Judiciary Committee--now, it is not an ordinary thing to have happen on its own that we all agree on something--from both sides of the aisle to support Mr.Wray's nomination in committee on July 20 with a unanimous vote of support.  In his hearing, Mr.Wray showed that he has integrity, that he will follow the law, and that he believes in the importance of an independent Senators on both sides of the aisle asked him strong and tough questions. Given this important time in our Nation's history for law enforcement and for the FBI, I don't think you would expect anything less.  Mr.Wray handled the questions well. He was knowledgeable, but most importantly for me, he showed respect for the agents, and he showed respect for his predecessors, both Mr.Mueller and Mr.He showed respect for the law, and he understood the somber time in which he comes in to take this job.  In particular, Mr.Wray said that if he were asked to do something illegal or unethical, he would urge the President not to proceed with such a course of action, and he would resign if necessary. Mr.Wray also responded to Senator Graham that he did not consider Special Counsel Mueller to be on a witch hunt, and he agreed that anyone running for elected office should notify the FBI if a foreign government offers assistance on a political campaign.  Mr.Wray also agreed with the concerns I raised that are posed by organized criminals, including those from foreign governments or who work for foreign governments, hiding their money in shell companies. He said that we had to ``follow the money.'' With news reports that the eighth person in the meeting with Donald Trump, Jr., Paul Manafort, and a lawyer connected to the Russian Government was a Russian who has been linked to money laundering, this issue is as important as ever.  In addition, Mr.Wray pledged to continue the FBI's efforts to work with the Election Assistance Commission and to address cyber security threats to our election infrastructure, so it is not just investigating things backward. A lot of what fighting crime is about--and I certainly knew this in my time as county attorney in Hennepin County--is making sure you protect people going forward. The FBI has enormous responsibilities going forward with cyber security, not only for our elections but for our government and also for business and for individual citizens.  Importantly, Mr.Wray promised to be responsive to requests from the Judiciary Committee as it carries out its oversight responsibilities. Those were questions posed to him by the committee's chairman, Senator  This is a tough time to take this tough job. The previous FBI Director, as we know, was fired because of the Russia investigation. The former Acting Attorney General was fired, and we have had a slew of other firings throughout the government over the last few months.  Well, I believe Christopher Wray is someone who will come in there with the integrity that is needed to do the job for those brave agents who go to work every day, not wearing a political button. They just go to do their work to protect us. I also believe he is the right choice at this time for our country.  I am very proud of the work the FBI in Minnesota has done, especially in the past year, with the stabbing we had at the shopping mall. The police chief there often talks about how there was so much going on at that moment, and the FBI was able to come in and help with that investigation in a significant way, so the police chief could not only work on the investigation with his officers but also calm the community, work with them, and do the other work that had to be done in the aftermath of that tragic stabbing.  That is just one example of our FBI in Minnesota, but I think every Member in this Chamber has examples in their own communities, and that is why it is important to have someone of the caliber of Christopher Wray take charge. I look forward to voting for his confirmation this evening.                   I-35W Bridge Collapse Anniversary  Mr.President, I am here today to talk about the I-35W bridge, and, as I said earlier, this was a tragedy that captivated not only my State but the country and the world. It was 10 years ago to the day that the I-35W bridge collapsed into the Mississippi River, taking the lives of 13 people and injuring over 100. I will never forget the shock and horror of that day. Everyone in my State remembers where they were when they heard that the bridge had collapsed.  As I said that day, a bridge just shouldn't fall down in the middle of America--not an eight-lane highway, not a bridge just a few blocks from my house that I drive over every single day with my family. But it happened, and when something like that happens, a lot of it has to do with, yes, what caused it--you want to know that--but also you want to know how the community responded, and that gets to the part that I really wanted to focus on today.  In the minutes and the hours following the disaster, the response of Minnesota's firefighters, police, hospital personnel, emergency personnel, and ordinary citizens was nothing short of heroic. People did not run away from that disaster. They ran toward it.  Everyone remembers the video of the off-duty firefighter diving in, over and over again, looking for survivors, or they remember that school bus precariously hanging on the edge of that broken-down bridge, where ordinary people had come to help on this broken[[Page S4644]]bridge as the school bus rested on the side, ready to fall. To get the kids off the bridge--they were just going to a summer camp and coming home for the day--the driver was helping them out one by one by one, not leaving that bus until every single kid got off the bus. During the first 2 hours after the bridge fell down, the Minneapolis Emergency Communications Center received and processed over 500 calls, 51 of which came directly from the scene of the disaster.  The eyes of the Nation were on our State, and what they saw that day was the very best of That tremendous spirit of community is what carried us through the dark days after the bridge collapsed. I remember going there with then-Senator Coleman the next morning with the Transportation There were already, literally, billboards the morning after, directing people where to go because this involved a major highway and telling them what buses would be working and which way they should go. That is a community responding.  Senator Coleman and I pledged that day that we would work with Congressman Oberstar, who was a major force--who sadly is no longer with us--on the House Transportation Committee and then, of course, with Congressman Ellison, who is the Congressman for that district.  Senator Coleman and I pledged to get the money, and we secured $250 million in emergency bridge reconstruction funding in just the first few days. It was a bipartisan effort, and I was proud to have the support of so many people in this As a result of that--and maybe this is a lesson in light of what we heard in Senator McCain's beautiful speech and in light of what we know we still need to be doing with infrastructure in this country--with President Bush's help and with bipartisan support, we rebuilt that huge bridge in Minnesota in a little over a year. Literally 13 months later, I was driving over that bridge to my house.  It is a shining example of what we can accomplish when we put politics aside to get big things done. I believe the I-35W bridge can and should be a model, not just of a tragic disaster and of our declining infrastructure, which it certainly is, but also a model of how we can fix things--a Republican Senator working with a Democratic Senator, and we got it done.  We have made some progress in this Chamber when it comes to infrastructure. In 2015, Democrats and Republicans worked together to pass the Fixing America's Surface Transportation Act or FAST Act, led by Senator McConnell, the leader, with Senator They don't agree on much, but they worked hard to get that bill done. I have always loved that it was called the FAST It is kind of a scary thing to name a bill in Congress these days, but they named it that, and it got done. It was a long-term reauthorization bill that increased transportation funding from existing revenue streams and helped provide certainty for local governments planning critical projects.  Under the FAST Act, Minnesota is scheduled to receive more than $4 billion in funding over 5 years, which will help to ensure that our infrastructure is safe and efficient, and by the last year, it will be an increase of about $100 million just for our State over what we were getting the year before we passed the FAST But we still need to do more.  This year, the American Society of Civil Engineers, which every so often comes out with grades of the Nation's infrastructure, gave America's infrastructure a grade of D-plus. While other countries are running ahead with infrastructure investments, we are still standing still. Even with the FAST Act, it doesn't propel us into the future, where we want to be. As we know--and as the Presiding Officer knows from his own State of North Dakota--we are an export State; we are an export country. We have to bring goods to market, and we have to bring goods into the United We also have to bring people to their jobs, and we can't do that if we have infrastructure--roads, bridges, rails, locks, and dams--that was set up for the last century. Standing still means falling behind in this global economy. In Minnesota, we know the cost of neglecting our roads and bridges. Our country needs to build roads, bridges, airports, locks, dams, and rails that work.  While safety should always be our first priority, it shouldn't be our only expectation. Our infrastructure should help farmers from the Presiding Officer's home State of North Dakota and my State of Minnesota to get crops to market quickly. Small businesses have to grow, and workers have to get to their jobs.  Let's not forget about updating our energy grid, repairing and replacing our water infrastructure and sewers, and making sure all Americans have access to broadband--not just low-speed broadband but high-speed broadband. I don't want to hear about another farmer going to the McDonald's parking lot to do his business or a doctor in northern Minnesota going to look at his x rays. If he couldn't use the hospital, he couldn't look at x rays at home or anywhere except another coffee store parking lot. That makes no sense.  If our deteriorating infrastructure goes unaddressed, it will cost our economy nearly $4 trillion by 2025, leading to a loss of over 2 million jobs. If we address it, we can create millions of jobs.  Here are some ideas. Senators Mark Warner of Virginia and Roy Blunt of Missouri have a bipartisan bill that I am part of that would establish an infrastructure financing authority to complement existing funding and expand overall infrastructure investments by providing new incentives to increase private sector spending. Another idea is to reform our Tax Code--and we have to do a lot of work on that--to simplify it and to create incentives for businesses to invest right here in We can also provide incentives to bring back trillions of dollars of foreign earnings. But if we do that, we have to make sure a chunk of it goes into infrastructure.  Of course, these tools should supplement and not replace direct Federal funding because, especially when it comes to rural America, we are not going to see the same kind of public-private partnership that you might in other, more populated areas of the country. So it has to be a combination of funding sources to make this work for every State, especially for rural  I am committed to moving forward in a bipartisan way to address our infrastructure needs and to prevent another tragedy like the collapse of the I-35W bridge. It is time to work together to make this happen. I actually believe the Senate is a place where we can make this happen. We showed the ability to get through a major infrastructure bill just 2 years ago, and we can do it again.  Today, on this 10th anniversary, we honor the victims, and their families, of that I-35W bridge collapse. We recognize the bravery of the first responders, who were incredible, and the 911 operators, who did their duty and answered those calls and got the help where they were supposed to go, and the doctors, nurses, ER people, ambulance workers, and everyone else.  Today, we also--and I can't think of a better time, when we are going through a difficult period, as we are in our country--remember the actions of ordinary citizens who could have just said: Oh, this looks scary; I am going home. They didn't do that. They didn't run away from the disaster; they ran toward it. Ordinary citizens did extraordinary things. Why? Because they cared about their fellow citizens. Because they knew that while maybe they had crossed over that bridge 5 minutes before it collapsed and could see it in their rearview mirror, or maybe they were approaching the bridge and actually saw it collapse--if it weren't for a 5-minute or 1-minute or 30-second difference, it would have been them on that bridge, and they knew that, and that is why they helped.  That is what America is really all about. It is not just a lottery where only certain people win and certain people lose. You have to put yourselves in the shoes of other people and think, we are all on one team. That is what this democracy is about, and that is what we saw on this day 10 years ago, August 1, in  Thank you, Mr. I yield the floor.  ",CREC-2017-08-01-pt1-PgS4640-2.txt,1826,1500,2017.0,1.0,June
5763,topic-id,156,"Mr.Speaker, one of the most important parts of President Obama's legacy is the recognition that Americans should not be discriminated against based on preexisting conditions. This principle was enshrined in law by the Affordable Care Act, and now millions of Americans across the political spectrum support these vital protections. Even yesterday, President Trump, an avowed opponent of the Affordable Care Act, stated unequivocally that he was opposed to discrimination based on preexisting conditions.  The bill under consideration by this House, the American Health Care Act, does not represent that same bipartisan principle. My colleagues are advancing a measure that would let States turn back the clock for millions of Americans and begin that discrimination again.  Today, I urge my colleagues to oppose this bill for the sake of all those it would harm. For the sake of anyone who has survived cancer, battled diabetes, or was simply born a woman, I urge you, vote ``no.''                          ____________________",CREC-2017-05-01-pt1-PgH2990-4.txt,99999999999999,1500,2017.0,1.0,June
5595,topic-id,107,"Mr.Speaker, I thank Chairman Walberg for his invitation to join him on the floor today to discuss combating human trafficking and in support of the Enhancing Detection of Human Trafficking  When people hear the term ``human trafficking,'' they often think of faraway places, or perhaps even movie[[Page H5488]]plots. But, unfortunately, human trafficking is a horrible 21st century problem here in the United  We have to do all we can to help combat the scourge of human trafficking, and this measure is a strong addition to the actions already taken here in the House, and I commend the chairman, Ranking Member Sablan, and also the full committee chair, ",CREC-2017-07-12-pt1-PgH5486-2.txt,1936,EXECUTIVE CALENDAR,2017.0,12.0,April
5486,topic-id,153,"Mr.Speaker, I rise in recognition of the 27th anniversary of the Americans with Disabilities Act, which was signed into law on July 26, 1990.  This landmark, bipartisan civil rights legislation enables people with disabilities, including me, to experience more inclusive and fulfilling lives.  The prohibition of discrimination on the basis of a disability has helped to promote equal opportunity, full participation, independent living, and economic self-sufficiency.  Mr.Speaker, it is true that we have made incredible progress since 1990, but we still have work ahead. Too many people with disabilities still lack access to affordable housing, public transportation, education, healthcare, and employment. Full access and inclusion remains a fundamental aspiration, but it is not yet a reality.  Mr.Speaker, we must remain vigilant in defending the intent of the ADA so that future generations can live in an inclusive, accessible world, where the unique talents and abilities of individuals with disabilities are innately recognized.                          ____________________",CREC-2017-07-24-pt1-PgH6199-5.txt,1668,WELCOMING DR. GEORGE DILLARD,2017.0,24.0,April
5558,topic-id,189,"Mr.Speaker, I rise today in recognition of Autism Awareness  It is shocking to know that at least 1 in 68 children have been identified with autism spectrum disorder in the United My own family has been affected by this situation with my nephew Joshua, who is now 20 years old, a bright and energetic young man who is autistic.  Mr.Speaker, early detection and treatment plans are crucial to the development of a child's social, behavioral, and communications skills. As such, we must invest in the research of new interventions, provide support to families and caregivers, and fund programs that assist those living with autism well into adulthood. Right now,[[Page H2841]]especially when they age into adulthood, those resources are not there.  Mr.Speaker, Sesame Street recently introduced a character with autism named Julia to teach audiences about inclusion. This month is part of a larger conversation about autism derived from a place of positivity.  I am hopeful that Julia can help convey such a message to our youth, and I will continue supporting programs that help people with autism and their families by providing the tools they need to succeed.                          ____________________",CREC-2017-04-25-pt1-PgH2840-6.txt,1668,ENHANCING DETECTION OF HUMAN TRAFFICKING ACT,2017.0,25.0,April
5470,topic-id,200,"Mr.Speaker, I rise today along with my Ohio colleagues to congratulate our colleague Steve Stivers on this great momentous occasion of being promoted to brigadier general.  I have known my friend since our days in the Ohio General I remember when he was deployed for his service that he so unselfishly gave to his Nation in uniform.  With Steve, you can go back in history. It was 242 years ago last week, on April 18, 1775, that Paul Revere, Dawes, and Prescott rode across the countryside and said that the regulars were out.  It was on the morning of April 19 that men left their shops, left their plows, and went to that call. It was that citizen soldier that went out there to make sure that this Nation attained the freedom that we have today.  From the National Guard and all of our men and women that are serving in uniform across all the services, it is because of them that we have the right to stand here today.  I applaud Congressman Stivers on his promotion to brigadier. And we, along with our colleagues in the Senate, congratulate him. Mr.Speaker, I thank him very much for his service.                          ____________________",CREC-2017-04-26-pt1-PgH2858-2.txt,,MAKE IT IN AMERICA,2017.0,26.0,April
