speech_id,topic_id,word_count,speech_text,file_name,speaker_id,session_title,year,day,month
4829,topic-id,938,"Mr.Speaker, I thank Brendan--Representative Boyle--and Marc for putting together a Blue Collar Caucus just to remind ourselves what we should be doing here is focusing on jobs. Jobs, which is the best social program I have ever been with.  I entered my professional life as an electrician, as an electrical apprentice. I went through the other 4 years of school. It was called an apprenticeship. I worked on bridges, refineries, pipelines throughout the Delaware I understood how tough it is sometimes for people to make it. When work got slow, we got laid off. We collected unemployment. Those are the struggles that men and women in our great country are going through each and every day. If anything, this last election cycle reminded us of that, that sometimes the dignity of being able to take care of your family, send your kids to school, and retire with dignity is the most important thing we can do.                              {time}  1815  I have seen firsthand what happens with minimum wage. They tend to think it is all a bunch of kids flipping hamburgers. Well, it is much more than that. It is a woman I spoke to, who had a child 8 years old, who had to work two jobs just to make sure that in the winter, when her daughter needed a coat for winter, that she could take care of her. And she recalled to us how badly she felt that her daughter's teacher for PTA wanted her to come in and help. She had to decide whether or not to keep food on her table or participate in her child's school. That is a tough decision when we both want to help.  When we look at what we have done as a country, as compared to elsewhere in the world, it is very different when we look at the blue collar, particularly in the building trades where I came from. Throughout Europe, particularly in Switzerland and Germany, they look at working with your hands with just the same dignity as going through college. This country doesn't always do that. Guidance counselors tend to push them into college as the only measurement.  College isn't for everybody. I have three brothers. They went the traditional college route. I decided I really enjoyed working with my hands. I went and became an electrician. Those jobs, we are on over 20 years ago, I still talk to my kids about it today--the dignity of working with your hands.  This country is starting to change, particularly when you need an electrician. When Mr.Boyle's lights in his house go out, who does he call? That electrician is worth his weight in gold, isn't he?  And I know Mr.Boyle's story. His parents came over here as first generation and are living the American They have to be so proud of him.  And in Mr.Veasey's district, those refineries are important for jobs, as they are in mine. I think we absolutely have to keep the focus on making sure that we have renewables, that we have clean energy. But we also understand with each of those decisions comes whether or not somebody is going to be able to go home and say: Honey, I lost my job today.  Today was a remarkable day--the first withdrawal of a nominee for the Department of And I guess this is where, during the election cycle, I see the difference.  It is very clear that the President wanted to talk about jobs, good jobs, putting America back to work. And then we have the secretary nominee put up--who talks about minimum wage is a bad thing, talks about robots are things you don't have argument with. He wants to outsource. That is not the way to rebuild the economy.  Mr.Boyle talked about the discrepancy between those who work for a living, the average worker on the line, and those who are the When I grew up, there was an implied partnership with so many of those companies. Those who went to work in a first-generation company, that CEO knew every employee's name. But time after time, when that company gets sold, that disconnect comes in. They forget about that. And that is where those relationships, that partnership that is so important, starts to break down.  We had a conversation in our Education and the Workforce Committee the other day about the NLRB, which is the group from the Department of Labor that judges whether or not elections with unions are done fairly. There was a suggestion somehow that they are not being treated fairly. It couldn't be any further from the truth. If workers want to have a voice, they should have that voice and choose whether or not they want to join with the union. That is the American way--that democracy. Yet, the nominee for Labor wanted to do away with the In fact, when we look at the total case history, it is like putting the fox in charge of the henhouse, unless, of course, you own the henhouse, and then it is okay.  I want to finish up by saying to Mr.Veasey and Mr.Boyle how appreciative I am of keeping this focus on the forefront of what we do here in I created a Building Trades Caucus, along with a colleague, Mr.McKinley, out of West We could try to move this forward, create an infrastructure package that puts America back to work and keeps our roads, our bridges, and our grid safe.  Let's remember one thing: a fair day's pay for a fair day's work and the dignity of a job. I appreciate what you have done.  ",CREC-2017-02-15-pt1-PgH1225.txt,2202,EXECUTIVE SESSION,2017.0,15.0,February
4685,topic-id,1119,"Mr.Speaker, I am very pleased to come to the floor this evening to coanchor the Congressional Black Caucus hour about the present nominee to the Supreme Court, Neil  I am very pleased that my good friend from Texas, Representative Sheila Jackson Lee, a distinguished member of the Judiciary Committee, has agreed to coanchor this hour with me.  Mr.Speaker, I am chair of the working group for the Congressional Black Caucus that looks at nominees for Federal courts. So, I have buried myself in the record of Neil Gorsuch and wrote the testimony that we submitted to the  What I will do is speak for a few minutes generally about the nominee, and then I will go to my good friend from I am very pleased that another good friend, Mr.Don Payne, Jr., is here from the State of New Jersey, and we will hear from him as well.  Now, just as the Congress has been polarized so has the court been polarized, if you look at the liberal and conservative blocks in that way. But, of course, since the death of Supreme Court Justice Antonin Scalia, there has been a 4-4 split. Justice Anthony Kennedy, who is still a Member of the Court is not always a predictable conservative, though he tends to vote with the conservatives.  What has happened in the Senate is entirely predictable, at least today. In an unprecedented move, the Senate refused to hear from or even meet the nominee of President There was almost a full year, yet the Senate refused to take up that nominee.  What happened today was not payback. If you listened to the testimony, you would see that there are good reasons why the Senate Democrats today decided to filibuster Judge  I want to begin because I am speaking for the Congressional Black Caucus with his views as they affect African-Americans and, by definition, others who depend upon the antidiscrimination laws and the Constitution of the United  There is more than enough in the record on race related matters from Judge Gorsuch's 10th Circuit service to oppose his nomination. But let me focus for a moment on his pre-court service, which seems to have predicted what he would do in the court of appeals.  He was a principal deputy to the principal who had jurisdiction over the Civil Rights We have to pay attention to the fact that the inspector general, during Judge Gorsuch's time in the Justice Department, found that the Civil Rights Division, where he had some oversight, had been politicized in order to stifle civil rights enforcement. As you might imagine, the Congressional Black Caucus had to pay attention to that finding by a neutral investigator.  We also are very concerned about how Gorsuch is a Justice Department Official treated a Georgia election law. As we know, election laws from the South--of course, there has been a historic decision that has made the Voting Rights Act far less effective than it was--but certainly during most of the time of the Act, Southern states had to go through the Justice Department to[[Page H2622]]see if the laws in southern States, that had kept African-Americans from voting for reasons of race, to see if newly enacted laws affecting voting rights, in fact, discriminated against African-Americans and others or not.  A Georgia election law was found by the Civil Rights Division to be discriminatory. Judge Gorsuch was part of the team that overturned the Civil Rights That was, of course, challenged in the courts. And the ruling of the Justice Department that pre-cleared the law--that said it was all right to go ahead with this law that the Civil Rights Division had found discriminated against Blacks--the court overturned that finding of the Justice  It used quite pregnant language. The District Court said that the Georgia election law was reminiscent of Jim Crow laws. Those words have special meaning in our history--and I speak not here about African-Americans alone. But if you have found yourself in the minority on any issue--it could be a First Amendment issue, it could be a criminal justice issue--you want a court that will protect your rights, not only the rights of the majority.  But this nominee has shown a hostility to litigation in the courts that have been the primary ways we have vindicated constitutional rights and the rights of minorities of every kind. In a telling op-ed, this nominee, Mr.Gorsuch, said: ``American liberals have become addicted to the courtroom, relying on judges and lawyers rather than elected leaders and the ballot box, as the primary means of effecting their social agenda.''  What? What else was there? The majority had enforced laws against the minority--in this case, African-He conceded that Brown v. Board of Education the school desegregation decision. But he went on to say that liberals should ``kick their addiction'' to constitutional litigation. This is a man who wants to get on the Court whose most important mission is constitutional litigation.  I submit to you that even the Justice who epitomized conservatism, Justice Scalia, never showed hostility coming to Court to vindicate the rights of people who felt themselves to be offended. So in that respect, I think it is clear that--and this is a very important respect--Judge Gorsuch is more conservative than Justice Scalia was on the  Nothing could be more concerning than a Justice who says: Look, the preferred way to vindicate your rights is the political process.  Who would disagree with that?  It is the failure of the political process that sends people to the court.  It shows, it seems to me, little appreciation for the Bill of Rights itself. The entire Bill of Rights is about the rights of the minority. And again, the word ``minority'' means any of us could be in that minority at any given point. You could be in that minority when it comes to religious rights. You could be in that minority because of a search and seizure case. You could be in that minority because of a free speech case. And, yes, you could be in that minority because you are part of a classic minority group.  That is why the 13th, 14th, and 15th Amendments were added to the Bill of The Framers, of course, shared Gorsuch's preference for the political process. A Constitution is a, small D, democratic document. But they created a separation of powers government knowing full well that majoritarian democracy sometimes treads on the rights of minorities. That is why we have the Supreme Court of the United States which Mr.Gorsuch seeks a seat.  Mr.Speaker, before I go on to discuss some cases, I yield to the gentleman from New Jersey, (Mr.Payne), my good friend from New Jersey's 10th Congressional  ",CREC-2017-04-03-pt1-PgH2621-2.txt,868,STATEMENTS ONINTRODUCED BILLS AND JOINT RESOLUTIONS,2017.0,3.0,February
4687,topic-id,21,"Mr.Speaker, I thank the gentleman from New Jersey (Mr.Payne) for those cogent remarks.  I yield to the gentlewoman from Texas (",CREC-2017-04-03-pt1-PgH2621-2.txt,868,TRIBUTE TO ALLY MARTIN,2017.0,3.0,March
4688,topic-id,1385,"I thank my friend for her comments.  Mr.Speaker, I was the chair, before I came to Congress, in another life, of the Equal Employment Opportunity Commission, dealing with job discrimination in our country. I was interested, in my own research on Judge Gorsuch to find that he has written more opinions in discrimination cases than other cases.  Now, the Rocky Mountain States of the Tenth Circuit do not have large numbers of African Americans, but the way in which the Supreme Court has interpreted antidiscrimination laws doesn't, in fact, basically differ from one group.  The EEOC also has jurisdiction over disability discrimination. For example, the Court has always indicated that anti-discrimination laws should be read broadly in order to capture discrimination. Whether we are talking about the antidiscrimination laws as they affect women or racial or ethnic minorities or religious minorities, the Supreme Court simply will not read these laws narrowly.  But that is not how Judge Gorsuch has operated on the Tenth He has given a cramped interpretation of the antidiscrimination laws, and yet it is interesting to note that, when there is a claim of discrimination based on religion, he gives a very broad interpretation.  He is perhaps best known for his opinion in the so-called Hobby Lobby case. This is the case in which he found that a closely held corporation was within its rights when it refused to adopt the Affordable Health Care Act's mandate that women and men be granted contraceptive protection as a part of health insurance. Judge Gorsuch found that this was a violation of the rights of the closely held corporation, the first time there has been such a holding.  It is very interesting also to note that right after that, there was a case called Little Sisters of the Now, the Little Sisters of the Poor, unlike the closely held corporation, is, in fact, a religious organization, and they too said they do not wish to have contraception be a part of any of the institutions that they govern.  Remember, we had a religious organization there, not a closely held corporation. The Court found that, to accommodate both women and the religious scruples of the Little Sisters, the Little Sisters had only to acknowledge that they did not desire to enforce the contraceptive mandate, and then it would be taken away from them and would be done by a third party, by the government. That was allowed as a way to accommodate the Little Judge Gorsuch opposed that and wrote an opposing opinion.  So to see this difference in the way he treats discrimination, reading antidiscrimination statutes affecting minorities of every kind in a narrow fashion; when he finds religious discrimination by statute, he reads those statutes very broadly.  His technical rulings are of statutes that the Supreme Court has broadly interpreted, would have made these statutes worthless. You simply cannot enforce antidiscrimination statutes by treating them as though they were technical statutes that, for example, govern financial dealings. And yet this nominee has brought that kind of interpretation of antidiscrimination statutes.  I was shocked at his holding in Hwang v. Kansas State University, which illustrates what I am saying. There, a professor brought a case because her university had refused to follow the guidance of the Equal Employment Opportunity She was entitled to a 6-month leave to accommodate her condition. This is a statute involving disability rights. She took that 6-month leave and asked to have it extended until a day certain, not indefinitely, to recover further from cancer and a bone marrow transplant.  Now, the EEOC guidance said that an additional leave beyond 6 months was possible as an accommodation to an employee unless there was an undue hardship. There was no undue hardship.  But this nominee, Judge Gorsuch, found that the ``6 months was more than enough to comply with the law in nearly every case''--yes, in nearly every case--but the EEOC guidance said that there obviously could be extensions. I can think of no case that would call for more of an extension than a professor who said: I will come back on a date certain, but I have a cancer diagnosis, and I have had a bone marrow transplant.  I hope that that case would give some pause to anyone who hears about it. The nominee has been quite consistent in how he has ruled in the Tenth Circuit, which gives every reason to believe that he is going to carry that consistency to the Supreme  I was very interested to see how he ruled on a Planned Parenthood case where the Governor of Utah had seen these notorious false videos that purported to show the sale of fetal tissue.                              {time}  2030  Now, those videos--every court that has considered those videos have found that they had nothing to do with Planned Parenthood and what it actually did. So this matter has been litigated in a number of circuits. It was litigated in the 10th Circuit in a case called Planned Parenthood Association of Utah v. Herbert; and the 10th Circuit found, as the other circuits have, that these videos were not, in fact, associated with Planned Parenthood--the false videos that surfaced.[[Page H2625]]  Interestingly, the court, on rehearing, which Judge Gorsuch had sought, characterized his dissenting opinion as ``mischaracterization of this litigation and the panel opinion at several turns.''  Here again, we see Judge Gorsuch going out of his way to rule in a fashion that he sees as necessary to sustain his broad views of religious claims. I am trying to give you an overview of Judge Gorsuch's opinions in a number of different areas, and I am mystified by how he would reach the conclusions he has reached in discrimination cases.  Here is one that is very revealing: A.ex rel Christine v. Espanola Public Schools, where a student was found by Judge Gorsuch not to be able to sue for violation of the Americans with Disabilities Act because she had earlier settled a suit for violations of another act, the so-called IDEA  Well, she has a right under both laws. She would have obviously raised perhaps different claims, but his view was that she should not be in court. This closing of the courts must be taken seriously in evaluating Judge Because if you can't get into court in the first place, particularly if you are a member of a minority group, or for the moment find yourself in the minority on a particular issue, then you are out of court before you are in court. You have lost before you cross the threshold.  I can't imagine why Judge Gorsuch didn't allow a student to continue when she had, in frustration, left her school because of violations of her disability rights. That frustration, as far as he was concerned, closed the courthouse door to her.  Why would we want to interpret discrimination laws in a fashion that you can't get into court to make your case?  A particularly cruel case, Compass Environmental v. OSHRC, a case where Gorsuch wrote the dissent, involved a worker who was electrocuted and died as a result. The corporation had trained its workers. This worker happened to be hired after the training had taken place; therefore, was not aware of all of the safeguards.  The Occupational Safety and Health Review Commission found that the electrocution of the worker could have been avoided if the corporation, Compass Environmental, had provided the necessary training. So it cited Compass and it fined Gorsuch dissented. He found that the company had not violated the law. The company hadn't provided the requisite training. The man was electrocuted, and it is very instructive what Judge Gorsuch said:       ``Administrative agencies enjoy remarkable powers in our      legal order. Their interpretations of ambiguous statutes      control even when everyone thinks Congress really meant      something else.''  He didn't like the administrative ruling, so he dissented and would have ruled against the family of a man who was electrocuted.  That is not a man I want on the Supreme This is not a man who knows how to interpret the discrimination statutes which have always been interpreted broadly by the Federal courts. This is not a man who should sit on the Supreme Court of the United  Mr.Speaker, I now yield to the gentlewoman from Texas (",CREC-2017-04-03-pt1-PgH2621-2.txt,868,STATEMENTS ON INTRODUCED BILLS AND JOINT RESOLUTIONS,2017.0,3.0,February
4689,topic-id,81,"I thank my good friend for helping us document why we believe this is not the time for this Justice to be on the Supreme  We recognize that it is not the House of Representatives that decides this matter, but the Congressional Black Caucus represents 17 million Americans who will be deeply affected by who sits on this I appreciate that we have had this full hour to express our views.  Mr.Speaker, I yield back the balance of my time.                          ____________________",CREC-2017-04-03-pt1-PgH2621-2.txt,868,EXECUTIVE SESSION,2017.0,3.0,February
4699,topic-id,211,"Mr.Speaker, I rise today to recognize Rare Disease Day to bring widespread awareness to more than 7,000 rare diseases affecting 30 million These individual diseases may be rare, but their impact isn't.  On this particular occasion, I want to remember Chloe Barnes from Minnesota, who passed away at the age of 2 from metachromatic leukodystrophy, or Her family founded Chloe's Fight, a foundation that is dedicated to supporting research for rare diseases.  There is no better person to honor and remember Chloe than her older sister, Eva, who wrote an essay in Chloe's memory. Eva writes:  ``My sister died when she was 2 and this is what happened. My parents were missing a part in their body. I was fine. But my sister Chloe didn't make it. I don't like talking about it. Because it makes me very sad. I only tell a few people that she died. She was very funny. I loved her so much. Her name was She was very brave. My mom and dad are doing a foundation called Chloe's Because every kid should have a chance to fight.''  Mr.Speaker, we should not only remember those suffering from rare diseases, but we should continue to support initiatives to find new cures and treatments on their behalf.                          ____________________",CREC-2017-02-27-pt1-PgH1341-2.txt,1930,REMEMBERING DAVID CULP,2017.0,27.0,February
