speech_id,topic_id,word_count,speech_text,file_name,speaker_id,session_title,year,day,month
8400,topic-id,37,"Mr.Speaker, I rise today to express strong opposition to any attempted repeal of the Affordable Care In North Carolina, more than 552,000 people have gained affordable health care through the Affordable Care One of those residents is ",CREC-2017-01-10-pt1-PgH246-4.txt,2201,HEALTH INSURANCE IN NAME ONLY,2017.0,10.0,February
8435,topic-id,168,"Mr.Speaker, it is with a heavy heart that I rise today to honor the life of Harris County Precinct 3 Assistant Chief Deputy Constable Clint  On Monday morning, Chief Deputy Greenwood was tragically murdered as he arrived to work at the Baytown, Texas, courthouse. Chief Deputy Greenwood was a respected and committed 30-year law enforcement veteran of the Houston area.  My heartfelt prayers go out to Chief Deputy Greenwood, his family, and the entire law enforcement community.  After yet another intentional killing of a Texas law enforcement officer, we must do more to end the continued violence and hate-filled rhetoric directed at our brave law enforcement officers. We hope for a quick apprehension of the evil perpetrators and an answer to why.  I stand in strong solidarity with the law enforcement community and offer my deepest condolences to all those impacted by the senseless murder of Chief Deputy  Rest in peace, Brother Clint Greenwood, and may God bless your family and all those who wear the uniform.                          ____________________",CREC-2017-04-05-pt1-PgH2706-5.txt,2270,MOMENT OF SILENCE IN REMEMBRANCE OF KANSAS SHOOTING VICTIMS,2017.0,5.0,March
