speech_id,topic_id,word_count,speech_text,file_name,speaker_id,session_title,year,day,month
2939,topic-id,1576,"Mr.Speaker, I move to suspend the rules and pass the bill (H.1808) to amend and improve the Missing Children's Assistance Act, and for other purposes, as amended.  The Clerk read the title of the bill.  The text of the bill is as follows:                               H.1808       Be it enacted by the Senate and House of Representatives of      the United States of America in Congress assembled,     SECTION 1. SHORT       This Act may be cited as the ``Improving Support for      Missing and Exploited Children Act of 2017''.     2.       Section 402 of the Missing Children's Assistance Act (42      U.S.5771) is amended--       (1) by amending paragraph (1) to read as follows:       ``(1) each year tens of thousands of children run away, or      are abducted or removed, from the control of a parent having      legal custody without such parent's consent, under      circumstances which immediately place the child in grave      danger;'',       (2) by striking paragraphs (4) and (5),       (3) in paragraph (6) by inserting ``, including child sex      trafficking and sextortion'' after ``exploitation'',       (4) in paragraph (8) by adding ``and'' at the end,       (5) by striking paragraph (9),       (6) by amending paragraph (10) to read as follows:       ``(10) a key component of such programs is the National      Center for Missing and Exploited Children that--       ``(A) serves as a nonprofit, national resource center and      clearinghouse to provide assistance to victims, families,      child-serving professionals, and the general public;       ``(B) works with the Department of Justice, the Federal      Bureau of Investigation, the United States Marshals Service,      the Department of the Treasury, the Department of State, the      United States Immigration and Customs Enforcement, the United      States Secret Service, the United States Postal Inspection      Service, other agencies, and nongovernmental organizations in      the effort to find missing children and to prevent child      victimization; and       ``(C) coordinates with each of the missing children      clearinghouses operated by the 50 States, the District of      Columbia, Puerto Rico, and international organizations to      transmit images and information regarding missing and      exploited children to law enforcement, nongovernmental      organizations, and corporate partners across the United      States and around the world instantly.'', and       (7) by redesignating paragraphs (6), (7), (8), and (10) as      paragraphs (4), (5), (6), and (7), respectively.     3.       Section 403 of the Missing Children's Assistance Act (42      U.S.5772) is amended--       (1) in paragraph (1)--       (A) by striking ``legal custodian'' each place it appears      and inserting ``parent'',       (B) in subparagraph (A) by striking ``custodian's'' and      inserting ``parent's'', and       (C) in subparagraph (C) by striking the period and the end      and inserting a semicolon,       (2) in paragraph (2) by striking ``and'' at the end,       (3) in paragraph (3) by striking the period at the end and      inserting ``; and'', and       (4) by adding at the end the following:       ``(4) the term `parent' includes a legal guardian or other      individual standing in loco parentis (such as a grandparent      or stepparent with whom the child lives, or an individual who      is legally responsible for the child's welfare).''.     4. DUTIES AND FUNCTIONS OF THE       Section 404 of the Missing Children's Assistance Act (42      U.S.5773) is amended--       (1) in subsection (a)--       (A) in paragraph (3) by striking ``telephone line'' and      inserting ``hotline'', and       (B) in paragraph (6)(E)--       (i) by striking ``telephone line'' and inserting      ``hotline'',       (ii) by striking ``(b)(1)(A) and'' and inserting      ``(b)(1)(A),'', and       (iii) by inserting ``, and the number and types of reports      to the tipline established under subsection (b)(1)(K)(i)''      before the semicolon at the end,       (2) in subsection (b)(1)--       (A) in subparagraph (A)--       (i) by striking ``telephone line'' each place it appears      and inserting ``hotline'', and       (ii) by striking ``legal custodian'' and inserting      ``parent'',       (B) in subparagraph (C)--       (i) in clause (i)--       (I) by striking ``restaurant'' and inserting ``food'', and       (II) by striking ``and'' at the end,       (ii) in clause (ii) by adding ``and'' at the end, and       (iii) by adding at the end the following:       ``(iii) innovative and model programs, services, and      legislation that benefit missing and exploited children;'',       (C) by striking subparagraphs (E), (F), and (G),       (D) by amending subparagraph (H) to read as follows:       ``(H) provide technical assistance and training to      families, law enforcement agencies, State and local      governments, elements of the criminal justice system,      nongovernmental agencies, local educational agencies, and the      general public--       ``(i) in the prevention, investigation, prosecution, and      treatment of cases involving missing and exploited children;       ``(ii) to respond to foster children missing from the State      child welfare system in coordination with child welfare      agencies and courts handling juvenile justice and dependency      matters; and       ``(iii) in the identification, location, and recovery of      victims of, and children at risk for, child sex      trafficking;'',       (E) by amending subparagraphs (I), (J), and (K) to read as      follows:       ``(I) provide assistance to families, law enforcement      agencies, State and local governments, nongovernmental      agencies, child-serving professionals, and other individuals      involved in the location and recovery of missing and abducted      children, both nationally, and in cooperation with the      Department of State, internationally;       ``(J) provide support and technical assistance to child-     serving professionals involved in helping to recover missing      and exploited children by[[Page H4454]]     searching public records databases to help in the      identification, location, and recovery of such children, and      help in the location and identification of potential      abductors and offenders;       ``(K) provide forensic and direct on-site technical      assistance and consultation to families, law enforcement      agencies, child-serving professionals, and nongovernmental      organizations in child abduction and exploitation cases,      including facial reconstruction of skeletal remains and      similar techniques to assist in the identification of      unidentified deceased children;''.       (F) by striking subparagraphs (L) and (M),       (G) by amending subparagraph (N) to read as follows:       ``(N) provide training, technical assistance, and      information to nongovernmental organizations relating to non-     compliant sex offenders and to law enforcement agencies in      identifying and locating such individuals;'',       (H) by striking subparagraph (P),       (I) by amending subparagraph (Q) to read as follows:       ``(Q) work with families, law enforcement agencies,      electronic service providers, electronic payment service      providers, technology companies, nongovernmental      organizations, and others on methods to reduce the existence      and distribution of online images and videos of sexually      exploited children--       ``(i) by operating a tipline to provide to individuals and      electronic service providers an effective means of reporting      Internet-related and other instances of child sexual      exploitation in the areas of--       ``(I) possession, manufacture, and distribution of child      pornography;       ``(II) online enticement of children for sexual acts;       ``(III) child sex trafficking;       ``(IV) sex tourism involving children;       ``(V) extra familial child sexual molestation;       ``(VI) unsolicited obscene material sent to a child;       ``(VII) misleading domain names; and       ``(VIII) misleading words or digital images on the      Internet;     and subsequently to make such reports available to the      appropriate law enforcement agency for its review and      potential investigation;       ``(ii) by operating a child victim identification program      to assist law enforcement agencies in identifying victims of      child pornography and other sexual crimes to support the      recovery of children from sexually exploitative situations;      and       ``(iii) by utilizing emerging technologies to provide      additional outreach and educational materials to parents and      families;'',       (J) by striking subparagraph (R),       (K) by amending subparagraphs (S) and (T) to read as      follows:       ``(S) develop and disseminate programs and information to      families, child-serving professionals, law enforcement      agencies, State and local governments, nongovernmental      organizations, schools, local educational agencies, child-     serving organizations, and the general public on--       ``(i) the prevention of child abduction and sexual      exploitation;       ``(ii) Internet safety, including tips for social media and      cyberbullying; and       ``(iii) sexting and sextortion; and       ``(T) provide technical assistance and training to local      educational agencies, schools, State and local law      enforcement agencies, individuals, and other nongovernmental      organizations that assist with finding missing and abducted      children in identifying and recovering such children.'', and       (L) by redesignating subparagraphs (H), (I), (J), (K), (N),      (O), (Q), (S), (T), (U), and (V) as subparagraphs (E) through      (O), respectively.     5.       Section 405 of the Missing Children's Assistance Act (42      U.S.5775) is amended--       (1) in subsection (a)--       (A) in paragraph (7) by striking ``(as defined in section      403(1)(A))'', and       (B) in paragraph (8)--       (i) by striking ``legal custodians'' and inserting      ``parents'', and       (ii) by striking ``custodians' '' and inserting ``parents'      '', and       (2) in subsection (b)(1)(A) by striking ``legal      custodians'' and inserting ``parents''.     6.       The Missing Children's Assistance Act (42 U.S.5771 et      seq.) is amended--       (1) by redesignating sections 407 and 408 as section 408      and 409, respectively, and       (2) by inserting after section 406 the following:     ``407.       ``(a) Required Reporting.--As a condition of receiving      funds under section 404(b), the grant recipient shall, based      solely on reports received by the grantee and not involving      any data collection by the grantee other than those reports,      annually provide to the Administrator and make available to      the general public, as appropriate--       ``(1) the number of children nationwide who are reported to      the grantee as missing;       ``(2) the number of children nationwide who are reported to      the grantee as victims of non-family abductions;       ``(3) the number of children nationwide who are reported to      the grantee as victims of family abductions; and       ``(4) the number of missing children recovered nationwide      whose recovery was reported to the grantee.       ``(b) Incidence of Attempted Child Abductions.--As a      condition of receiving funds under section 404(b), the grant      recipient shall--       ``(1) track the incidence of attempted child abductions in      order to identify links and patterns;       ``(2) provide such information to law enforcement agencies;      and       ``(3) make such information available to the general      public, as appropriate.''.  The SPEAKER pro tempore. Pursuant to the rule, the gentleman from Kentucky (Mr.Guthrie) and the gentleman from Connecticut (Mr.Courtney) each will control 20 minutes.  The Chair recognizes the gentleman from                             General Leave  ",CREC-2017-05-23-pt1-PgH4453.txt,1922,PROTECTING ACCESS TO CARE ACT OF 2017,2017.0,23.0,May
2940,topic-id,46,"Mr.Speaker, I ask unanimous consent that all Members may have 5 legislative days in which to revise and extend their remarks and include extraneous material on H.1808.  The SPEAKER pro tempore. Is there objection to the request of the gentleman from Kentucky?  There was no objection.  ",CREC-2017-05-23-pt1-PgH4453.txt,1922,PROTECTING ACCESS TO CARE ACT OF 2017,2017.0,23.0,May
2941,topic-id,402,"Mr.Speaker, I yield myself such time as I may consume.  I rise today in strong support of H.1808, the Improving Support for Missing and Exploited Children Act of 2017.  Mr.Speaker, as a father, I cannot imagine the horror moms and dads in this country experience when they discover one of their children has been taken, abused, or exploited. Sadly, that is a nightmare for hundreds of thousands of parents in this country. Last year alone, there were more than 465,000 reports of missing children, and those are just the cases that were reported.  The well-being of America's children has long been a national priority. In 1984, Congress established the Missing and Exploited Children's Program to help coordinate State and local efforts to recover children who are missing and better protect and support kids who are victims of abuse and exploitation. As part of that program, we provide a grant that is used to support the work of the National Center for Missing & Exploited Children, known as  For more than 30 years, NCMEC has worked to provide help to people across the country, partnering with parents, law enforcement, nonprofits, and other public and private entities in an effort to recover, protect, and support missing and exploited children and their families. We are here today to ensure this supportive work continues.  H.1808 updates and streamlines the Missing Children's Assistance Act, making positive changes that will enable us to strengthen our efforts. This includes reforms that encourage and increase public awareness of new and innovative ways to recover and protect missing and exploited children.  The bill better protects the growing number of children who go missing from State care or are victims of sex trafficking, while also providing transparency surrounding recovery and prevention efforts. In recent years, some of the advances in technology have, unfortunately, made it easier for kids to be victimized and exploited. H.1808 ensures the law aimed at recovering and protecting exploited children is able to effectively identify and locate today's abductors and criminal offenders, many of whom are turning to more modern techniques to commit their disturbing crimes.  The Improving Support for Missing and Exploited Children Act of 2017 delivers important reforms that will provide the tools needed to effectively serve vulnerable youth, help bring perpetrators to justice, and ensure taxpayer dollars are spent responsibly. I urge my colleagues to support H.1808.  Mr.Speaker, I reserve the balance of my time.  ",CREC-2017-05-23-pt1-PgH4453.txt,1922,PROTECTING ACCESS TO CARE ACT OF 2017,2017.0,23.0,May
2943,topic-id,38,"Mr.Speaker, I echo my support, and I enjoy working with my friend, the gentleman from Connecticut (Mr.Courtney).  Mr.Speaker, I yield 1 minute to the gentleman from Michigan (Mr.Walberg), the chairman of the Subcommittee on Health, Employment, Labor, and  ",CREC-2017-05-23-pt1-PgH4453.txt,1922,IMPROVING SUPPORT FOR MISSING AND EXPLOITED CHILDREN ACT OF 2017,2017.0,23.0,May
2947,topic-id,27,"Mr.Speaker, I yield 1 minute to the gentleman from Tennessee (Mr.Roe), the chairman of the Veterans' Affairs Committee, and a member of the Education and the Workforce  ",CREC-2017-05-23-pt1-PgH4453.txt,1922,PROTECTING ACCESS TO CARE ACT OF 2017,2017.0,23.0,May
2949,topic-id,22,"Mr.Speaker, I yield 1 minute to the gentleman from Michigan (Mr.Mitchell), my friend and a member of the Education and the Workforce  ",CREC-2017-05-23-pt1-PgH4453.txt,1922,PROTECTING ACCESS TO CARE ACT OF 2017,2017.0,23.0,May
2953,topic-id,12,"Mr.Speaker, I yield 3 minutes to the gentlewoman from North Carolina (",CREC-2017-05-23-pt1-PgH4453.txt,1922,PROTECTING ACCESS TO CARE ACT OF 2017,2017.0,23.0,May
2955,topic-id,8,I yield the gentlewoman an additional 30 seconds.  ,CREC-2017-05-23-pt1-PgH4453.txt,1922,COUNTERING IRAN'S DESTABILIZING ACTIVITIES ACT OF 2017,2017.0,23.0,May
2958,topic-id,39,"Mr.Speaker, I yield such time as he may consume to the gentleman from Minnesota (Mr.Paulsen), a good friend of mine who, in his work on the Ways and Means Committee, has been focused on and dedicated to this issue.  ",CREC-2017-05-23-pt1-PgH4453.txt,1922,PARTNERSHIP GRANTS TO STRENGTHEN FAMILIES AFFECTED BY PARENTAL,2017.0,23.0,June
2961,topic-id,203,"Mr.Speaker, I yield myself such time as I may consume.  I had the opportunity to visit the Center, and the building that I got to go visit was full of men and women who show up every day, who do exceptional work dealing with the disturbing issues, and so my hat is off to them. They deal with stuff that is just unimaginable to most of us, and they do it in a way that is dignified and in a way that is well worthy of the effort that we are giving them to give more transparency and empower them to help more.  I really appreciate working with my friend, Mr.H.1808 is a bipartisan proposal, and I urge my colleagues to support the Improving Support for Missing and Exploited Children Act of 2017.  Mr.Speaker, I yield back the balance of my time.  The SPEAKER pro tempore. The question is on the motion offered by the gentleman from Kentucky (Mr.Guthrie) that the House suspend the rules and pass the bill, H.1808, as amended.  The question was taken; and (two-thirds being in the affirmative) the rules were suspended and the bill, as amended, was passed.  A motion to reconsider was laid on the table.                          ____________________",CREC-2017-05-23-pt1-PgH4453.txt,1922,AMERICANS' RIGHT TO LIVE IN FAITH,2017.0,23.0,June
3145,topic-id,798,"Mr.Speaker, ``This is a new era. This is the Trump era.'' Mr.Speaker, those were the words of the Attorney General, the former Senator from  The Attorney General has launched a campaign to paint immigrants as criminals, rapists, gang members, and ``cartel henchmen.'' In his prepared remarks at the border a couple of weeks ago, the Attorney General planned to say the following: ``It is here, on this sliver of land, where we first take our stand against this filth.''  When he gave the speech he edited out the words ``this filth'' because, I guess, calling immigrants from Latin America ``filth'' was even too extreme for this Attorney But it remains on the DOJ website. In fact, as far as the Attorney General is concerned, any immigrant who is here illegally is a criminal.  He has ordered the government to prosecute immigration violations, even minor ones, to the full extent of the law and to make prosecution of immigrants a top priority--on par with murder, drugs, counterfeiting, and kidnapping.  He has ordered every one of the 94 U.Attorney Offices to appoint a special prosecuting attorney so that immigrants are considered public enemy number one, nationwide--not drug dealers, immigrants. According to the latest Federal data, 46 percent of all new Federal criminal prosecution is immigration related--not narcotics. The second highest crime prosecuted accounts only for 14 percent of new Federal cases. In the new Trump era, a felony prosecution against an immigrant who has been living and working here peacefully for decades is three times important than a felony prosecution of a drug dealer.  And that imbalance is not enough for the Attorney He wants to prosecute immigrants beyond the full extent of the law by turning misdemeanors into felonies, and turning felonies into aggravated felonies. They think it will not look so ugly when the U.is deporting moms and dads who have raised successful families--or deporting children who grew up in the U.from the time they were toddlers--if the Attorney General and his team can look and tell the American people they were just thugs, gangbangers, and rapists.  Jeff Sessions and Donald Trump want more immigrants criminalized, felonized, and deported. Yes, we are truly in the Trump era.[[Page H2904]]  But let's be frank. This is not a surprise when Donald Trump descended the gold escalator and announced his candidacy for Almost the first words out of his mouth were Mexicans are rapists, murderers, drug dealers, and immigration is turning America into a war zone.  When he was a Senator from Alabama, the Attorney General made a career of associating immigrants with crime and doing his best to defeat reforms that would strengthen legal immigration and reduce illegal immigration. Deportation, criminalization, and restricting legal immigration were the bedrock of this Attorney General's approach when he was a U. Our legal immigration system already works fine according to both Senator and Attorney General Sessions, no matter that some people who are receiving their visas today applied for them when Bill Clinton was President and that those applying for visas today will probably get them when Chelsea Clinton is President of the United  Mr.Speaker, when your constituents say, ``Hey, why don't those immigrants come here legally?'' or, ``Why don't they just go back and come back legally?'' the answer is clear: as a Senator, our Attorney General made sure that that was impossible.  Next week, millions of Americans will take to the streets to demonstrate against mass deportation, the border wall, prison beds, and drive-by deportations. But it is not because we are soft on crime or love immigrants more than the people who were born here. We have a different vision of what the United States is and should always be.  We are not an incarceration nation, a nation hostile to other countries and their people. We are a great nation, a nation that, in her greatness, is a beacon of hope to refugees, a land of opportunity for entrepreneurs, and a democracy with separate branches of government that act as effective checks and balances on unlimited power.  The American people are sensible, fair, and pragmatic, and are correct when they reject the idea that a wall makes sense in the 21st century as the centerpiece of our immigration policy. We are not persuaded by the poetry of the Attorney General when he stands at the border and says: ``It is here, on this sliver of land, where we first take our stand against this filth.'' No, we think of another, better poem, the one at the Statue of Liberty, the lady with her torch in the harbor, who shares our deeply held values as Americans and says every day to the entire world at that harbor: ``Give me your tired, your poor, your huddled masses yearning to breathe free.''                          ____________________",CREC-2017-04-27-pt1-PgH2903-2.txt,478,COUNTERING IRAN'S DESTABILIZING ACTIVITIES ACT OF 2017,2017.0,27.0,June
3199,topic-id,39,"Mr.President, I was unavoidably absent during today's vote, Executive Calendar 55, due to my son's college graduation. Had I been present, I would have voted nay on the confirmation of Governor Terry Branstad to be the U.Ambassador to                          ____________________",CREC-2017-05-22-pt1-PgS3061.txt,2026,COUNTERING IRAN'S DESTABILIZING ACTIVITIES ACT OF 2017,2017.0,22.0,June
3047,topic-id,15,"Mr.President, today I wish to ask my colleagues to join me in recognizing and congratulating ",CREC-2017-05-18-pt1-PgS3040-3.txt,99999999999999,HIRE VETS ACT,2017.0,18.0,June
2911,topic-id,26,"Mr.President, I ask unanimous consent that the order for the quorum call be rescinded.  The PRESIDING Without objection, it is so ordered.                Congressional Baseball Practice Shooting  ",CREC-2017-06-14-pt1-PgS3462-3.txt,1351,VETERANS' COMPENSATION COST-OF-LIVING ADJUSTMENT ACT OF 2017,2017.0,14.0,June
