speech_id,topic_id,word_count,speech_text,file_name,speaker_id,session_title,year,day,month
14113,topic-id,428,"Mr.Speaker, the Bureau of Land Management manages 245 million acres, or nearly 10 percent of the total area of the United States, and a whopping 700 million acres of mineral estate. Nearly all of this acreage is in our Western States, which makes it imperative that the agency extensively cooperate with the State and local governments during the planning process.  It is true that the BLM's new planning rule, Planning 2.0, included revisions to several aspects of the planning process, some of which seemed to make some good sense.  Unfortunately, the new rule also introduced a significant measure of confusion regarding how planning areas would be determined, and, most distressingly, diminished the historic and valued role that State and local governments play throughout the process.  In many of the counties in my district, it is not uncommon for the public lands to make up well over half of the total area. For these communities, having an equal seat at the planning table isn't merely a luxury. It is an essential ingredient to ensuring that our way of life is proudly maintained over many generations and is not extinguished.  Because of this, the BLM is required by law to consult and to coordinate with State and local governments and maintain consistency across their management plans and policies. Yet, the agency's new planning rule envisioned weakening that partnership in several regards. For one, the agency intends to dismiss consistency requirements with anything other than the officially approved and adopted plans. This not only places an undue burden on rural communities who likely do not have the resources available to draft and maintain comprehensive plans, but significantly lessens the importance of an array of other policies and agreements that are germane to the planning process.  The importance of a State Governor's review of a Federal management plan is also reduced, as it appears to limit input only to the identification of inconsistencies with State and local plans, but precludes formal input and observations regarding other aspects of the plan.  Americans the Nation over treasure our public lands and thoroughly enjoy our ability to be able to access them. But it cannot be denied that, in many of our communities, decisions made by Federal Land Management agencies like the BLM have amplified the impact. No planning process revision should weaken the voices of our communities as Planning 2.0 would do.  For those reasons, I urge my colleagues to support this resolution. I applaud the efforts of my colleague out of Wyoming for her efforts on this and urge passage of this resolution.  ",CREC-2017-02-07-pt1-PgH1032.txt,1997,"PROVIDING FOR CONSIDERATION OF H.R. 78, SEC REGULATORY ACCOUNTABILITY",2017.0,7.0,February
14115,topic-id,380,"Mr.Speaker, I rise in opposition to this resolution which would do away with the new procedures established under BLM Planning 2.0.  Planning 2.0 encourages, at its foundation, early and frequent public input. By rolling back this planning effort, public input--in particular, tribal input--will be removed.  Federally recognized tribes have the right to engage in government-to-government consultation, and, under Planning 2.0, tribal rights to participate in the planning process are clearly enumerated and protected.  By introducing the resolution we are considering today, the majority is making clear it doesn't value tribal input in the development of BLM's resource management plans. In this updated planning process, the BLM worked hard to ensure government-to-government consultation was accomplished. Tribes were encouraged to submit comments through the formal comment period and through government-to-government consultation. But BLM recognizes the hard work of tribes and has been inclusive of tribal concerns.  In fact, BLM has recognized the quality and value that tribes' traditional ecological knowledge brings to planning efforts. It is important to incorporate this information to avoid resource conflicts and to protect hunting and fishing grounds.  In many areas, the BLM and tribes actually have to manage resources together. How can they do this when tribes are not invited to be a part of the consultation process? By including government-to-government consultation early in the planning process, all taxpayers benefit in the long run because we can develop a stronger plan that doesn't end up in court being litigated.  We want BLM to be an agency that actively embraces the people who live on and use the land they manage. By formalizing the tribal consultation role and recognizing the value tribes bring to the planning process as Planning 2.0 does, the BLM is taking important steps to fully engage with all their constituents.  Land management is about looking at the bigger picture, and tribes understand that more than anyone. They deserve to be recognized in the planning process, and Planning 2.0 does that.  Repealing this rule through the CRA is shortsighted and wrongheaded. BLM[[Page H1035]]Planning 2.0 allows for the very kind of oversight and public input my Republican colleagues claim to want, and helps avoid the costly court battles they complain about.  I urge my colleagues to vote against this measure and keep Planning 2.0 in place.  ",CREC-2017-02-07-pt1-PgH1032.txt,2231,FORT FREDERICA NATIONAL MONUMENT BOUNDARY EXPANSION ACT,2017.0,7.0,February
14108,topic-id,506,"Mr.Speaker, last week, the Republican majority pushed through legislation attacking clean air, clean water, and blocking public transparency into payments made to foreign governments by oil and mining companies.  Today we are considering legislation that will roll back opportunities for the American people to have a say in how our Nation's public lands are managed. The idea that there should be national public lands that belong to and are managed on behalf of the American people is a value that dates back to the founding of our country and is embedded in our  Generation after generation of Americans has endorsed the idea that our public lands should be managed to balance many competing uses: recreation, responsible economic development, sustainable resource extraction, renewable energy, military purposes, and conservation of historic American landscapes, just to name a few.  We all want to see this important aspect of our national heritage managed in an effective and efficient manner, balancing conservation for future generations with sustainable productivity for local communities.  The Bureau of Land Management's Planning 2.0, as it is known, will help us better achieve this balance on the approximately 245 million acres of land managed by the As American citizens, we all have a right to provide input on how we would like to see these public lands managed; but the current process for doing so is slow, lacks transparency, and fails to incorporate over 30 years of updated science and understanding of our changing climate. In fact, this process hasn't been substantially updated since the Reagan administration. States, local governments, and other stakeholders all agreed that the process was in need of updates.  BLM agreed with this consensus and began a 2-year review, receiving over 3,000 public comments on what changes needed to be made. Two years, 3,000 public comments, this was no midnight regulation. Their final product, which the resolution before us today would permanently overturn, increases transparency, enhances the role of science and decisionmaking, and strengthens the role of the public's voice earlier in this planning process.                              {time}  1400  Planning 2.0 also upholds the Federal Land Policy and Management Act's commitment to States, local government, and tribes in land management decisions.  The Bureau of Land Management made several changes in between the draft rule and the final rule to clarify coordination requirements and promote consistency with local land use plans, all in response to concerns raised through the public input process.  According to a BLM fact sheet on the final rule, ``The new rule does not change the special relationship and opportunities provided by statute for cooperating agencies,'' and, ``The final rule establishes several new opportunities for coordination between the BLM and our government partners.''  We should be working together on proposals that strengthen management of our public lands, balance conservation with economic development, and provide sustainable benefits to the people who rely on them for their economic livelihoods. The resolution before us today flies in the face of these goals.  I urge my colleagues to reject this Congressional Review Act resolution and vote ``no.''  ",CREC-2017-02-07-pt1-PgH1032.txt,1884,MOTION TO ADJOURN,2017.0,7.0,February
14066,topic-id,1675,"Mr.President, I know several Members are ready to come here and talk on a veterans issue, and they will let me know when they are ready to start. I thought there might be a good chance to get this in.  Our democracy is under attack. U.intelligence agencies have concluded that the Russian Government interfered in the U.Presidential election and intervened to help Candidate Around the same time, Candidate Trump began making flattering statements about Russian President Putin and proposing pro-Russia policy changes while criticizing longstanding U.allies, including in  President Trump continues to defend Putin and offend Western allies. Now we have come to learn that there are unexplained ties between the President, his campaign staff, his associates, and Russia; that many close to the President had meetings and telephone calls with Russian officials during the campaign and the transition; most critically, that the FBI and the Department of Justice are investigating whether the President and his associates coordinated or conspired with the Russian Government to interfere with the Presidential election--an investigation that began last July and is likely to continue for months.  The President and his associates keep giving the American people reason for worry--inaccurate denials, evasive answers, explosive attacks they can't back up, scheming with the chair of the House Intelligence Committee on the committee's investigation of the White New, very disturbing information comes to light every day.  A recent CNN/Opinion Research Corporation poll showed that two thirds of Americans believe a special prosecutor should be appointed. The American people want answers. What was the scope of the interference? Who knew what, and when? How can we protect ourselves and our allies, who are facing similar cyber attacks? What is the appropriate government response to such an attack?  I appreciate the work the Senate Intelligence Committee is doing. I believe that is the first step, but I believe we must go further. That is why I am again calling for an independent, bipartisan national commission modeled on the 9/11 Commission to fully investigate Russia's interference with our election and our election processes and to investigate the ties between the President, his family businesses, and his close associates and Russia that may threaten our national security. I am also again calling on the Department of Justice to appoint a special counsel to investigate potential criminal conduct that may jeopardize our security.  Questions about the President's ties to Russia will divide the country, undermine his Presidency, and distract Congress, unless we take these steps. The American people are right to be concerned. The President's stance on Russia is perplexing, starting when he first denounced the role of NATO last spring, calling it ``obsolete,'' suggesting that it would be OK if NATO broke up. Then, he publicly asked Russia to hack Hillary Clinton's emails.  Then, Mr.Trump's campaign manager, Paul Manafort, was forced to resign because of his close political and financial ties to Ukraine's former pro-Russian He became the subject of a multi-agency investigation. We don't have the full story, but we do know that he failed to register as a foreign agent while he lobbied for pro-Russian Ukrainian interests in the United It appears that Manafort has a $10 million contract with a Russian oligarch who is very close to Putin that would ``greatly benefit the Putin Government'' and that he had at least 15 offshore bank accounts in Cyprus that even Cypriot bank officials thought were suspicious. Once those bank officials began asking about money laundering activities, Manafort closed the accounts rather than answer questions.  During his campaign, Mr.Trump stated that he would ``be looking at'' whether to recognize Crimea as Russian and to lift sanctions. President Trump and his team apparently took little or no interest in the debate over the party platform in the Republican National Convention, except for one thing--They intervened with delegates to get more Russia-friendly language in the Republican Party platform. Candidate Trump's national security policy staffer J.Gordon told CNN: ``This was the language Donald Trump himself wanted . . . and advocated for . . . back in March.'' Now Gordon is reportedly under investigation for his ties to  We have all heard the President compliment President Putin, calling him a strong leader. Why is the President so enamored, when Putin's actions are authoritarian, violent, and anti-democratic? Putin seeks to weaken NATO and the European He annexed Crimea in violation of international law and treaties. He interfered with our national election. Putin has crushed free press in the Russian Federation, placing restriction upon restriction on the press, quashing independent news organizations, and harassing and jailing journalists. The President's outspoken admiration is inexplicable.  So we are still left with a President who has expressed policy views toward Russia that run counter to U.ideals and treaty obligations, as well as global norms of international affairs. While we don't know the full extent of the President's financial, personal, and political ties to Russia and Putin, we have plenty of reason to seek an impartial investigation. The President still has not released his tax returns, unlike any previous modern His son Donald Junior volunteered, as far as[[Page S2141]]back as 2008, that ``Russians make up a pretty disproportionate cross-section of a lot of our assets. . . . We see a lot of money pouring in from Russia.''  In 2013, Mr.Trump said on a talk show: ``Well, I've done a lot of business with the Russians.''  Due to his history of bankruptcies, no major U.bank would loan to Donald Trump in recent years. So he has needed new sources of capital for his real estate projects. There is growing reason to believe that Russia--or at least wealthy Russians--have financial interests in the Trump organization. Recent reports link the President and his companies to ten wealthy former Soviet businessmen with alleged ties to criminal organizations or money laundering. The extent of corruption and criminal ties among the oligarchs of Russia are well known, and to stay wealthy oligarchs, they must stay friendly with the Putin regime.  Is the Trump organization reliant on Russian capital or loans from Russian banks? What relationships are there between Russian oligarchs that are tied to the Russian Government and the Trump organization and between those former Soviet businessmen and Trump's properties? We need to get to the bottom of this, with a credible, deliberate, nonpartisan investigation.  Mr.Trump has surrounded himself with associates with close Russian ties--not just Mr.Michael Flynn headed to Russia within 18 months after his retirement as the head of the Defense Intelligence Agency to celebrate the 10th anniversary of the Russian Government's media outlet Secretary John Kerry called RT a ``propaganda bullhorn'' for Mr.Flynn was paid for that trip by RT, a potential violation of the emoluments clause of the Constitution, and appeared regularly on Flynn, of course, had to resign as National Security Advisor after 24 days in office. But the President knew of Flynn's misrepresentations weeks before he was fired and did nothing until it became public. We now know that Russia's payments to Flynn were generous. In 2015, Russian entities paid him $65,000. We know he worked for pay as a foreign agent for Turkey during the campaign and during the transition, but he failed to register as an agent at the time, as required by law.  Other Trump associates and campaign staff--Roger Stone, Carter Page, and Mr.Gordon--all are reportedly under investigation for intercepted communications and financial transactions with Stone admitted at least 16 contacts with Gufficer 2.0, the Twitter handle covering for Russian intelligence that released the Democratic National Committee hacked emails.  Page, who has strong financial ties with Russia, admitted to meeting with the Russian Ambassador during the Republican Convention and traveling to Russia during the campaign.  The President's Attorney General was forced to recuse himself from any Department of Justice investigation into Trump and Russia because he did not disclose to the Senate Foreign Relations Committee that he met with the Russian Ambassador during the campaign.  Now the President's son-in-law and senior adviser is set to testify before the Senate's Intelligence He will talk about his contacts with the Russian ambassador, a close Putin ally who is head of a Russian-owned bank.  Where does it stop, folks? Where does it stop?  These contacts give us enough reason for pause. Combined with Mr.Trump's positions on NATO, sanctions relief, and Russia's human rights violations, they raise serious security questions for the United States and As I said, we need an independent prosecutor at the helm to ensure that the whole of the investigation is not compromised--one who is not subject to White House pressure and not in a position of investigating his or her boss--and a bipartisan commission along the lines of the 9/11 Commission that is independent of politics.  The chair of the House Intelligence Committee is compromised and damaged beyond repair. He has coordinated with the subjects of his committee's investigation, and he has completely lost credibility. I compliment my Senate colleagues who are working together on an investigation. But the Senate committee does not have the resources to fully investigate this, and the ranking Democrat on the committee agrees we need an independent investigation that could go further, that could be public, and could be transparent.  A former Acting Director of the CIA called the Russian interference in our election one of the most successful covert operations in history. Former Vice President Cheney has said that what they did could be ``considered an act of war.'' By covert interference in a U.election, Russia pursued a policy to install its favorite candidate as President of the United Yet the President has dismissed the National Security Agency findings, accused our national security agencies of acting like Nazi Germany, and leveled fake charges at the former  The American people are not fooled, and they want Congress to get to the bottom of this. We in Congress have a solemn duty to the American people to do just that.  I suggest the absence of a quorum.  The PRESIDING The clerk will call the roll.  The senior assistant legislative clerk proceeded to call the roll.  ",CREC-2017-03-30-pt1-PgS2140.txt,1567,HONORING CARL LAMM ON HIS 90TH BIRTHDAY,2017.0,30.0,February
14125,topic-id,340,"Mr.Speaker, I thank the gentlewoman for yielding.  Mr.Speaker, after serving on a school board, in my State legislature, and now in Congress, I have witnessed firsthand that government works better when it is closest to the people. That is why I rise today in support of H.44, which disapproves the Bureau of Land Management's 2.0 Planning rule.  I commend the gentlewoman from Wyoming for introducing this legislation on behalf of her constituents as[[Page H1037]]well as Americans all across the country that desire more effective government.  The Planning 2.0 rule will fundamentally change the way land management decisions are made, and I believe it will fundamentally change them for the worse. Planning 2.0 puts faith in a faraway, Washington-based one-size-fits-all approach to land management decisions.  BLM has a light footprint in my home State of Arkansas, but last year I had the opportunity to attend a field hearing in George, I saw firsthand the mismanagement by the BLM and how it impacts real people.  Individuals from Washington County, Utah, told our field hearing of the heavy-handed approach BLM takes toward local landowners in management decisions. Local officials talked about how BLM has also ignored the will of Congress by ensuring updated resource management plans decrease grazing permits or effectively stop the construction of roads that are authorized in Federal legislation. Land management changes should be made in a collaborative way, with ample State and local input.  Despite what some people may think, Congress and Congress' will still matters. Planning 2.0 marginalizes State and local officials in favor of unelected bureaucrats and special interests. By passing H.44, we will remind Federal agencies that they work for the people.  Mr.Speaker, we are not a people of the government, by the government, and for the government. We have a government that is supposed to be of the people, by the people, and for the people. The people's voice should be heard in major land management decisions. H.44 will make the BLM listen to their voice.  I strongly urge my colleagues to support this legislation.  ",CREC-2017-02-07-pt1-PgH1032.txt,2224,TO CONSTITUTE THE MINORITY PARTY'S MEMBERSHIP ON CERTAIN COMMITTEES FOR,2017.0,7.0,February
14052,topic-id,31,"Mr.President, I ask unanimous consent that Patrick Reilly, a fellow in my office, be granted floor privileges for the remainder of this  The PRESIDING Without objection, it is so ordered.                          ____________________",CREC-2017-01-24-pt1-PgS456-2.txt,1823,TO CONSTITUTE THE MINORITY PARTY'S MEMBERSHIP ON CERTAIN COMMITTEES FOR,2017.0,24.0,February
