speech_id,topic_id,word_count,speech_text,file_name,speaker_id,session_title,year,day,month
7915,topic-id,625,"Mr.Speaker, on that I demand the yeas and nays.  The yeas and nays were ordered.  The SPEAKER pro tempore. Pursuant to clause 8 of rule XX, this 15-minute vote on the motion to lay the appeal on the table will be followed by 5-minute votes on the motion to recommit on H.372 and passage of H.372, if ordered.  The vote was taken by electronic device, and there were--yeas 230, nays 189, answered ``present'' 1, not voting 9, as follows:                             [Roll 182]                               YEAS--230     Abraham     Aderholt     Allen     Amash     Amodei     Arrington     Babin     Bacon     Banks (IN)     Barletta     Barr     Barton     Bergman     Biggs     Bilirakis     Bishop (MI)     Black     Blum     Bost     Brady (TX)     Brat     Bridenstine     Brooks (AL)     Brooks (IN)     Buchanan     Buck     Bucshon     Budd     Burgess     Byrne     Calvert     Carter (GA)     Carter (TX)     Chabot     Chaffetz     Cheney     Coffman     Cole     Collins (GA)     Collins (NY)     Comer     Comstock     Conaway     Cook     Costello (PA)     Cramer     Crawford     Culberson     Curbelo (FL)     Davidson     Davis, Rodney     Denham     Dent     DeSantis     DesJarlais     Diaz-Balart     Donovan     Duffy     Duncan (SC)     Duncan (TN)     Dunn     Emmer     Farenthold     Faso     Ferguson     Fitzpatrick     Fleischmann     Flores     Fortenberry     Foxx     Franks (AZ)     Frelinghuysen     Gaetz     Gallagher     Garrett     Gibbs     Gohmert     Goodlatte     Gosar     Gowdy     Granger     Graves (GA)     Graves (LA)     Graves (MO)     Griffith     Grothman     Guthrie     Harper     Harris     Hartzler     Hensarling     Herrera Beutler     Hice, Jody     Higgins (LA)     Hill     Holding     Hollingsworth     Hudson     Huizenga     Hultgren     Hunter     Hurd     Issa     Jenkins (KS)     Jenkins (WV)     Johnson (LA)     Johnson (OH)     Johnson, Sam     Jordan     Joyce (OH)     Katko     Kelly (MS)     Kelly (PA)     King (NY)     Kinzinger     Knight     Kustoff (TN)     Labrador     LaHood     LaMalfa     Lamborn     Lance     Latta     Lewis (MN)     LoBiondo     Long     Loudermilk     Love     Lucas     Luetkemeyer     MacArthur     Marchant     Marino     Marshall     Massie     Mast     McCarthy     McCaul     McClintock     McHenry     McKinley     McMorris Rodgers     McSally     Meadows     Meehan     Messer     Mitchell     Moolenaar     Mooney (WV)     Mullin     Murphy (PA)     Newhouse     Noem     Nunes     Olson     Palazzo     Palmer     Paulsen     Pearce     Perry     Pittenger     Poe (TX)     Poliquin     Posey     Ratcliffe     Reed     Reichert     Renacci     Rice (SC)     Roby     Roe (TN)     Rogers (AL)     Rogers (KY)     Rohrabacher     Rokita     Rooney, Francis     Rooney, Thomas     Ros-Lehtinen     Roskam     Ross     Rothfus     Rouzer     Royce (CA)     Russell     Rutherford     Scalise     Schweikert     Scott, Austin     Sensenbrenner     Sessions     Shimkus     Simpson     Smith (MO)     Smith (NE)     Smith (NJ)     Smith (TX)     Smucker     Stefanik     Stewart     Stivers     Taylor     Tenney     Thompson (PA)     Thornberry     Tiberi     Tipton     Trott     Turner     Upton     Valadao     Wagner     Walberg     Walden     Walker     Walorski     Walters, Mimi     Weber (TX)     Webster (FL)     Wenstrup     Westerman     Williams     Wilson (SC)     Wittman     Womack     Woodall     Yoder     Yoho     Young (AK)     Young (IA)     Zeldin                               NAYS--189     Adams     Aguilar     Barragan     Bass     Beatty     Bera     Beyer     Bishop (GA)     Blumenauer     Blunt Rochester     Bonamici     Boyle, Brendan     Brady (PA)     Brown (MD)     Brownley (CA)     Bustos     Butterfield     Capuano     Carbajal     Cardenas     Carson (IN)     Cartwright     Castor (FL)     Castro (TX)     Chu, Judy     Cicilline     Clark (MA)     Clarke (NY)     Clay     Cleaver     Clyburn     Cohen     Connolly     Conyers     Cooper     Correa     Costa     Courtney     Crist     Crowley     Cuellar     Cummings     Davis (CA)     Davis, Danny     DeFazio     DeGette     Delaney     DeLauro     DelBene     Demings     DeSaulnier     Deutch     Dingell     Doggett     Doyle, Michael     Ellison     Engel     Eshoo     Espaillat     Esty     Evans     Foster     Frankel (FL)     Fudge     Gabbard     Gallego     Garamendi     Gonzalez (TX)     Gottheimer     Green, Al     Green, Gene     Grijalva     Gutierrez     Hanabusa     Hastings     Heck     Higgins (NY)     Himes     Hoyer     Huffman     Jackson Lee     Jayapal     Jeffries     Johnson (GA)     Johnson,     Jones     Kaptur     Keating     Kelly (IL)     Kennedy     Khanna     Kihuen     Kildee     Kilmer     Kind     Krishnamoorthi     Kuster (NH)     Langevin     Larsen (WA)     Larson (CT)     Lawrence     Lawson (FL)     Lee     Levin     Lewis (GA)     Lieu, Ted     Lipinski     Loebsack     Lofgren     Lowenthal     Lowey     Lujan Grisham,     Lujan, Ben Ray     Lynch[[Page H2311]]     Maloney, Carolyn     Maloney, Sean     Matsui     McCollum     McEachin     McGovern     McNerney     Meeks     Meng     Moore     Moulton     Murphy (FL)     Nadler     Napolitano     Neal     Nolan     Norcross     O'Halleran     O'Rourke     Pallone     Panetta     Pascrell     Pelosi     Perlmutter     Peters     Peterson     Pingree     Pocan     Polis     Price (NC)     Quigley     Raskin     Rice (NY)     Richmond     Rosen     Roybal-Allard     Ruiz     Ruppersberger     Ryan (OH)     Sanchez     Sarbanes     Schakowsky     Schiff     Schneider     Schrader     Scott (VA)     Scott, David     Serrano     Sewell (AL)     Shea-Porter     Sherman     Sires     Smith (WA)     Soto     Speier     Suozzi     Swalwell (CA)     Takano     Thompson (CA)     Thompson (MS)     Titus     Tonko     Torres     Vargas     Veasey     Vela     Velazquez     Visclosky     Walz     Wasserman Schultz     Waters, Maxine     Watson Coleman     Welch     Wilson (FL)     Yarmuth                        ANSWERED ``PRESENT''--1            Sanford                                    NOT VOTING--9     Bishop (UT)     Blackburn     King (IA)     Payne     Rush     Shuster     Sinema     Slaughter     Tsongas                              {time}  1336  ",CREC-2017-03-22-pt1-PgH2308.txt,1910,EXECUTIVE CALENDAR--Continued,2017.0,22.0,March
7736,topic-id,1092,"Mr.Chairman, I yield myself as much time as I may consume.  Mr.Chairman, we have seen a number of bills this session which are designed to shut the door on victims of corporate misfeasance and negligence and to nail the door shut. H.725 is part of this wave of legislation.  Like most other bills we have seen this session with brazenly Orwellian titles, the so-called Innocent Party Protection Act of 2017 has nothing to do with protecting innocent parties. Rather, it is just the latest attempt to tilt the civil justice system dramatically in favor of big corporate defendants by making it much more difficult for plaintiffs to pursue State law claims in State courts under the system of federalism designed by our  Again, this is a familiar experience because the bill addresses a completely nonexistent problem. If there had been a real problem, the Judiciary Committee might have held a hearing in which we could have invited groups to come forward who support tort victims. They could have come and testified about why it was so important for the interests of civil justice for us to pass this legislation.  But there was no hearing at all. We didn't hear any witnesses, much less the testimony of those groups that represent victims of mass toxic torts, asbestos poisoning, lead poisoning, sex discrimination lawsuits--none of it.  In fact, the groups that we would have called, if we were interested in the testimony of victims and people seeking civil justice, oppose this legislation overwhelmingly: the Alliance for Justice opposes it; the Center for Justice and Democracy opposes it; the Consumer Federation of America opposes it; the National Association of Consumer Advocates opposes it; the National Consumer Law Center opposes it; the Natural Resources Defense Council opposes it; Public Citizen opposes it; the Sierra Club opposes it.  Under current law, a defendant may remove a case, alleging State law claims, to a Federal court only if there is complete diversity of citizenship between all plaintiffs and all defendants. If the plaintiff adds an instate defendant to the case solely for the purpose of defeating jurisdiction, this constitutes fraudulent joinder today; and in such circumstances, the case may be removed directly to Federal court.  In determining whether a joinder was fraudulent, the court considers only whether there was any basis for a claim against the nondiverse defendant. The defendant must show that there was no possibility of recovery or no reasonable basis for adding the nondiverse defendant to the suit.  This very high standard has guided our Federal courts for more than a century and it has functioned well, and the bill's proponents offer no objective evidence to the contrary. And again, we have had no hearing. For a new Member of Congress like me, who comes from the Maryland State Senate, I am absolutely astonished and amazed that we would think of overturning a standard fixture in our civil justice system without so much as a hearing as to what the problem is.  H.725 would replace a time-honored standard with an ambiguous one that would dramatically increase the costs and burdens of litigation on plaintiffs in Federal courts. It would try to strip our State courts of their basic powers to hear cases relating to their citizens. This is an assault on federalism.  The measure would require a court to deny a motion remanding to the State[[Page H1970]]courts unless the court finds, one, that it is ``plausible to conclude that applicable State law would impose liability'' on an instate defendant; two, that the plaintiff had a ``good faith intention to prosecute the action against each'' instate defendant or to seek a joint judgment; and three, that there was no ``actual fraud in the pleading of jurisdictional facts.''  This gauntlet of hurdles suddenly shifts the burden and creates a presumption that a Federal court should hear the case, making it far more expensive and difficult for plaintiffs to have their cases heard in State court.  H.725 would effectively overturn the local defendant exception, which prohibits removal to Federal court even if complete diversity of citizenship exists when the defendant is a citizen of the State where the suit was filed.  The bill's radical changes to longstanding jurisdictional practice reveal the authentic purpose behind the measure. It is simply intended to stifle the ability of plaintiffs to have their choice of forum and, possibly, even their day in court.  In addition, H.725 would sharply increase the cost of litigation for plaintiffs and further burden the Federal court system. For example, the meanings of terms like ``plausible'' and ``good faith intention'' are ambiguous and will spawn substantial litigation over their proper interpretation and application, further postponing decisions and justice.  Additionally, these standards would require a court to engage in a mini-trial during the early procedural stages of the case without any opportunity for the full development of evidence. Again, this would sharply increase the burdens and costs of litigation for ordinary citizens, for plaintiffs, which appears to be, to my mind, the only possible contemplated result of this legislation.  Finally, we need to focus on the fact that this bill offered by the majority raises profound federalism concerns, which I would have hoped they would be attentive to. Matters of State law should be decided by State courts, subject to certain exceptions as set forth in the  It was our constitutional design that matters of civil dispute and conflict go to State courts, State judges, and State juries, all of them closer to the people themselves, unless you have a Federal question, a matter of Federal statutory law, a matter of Federal constitutional law, or you have got diversity jurisdiction.  H.725 bulldozes this key federalism constraint and casts a shadow, unnecessarily and improperly, over State courts, the courts of the people. By applying sweeping and vaguely worded new standards to the determination of when a State case must be remanded to State court, the bill denies State courts the ability to decide and, ultimately, to shape the unfolding of State law. This is completely contrary to the design of the Founders, many of them Virginians, like Thomas Jefferson and James Madison and George Mason, who wanted the State courts to be the central arena for the resolution of civil conflicts and tort disputes.  Simply put, H.725 tramples State sovereignty and our basic constitutional structure. For these reasons and for the fact that nobody has demonstrated there is a real problem, I urge the House to resist this unnecessary and flawed legislation, and I reserve the balance of my time.  ",CREC-2017-03-09-pt1-PgH1968-2.txt,99999999999999,EXECUTIVE CALENDAR--Continued,2017.0,9.0,January
7738,topic-id,150,"Mr.Chairman, I yield myself such time as I may consume.  I very much appreciate my colleague's remarks there. I want to make one point before I yield to my distinguished colleague from New  Mr.Chairman, my colleague asked us to reckon with the fact that it is emotionally devastating for people to be sued, and, undoubtedly, it is in certain cases. But compare whatever it might feel like to be sued in whatever case he might have in mind with the outrageous emotional devastation caused by asbestos poisoning, by lead poisoning, by mass sexual harassment, sex discrimination, race discrimination, all of the torts that come to dominate what takes place in our courts. So if we are going to have a new emotional devastation standard, I would put the plaintiffs up against the large corporate defendants any day.  Mr.Chairman, I yield 3 minutes to my distinguished colleague from New York (Mr.Nadler).  ",CREC-2017-03-09-pt1-PgH1968-2.txt,99999999999999,PROGRAM,2017.0,9.0,February
7741,topic-id,12,"Mr.Chairman, I yield 3 minutes to the distinguished gentleman from Georgia (Mr.Johnson).  ",CREC-2017-03-09-pt1-PgH1968-2.txt,99999999999999,INNOCENT PARTY PROTECTION ACT,2017.0,9.0,February
7743,topic-id,569,"Mr.Chairman, I yield myself such time as I may consume.  Mr.Chairman, I think that we are actually progressing in our discussion of the issue because we presently have a law against fraudulent joinder. They simply want to make it far more difficult for plaintiffs to get justice in State courts. The law already makes it impossible to fraudulently join someone.  So in the case offered by the distinguished gentleman from Georgia, I could very much see an out-of-State corporate behemoth that owns nursing homes across the country saying that all of this should be in Federal court because the person who actually committed the sexual assault instate is judgment-proof because they don't have any money and that is not really a plausible opportunity to recover, and, therefore, it should stay in Federal court.  The grand irony here, Mr.Chairman, is that the party which sings lullabies about federalism and states' rights is in the business of stripping our State courts and our people of the opportunity to get into State court. All of this is about forcing everybody into Federal court. I remember a President who recently said in his inaugural address that the whole sum and substance of his administration is to give power back to the States and back to the people, but this legislation is designed to wreck federalism and to force everybody into Federal court where the big corporate defendants and the fancy lawyers have every conceivable advantage over people who are just trying to get justice when they have been injured in their  Mr.Chairman, the substantive issues at stake here are obviously complex, and I would invite all Americans to try to research what is going on. But if you don't have the time to actually study the more than a century in which we have had current fraudulent joinder rules and you don't have time to go and examine the bill as submitted by the majority, then just consider the procedure that has gotten us to this point.  There has been no hearing on this bill, there has been no call for this bill by anybody who has been injured in a civil tort case, and all of the groups that try to stand up for citizens against the largest corporations who are bankrolled by billions of dollars and are trying to force everybody these days into arbitration and to shut the courthouse door, all of those groups are opposed to the legislation because they understand what it is going to do.  It is going to make it far more difficult for people to prosecute civil[[Page H1972]]claims when they have been injured in something like a sexual harassment case, a sexual violence case, a discrimination case, an asbestos poisoning case, or a mass toxic tort. It is going to be far more difficult for people to get justice in their State courts.  Apparently, the interests of the large corporate polluters and inflictors of injuries--tortfeasors--are so important that we are willing to trample the basic principles of our constitutional design which is that these kinds of cases go into State court for State resolution, we reserve the Federal courts for complicated questions of Federal law and real cases of diversity jurisdiction, not phony cases of diversity jurisdiction where they try to eliminate the instate defendant, but real cases of diversity jurisdiction where nobody else is involved.  Mr.Chairman, I yield back the balance of my time.  ",CREC-2017-03-09-pt1-PgH1968-2.txt,99999999999999,EXECUTIVE CALENDAR--Continued,2017.0,9.0,February
7750,topic-id,206,"Mr.Chairman, the Soto amendment is an excellent amendment and I can't see why anybody would oppose it. I can't see, in the first instance, why anyone would want to keep the people's cases out of the people's courts in their own  It seems as if there is a move somewhere in this Congress that is so intent on protecting polluters and the manufacturers of auto defects that they are willing to trample our basic principles of federalism and invade the proper province of the courts.  The Soto amendment would exempt from this bill all cases in which the plaintiff seeks compensation for public health risks like fracking or any other kind of water contamination. Water contamination is devastating to our communities regardless of the source, as demonstrated by the ongoing Flint water crisis in  This bill makes it easier for large corporations to remove State law claims to Federal court, where they think they have got a better chance of beating the claims of the small guy. The Soto amendment at least would carve out cases where there are public health risks at stake, such as those caused by fracking, which has been proven to generate earthquakes, well contamination, and the poisoning of local water supplies.  ",CREC-2017-03-09-pt1-PgH1968-2.txt,99999999999999,EXECUTIVE CALENDAR--Continued,2017.0,9.0,January
7753,topic-id,50,"Mr.Chairman, I demand a recorded vote.  The Acting Pursuant to clause 6 of rule XVIII, further proceedings on the amendment offered by the gentleman from Florida will be postponed.               Amendment 2 Offered by Mr.Cartwright  The Acting It is now in order to consider amendment 2 printed in House Report 115-27.  ",CREC-2017-03-09-pt1-PgH1968-2.txt,99999999999999,REQUIRING THE ADMINISTRATOR OF THE FEDERAL EMERGENCY MANAGEMENT AGENCY,2017.0,9.0,January
7975,topic-id,12,I object.  The PRESIDING Objection is heard.  The PRESIDING The Senator from  ,CREC-2017-02-06-pt2-PgS825.txt,1896,ADJOURNMENT,2017.0,6.0,January
7977,topic-id,152,"Mr.President, I am the one who entered the objection, and let me say to my good friend from Vermont that I agree with him 100 percent that we should get back to what made the Senate great.  We have rules around here, and the rules are very clear that you don't impugn another Now, you can't do that in your words and you can't do it with writings. You can't hold up a writing that impugns another Senator and say: Well, this is what somebody else said. I am not saying it, but that is  It is not It is a violation of the rules, and we should get back to what made this Senate great, and that is, to stay within the rules, stay within civility, and not impugning another Senator, whether it is through words or whether it is through writings.  I yield the floor.  The PRESIDING The Senator from  ",CREC-2017-02-06-pt2-PgS825.txt,1896,EXECUTIVE CALENDAR--Continued,2017.0,6.0,January
7830,topic-id,324,"Madam Speaker, I rise in support of H.43. Congress must use its authority to strike this rule and stop the Federal Government from forcing States to funnel taxpayer money to abortion providers.  This rule is wrong on process and it is wrong on policy. First of all, States have every right to put in place reasonable guidelines for how their Federal dollars are spent. For Washington to attempt to coerce States in this way would be bad enough, but for unelected bureaucrats in the Department of Health and Human Services to go around Congress at the eleventh hour of the Obama administration is just outrageous.  Madam Speaker, I think we all agree that low-income women should have access to essential title X services, but why is it necessary for those services to be funded at the Nation's largest provider of abortion? It isn't, of course, but the abortion industry and its supporters want us to believe that it is.  When it comes to funding, they like to pretend that abortion doesn't exist and that Planned Parenthood is the only place where women can get health care, but that is not true. The truth is that there are more than 13,000 federally qualified and rural health centers that offer low-cost health care to women. These centers outnumber Planned Parenthood clinics 20 to 1; they just don't preform abortions.  Understanding this, some States have rightly enacted laws and policies redirecting title X dollars away from abortion providers and toward these noncontroversial clinics. If the true goal here were to ensure women's health care, no one should have a problem with that. But that wasn't the goal, and everybody knows it.  There is a reason people call this rule President Obama's parting gift to Planned It was a blatant, transparent attempt to preserve the[[Page H1271]]pipeline of funding to the Nation's largest abortion business. It was wrong, and I urge my colleagues to vote to nullify it today.  ",CREC-2017-02-16-pt1-PgH1268.txt,1986,1215,2017.0,16.0,February
7839,topic-id,231,"Madam Speaker, I thank Representative Black for her work on this subject.  I rise today in strong support of H.43, a joint resolution to stop an Obama administration rule that will force States to send taxpayer dollars to abortion providers, including abortion giant Planned  In addition to last year's shocking videos where we heard high-ranking Planned Parenthood officials use jarring language such as doing a less crunchy type of procedure to preserve body parts, we have recently learned in Pennsylvania that Planned Parenthood was using false advertising on its websites.  The Pennsylvania Family Institute recently found that each Planned Parenthood affiliate in Pennsylvania does not provide prenatal services, even though all 27 Planned Parenthood locations in Pennsylvania had listed ``prenatal'' as a service on their website.  After these clinics were called and asked, Do you provide prenatal services, not one had any such services to offer, but they did offer terminations. Planned Parenthood has since removed[[Page H1274]]the word ``prenatal'' from their booking appointments website.  They should not be receiving one dime of Federal dollars when they are actively attempting to deceive women to get them in the door. Abortion is not health care. Subsidizing the destruction of human life with Federal dollars in the name of family planning is simply unconscionable.  I urge my colleagues to join me in defending the lives of the unborn and support this important joint resolution.  ",CREC-2017-02-16-pt1-PgH1268.txt,2158,EXECUTIVE CALENDAR--Continued,2017.0,16.0,February
7978,topic-id,61,"Mr.President, I have a parliamentary inquiry as well.  The first question, Mr.President, is this: It is my understanding that the ruling of the Chair was based on the advice of the Is that accurate, Mr.President; on the advice of the Parliamentarian that the rule had been violated?  The PRESIDING The Chair sustained the ruling of the majority leader on his own.  ",CREC-2017-02-06-pt2-PgS825.txt,2084,EXECUTIVE CALENDAR--Continued,2017.0,6.0,February
7979,topic-id,76,"The second question I have, Mr.President: Does the rule say anything that impugns another Member of the Senate, directly or indirectly? Is that an accurate reading of the rule?  The PRESIDING The Senator is correct, and I will read the paragraph. This is rule XIX, section 2.       No Senator in debate shall, directly or indirectly, by any      form of words impute to another Senator or to other Senators      any conduct or motive unworthy or unbecoming a  ",CREC-2017-02-06-pt2-PgS825.txt,2084,EXECUTIVE CALENDAR--Continued,2017.0,6.0,February
7980,topic-id,8,"Thank you, Mr. The PRESIDING The Senator from  ",CREC-2017-02-06-pt2-PgS825.txt,2084,EXECUTIVE CALENDAR--Continued,2017.0,6.0,February
