title,date,text,name
UNITED NATIONS PEACEKEEPING AND OPPORTUNITIES FOR REFORM,12/9/2015,"    Thank you, Senator Cardin._x000D_
    We have two distinguished panels today, and we want to _x000D_
thank all who are here to share their wisdom._x000D_
    Our first witness is the Permanent Representative to the _x000D_
U.S. Mission to the United Nations, Samantha Power. We thank _x000D_
you for being here today with a very tight schedule._x000D_
    We also thank you for bringing Haley back, who served so _x000D_
well with Senator Coons here and was one of the bright people _x000D_
we had here on the committee amongst many._x000D_
    But we thank you both for being here. If you could keep _x000D_
your comments to about 5 minutes or so, we would appreciate it, _x000D_
and then we look forward to Q&A. Thank you._x000D_
_x000D_
   STATEMENT OF HON. SAMANTHA POWER, UNITED STATES PERMANENT _x000D_
REPRESENTATIVE TO THE UNITED NATIONS, UNITED STATES MISSION TO _x000D_
             THE UNITED NATIONS, NEW YORK, NEW YORK_x000D_
_x000D_
     Ambassador Power. Thank you so much, Mr. Chairman, Ranking _x000D_
Member Cardin, for convening this hearing. And thank you all, _x000D_
distinguished members of the committee, for making time to be _x000D_
here to discuss peacekeeping._x000D_
    This committee is acutely aware of the extent to which _x000D_
conflicts on the other side of the globe can come back and _x000D_
threaten American security. We have seen time and again how _x000D_
conflicts can displace millions of people, upend markets, and _x000D_
destabilize entire regions._x000D_
    All too recently and all too frequently, we have seen how _x000D_
such instability can attract and enable violent extremist _x000D_
groups, who exploit the vacuum of authority to terrorize _x000D_
civilians; recruit new members; and plan, launch, or inspire _x000D_
attacks._x000D_
    U.N. peacekeepers play a vital role in the international _x000D_
community's efforts to address war, violence, and instability. _x000D_
As President Obama said in September, ``We know that peace _x000D_
operations are not the solution to every problem, but they do _x000D_
remain one of the world's most important tools to address armed _x000D_
conflict.''_x000D_
    Peacekeepers can help resolve conflict, shore up stability, _x000D_
deny safe harbor to extremists, and protect civilians from _x000D_
atrocities, all of which serve core American interests and _x000D_
reflect deep American values, while ensuring greater burden-_x000D_
sharing by the international community._x000D_
    This administration has consequently been working _x000D_
aggressively to ensure that U.N. peacekeeping operations are _x000D_
better able to meet the demands of international peace and _x000D_
security, which, as has been noted by both the chairman and the _x000D_
ranking member, those requirements have changed considerably _x000D_
over just the last 20 years._x000D_
    Peacekeepers today are undertaking more missions. The _x000D_
number of uniformed personnel has risen from fewer than 20,000 _x000D_
15 years ago to over 100,000 today._x000D_
    They are assuming greater risk. Two-thirds of peacekeepers _x000D_
are operating in active conflicts, the highest percentage in _x000D_
history._x000D_
    And they are assigned broad and increasingly complex _x000D_
responsibilities, ranging from disarming armed groups to _x000D_
facilitating the safe delivery of humanitarian aid to _x000D_
protecting civilians from those who wish them harm._x000D_
    Today, 98 percent of uniformed personnel in U.N. missions _x000D_
around the world are under orders to protect civilians as part _x000D_
of their mandate. This is not your mother's peacekeeping, your _x000D_
father's peacekeeping, your grandfather's peacekeeping. It has _x000D_
evolved significantly._x000D_
    While peacekeeping has never been more important to _x000D_
American interests, it has also never been more demanding. And _x000D_
that is why, in September, President Obama issued the first _x000D_
presidential memorandum on multilateral peace operations in _x000D_
more than 20 years, directing a wide range of actions to _x000D_
strengthen and modernize U.N. operations, including by building _x000D_
partner capacity, providing U.S. support, and leading reform of _x000D_
U.N. peacekeeping._x000D_
    I just want to briefly, Mr. Chairman, touch on a few key _x000D_
lines of effort that we have pursued. These are described in _x000D_
greater detail in my written submission._x000D_
    First, we are working to ensure that countries with the _x000D_
will to perform 21st century peacekeeping, that they have the _x000D_
capacity to do so. One way we are doing this is through the _x000D_
African Peacekeeping Rapid Response Partnership, or APRRP, _x000D_
which President Obama announced in August 2014._x000D_
    Through APRRP, the United States is investing in the _x000D_
capacity of six African countries that have proven themselves _x000D_
leaders in peacekeeping. In exchange, these countries have _x000D_
committed to maintain the forces and equipment necessary to _x000D_
deploy rapidly._x000D_
    This initiative builds upon the Global Peace Operations _x000D_
Initiative launched under President George W. Bush, which is _x000D_
our primary tool for building partner-nation peacekeeping _x000D_
capacity, and it will help ensure that more soldiers deployed _x000D_
for peacekeeping missions will be fully prepared._x000D_
    I hope that the Senate and House will fully fund this _x000D_
important initiative in future years._x000D_
    Second, we are expanding the pool of troop- and police-_x000D_
contributing countries, and bringing advanced militaries back _x000D_
into peacekeeping. In September, President Obama convened a _x000D_
historic high-level summit, the first of its kind, at the U.N. _x000D_
to rally new commitments to peacekeeping, marking the _x000D_
culmination of a yearlong effort initiated by Vice President _x000D_
Biden at the previous U.N. General Assembly. Forty-nine _x000D_
countries participated and pledged nearly 50,000 additional _x000D_
troops and police._x000D_
    Not only that, more of these troops will now come from _x000D_
advanced militaries, who bring with them equipment and _x000D_
expertise that is critically needed on the ground. We saw this _x000D_
in Mali in January this year, when Dutch attack helicopters _x000D_
helped Bangladeshi infantry repel rebels who had opened fire on _x000D_
their camp, where civilians were taking refuge._x000D_
    The United States is making contributions in this respect _x000D_
as well as one part of our unrivaled contribution to global _x000D_
peace and security, looking specifically for ways to leverage _x000D_
our military's unique capabilities to support peacekeeping _x000D_
operations, including by enabling faster deployment by others._x000D_
    Third, we are working to ensure a higher standard of _x000D_
performance and conduct once peacekeeping contingents are _x000D_
deployed, specifically in two critical areas: the complete _x000D_
fulfillment of their mandates and the combating of sexual _x000D_
exploitation and abuse._x000D_
    The additional troops generated by the President's _x000D_
September summit will prove invaluable to both goals, by _x000D_
allowing the U.N. to be more selective as to which troops it _x000D_
deploys, and now giving it the leverage to repatriate poorly _x000D_
performing troops and police when necessary, and especially, of _x000D_
course, in instances where there are credible allegations of _x000D_
sexual abuse._x000D_
    With respect to mandate, when peacekeepers deploy in _x000D_
volatile situations, they have to be prepared to use force to _x000D_
defend themselves, to protect civilians, and to otherwise carry _x000D_
out their mandated tasks._x000D_
    Too often in the past, peacekeepers have shied away, even _x000D_
when atrocities are being perpetrated. A report by the U.N.'s _x000D_
internal oversight office in March last year found that in 507 _x000D_
attacks against civilians from 2010 to 2013, peacekeepers _x000D_
virtually never used force to protect those coming under _x000D_
attack. Thousands of civilians likely lost their lives as a _x000D_
result. This cannot continue, and a growing number of leading _x000D_
troop contributors agree. The 50,000 additional troops and _x000D_
police should enable more capable, more willing troops and _x000D_
police to staff these missions._x000D_
    The same is true on sexual exploitation and violence. And _x000D_
let me just state the obvious here. We share the outrage of _x000D_
everyone on this committee, all the American people who are _x000D_
focused on this issue. Peacekeepers must not abuse civilians. _x000D_
Sexual abuse and exploitation have no place, it goes without _x000D_
saying, again, in any society. It is especially abhorrent when _x000D_
committed by those who take advantage of the trust that _x000D_
communities are placing in the United Nations, and those _x000D_
responsible must be held accountable._x000D_
    Addressing this scourge will require continuing the _x000D_
important efforts begun by Secretary General Ban Ki-moon to _x000D_
strengthen the implementation of a zero-tolerance policy, _x000D_
including bolstering reporting and accountability measures, and _x000D_
pledging to set up an immediate response team to investigate _x000D_
certain cases. It will also require more vigilance and follow-_x000D_
through from troop-contributing countries._x000D_
    There must also be far more transparency in these _x000D_
investigations, to track cases and ensure that justice is _x000D_
served._x000D_
    The U.N. should be able to take advantage now of its newly _x000D_
expanded pool of soldiers and police by suspending from _x000D_
peacekeeping any country that does not take seriously the _x000D_
responsibility to investigate and, if necessary, prosecute _x000D_
credible allegations._x000D_
    The fourth and final priority, Mr. Chairman, is to press _x000D_
for bold institutional reforms within the U.N. itself. We have _x000D_
seen the U.N. secretariat make profound changes to _x000D_
peacekeeping, from improved logistics and sustainment to a more _x000D_
comprehensive approach to crisis situations that integrates _x000D_
military, police, and civilian tools. But much, much more needs _x000D_
to be done, and we have spearheaded efforts to enact further _x000D_
reforms, including longer troop rotations to preserve _x000D_
institutional memory, penalties for troops who show up without _x000D_
the necessary equipment to perform their duties._x000D_
    And we will continue to work aggressively to cut costs. The _x000D_
U.N. has already, thanks to U.S. leadership, cut the per-_x000D_
peacekeeper costs by roughly 17 percent since 2008. We are also _x000D_
working to advance the reforms proposed by the Secretary _x000D_
General's High-Level Independent Panel on U.N. Peace _x000D_
Operations, which are intended to address inadequate planning, _x000D_
slow troop deployment, uneven mission leadership, breakdowns in _x000D_
command-and-control, and a current set of rules around human _x000D_
resources and procurement designed for the conference rooms of _x000D_
New York and not the streets of Bangui._x000D_
    Let me conclude. In all of the areas I have just described, _x000D_
we have seen improvements, and the United States has played an _x000D_
instrumental role in making them possible. But there is much _x000D_
more to be done._x000D_
    We are not satisfied with peacekeepers fulfilling only _x000D_
parts, but not all, of their mandates; with peacekeepers _x000D_
standing up to protect civilians in some, but not all, _x000D_
situations; or with soldiers being held accountable for crimes _x000D_
or misconduct some, but not all, of the time._x000D_
    The role played by peacekeepers today is too important. For _x000D_
the sake of our own interests and security, as well as the _x000D_
millions of innocent people around the world whose lives may _x000D_
depend on peacekeepers, we will continue working to strengthen _x000D_
peacekeeping so that it is tailored for the 21st century _x000D_
threats peacekeepers face._x000D_
    We appreciate your interest and support and continued _x000D_
dialogue on these matters. Thank you.",corker
UNITED NATIONS PEACEKEEPING AND OPPORTUNITIES FOR REFORM,12/9/2015,"    Well, thank you very much for those comments._x000D_
    Senator Isakson and I were in Darfur years ago and just _x000D_
infuriated by the caveats that the U.N. peacekeepers had. They _x000D_
could only fire at people when they were fired upon. You had _x000D_
women going out and collecting wood from their villages being _x000D_
raped, abused, people being murdered by the Janjaweed. Yet _x000D_
those caveats remained._x000D_
    So we have evolved, as you mentioned. This is not our _x000D_
father's peacekeeping mission anymore._x000D_
    As we have evolved these missions, though, and people now _x000D_
are placing themselves as peacekeepers more in the center of _x000D_
conflicts, in some cases taking sides, how has this changed the _x000D_
way the U.N. is viewed in these peacekeeping missions? I assume _x000D_
you believe this is in our national interests for us to be in _x000D_
these missions certainly, I do. But how has this changed the _x000D_
way these blue hats are viewed in these areas?_x000D_
     Ambassador Power. Thank you, Senator Corker. It is an _x000D_
excellent question._x000D_
    I think one of the lines that the U.N. struggles to walk is _x000D_
that it has, on the one hand, peacekeepers that are charged _x000D_
with an aggressive enforcement of mandates, which entail _x000D_
protecting civilians, not just protecting peacekeepers _x000D_
themselves, as was once the case. You have that on one hand. _x000D_
Then you have U.N. country programs that often look _x000D_
indistinguishable. They are all driving around in white _x000D_
vehicles, unarmed, passing out food, providing shelter, trying _x000D_
to provide counseling to those who have been victimized by _x000D_
sexual abuse._x000D_
    So it has been challenging, the blurring of functions _x000D_
across these missions. But the only thing worse than _x000D_
confronting that challenge of having people in society _x000D_
distinguish who does what, is actually people in these _x000D_
societies rely on peacekeepers, know that the mandate says _x000D_
protect civilians, and have those peacekeepers bunkered and _x000D_
more interested, again, in collecting a paycheck and then going _x000D_
home than actually being out and about and delivering on the _x000D_
promise of that blue flag._x000D_
    So, again, it varies per conflict area. I think we have _x000D_
come a long way. But as I noted, the statistics are not _x000D_
inspiring. I mean, there are still many troop-contributing _x000D_
countries who send their troops in without the very strict _x000D_
guidance that you will be sent home if you do not enforce the _x000D_
mandate you are given.",corker
UNITED NATIONS PEACEKEEPING AND OPPORTUNITIES FOR REFORM,12/9/2015,"    Yes. I appreciate the comment Senator Cardin _x000D_
made about the cost. But, as I understand it, for some of these _x000D_
countries, even though the cost to us is far less than having _x000D_
U.S. soldiers there, the pay for these soldiers is far greater _x000D_
than they would otherwise receive in their own countries. And, _x000D_
actually, if I understand correctly, that money goes to the _x000D_
national governments of those countries. And so these countries _x000D_
are benefiting financially in sending troops there._x000D_
    Is that correct, in some cases, in some of the lower income _x000D_
countries? And is that feeding this situation of actually _x000D_
having troops there that are not, if you will, carrying out _x000D_
their mandates in an appropriate way, with soldiers not _x000D_
qualified or trained and not properly equipped? Talk to us a _x000D_
little bit about what is driving having folks within the _x000D_
peacekeeping missions that are that are certainly not _x000D_
conducting themselves in a professional manner._x000D_
     Ambassador Power. Well, thank you, Mr. Chairman, again. It _x000D_
reflects a real understanding of the dynamics in some of these _x000D_
missions._x000D_
    Again, the performance is uneven. The motivation is uneven. _x000D_
The incentive for troops is uneven. If you take, for instance, _x000D_
Rwandan peacekeepers, who do get a more substantial stipend by _x000D_
serving in peacekeeping missions than they might if they were _x000D_
at home, but they are totally driven by what happened in their _x000D_
country 21 years ago and actually view protecting civilians as _x000D_
a way of showing the world what should have been done when the _x000D_
genocide unfolded in Rwanda._x000D_
    Contrast that with other troops, again, who institutionally _x000D_
are not given the guidance from capital that they need to be _x000D_
out and about, that, yes, there are risks entailed with _x000D_
patrolling, but there are risks also that are entailed by being _x000D_
bunkered._x000D_
    I think on the question, the very specific question of the _x000D_
stipend, as Senator Cardin said, this is a very good deal for _x000D_
the American taxpayer. These are extremely difficult _x000D_
environments, not only because of the risks of militia and _x000D_
government forces targeting peacekeepers as they are out and _x000D_
about, but also just the conditions in terms of logistics, _x000D_
access to water. I mean, these are missions that are not _x000D_
expending resources in the manner that our missions do when _x000D_
they deploy internationally. The logistic tail is not nearly as _x000D_
fulsome._x000D_
    So I think it is important to incentivize their _x000D_
participation. Some countries are doing it because they are _x000D_
able, again, to secure additional resources that they are _x000D_
investing in ways that sometimes we do not have full visibility _x000D_
into, sometimes in professionalizing their militaries, _x000D_
sometimes in other parts of their government._x000D_
    But I think Senator Cardin's point is very, very important. _x000D_
We are getting a lot out of the 100,000-plus troops who are _x000D_
active in these conflict areas. These are places where, in some _x000D_
instances, if you look at Mali or Lebanon, places that are _x000D_
really cutting-edge theaters in terms of terrorism and _x000D_
extremism, and if it weren't for U.N. peacekeepers who were _x000D_
there putting their lives at risk, it may come to the United _x000D_
States at some point in order for us to advance our security.",corker
UNITED NATIONS PEACEKEEPING AND OPPORTUNITIES FOR REFORM,12/9/2015,"    As it relates to the issues of the abuse that _x000D_
has taken place that is, obviously, abhorrent, in fairness, I _x000D_
think people on both sides of the aisle have concerns about the _x000D_
U.N.'s ability to actually put reforms in place. And we _x000D_
understand how the U.N. operates, and I know you talked about _x000D_
the leader's desire to create reforms. We sent a letter _x000D_
suggesting that we have onsite court marshals by the countries _x000D_
to handle peacekeeping soldiers accused of crimes be tried, by _x000D_
the way, under their own country military preocedures to reduce _x000D_
impunity. We also made some other suggestions._x000D_
    What is your sense that those types of reforms can be _x000D_
implemented, relative to peacekeeping?_x000D_
     Ambassador Power. Well, as Ambassador Negroponte behind me _x000D_
I think will attest, through the life of the U.N. you have a _x000D_
challenge, always, on reform, in the sense that there are two _x000D_
places you have to secure--will and follow-through._x000D_
    The first is with the countries that comprise the U.N. So _x000D_
every troop-contributing country to peacekeeping has to be _x000D_
prepared to look at the kinds of ideas that you put in your _x000D_
letter that we have been pushing in new York and implement in _x000D_
their own military changes to ensure follow-though, oversight _x000D_
in the first instance, follow-through on investigation, and _x000D_
accountability, whether a court martial or some kind of _x000D_
prosecution in civilian court._x000D_
    And again, there is probably no one-size-fits-all solution, _x000D_
because every country has its own set of procedures, again, for _x000D_
following up on abuse of any kind._x000D_
    Then there is the U.N. itself, which has to be much _x000D_
aggressive in shining a spotlight on those countries that are _x000D_
not taking the steps that are needed._x000D_
    I think that we have seen improvements. This is, again, not _x000D_
something one should cite as an improvement. It should never _x000D_
have been the case that it was otherwise. But those individuals _x000D_
who were alleged to be involved in sexual abuse now are not _x000D_
being paid by the U.N. They are being recalled to their _x000D_
capital. Training and vetting now is changing, so that there is _x000D_
training on preventing sexual abuse and exploitation._x000D_
    You had an idea, I believe, in your letter about a claims _x000D_
kind of commission. I think the U.N. is looking at creating a _x000D_
victim support trust fund, which is something, of course, we _x000D_
would wish to support as well. It is going to require going _x000D_
back to member states and getting resources to put into that, _x000D_
but maybe some of the docked pay of those against whom there _x000D_
are allegations could be used in service of such a fund. And _x000D_
then I think having more aggressive onsite investigative _x000D_
capacity, so that less time passes between an allegation and an _x000D_
actual follow-through._x000D_
    Lastly, the two aspects of reform come together. In order _x000D_
to secure meaningful reform that actually matters for potential _x000D_
victims or people who have already been victimized, there has _x000D_
to be more transparency between what is actually going on in _x000D_
the field and then what we are made aware of in New York._x000D_
    Too often, we hear from NGOs or from journalists about _x000D_
sexual abuse and exploitation, rather than from the U.N. _x000D_
itself. And if we are to go to a developing country and try to _x000D_
enhance their capacity, their training on the front end, their _x000D_
capacity to investigate on the backend of an allegation, we _x000D_
have to know who has been accused of doing what at what period, _x000D_
and be in a position to offer support._x000D_
    If there are countries who are shirking their obligation to _x000D_
carry out investigations, we have to know so that we can look _x000D_
at our bilateral leverage and whether we might suspend some _x000D_
forms of assistance, if, in fact, there is a recurrent pattern _x000D_
of not actually taking seriously the zero-tolerance policy.",corker
UNITED NATIONS PEACEKEEPING AND OPPORTUNITIES FOR REFORM,12/9/2015,"    Well, thank you. My time is up. And as a _x000D_
courtesy, I want to move on._x000D_
    I do hope through questioning at some point and--I know the _x000D_
President has made additional pledges to the U.N. beyond our _x000D_
normal peacekeeping budgeting. I hope at some point it will _x000D_
come to light as to where those resources are planned to come _x000D_
from. But thank you again for being here._x000D_
    Senator Cardin?",corker
UNITED NATIONS PEACEKEEPING AND OPPORTUNITIES FOR REFORM,12/9/2015,"    Before turning to Senator Perdue, I just want _x000D_
to thank the ranking member for bringing up an issue that is _x000D_
brought up consistently, certainly, on our side of the aisle. I _x000D_
want to thank him for that._x000D_
    I do want to just emphasize that with NATO, which I know is _x000D_
not in your jurisdiction, we have become the provider of _x000D_
security services. Our NATO allies, generally speaking, are the _x000D_
consumer of security services._x000D_
    And the same thing is happening with peacekeeping at the _x000D_
U.N. I know it is a different set of actors._x000D_
    But the very people that stymie our efforts to pursue our _x000D_
interests--China, for instance--are taking advantage of us with _x000D_
respect to sharing the peacekeeping costs. So yes, it is in our _x000D_
U.S. national interests that we have peacekeeping missions and _x000D_
that we have stability and security around the world. But I _x000D_
think we continue to be not as good as we should be at forcing _x000D_
other nations to also be responsible._x000D_
    So I want to thank Senator Cardin for bringing this _x000D_
important issue up. It is infuriating--infuriating--to have the _x000D_
lack of transparency that exists at the U.N. I think, over _x000D_
time, it will erode support. Such support is already not _x000D_
particularly high because of the many issues we see going _x000D_
unattended, like not dealing with the ballistic missiles that _x000D_
are being fired by Iran in violation of UNSCR 1929._x000D_
    So I would just say, I am glad there is bipartisan concern. _x000D_
I hope that you can address it._x000D_
    With that, Senator Perdue.",corker
