title,date,text,name
AMERICAN FOOD AID: WHY REFORM MATTERS,4/15/2015,"    The Foreign Relations Committee will come to _x000D_
order._x000D_
    I want to welcome our witness. I understand there may be _x000D_
circumstances where you may need to depart. We are just glad _x000D_
you are here. If you need to leave in 2 minutes, leave. I _x000D_
understand that there may be something occurring that will _x000D_
cause that. So please, just whatever makes you comfortable._x000D_
    I am glad to be here with our outstanding ranking member, _x000D_
who I have enjoyed working with so much. And I am glad we are _x000D_
having this hearing today on something that is so important to _x000D_
people around the world._x000D_
    I do not normally read opening statements. I think I may do _x000D_
it. We have been sort of focused on another issue for a while, _x000D_
but I think people know that since 1954, U.S. international _x000D_
food aid programs have helped to feed over 3 billion people and _x000D_
promote food security in over 150 countries. Most U.S. food aid _x000D_
is provided through Food for Peace, which is currently funded, _x000D_
on average, at $1.6 billion annually. Over the past 5 years, _x000D_
U.S. food aid has helped 56 million people, on average, per _x000D_
year._x000D_
    Today's hearing will provide the committee with an update _x000D_
on the current operations of the program, including the _x000D_
challenges it faces while responding to increasingly dangerous _x000D_
emergencies._x000D_
    This increasingly challenging global environment has _x000D_
illustrated to Congress the need for greater flexibility in how _x000D_
Food for Peace operates. The law requires that 100 percent of _x000D_
the food aid to be delivered be U.S.-purchased commodities, and _x000D_
50 percent of that is to be shipped on U.S.-flagged vessels._x000D_
    While recent reforms in the farm bill provide some _x000D_
administrative funds to be used for such things as locally and _x000D_
regionally purchased food aid and/or food vouchers, this _x000D_
limited flexibility must be executed in tandem with U.S.-_x000D_
purchased commodities. The cargo and commodity preferences _x000D_
create inefficiencies that undermine our ability to get maximum _x000D_
impact in addressing poverty and suffering from our U.S. food _x000D_
aid dollars._x000D_
    In some cases, where U.S. national security interests are _x000D_
at stake, like in Syria and other regions in conflict, U.S. _x000D_
food aid plays an important role in U.S. policy and engagement. _x000D_
These interventions would not be possible if we relied on U.S.-_x000D_
purchased commodities._x000D_
    Increasing flexibility in the Food for Peace program would _x000D_
provide up to $444 million in savings, allowing the United _x000D_
States _x000D_
to reach as many as 12 million more starving people, up to 2\1/_x000D_
2\ months faster in some cases._x000D_
    Again, I think this just jumps out at us, that self-imposed _x000D_
limitations--I am tired, I have not had a lot of sleep. I will _x000D_
just say that the special interests that capture this program _x000D_
cause people around the world to starve._x000D_
    While the impact of reforming U.S. food aid overseas is _x000D_
profound, the domestic implications are minor, as food aid only _x000D_
contributes 1.41 percent to net farm income and 0.86 percent to _x000D_
agriculture exports._x000D_
    I have joined forces with my friend and colleague, Senator _x000D_
Coons, by authorizing with him the Food for Peace Reform Act. _x000D_
We are seeking to increase the flexibility of our food aid _x000D_
programs and are looking to our witnesses today to illustrate _x000D_
why reform to the program matters._x000D_
    For many around the globe we are not yet reaching but _x000D_
could, it is a matter of life and death._x000D_
    Again, we thank you for being here. I look forward to _x000D_
turning to Senator Cardin and maybe Senator Coons, who has been _x000D_
such a champion._x000D_
    But I hope that out of this hearing, something is going to _x000D_
occur where we will do the things necessary to make sure that _x000D_
our U.S. dollars help those people that today, as we sit here _x000D_
in this comfort, are starving because of special interests here _x000D_
in our own Nation._x000D_
    With that, Senator Cardin.",corker
AMERICAN FOOD AID: WHY REFORM MATTERS,4/15/2015,"    Without objection._x000D_
_x000D_
the ``Additional Material Submitted for the Record'' section at ",corker
AMERICAN FOOD AID: WHY REFORM MATTERS,4/15/2015,"    I am glad that these entities that have so _x000D_
much to do with this program will have a chance. I know we _x000D_
tried to accommodate additional witnesses. But anyway, I am _x000D_
glad you made that statement._x000D_
    I wonder if Senator Coons would like to make an opening _x000D_
comment.",corker
AMERICAN FOOD AID: WHY REFORM MATTERS,4/15/2015,"    Thank you. And I think people should know, _x000D_
for the record, one of the reasons that we are having this _x000D_
hearing today is a commitment that was made to Senator Coons, _x000D_
as we closed out last year, that we would deal with this issue. _x000D_
So I thank him for his leadership._x000D_
    Our first witness is director Dina Esposito, as long as she _x000D_
is here, from the USAID Office of Food for Peace. Director _x000D_
Esposito manages the Food for Peace program, which responds to _x000D_
acute food insecurity by providing in-kind food aid locally and _x000D_
regionally procured food aid, food vouchers, and cash transfers _x000D_
to millions of people affected by conflict and natural _x000D_
disasters annually._x000D_
    In addition, it also supports interventions in critical _x000D_
areas such as nutrition, health, agriculture, and livelihood to _x000D_
address the underlying causes of poverty and hunger among the _x000D_
poorest of the poor with development food aid._x000D_
    Thank you for being here and sharing your thoughts. Please _x000D_
take however long you wish to share those thoughts. Then we _x000D_
will have questions. Thank you very much.",corker
AMERICAN FOOD AID: WHY REFORM MATTERS,4/15/2015,"    Thank you. Thank you very much for what you _x000D_
and your staff do on behalf of our country. It is deeply _x000D_
appreciated._x000D_
    Just to begin, what would be the implications for U.S. _x000D_
national security if you did not have the flexibility that you _x000D_
now have in Syria and in the region in delivering aid, and you _x000D_
had to rely solely on U.S. commodities?",corker
AMERICAN FOOD AID: WHY REFORM MATTERS,4/15/2015,"    So, critics of us not purchasing food created _x000D_
in the United States say that it increases the chance of using _x000D_
unsafe food._x000D_
    In the places where we have been able to use local and _x000D_
regional food, has this been a problem?",corker
AMERICAN FOOD AID: WHY REFORM MATTERS,4/15/2015,"    So if I hear you correctly, that allegation _x000D_
is a hoax.",corker
AMERICAN FOOD AID: WHY REFORM MATTERS,4/15/2015,"    Okay._x000D_
    Critics of reform also claim that cash-based programs _x000D_
transfer cash from the United States to corrupt governments, _x000D_
but we know that the aid is being provided directly to _x000D_
beneficiaries. So can you discuss this issue for us?",corker
AMERICAN FOOD AID: WHY REFORM MATTERS,4/15/2015,"    So generally speaking, that criticism is a _x000D_
hoax. [Laughter.]",corker
AMERICAN FOOD AID: WHY REFORM MATTERS,4/15/2015,"    I am sure there are examples, minor examples. _x000D_
But generally speaking, that is not the case.",corker
AMERICAN FOOD AID: WHY REFORM MATTERS,4/15/2015,"    So we are the only major developed country in _x000D_
the world that still provides the bulk of our food aid through _x000D_
domestic commodities.",corker
AMERICAN FOOD AID: WHY REFORM MATTERS,4/15/2015,"    I think that kind of speaks for itself._x000D_
    I just would like to know, does this make it more difficult _x000D_
for us to coordinate with other multilateral agencies and other _x000D_
donors in really hard-hit areas like Haiti, for example, in _x000D_
dealing with making sure that people have food when they need _x000D_
it?",corker
AMERICAN FOOD AID: WHY REFORM MATTERS,4/15/2015,"    So the other developed countries like us that _x000D_
care deeply about making sure that people have food, they have _x000D_
more flexibility. We are sort of locked in.",corker
AMERICAN FOOD AID: WHY REFORM MATTERS,4/15/2015,"    So as the perceived most innovative free _x000D_
nation in the world, we are really behind the rest of the world _x000D_
when it comes to feeding the poor. Is that correct?",corker
AMERICAN FOOD AID: WHY REFORM MATTERS,4/15/2015,"    Listen, thank you for being here, and I look _x000D_
forward to the questions from our distinguished ranking member.",corker
AMERICAN FOOD AID: WHY REFORM MATTERS,4/15/2015,"    Thank you, Senator._x000D_
    Senator Gardner.",corker
AMERICAN FOOD AID: WHY REFORM MATTERS,4/15/2015,"    Thank you._x000D_
    I know you were not feeling particularly well when you came _x000D_
in. I hope the response you got today makes you feel a little _x000D_
bit better. We, certainly, thank you for being here._x000D_
    I do want to make a comment, which may generate the need _x000D_
for a response from others, but it is not USAID's job to ensure _x000D_
that our military policy and sealift capacity is met, is it?",corker
AMERICAN FOOD AID: WHY REFORM MATTERS,4/15/2015,"    That is sort of a DOD problem, is it not?",corker
AMERICAN FOOD AID: WHY REFORM MATTERS,4/15/2015,"    I would just say, look, I realize we have _x000D_
some sensibilities that will have to be dealt with. I would _x000D_
hope that the reason Americans, whether they are in the _x000D_
agriculture business or the maritime business or whatever, or _x000D_
the NGO business, especially the NGO business, would support us _x000D_
making changes because other people will not starve._x000D_
    I would hope that people would support this because it is _x000D_
an important American value. And I hope that as we move through _x000D_
this, in spite of the fact that, let us face it, people make a _x000D_
living off U.S. programs, in some cases to the adversity of _x000D_
people who are starving, I would hope we would figure out a way _x000D_
to first prioritize the great work that you are doing and this _x000D_
American value that exists for this program. So thank you._x000D_
    I think there may be a response.",corker
AMERICAN FOOD AID: WHY REFORM MATTERS,4/15/2015,"    And, as you mentioned, coming in, I am sure, _x000D_
that based on what has happened over the last week, we, _x000D_
certainly, should be able to deal with this._x000D_
    I would say that one of the things that would hit a chord, _x000D_
I think with every American, is using even the same dollars _x000D_
that we are spending--the same dollars that we are spending--to _x000D_
reach millions more to make sure they are not starving. And _x000D_
with the passage of this legislation, we, certainly, could make _x000D_
that happen.",corker
AMERICAN FOOD AID: WHY REFORM MATTERS,4/15/2015,"    Very good. Thank you._x000D_
    Thank you. Goodbye. [Laughter.]_x000D_
    Okay, we will now turn to our witnesses on the second _x000D_
panel. Our first witness is Mr. David Ray, vice president for _x000D_
policy and advocacy at CARE USA. Mr. Ray has over 20 years of _x000D_
experience working at CARE USA. Founded in 1945, it is one of _x000D_
the largest and oldest humanitarian aid organizations focused _x000D_
on fighting global poverty._x000D_
    CARE USA is an important implementing partner of the Food _x000D_
for Peace program and was an early adopter of some of the food _x000D_
aid programs we are discussing today._x000D_
    I thank you for allowing my daughter to intern with you in _x000D_
Tanzania years ago. It had a huge impact on her life. I thank _x000D_
you._x000D_
    Our second witness is Dr. Vincent Smith, professor of _x000D_
economics at the Montana State University and visiting scholar _x000D_
at the American Enterprise Institute. Dr. Smith's research _x000D_
includes an examination of agricultural science policy, _x000D_
domestic and world commodity markets, risk management, and _x000D_
agricultural trade policy. He has authored nine books and _x000D_
monographs, and published over 100 articles on agriculture and _x000D_
other policy and economic issues._x000D_
    Our third witness is Dr. Stephanie Mercier, a senior policy _x000D_
adviser at the Farm Journal Foundation. Prior to that, Dr. _x000D_
Mercier--am I pronouncing it correctly?--was a chief economist _x000D_
at the Senate Agriculture Committee from 1997 to 2011. Thank _x000D_
you for your service here. She was involved in several reform _x000D_
efforts made to the Food for Peace program._x000D_
    With that, I will recognize Dr. Ray._x000D_
    Thank you all for being here. We look forward to your _x000D_
testimony and your assistance in helping us navigate these _x000D_
issues. Thank you.",corker
AMERICAN FOOD AID: WHY REFORM MATTERS,4/15/2015,"    Thank you very much._x000D_
    Dr. Smith.",corker
AMERICAN FOOD AID: WHY REFORM MATTERS,4/15/2015,"    Thank you, Doctor._x000D_
    Dr. Mercier.",corker
AMERICAN FOOD AID: WHY REFORM MATTERS,4/15/2015,"    Thank you all for your testimony. I think you _x000D_
have all been most helpful. There are not many Americans, I _x000D_
realize, who watch these kinds of panels, but this panel is _x000D_
selected jointly by Republicans and Democrats, and it is _x000D_
amazing to me that the message is exactly the same by the _x000D_
panelists._x000D_
    I want to ask a few questions and then make a statement, _x000D_
and then turn to our ranking member._x000D_
    Dr. Smith, it is my understanding, if I heard you _x000D_
correctly, that 70 percent to 75 percent of the ships moving _x000D_
food aid are not militarily useful. Is that correct?",corker
AMERICAN FOOD AID: WHY REFORM MATTERS,4/15/2015,"    It is my understanding that that number _x000D_
actually could be as much as 40 percent foreign-owned. Is that _x000D_
correct?",corker
AMERICAN FOOD AID: WHY REFORM MATTERS,4/15/2015,"    Yes. So to go down the same path we did with _x000D_
our former witness, first of all, food aid certainly is not _x000D_
designed for national security. But the fact that this actually _x000D_
has significant effect on our national security again is a _x000D_
total hoax. Is that correct? Let me say, mostly a hoax, okay? ",corker
AMERICAN FOOD AID: WHY REFORM MATTERS,4/15/2015,"    I have not seen House of Cards, but I _x000D_
understand they say those kinds of things.",corker
AMERICAN FOOD AID: WHY REFORM MATTERS,4/15/2015,"    Well, based on the amount of money we are _x000D_
blowing, I think you said we are spending more on shipping than _x000D_
on food.",corker
AMERICAN FOOD AID: WHY REFORM MATTERS,4/15/2015,"    These 450 folks could be sent to Tahiti and _x000D_
supported for the rest of their lives better than any of us, _x000D_
and we would still be saving huge amounts of money. So I think _x000D_
we can figure out a way to deal with that.",corker
AMERICAN FOOD AID: WHY REFORM MATTERS,4/15/2015,"    Very good._x000D_
    This is for everybody. In recent years, some countries in _x000D_
Africa have received U.S. food aid in the form of U.S. _x000D_
commodities for several years in a row. Do you think this has _x000D_
hampered some recipients' ability to recover from the shock of _x000D_
the initial disaster that they faced? This is for all of you, _x000D_
briefly.",corker
AMERICAN FOOD AID: WHY REFORM MATTERS,4/15/2015,"    Listen, again, I want to thank Senator _x000D_
Cardin, Senator Coons, Senator Kaine, Senator Gardner, who was _x000D_
here earlier. I think that we have an opportunity here to work _x000D_
together to solve this problem._x000D_
    I will say that I wish every American could have seen this _x000D_
testimony today. What is happening in food aid in our Nation, _x000D_
for a few special interests that benefit only marginally, is a _x000D_
national disgrace--a national disgrace. I am going to do _x000D_
everything in my power to make sure that every American I come _x000D_
in contact with is aware that a few special interests that have _x000D_
negligible impact, really, on them, but they have this Nation _x000D_
in their grip, people are dying and starving--dying and _x000D_
starving--because of this national disgrace of corporate _x000D_
welfare that is totally unnecessary, totally unnecessary to the _x000D_
beneficiaries._x000D_
    So I thank you for being here. I look forward to working _x000D_
constructively with people on this committee, as we have so _x000D_
much recently, to ensure that our focus here is on making sure _x000D_
that people who are hungry have the basic food elements that _x000D_
they need to survive._x000D_
    Thank you very much._x000D_
    Ranking Member Cardin.",corker
AMERICAN FOOD AID: WHY REFORM MATTERS,4/15/2015,"    Thank you. Thank you so much for your input _x000D_
and just tremendous successes we have had recently._x000D_
    Senator Perdue.",corker
AMERICAN FOOD AID: WHY REFORM MATTERS,4/15/2015,    Senator Coons.,corker
AMERICAN FOOD AID: WHY REFORM MATTERS,4/15/2015,"    Senator Coons, if I could, could I add a _x000D_
minute or 2 to your time, and for people who are just watching _x000D_
this, ask your witness to explain how monetization works?",corker
AMERICAN FOOD AID: WHY REFORM MATTERS,4/15/2015,"    I think it would be helpful to everyone and _x000D_
help build a case for what you are trying to----",corker
AMERICAN FOOD AID: WHY REFORM MATTERS,4/15/2015,    Sure.,corker
AMERICAN FOOD AID: WHY REFORM MATTERS,4/15/2015,"    Thank you._x000D_
    Senator Coons, thank you for asking the great question _x000D_
about what if food aid were focused on food aid. That would be _x000D_
a good thing._x000D_
    I would just say, editorially, I doubt there are other aid _x000D_
programs that we participate in that have such a small amount _x000D_
of corporate welfare interests that cause us to waste as much _x000D_
money. I just cannot believe 450 sailors are generating the _x000D_
support for this aid program. And I just hope that we will _x000D_
figure out a way to deal appropriately with it._x000D_
    Senator Shaheen.",corker
AMERICAN FOOD AID: WHY REFORM MATTERS,4/15/2015,    Sure.,corker
AMERICAN FOOD AID: WHY REFORM MATTERS,4/15/2015,"    Anybody else have any closing questions or _x000D_
comments?_x000D_
    I want to thank all of you for being here. I think this _x000D_
testimony has been outstanding, as has the hearing._x000D_
    My guess is, to follow up on Dr. Smith's comments, I would _x000D_
bet that while there are associations and entities that lobby _x000D_
on behalf of various industries, if you will, I would bet if _x000D_
the members themselves were aware of the negative impact this _x000D_
lobbying was having on people who were starving, I do not _x000D_
believe there would be as much lobbying taking place._x000D_
    I do not think they have any idea that there are paid _x000D_
lobbyists up here that are causing people around the world to _x000D_
starve. I just have greater faith in the American people, _x000D_
greater faith that if these groups they are representing, if _x000D_
the individuals actually knew what was happening, they would be _x000D_
ashamed and they would cause it to stop._x000D_
    So I thank you all for being here._x000D_
    Mr. Ray, thank you for the example your organization is _x000D_
setting._x000D_
    Dr. Mercier, thank you for all your efforts through the _x000D_
years to cause reforms to happen._x000D_
    The meeting will be adjourned, although for questions, the _x000D_
record will remain open through the end of the day Friday._x000D_
    Thank you all for being here.",corker
THE ADMINISTRATION'S STRATEGY IN AFGHANISTAN,12/16/2015,"    The Foreign Relations Committee will come to _x000D_
order. We want to thank our witnesses for being here and, _x000D_
certainly, all of our committee members._x000D_
    I think in lieu of reading my normal opening statement, I _x000D_
just want to make a general statement, and that is that _x000D_
yesterday we had a classified briefing. What we hear in _x000D_
classified briefings about the direction and the signals and _x000D_
all of the things that are occurring in Afghanistan directly _x000D_
contradict some of the rosy public statements that are made _x000D_
about what is happening within the country._x000D_
    I think it is actually alarming to go to a classified _x000D_
session and then to hear reports about those discussions in the _x000D_
Armed Services Committee itself._x000D_
    So with that backdrop, I just want to say to each of you, _x000D_
all of us obviously want our Nation to be successful in its _x000D_
efforts in Afghanistan. I know there has been a debate about _x000D_
the number of troops on the ground. There have been some _x000D_
arbitrary numbers that have been thrown out. I know today we _x000D_
have 9,800 troops there. Yet, from what I can tell yet, we are _x000D_
continuing to lose territory, lose momentum. The status in _x000D_
Afghanistan is today that we are moving in a very negative _x000D_
direction on the ground._x000D_
    So obviously, that is concerning. We know that President _x000D_
Ghani has a vast amount of experience, even though he is _x000D_
somewhat of a technocrat. He knows there are issues that need _x000D_
to be dealt with appropriately within the country._x000D_
    But when you look at all of these security issues that are _x000D_
being dealt with, certainly it takes away from his ability to _x000D_
implement those._x000D_
    So we are concerned about security. I think we are _x000D_
concerned about any type of reconciliation that is taking _x000D_
place. We understand the concerns that exist relative to _x000D_
Pakistan. And let us face it, it is them, to a degree, hedging _x000D_
their bets. But from the outside, as you watch what is _x000D_
happening there, the Taliban is gaining ground, and that is _x000D_
just a fact._x000D_
    So I hope this hearing today, which will obviously be the _x000D_
first public hearing we have had in some time on this topic, _x000D_
will help us be illuminated._x000D_
    We thank both of you very, very much for your service and _x000D_
for being here. And we thank you for your willingness to help _x000D_
us with understanding as to what is actually happening there on _x000D_
the ground._x000D_
    With that, I will turn to Senator Cardin.",corker
THE ADMINISTRATION'S STRATEGY IN AFGHANISTAN,12/16/2015,"    Thank you, sir._x000D_
    We will now turn to our witnesses on the first panel. We _x000D_
will hear from two administration witnesses representing the _x000D_
State Department and USAID whose portfolios include both _x000D_
Afghanistan and Pakistan. Our second panel includes three _x000D_
informed experts on Afghanistan and the region. We thank them _x000D_
for being here._x000D_
    So our first witness is the respected Ambassador Richard _x000D_
Olson, the United States Special Representative for Afghanistan _x000D_
and Pakistan, and recently returned as our Ambassador from _x000D_
Islamabad._x000D_
    We thank you very much for a career in public service and _x000D_
Foreign Service, and for being here today._x000D_
    Our second witness is Donald L. Sampler Jr., assistant to _x000D_
the administrator for Pakistan and Afghanistan for USAID. We _x000D_
thank you for what you and your cohorts do around the world to _x000D_
further U.S. interests._x000D_
    So with that, Ambassador Olson, if you would begin, we _x000D_
would appreciate it._x000D_
    I would just say, as a courtesy to my fellow panelists _x000D_
here, the deadline on a couple of issues is 21 minutes relative _x000D_
to the other thing we are working on. I may step in and out a _x000D_
little bit and miss a little bit, not out of disrespect. Thank _x000D_
you.",corker
THE ADMINISTRATION'S STRATEGY IN AFGHANISTAN,12/16/2015,"    Thank you._x000D_
    Mr. Sampler.",corker
THE ADMINISTRATION'S STRATEGY IN AFGHANISTAN,12/16/2015,"    Thank you very much for that testimony. I am _x000D_
going to do some interaction along the way and turn at present _x000D_
to Senator Cardin for questions.",corker
THE ADMINISTRATION'S STRATEGY IN AFGHANISTAN,12/16/2015,    Senator Perdue?,corker
THE ADMINISTRATION'S STRATEGY IN AFGHANISTAN,12/16/2015,    Senator Barrasso?,corker
THE ADMINISTRATION'S STRATEGY IN AFGHANISTAN,12/16/2015,    Senator Kaine?,corker
THE ADMINISTRATION'S STRATEGY IN AFGHANISTAN,12/16/2015,"    Thank you._x000D_
    Senator Udall?",corker
THE ADMINISTRATION'S STRATEGY IN AFGHANISTAN,12/16/2015,"    Thank you._x000D_
    Senator Isakson?",corker
