title,date,text,name
IRAN NUCLEAR NEGOTIATIONS: STATUS OF TALKS AND THE ROLE OF CONGRESS,1/21/2015,"    So I do not understand. You know, you have _x000D_
talked about the sanctions piece. I have talked to our French _x000D_
negotiators directly. I talked to our U.K. negotiators _x000D_
directly. I talked to Prime Minister Cameron directly. I talked _x000D_
last night at length in my office to the negotiator on behalf _x000D_
of the European Union._x000D_
    I was in Israel this weekend, talked to the intelligence _x000D_
agencies there. I talked to the Prime Minister. I have met no _x000D_
one who believes that us weighing in would do anything to _x000D_
destabilize these negotiations. As a matter of fact, many have _x000D_
said knowing that Congress has to approve the deal would be a _x000D_
great backstop for the administration to strengthen their hand, _x000D_
just as the negotiators in Iran continue to refer to the _x000D_
hardliners and to Khamenei, the spiritual--the leader, the _x000D_
Supreme Leader._x000D_
    And I do not understand why--I mean, again, we could just _x000D_
do away. We were generous in the passage of these sanctions _x000D_
giving you a security waiver. We could actually just do away _x000D_
with that, and you would have to come to us._x000D_
    So why would you oppose Congress weighing in on an issue of _x000D_
this importance? And is it hollow for you to say that you want _x000D_
this to pass muster or Secretary Kerry to say this should pass _x000D_
muster and yet continue to stiff-arm, every effort to be pushed _x000D_
away. Congress, who represents more fully this Nation than the _x000D_
negotiators, not having the ability to weigh in on this deal.",corker
IRAN NUCLEAR NEGOTIATIONS: STATUS OF TALKS AND THE ROLE OF CONGRESS,1/21/2015,"    Does the Iranian Parliament not need to weigh _x000D_
in on some of the agreements that Iran is putting in place?",corker
IRAN NUCLEAR NEGOTIATIONS: STATUS OF TALKS AND THE ROLE OF CONGRESS,1/21/2015,"    Okay. So, so on one hand, we would negotiate _x000D_
in such a way as we know that the Supreme Leader could try to _x000D_
influence the Iranian Parliament to go against what they may _x000D_
agree to, and yet you would say here it is not important for _x000D_
the greatest deliberative body in the world to be able to weigh _x000D_
in on this issue._x000D_
    Matter of fact, the body that actually put together this _x000D_
regime that the entire international community is building _x000D_
these negotiations off of.",corker
IRAN NUCLEAR NEGOTIATIONS: STATUS OF TALKS AND THE ROLE OF CONGRESS,1/21/2015,"    Well, my time is up. But I would support a _x000D_
series of votes, if that is what you are saying. I would _x000D_
support an initial vote on the deal as a whole, and I think _x000D_
Congress would be more than glad to work with you on a series _x000D_
of votes as you move along._x000D_
    I will say, Mr. Blinken, after having served on this _x000D_
committee, and after you all spending incredible amounts of _x000D_
time dissing the sanctions regime, which we are not focused on, _x000D_
we are trying to find a constructive way for Congress to play _x000D_
its rightful role in these negotiations. And I am very _x000D_
disappointed that, in essence, what the administration is _x000D_
saying is we really do not want--even though Congress put us in _x000D_
this place, we really do not want Congress to play a role in _x000D_
one of the most important geopolitical agreements that may take _x000D_
place during this administration._x000D_
    With that, Ranking Member Menendez.",corker
IRAN NUCLEAR NEGOTIATIONS: STATUS OF TALKS AND THE ROLE OF CONGRESS,1/21/2015,"    Senator Menendez, I appreciate your _x000D_
willingness to look at some legislation that would give us an _x000D_
up-or-down vote on this issue. And I would say in response to _x000D_
Mr. Blinken's comments, I have talked with our international _x000D_
partners. Not a single one of them has any concerns whatsoever _x000D_
with Congress having the ability to vote up or down on a final _x000D_
deal._x000D_
    Many of them believe it strengthens our hand. So, with _x000D_
that, Mr. Gardner--Senator Gardner.",corker
IRAN NUCLEAR NEGOTIATIONS: STATUS OF TALKS AND THE ROLE OF CONGRESS,1/21/2015,"    Thank you, and we would certainly love input, _x000D_
love engagement like you are doing with Iran. We would like the _x000D_
same respect. So if you have some details you would like to _x000D_
talk with us about, that would be fine._x000D_
    Senator Markey.",corker
IRAN NUCLEAR NEGOTIATIONS: STATUS OF TALKS AND THE ROLE OF CONGRESS,1/21/2015,"    Thank you._x000D_
    Senator Barrasso.",corker
IRAN NUCLEAR NEGOTIATIONS: STATUS OF TALKS AND THE ROLE OF CONGRESS,1/21/2015,"    Thank you. I understand that Senator Purdue _x000D_
has deferred to Senator Johnson for time reasons._x000D_
    I would say to the audience we very much appreciate you _x000D_
being here and listening. We do not appreciate being involved _x000D_
in the dialogue. So if you could keep comments to yourself._x000D_
    And with that, I am sorry, I am going to the wrong side _x000D_
here, I guess, Senator Murphy.",corker
IRAN NUCLEAR NEGOTIATIONS: STATUS OF TALKS AND THE ROLE OF CONGRESS,1/21/2015,    Senator Johnson.,corker
IRAN NUCLEAR NEGOTIATIONS: STATUS OF TALKS AND THE ROLE OF CONGRESS,1/21/2015,"    Thank you._x000D_
    Senator Kaine.",corker
IRAN NUCLEAR NEGOTIATIONS: STATUS OF TALKS AND THE ROLE OF CONGRESS,1/21/2015,"    Very good. Thank you._x000D_
    Senator Purdue.",corker
IRAN NUCLEAR NEGOTIATIONS: STATUS OF TALKS AND THE ROLE OF CONGRESS,1/21/2015,"    Thank you. Thank you very much._x000D_
    Senator Shaheen.",corker
IRAN NUCLEAR NEGOTIATIONS: STATUS OF TALKS AND THE ROLE OF CONGRESS,1/21/2015,"    Thank you._x000D_
    Senator Flake.",corker
IRAN NUCLEAR NEGOTIATIONS: STATUS OF TALKS AND THE ROLE OF CONGRESS,1/21/2015,"    Thank you, Senator._x000D_
    Senator Coons.",corker
IRAN NUCLEAR NEGOTIATIONS: STATUS OF TALKS AND THE ROLE OF CONGRESS,1/21/2015,    Sure.,corker
IRAN NUCLEAR NEGOTIATIONS: STATUS OF TALKS AND THE ROLE OF CONGRESS,1/21/2015,"    Thank you._x000D_
    Senator Paul.",corker
IRAN NUCLEAR NEGOTIATIONS: STATUS OF TALKS AND THE ROLE OF CONGRESS,1/21/2015,"    Thank you, Senator._x000D_
    I will say consultations up until this point have been a _x000D_
phone call in the morning that something is happening. And, _x000D_
generally speaking, while we are receiving that phone call, we _x000D_
are reading the New York Times or someone else's report._x000D_
    So I do want to associate myself with his comments, _x000D_
generally speaking, and do hope we will come to some accord._x000D_
    Senator Udall.",corker
IRAN NUCLEAR NEGOTIATIONS: STATUS OF TALKS AND THE ROLE OF CONGRESS,1/21/2015,"    Thank you, sir._x000D_
    Senator Rubio.",corker
IRAN NUCLEAR NEGOTIATIONS: STATUS OF TALKS AND THE ROLE OF CONGRESS,1/21/2015,"    If I could interject, I assure you that I was _x000D_
not consulted.",corker
IRAN NUCLEAR NEGOTIATIONS: STATUS OF TALKS AND THE ROLE OF CONGRESS,1/21/2015,"    Thank you, Senator._x000D_
    If I could say, again, this committee is not proposing _x000D_
anything that breaks us apart from the international partners _x000D_
that we have. I know you keep referring to that. I know that is _x000D_
a red herring that keeps being thrown out. But we are asking, _x000D_
many of us, for consultation and a vote on the deal that we _x000D_
have been so involved in making happen._x000D_
    Senator Risch.",corker
IRAN NUCLEAR NEGOTIATIONS: STATUS OF TALKS AND THE ROLE OF CONGRESS,1/21/2015,"    Thank you, Senator._x000D_
    Senator Menendez.",corker
IRAN NUCLEAR NEGOTIATIONS: STATUS OF TALKS AND THE ROLE OF CONGRESS,1/21/2015,"    Thank you, sir. Again, thanks for all your _x000D_
efforts to bring us to this point. I look forward, over the _x000D_
next few days, to see if there is some common ground to address _x000D_
the consultation and Congress' role, ultimately, in this._x000D_
    I do want to say one thing. I know there have been a lot of _x000D_
discussions about Bibi Netanyahu's whatever you might have _x000D_
called his prop at the U.N. I think it is fair to note that _x000D_
with the additional research and development that Iran has _x000D_
done, and they are moving way up the food chain from the _x000D_
standpoint of the centrifuge development, they can move so much _x000D_
more quickly from 0 to 90 percent now that that is almost an _x000D_
old adage. I think you all are very aware of that._x000D_
    And I think that is the concern that we have. It is on the _x000D_
research and development component, and the things they are _x000D_
doing to move rapidly--rapidly--toward being able to get to 90 _x000D_
percent very, very quickly._x000D_
    But let me just give a few closing comments. I, too, want _x000D_
you to be successful. I wake up every day wanting our Nation to _x000D_
be successful in every endeavor. And I think I have shown to _x000D_
this administration my desire to work toward common ground and _x000D_
to try to solve problems. So I want these negotiations to be _x000D_
successful._x000D_
    And I had one of the most impactful meetings, along with a _x000D_
number of people here on the committee, in Israel just in the _x000D_
last couple days._x000D_
    But I think the concerns are, as you look back over the _x000D_
history over the last 10 years that some people have alluded _x000D_
to, Iran has stayed here and the P5 began here, and as the _x000D_
negotiations have progressed, what has happened is the P5 and _x000D_
us, being the major driving force, have continued to move _x000D_
toward their position._x000D_
    And I would just argue that, again, having Congress as a _x000D_
backstop as you enter these final steps, having Congress as a _x000D_
backstop, someone that you do, in fact, not only have to _x000D_
consult with but you have to seek their approval, would be _x000D_
somewhat of an anchor to keep us from continuing to move toward _x000D_
their position._x000D_
    I think it would be very difficult for you to say that _x000D_
there has not been a continual movement toward their position. _x000D_
I mean, you look at where we began with the U.N. security _x000D_
resolutions, you look at where we began with us potentially _x000D_
agreeing to them having enough centrifuges to serve their, _x000D_
quote, ``practical needs,'' which, as I understand it, every _x000D_
scientist has said was about 500 centrifuges, and I think you _x000D_
would tell me today we have moved way beyond that._x000D_
    So I would just say to you, Congress can be an excellent _x000D_
backstop to you as you are moving down the road._x000D_
    I thought Senator Kaine probably expressed it better than _x000D_
any of us here. When we entered into these agreements that _x000D_
Senator Menendez was so much a part of, meaning the sanctions, _x000D_
I do not think anyone in giving you the national security _x000D_
waivers ever thought the President was going to suspend them, _x000D_
in all likelihood, until the end of his term. I do not think _x000D_
anybody ever thought that._x000D_
    So the fact that we know that if you do that, the entire _x000D_
sanctions regime falls apart. I have tremendous respect for _x000D_
Secretary Cohen. But the fact is, these take a long time to put _x000D_
together. And so, again, to have to come to us on the front end _x000D_
of a deal, before you dismantle the entire regime, to me, is an _x000D_
incredibly important step that I hope you with will consult _x000D_
with us on._x000D_
    We laid out a proposal. We hope you will consult. And we _x000D_
hope you will come to an agreement that takes into account some _x000D_
of the nuance that you pointed out earlier, that you would like _x000D_
us to discuss._x000D_
    But just stiff-arming, and saying after the role that we _x000D_
have played, to basically put the international community at _x000D_
the table just to stiff-arm, say, ``No, we really do not want _x000D_
you to play a role. You want you just to trust us,'' is totally _x000D_
unacceptable, from my standpoint._x000D_
    So look, the Supreme Leader, we keep referring to him._x000D_
    And apparently as we negotiate, we seem to be more _x000D_
concerned about the Supreme lLader's position than anyone _x000D_
else's. I just want to lay out one thing. The Supreme Leader _x000D_
has said publicly that one of his major concerns is that Iran _x000D_
enters into an agreement and somehow, over time, Congress _x000D_
changes its mind._x000D_
    We have a presidential race that is coming up. I assure you _x000D_
that the Iran component will be a major part of the next _x000D_
Presidential race. I believe that to be the case. And so, since _x000D_
there is so much concern about the supreme leader and him _x000D_
walking away or doing whatever, I would just say that Congress' _x000D_
approval of a deal to me would be reassuring that whatever deal _x000D_
that you have done will stand the test of time._x000D_
    So I would encourage you to sit down, to walk through with _x000D_
us some of the concerns you have about timing. But I would say _x000D_
that general movement today is toward Congress playing a role. _x000D_
I think, again, just stiff-arming does not take us to a place _x000D_
that probably meets the test that both of us need to meet. And _x000D_
I would encourage you again to sit down and talk with us._x000D_
    We thank you for being here today. We thank you both, in _x000D_
spite of our concerns, for your service to our country._x000D_
    Let me just give some formalities._x000D_
    For the information of the members, the record will remain _x000D_
open until the close of business Friday, including for members _x000D_
to submit questions for the record._x000D_
    We ask the witnesses to respond as promptly as possible. _x000D_
Your responses will also be made a part of the record.",corker
IRAN NUCLEAR NEGOTIATIONS: STATUS OF TALKS AND THE ROLE OF CONGRESS,1/21/2015,"    With the thanks of the committee, this _x000D_
hearing is now adjourned. Thank you.",corker
SAFEGUARDING AMERICAN INTERESTS IN THE EAST AND SOUTH CHINA SEAS,5/13/2015,"    I will call the meeting to order._x000D_
    In June 2014, this committee held a hearing on the future _x000D_
of United States-China relations. At that time, I raised _x000D_
concerns over the lack of a coherent China policy, including _x000D_
the absence of sustained high-level engagement from senior _x000D_
administration officials despite the consistent rhetoric that _x000D_
the United States-China relationship is one of the most _x000D_
consequential relationships for United States political, _x000D_
security, and economic interests._x000D_
    I left that hearing scratching my head. And after nearly a _x000D_
year later, I am even more troubled._x000D_
    Yesterday, this committee convened to discuss a new nuclear _x000D_
cooperation agreement with China. We heard troubling _x000D_
information about the Chinese intent to divert U.S. technology _x000D_
for military purposes. In addition, we were told that China has _x000D_
not taken adequate steps to end proliferation of sensitive _x000D_
technologies by Chinese entities and individuals to countries _x000D_
of concern, including Iran and North Korea._x000D_
    Despite these concerns, administration officials testified _x000D_
in support of a new nuclear cooperation agreement, noting the _x000D_
mutual benefits for the bilateral relationship, including _x000D_
commercial interests._x000D_
    This afternoon, the absence of a genuine China policy will _x000D_
be on display as we discuss the situation in the East and South _x000D_
China Seas where China continues to engage in provocative and _x000D_
destabilizing behavior._x000D_
    As you can see from these pictures on display, China _x000D_
continues to engage in land reclamation and construction _x000D_
activities, the scope and scale of which are unprecedented in _x000D_
the South China Sea._x000D_
    Figure 1 shows Fiery Cross Reef, in the Spratly Islands, as _x000D_
it appeared on May 2014. Figure 2 shows that same reef less _x000D_
than a year later with over 1,300 meters of runway already _x000D_
completed and analyst assessments that it could be expanded up _x000D_
to 3,100 meters._x000D_
    Clearly, these activities are not simply limited to _x000D_
dredging and piling sand. China is deliberately constructing _x000D_
facilities on these reefs and islets that could be used for _x000D_
military purposes, including airstrips and ports, as you can _x000D_
see in Figure 3, which shows Fiery Cross Reef just a few weeks _x000D_
ago. Again, in Figure 4, you can see large, multistory _x000D_
buildings with additional military capabilities._x000D_
    Moreover, Beijing has publicly confirmed that there are _x000D_
military uses for these facilities, with China's foreign _x000D_
ministry spokesperson stating on March 9 that this construction _x000D_
was undertaken in part to satisfy the necessary military _x000D_
defense needs._x000D_
    It is worth noting that all of these activities are _x000D_
occurring against the backdrop of China's massive military _x000D_
buildup, including significant investments in the antiaccess/_x000D_
area-denial capabilities._x000D_
    Most China watchers believe that Beijing does not want to _x000D_
start a conflict in either the East or South China Seas. Yet _x000D_
many of the same experts concede that Beijing may do everything _x000D_
short of engaging in a military conflict to solidify its _x000D_
claims._x000D_
    That is why I recently joined Senators McCain, Reed, and _x000D_
Menendez in a bipartisan letter to Secretary Kerry and _x000D_
Secretary Carter to highlight our growing concerns with China's _x000D_
efforts to alter the status quo through ongoing land _x000D_
reclamation and construction activities in the South China Sea._x000D_
    According to the most recent statistics, some $5 trillion _x000D_
in global ship-borne trade passes through the South China Sea _x000D_
annually. As you can see from Figure 5, all of the major trade _x000D_
routes through the South China Sea pass near disputed areas in _x000D_
both the Spratlys and Paracels. And you can see those circled _x000D_
on this display._x000D_
    I hope we will be able to have a thoughtful discussion _x000D_
today that outlines U.S. interests in the Indo-Pacific and how _x000D_
Chinese actions in the East and South China Seas affect, if at _x000D_
all, the balance of the United States-China bilateral _x000D_
relationship._x000D_
    In addition, I hope we will explore various options _x000D_
available to the United States to ensure that the situation in _x000D_
the East and South China Seas does not result in a conflict. I _x000D_
support efforts to constructively engage with China, including _x000D_
strengthening economic and trade ties._x000D_
    Yet simply defaulting to an approach that maintains _x000D_
cooperation while managing differences with China is not a _x000D_
successful formula, particularly when such management cedes _x000D_
United States influence and places American interests at risk _x000D_
in the Indo-Pacific._x000D_
    I am concerned that absent a course correction, _x000D_
specifically high-level and dedicated engagement from the _x000D_
United States Government to articulate a coherent China policy, _x000D_
our credibility will continue to suffer throughout the region, _x000D_
whether it is in regards to nonproliferation or preserving _x000D_
freedom of navigation in the East and South China Seas._x000D_
    I look forward to hearing from the witnesses and thank them _x000D_
for being here._x000D_
    And now I look forward to hearing from our distinguished _x000D_
ranking member.",corker
SAFEGUARDING AMERICAN INTERESTS IN THE EAST AND SOUTH CHINA SEAS,5/13/2015,"    With the bilateral relationship that we have _x000D_
with China and the economic interests that we have there, does _x000D_
that stifle us from being a little bit more engaged directly in _x000D_
this issue?",corker
