title,date,text,name
THE FIGHT AGAINST ISIS: BUILDING THE COALITION AND ENSURING MILITARY EFFECTIVENESS,2/25/2015,"    Okay. So it is an interesting place that we _x000D_
find ourselves where 6 months after conflicts have begun, a new _x000D_
AUMF is being offered. And I know that in order to pursue one _x000D_
properly through Congress, it is standard process to submit _x000D_
one, which I appreciate. But it is an interesting place that _x000D_
those authorities already exist._x000D_
    The train and equip program that you have been able to _x000D_
negotiate, many concerns have been raised about the fact that _x000D_
most of the free Syrian opposition initially was targeting _x000D_
Assad. That was the reason for their being. Now we are _x000D_
organizing these against ISIS, and my understanding is we are _x000D_
going against an entirely different recruitment group to do _x000D_
that. Are we finding that to be an easy recruitment process?",corker
THE FIGHT AGAINST ISIS: BUILDING THE COALITION AND ENSURING MILITARY EFFECTIVENESS,2/25/2015,"    So my sense is there are, based on my _x000D_
experiences last week, there are larger groups of people that _x000D_
are willing to go against ISIS initially in this train and _x000D_
equip than some initially thought. Is that correct?",corker
THE FIGHT AGAINST ISIS: BUILDING THE COALITION AND ENSURING MILITARY EFFECTIVENESS,2/25/2015,"    So let me ask you this question. One of the _x000D_
big moral dilemmas I think is that as we train and equip these _x000D_
folks, we know that Assad is, in fact, barrel bombing other _x000D_
members of the Free Syrian Army today. I know that is a loose _x000D_
description of who it is that is opposing him. But my _x000D_
understanding is there have been significant discussions with _x000D_
Turkey over an air exclusion zone in the northwestern Aleppo _x000D_
area and a no-fly zone along the border. And that has been the _x000D_
issue that has hindered them actually getting more involved in _x000D_
the conflict even though they are working with us more fully _x000D_
than they have in multiple areas, some of which I will not _x000D_
mention here. That has been the issue that has kept them from _x000D_
actually getting more involved._x000D_
    It is also my understanding that that decision, the _x000D_
decision to do that, is at the President's desk. It is at the _x000D_
White House, and he has not made a decision yet as to whether _x000D_
to engage. Can you update us on that or tell us the effect of _x000D_
that decision not being made on Turkey getting more involved in _x000D_
the conflict, and helping us with those ground operations you _x000D_
were talking about earlier?",corker
THE FIGHT AGAINST ISIS: BUILDING THE COALITION AND ENSURING MILITARY EFFECTIVENESS,2/25/2015,"    But it is fair to say that there are some _x000D_
significant decisions that our government needs to make _x000D_
relative to those protections. And if they are made, could _x000D_
break a little bit of a logjam relative to greater involvement _x000D_
by Turkey. That would be a fair assessment. Is that correct?",corker
THE FIGHT AGAINST ISIS: BUILDING THE COALITION AND ENSURING MILITARY EFFECTIVENESS,2/25/2015,    That is right.,corker
THE FIGHT AGAINST ISIS: BUILDING THE COALITION AND ENSURING MILITARY EFFECTIVENESS,2/25/2015,"    And one final question, and then I will stop _x000D_
and turn it over to Senator Menendez. In the event that we _x000D_
needed to protect those that we are training and equipping and _x000D_
other members of the Free Syrian Army, in the event we needed _x000D_
to protect them against Assad barrel bombing them, do you _x000D_
believe that is something that needs an additional authority _x000D_
other than what is now being requested?",corker
THE FIGHT AGAINST ISIS: BUILDING THE COALITION AND ENSURING MILITARY EFFECTIVENESS,2/25/2015,"    You would want to make sure that we knew that _x000D_
that type of authorization was a part of anything we may do.",corker
THE FIGHT AGAINST ISIS: BUILDING THE COALITION AND ENSURING MILITARY EFFECTIVENESS,2/25/2015,    Senator Menendez.,corker
THE FIGHT AGAINST ISIS: BUILDING THE COALITION AND ENSURING MILITARY EFFECTIVENESS,2/25/2015,    Senator Johnson.,corker
THE FIGHT AGAINST ISIS: BUILDING THE COALITION AND ENSURING MILITARY EFFECTIVENESS,2/25/2015,"    Thank you._x000D_
    Senator Cardin.",corker
THE FIGHT AGAINST ISIS: BUILDING THE COALITION AND ENSURING MILITARY EFFECTIVENESS,2/25/2015,"    Thank you, sir._x000D_
    Senator Paul.",corker
THE FIGHT AGAINST ISIS: BUILDING THE COALITION AND ENSURING MILITARY EFFECTIVENESS,2/25/2015,    Senator Markey.,corker
THE FIGHT AGAINST ISIS: BUILDING THE COALITION AND ENSURING MILITARY EFFECTIVENESS,2/25/2015,"    Thank you._x000D_
    Senator Isakson.",corker
THE FIGHT AGAINST ISIS: BUILDING THE COALITION AND ENSURING MILITARY EFFECTIVENESS,2/25/2015,"    Thank you._x000D_
    Senator Boxer.",corker
THE FIGHT AGAINST ISIS: BUILDING THE COALITION AND ENSURING MILITARY EFFECTIVENESS,2/25/2015,"    Thank you._x000D_
    Senator Rubio.",corker
THE FIGHT AGAINST ISIS: BUILDING THE COALITION AND ENSURING MILITARY EFFECTIVENESS,2/25/2015,"    Thank you._x000D_
    Senator Kaine.",corker
THE FIGHT AGAINST ISIS: BUILDING THE COALITION AND ENSURING MILITARY EFFECTIVENESS,2/25/2015,"    Thank you, Senator. Senator Kaine I know had _x000D_
a followup.",corker
THE FIGHT AGAINST ISIS: BUILDING THE COALITION AND ENSURING MILITARY EFFECTIVENESS,2/25/2015,"    And that would be in the form of some type of _x000D_
no-fly zone----",corker
THE FIGHT AGAINST ISIS: BUILDING THE COALITION AND ENSURING MILITARY EFFECTIVENESS,2/25/2015,"    Very good. Well, General, I know you have got _x000D_
a hard stop in 20 minutes, and I think we have--you have _x000D_
certainly helped us in the way that we wanted you to help us. _x000D_
We appreciate your testimony._x000D_
    I would have one question, and that is you, in response to _x000D_
Senator Flake, talked about the need for Congress to be behind _x000D_
the effort that is taking place with ISIL. There have been _x000D_
differing discussions about the length of time from an AUMF _x000D_
standpoint. And is there anything about the timeframe--I know _x000D_
the President has asked for three--whether it is longer, _x000D_
shorter? Is there anything about that that you think matters at _x000D_
all relative to those that you are talking about appealing to _x000D_
our enemies and allies together?",corker
THE FIGHT AGAINST ISIS: BUILDING THE COALITION AND ENSURING MILITARY EFFECTIVENESS,2/25/2015,"    And if it was shorter than that, it would _x000D_
trouble you either.",corker
THE FIGHT AGAINST ISIS: BUILDING THE COALITION AND ENSURING MILITARY EFFECTIVENESS,2/25/2015,"    No, no, no, it would not trouble us either. _x000D_
Thank you. Does the length of time really particularly matter _x000D_
to you from the standpoint of the allies and those that we are _x000D_
defeating, or is it just more Congress getting behind the _x000D_
effort in a bipartisan way?",corker
THE FIGHT AGAINST ISIS: BUILDING THE COALITION AND ENSURING MILITARY EFFECTIVENESS,2/25/2015,"    Yes. Well, listen, I called you over the _x000D_
weekend when I knew you were on your way to Kuwait. I know you _x000D_
are your way to CENTCOM now. I think you can tell by the _x000D_
respect that everyone has shown you today we all view you as _x000D_
someone who is an outstanding public servant. We appreciate the _x000D_
way you have gone about your work._x000D_
    I know it is difficult. I know that decisions do not always _x000D_
get made in the manner or in the timeframe that someone like _x000D_
you that wants to seek this--get this done in the appropriate _x000D_
way. But I think your demeanor, the way you talk with all of us _x000D_
is certainly very, very well received. We wish you well in what _x000D_
you are doing, and hope you will be before us again soon to _x000D_
update us.",corker
THE FIGHT AGAINST ISIS: BUILDING THE COALITION AND ENSURING MILITARY EFFECTIVENESS,2/25/2015,    Thank you.,corker
THE FIGHT AGAINST ISIS: BUILDING THE COALITION AND ENSURING MILITARY EFFECTIVENESS,2/25/2015,    Thank you.,corker
THE FIGHT AGAINST ISIS: BUILDING THE COALITION AND ENSURING MILITARY EFFECTIVENESS,2/25/2015,"    And with that, the record will be open until _x000D_
Friday for any questions.",corker
THE FIGHT AGAINST ISIS: BUILDING THE COALITION AND ENSURING MILITARY EFFECTIVENESS,2/25/2015,"    We would ask that you and your staff respond _x000D_
to those in a fairly timely fashion._x000D_
    And the meeting is adjourned.",corker
ENDING MODERN SLAVERY: WHAT IS THE BEST WAY FORWARD?,2/4/2015,"    The Foreign Relations Committee will now come _x000D_
to order. We have convened this hearing to examine modern _x000D_
slavery and what is being done about it. We recognize that the _x000D_
United States Congress and our executive agencies have worked _x000D_
hard to draw attention to and address modern slavery, but I _x000D_
believe we have come to a point where we can do more. We need _x000D_
to take these efforts to the next level._x000D_
    I think most Americans would be stunned to know that _x000D_
slavery still exists in this world. Let me pause to state that _x000D_
again. It is difficult to imagine that in this modern day, more _x000D_
than 27 million around the world are forced to live as slaves. _x000D_
At this hearing, in addition to our expert witnesses, we will _x000D_
hear from two individuals who suffered and ultimately escaped _x000D_
this experience, and went on to help others. And we thank them _x000D_
for being with us today._x000D_
    Modern forms of slavery thrive where the rule of law is _x000D_
weakest. Corruption, crime, and cultural attitudes contribute _x000D_
to a climate of low risk and impunity for those who profit from _x000D_
modern slavery. In many instances, modern slavery is a crime of _x000D_
opportunity for perpetrators. It is often practiced quite _x000D_
openly, for example, in brick or rug manufacturing or in bars _x000D_
or brothels._x000D_
    Under U.S. law, such conditions are defined as the most _x000D_
severe forms of trafficking in persons, including forced sexual _x000D_
servitude of minors and adults and persons in bonded and other _x000D_
forced labor conditions. Women, children, and men alike are _x000D_
subjected to involuntary labor or sexual exploitation. _x000D_
According to a leading nongovernmental organization, forced _x000D_
labor accounts for 74 percent of victims, and forced sexual _x000D_
servitude accounts for 26 percent of victims. Women and girls _x000D_
are especially vulnerable, accounting for 54 percent of _x000D_
victims. Children under the age of 18 account for 26 percent of _x000D_
victims._x000D_
    We have been to countries and met with people who have _x000D_
survived this horrific experience, and heard from people who _x000D_
work to end modern slavery. U.S. Government and private _x000D_
philanthropic funding are spurring increasingly sophisticated _x000D_
efforts to combat modern slavery. There is a growing consensus _x000D_
that in order to end the practice of modern slavery, reliable _x000D_
baseline data and consistent and effective monitoring and _x000D_
evaluation are needed to deal with this issue. Leveraging and _x000D_
coordinating private and government funding are also seen as _x000D_
key challenges by many in the antimodern slavery community._x000D_
    Today we will explore these questions to help inform our _x000D_
thinking on how we can maximize our efforts and take them to _x000D_
the next level, and to find the best way forward to begin the _x000D_
process in earnest of putting an end to modern slavery. With _x000D_
that, I turn to our distinguished ranking member, Bob Menendez.",corker
ENDING MODERN SLAVERY: WHAT IS THE BEST WAY FORWARD?,2/4/2015,"    Thank you, and I want to thank others for _x000D_
being here. We will now turn to our witnesses, and we _x000D_
appreciate the tremendous commitment that they have shown in _x000D_
this effort._x000D_
    Our first witness is Gary Haugen, the founder and president _x000D_
of International Justice Mission, IJM, a global organization _x000D_
that protects the poor from violence by partnering with local _x000D_
authorities to rescue victims, bring criminals to justice, _x000D_
restore survivors, and strengthen justice systems. IJM combats _x000D_
modern slavery, sex trafficking, rape, police brutality, _x000D_
property grabbing, and other forms of violence in Africa, Latin _x000D_
America, South Asia, Southeast Asia._x000D_
    Before founding IJM, he served as the director of the U.N. _x000D_
investigation of the aftermath of the Rwandan genocide, and as _x000D_
a human rights attorney for the U.S. Department of Justice. He _x000D_
has been recognized by the U.S. State Department as a _x000D_
trafficking in persons hero. I have gotten to know him _x000D_
personally, and he certainly deserves that recognition._x000D_
    Our second witness is Shawna Bader-Blau. I am going to call _x000D_
you ``Shawna'' if that is okay. [Laughter.]_x000D_
    Shawna is the executive director of the Solidarity Center _x000D_
in Washington, DC, the largest global worker rights _x000D_
organization in the United States. Solidarity Center works with _x000D_
partners and allies from more than 400 unions, nongovernmental _x000D_
organizations, legal aid groups, and human rights defenders _x000D_
from around the world to help workers exercise their rights and _x000D_
improve their working conditions._x000D_
    Prior to her appointment as executive director, she served _x000D_
as the Solidarity Center's regional program director for the _x000D_
Middle East and North Africa, where she worked directly with _x000D_
victims of forced labor and human trafficking, and with labor _x000D_
activists and human rights defenders._x000D_
    Thank you for being here and for sharing your thoughts and _x000D_
viewpoints today. We would like to remind you that your full _x000D_
testimony, full statements will be included in the record _x000D_
without objection. So if you could please keep your remarks to _x000D_
about 5 minutes, we would appreciate it so members can engage _x000D_
you in questions. And with that, Mr. Haugen, if you would _x000D_
begin, we would appreciate it.",corker
ENDING MODERN SLAVERY: WHAT IS THE BEST WAY FORWARD?,2/4/2015,"    Thank you._x000D_
    Shawna._x000D_
_x000D_
STATEMENT OF SHAWNA BADER-BLAU, EXECUTIVE DIRECTOR, SOLIDARITY _x000D_
                     CENTER, WASHINGTON, DC",corker
ENDING MODERN SLAVERY: WHAT IS THE BEST WAY FORWARD?,2/4/2015,"    Well, thank you both. Great testimony and we _x000D_
really appreciate your efforts in being here and your efforts _x000D_
regarding this issue._x000D_
    I have come to believe that through Congress, we can create _x000D_
and lead a vision to end modern day slavery. I really believe _x000D_
that. And we have had conversations with both the private _x000D_
sector and public sector--some partners around the world. I _x000D_
really believe that, undoubtedly, with the United States behind _x000D_
it, we can lead, we can solve this, and we can bring others to _x000D_
the table._x000D_
    One of the things that I have learned is that many _x000D_
organizations are adopting best practices, okay? And, Gary, if _x000D_
I could, my staff has prepared a number of questions, but I was _x000D_
able to go to the Philippines and see your work there. And I _x000D_
would just say to the audience and the people here that seeing _x000D_
the 22 young women that we saw that day, you would have to be _x000D_
not a human being to sit through that with dry eyes._x000D_
    I would just like, with my time, if you could just walk _x000D_
through how you go into a jurisdiction and build from the _x000D_
ground up the type of effort that you just talked about so that _x000D_
others might hear.",corker
ENDING MODERN SLAVERY: WHAT IS THE BEST WAY FORWARD?,2/4/2015,"    So, the question is, I mean, as we begin to _x000D_
look at doing something, mobilizing on a global scale, is what _x000D_
you have done there, in your opinion, something that can be _x000D_
replicated around the world where slavery is just a part of the _x000D_
culture there?",corker
ENDING MODERN SLAVERY: WHAT IS THE BEST WAY FORWARD?,2/4/2015,"    You know, you compared this to malaria. We _x000D_
have had some of the same results in PEPFAR because we have _x000D_
continued to focus on treatment, although there is always a _x000D_
push, as you mentioned earlier, to sort of move out into other _x000D_
areas. But if you focus on treatment, then you have the kind of _x000D_
results, and we have been able to do that. This committee has _x000D_
been able to make sure that the focus is on treatment._x000D_
    One of the things that I think people would be concerned _x000D_
about is how do you know you are achieving the results that are _x000D_
laid out with an issue like this? Could you talk to us a little _x000D_
bit about how you set the base and how we can actually measure _x000D_
the results in a way that if we were to lead an effort like _x000D_
this, we would know that we were actually achieving results?",corker
ENDING MODERN SLAVERY: WHAT IS THE BEST WAY FORWARD?,2/4/2015,"    And in closing, Shawna, in listening to that, _x000D_
I know you have had a tremendous amount of experience in supply _x000D_
chains and efforts in that regard. Do you think we are at a _x000D_
point in time where we can measure success and that these types _x000D_
of best practices can be multiplied in other places around the _x000D_
world?",corker
ENDING MODERN SLAVERY: WHAT IS THE BEST WAY FORWARD?,2/4/2015,"    Thank you for that full answer, and I am _x000D_
sorry I went over just a little bit. As we turn to our _x000D_
distinguished ranking member--thank you both again--Senator _x000D_
Menendez.",corker
ENDING MODERN SLAVERY: WHAT IS THE BEST WAY FORWARD?,2/4/2015,"    Thank you. Thank you, Senator._x000D_
    Senator Risch.",corker
ENDING MODERN SLAVERY: WHAT IS THE BEST WAY FORWARD?,2/4/2015,    Senator Cardin.,corker
ENDING MODERN SLAVERY: WHAT IS THE BEST WAY FORWARD?,2/4/2015,"    Thank you, and thanks for your leadership on _x000D_
this issue the entire time you have been in Congress, and for _x000D_
being here today, absolutely._x000D_
    Senator Isakson.",corker
ENDING MODERN SLAVERY: WHAT IS THE BEST WAY FORWARD?,2/4/2015,"    Thank you, Senator. Thank you._x000D_
    Senator Gardner.",corker
ENDING MODERN SLAVERY: WHAT IS THE BEST WAY FORWARD?,2/4/2015,"    Thank you. Thank you very much._x000D_
    Senator Rubio.",corker
ENDING MODERN SLAVERY: WHAT IS THE BEST WAY FORWARD?,2/4/2015,"    Thank you. You all have been outstanding _x000D_
witnesses. In my opening comments I mentioned the role Congress _x000D_
has played. But, I think because of your efforts and so many _x000D_
advocates from around our country, the administration, too, I _x000D_
think is very focused on this. I know Secretary Kerry recently _x000D_
referred to a much more robust effort. So I think this is _x000D_
something that we can all work on together in a very positive _x000D_
way, and I want to thank you both for a lifetime of effort in _x000D_
this regard, for being here today, for sharing your _x000D_
experiences, and for working with us in the future. Thank you _x000D_
very much._x000D_
    And now we will have the second panel. Do we have our _x000D_
second panel?",corker
ENDING MODERN SLAVERY: WHAT IS THE BEST WAY FORWARD?,2/4/2015,"    They get mentioned enough, thank you.",corker
ENDING MODERN SLAVERY: WHAT IS THE BEST WAY FORWARD?,2/4/2015,"    We will now turn to our witnesses for the _x000D_
second panel. Thank you for being here. Our first witness is _x000D_
Mr. James Kofi Annan. In 2013, he was awarded the World's _x000D_
Children Prize for his work to stop child slavery. He himself _x000D_
was a fishing slave as a child for 7 years. He managed to _x000D_
escape, get an education, and become a bank manager. In 2007 he _x000D_
left the bank to work solely to stop child slavery. By that _x000D_
time, he had already started an organization called Challenging _x000D_
Heights in 2003, which has liberated over 500 children from _x000D_
slavery._x000D_
    Liberated slave children come first through Challenging _x000D_
Heights' safe home for 65 children. Challenging Heights also _x000D_
runs a school for 700 pupils of different ages. They offer _x000D_
training to poor mothers so that they can support their _x000D_
families and do not just sell their children into slavery. He _x000D_
has supported over 10,000 children who have been slaves or at _x000D_
risk for slavery. Thank you for being here._x000D_
    Our second witness is Shandra Woworuntu, the founder of a _x000D_
nonprofit organization dedicated to empowering human _x000D_
trafficking survivors through mentorship and job training. She _x000D_
graduated from college with a major in finance and bank _x000D_
management in her native Indonesia. After graduation, she _x000D_
became the manager of the Treasury Department of the Korea _x000D_
Exchange Bank in Indonesia, specializing in money market _x000D_
trading._x000D_
    When political turbulence erupted, she lost her job because _x000D_
of economic, religious, and racial persecution. She applied for _x000D_
a job that promised a 6-month position in the hotel industry in _x000D_
Chicago, which led her to become--and to survive being--a _x000D_
victim of a criminal human trafficking organization. Thank you _x000D_
again for being here today._x000D_
    Our next witness is David Abramowitz. He is vice president _x000D_
of policy in government relations at Humanity United, a _x000D_
foundation that focuses on advancing human freedom by combating _x000D_
human trafficking and modern slavery, among other human rights _x000D_
issues. Previously he served as Department of State's Office of _x000D_
Legal Advisor._x000D_
    In 1999, he joined the staff of the Committee on Foreign _x000D_
Affairs for the House of Representatives, and served as chief _x000D_
counsel. Over the next year 10 years, he worked on such _x000D_
legislation as the Victims of Trafficking and Violence Act of _x000D_
2000 and the William Wilberforce Trafficking Victims Protection _x000D_
Reauthorization Act of 2008._x000D_
    And with that, we will recognize James Kofi Annan. If you _x000D_
would begin and just go in order. Thank you all for being here.",corker
ENDING MODERN SLAVERY: WHAT IS THE BEST WAY FORWARD?,2/4/2015,"    Thank you very much._x000D_
    Ms. Woworuntu.",corker
ENDING MODERN SLAVERY: WHAT IS THE BEST WAY FORWARD?,2/4/2015,"    Thank you very much._x000D_
    Mr. Abramowitz.",corker
ENDING MODERN SLAVERY: WHAT IS THE BEST WAY FORWARD?,2/4/2015,"    Well, thank you for your testimony, and your _x000D_
entire statement will be made a part of the record. And thank _x000D_
you each for what you have said today and for sharing your _x000D_
experiences._x000D_
    Mr. Kofi Annan, how aware are the people of Ghana that this _x000D_
slavery issue exists, and what is it that would motivate _x000D_
parents to allow their children to become a part of this?",corker
ENDING MODERN SLAVERY: WHAT IS THE BEST WAY FORWARD?,2/4/2015,"    And the parents, though they are obviously _x000D_
aware in many of the cases that their children are being _x000D_
victims of slavery, are they not?",corker
ENDING MODERN SLAVERY: WHAT IS THE BEST WAY FORWARD?,2/4/2015,"    Thank you very much. Ms. Woworuntu, you are _x000D_
obviously incredibly well educated, had a great job in _x000D_
Indonesia, and yet ended up in a situation here in the United _x000D_
States through a recruiter where you were in obviously a very _x000D_
terrible situation, fortunately escaped, and are helping _x000D_
others. Could you tell me a little bit about how that occurred, _x000D_
what the experience was with the recruiter? And then post that, _x000D_
how the prosecution worked with you here in the United States?",corker
ENDING MODERN SLAVERY: WHAT IS THE BEST WAY FORWARD?,2/4/2015,"    Very impactful. Thank you both. And in order _x000D_
to be courteous to my colleagues, I will press on. I may want _x000D_
to come back, if it all right, and ask you a question._x000D_
    Senator Menendez.",corker
ENDING MODERN SLAVERY: WHAT IS THE BEST WAY FORWARD?,2/4/2015,"    There is more I could say, but I will not.",corker
ENDING MODERN SLAVERY: WHAT IS THE BEST WAY FORWARD?,2/4/2015,    Senator Kaine.,corker
